date,rating,review
5/2/2020,5 star rating,"I've been to the restaurant once so far, but the food was excellent. I will definitely be coming here to eat. The employees are very nice. I can't wait for them to open back up, so I can get the full experience of dining inside and not just takeout. Safety first."
5/19/2021,1 star rating,"Went there for my friends birthday and it was one of the worst experiences I've ever had at a restaurant. They ran out of many items on the menu, our food took forever to get to the table, and when it got there, multiple things were wrong. The food was extremely greasy, and  the $30 lobster and shrimp mac I ordered only came with 3 skippy pieces of shrimp and the lobster was over cooked to the point it was burnt.  Our server was horrible and took at least 30 minutes to get the simplest things such as boxes. In addition, we had got attitude from not only the waiter, but the lady cashing us out about splitting the bill even though we saw the bill being split at other tables. When we finally were able to leave, after waiting for our bill for another 30 minutes, the security guard made some inappropriate comments to one of my friends. I honestly had high hopes for this restaurant but was sadly let down. I will not be returning."
5/14/2020,2 star rating,"Customer service was great.  Wait time took 2hrs but I understood it was mother's day weekend.   I order 95 dollar of food and the only thing that was good was the lobster tacos.  Beside the tacos I order side salad and two lobster and shrimp pastas.  The dishes had a burnt taste to them.  I came back up there.  The owner replaced them with no problems.  Which I appreciated.  I  got home and one of the meals was just okay and the other meal had the same burnt taste and smell to it.  So disappointed.  Unable to call and speak to anyone because phone lines are busy.  Side note, All the bread was burnt on one side (charcoal burnt).  I am not looking for a refund or food replacement.  Just disappointed with the food especially when you waited was for 2 hours and the money spent.   Staff customer service excellent.   Wish the food matched that"
5/10/2020,5 star rating,"This experience could have turned me away forever but management handled the problem. Preordered and paid for Mother's Day only to get there and they had run out of everything on our order. They made sure we left with food to eat, a refund and offer to return for our original order on the house. The food, though not what we ordered, was excellent. Can't wait to taste what we ordered and already planning to return for Father's Day, if not before. Also anxious to try dining in when the time is right. A gem in our neighborhood. Thanks to the staff and management. - my mom using my Yelp account LOL but yes the food not only looks but IS AMAZING!"
5/28/2020,4 star rating,So I must say that the food here is really good... and it started it to be pretty reasonable to dine here however I first went here on 5/1/20 then 5/7/20 then again 5/27/20 .... so that lets you know the food is really good... but from the last two visits the meal that I was buying went from 24 bucks to 30 ... now listen I get it's a pandemic and all that good stuff and I even get raising ur price a buck or 2 but 6 in a matter of weeks is totally astronomical..... to me I'm just trying to figure out why???? Why the sudden and drastic price change.... not sure if they were doing a test run with prices or what but that was crazy ... to go from feeding three people for 70 something bucks to 95 .... UNBELIEVABLE !!!!
7/30/2020,5 star rating,"I tried to call but the phone lines were busy, so I decided to just go and place my order in person. The staff were very friendly and helpful. I ordered sloppy (lamb) chops, chicken & shrimp alfredo (classic), lobster tacos, and of course the strawberry crunch cheesecake. I gave my phone number and they said they would call me when my order was ready. I sat in my car and waited. It about 15 minutes for my order to be ready. Everything I ordered taste delicious! The portions are generous and very filling. My husband and I ate on that food for two days. I can't say enough great things about the entire experience. We will be back!"
