date,rating,review
2/22/2015,4 star rating,"First, Bistro is pretty small.. It's a cute, quaint restaurant. The ambiance is welcoming and has almost a small town feel to it in the middle of south Harlem. I went with my family for Brunch.. We were five adults and two children, not the most comfortable for large groups. Our table seats 6 so we added a high chair and were fine.. But it was a tight squeeze. The hostess was very nice and accommodating.. And our server, I think his name was Deandre? Was one of the best waiters I have had in a very long time... If not ever! The bread bowl is actually from Balthazar's and amazing as expected ... My son loved it and dug in to it full force.. The infused butter and preserves were delicious as well. The lattes and cappuccinos can beat out almost any cafe in the area. A few of us had the crab cake Benedict and it was seriously delicious.. The crab had no fillers tasted very fresh and well seasoned.. When living in NOVA I loved the crab cake Benedict from Artie's in Fairfax and this beat it out by a landslide. I didn't get pictures of everyone else's meal.. Sorry.. My husband had the brioche French toast and thoroughly enjoyed it.. It is a huge order so with a side of eggs and bacon it was more than enough to share with our son.. And still some. It was a hit with both of them. My nieces had the bacon and egg on a biscuit.. The bacon is scrambled into the egg and is also a huge order so they shared and cleaned out their plates as well. The kids had fresh squeezed orange juice which was great and they only have boylan sodas, but who doesn't love those? Over all the service is great and food is delicious.. Not great for parties larger than 6 people so expect to wait at least 20 minutes if not more for a table and our check was more than expected but still well worth it. Food and service get five stars..."
12/1/2016,3 star rating,"I've passed by this place many times, I've always been curious about it because it's always busy. Yesterday I tried it and I gotta say I was disappointed. Mainly because I ordered the steak and it was TERRIBLE. I ordered it medium well and it was well done , the worst part was the seasoning, it was too smokey, too spicy , too salty and too over seasoned. Everything was wrong with it. I sent it back and got something else the ribs which were alright . I gotta say though, best string Beans I've ever had"
8/4/2019,4 star rating,"Made a reservation for 2:45 for 4 people. We arrived on time it was crowded told the hostess on 3 people and we were all here she said great you are checked in your table will be ready.  I will call you. We waited my BFF inquired after 15 mins she was told a feeler mins for a table.  30mins we inquire again I'm told the table behind me is cashing out. After the manager told us we were next 10 mins prior.  Other people are seated and finally we demanded the manager a Whole 45 mins after our reservation.  She comes over and says ooh no you still waiting I told you 15 mins ago you were next.  So sorry she says we will seat you now.  We sat in the back were it was quiet and cozy.  She gave us a bread basket immediately and took our drink orders.  She apologized and checked on us.  The manager did what a manager is supposed to do...provide customer service and admit when you make a mistake.  Our waiter, the food and service there after was back at four star.  The new location is bigger and the food was great.  Today could have been bumped up to 5 Stars if the hostess didn't play games with our reservation juggling us around like we didn't matter or couldn't pay the bill! Don't wait 45 mins fooling with the hostess like us, just ask for the manager.  She handles business and is fair!   I forgot to get her name but she saved the day for real because it was about to be a problem.  Fried chicken dinner, catfish and shrimp and grits meals. Grits are still so creamy and dreamy..."
11/11/2018,4 star rating,"Food is delicious! Great catfish and grits with cheese eggs. And a biscuit. Shrimp and grits good. The mac and cheese was disappointing. The lemonade spritzer was good. Tight space, small quaint restaurant. The service is great. Homemade biscuits with honey butter is amazing. They have Turkey bacon and Turkey burgers! Exciting little menu...Turkey meatloaf and chicken sliders. Sound delicious...."
11/7/2016,3 star rating,"It was good, but nothing to write home about. My friend and I spent about $70, with tip, on two entrees, two non-alcoholic drinks, and the bread plate. I got the crab benedict, and it was really very good. It came with a delicious biscuit. I would definitely get this entree again. However, my friend got an omelet and it looked so sad on its plate by itself. I don't think it was the best choice on the menu. I will say that she got the bread basket and really liked it. The homemade butter was delicious. I had to ask my server three times to get a coffee refill, which was very frustrating. The worst part, though, was that it tasted horrible. I know it was drip coffee, but it tasted like instant. While I liked my entree, I wouldn't go back to this place because of the bad coffee, my friend's underwhelming omelet, and the price."
7/8/2016,4 star rating,"Boulevard Bistro hosted a large group of my clients (about 25) on a Wednesday for lunch. They provided us with a prefix menu l and treated us well (my clients loved the Harlem vibe--jazz and all).  Because my program manager was responsible for setting up the menu and I wasn't involved in every detail but next time I will request a vegetarian option as well as more drink options given the limited selections. The peach cobbler was excellent but had a messy presentation. Overall, a great spot that could enhance the experience even further by paying attention to more detail."
2/28/2020,5 star rating,"Every employee that we came in contact with was fabulous -- hostess, server, bartender, & busboy! Great service!"
11/5/2018,4 star rating,"The reservation was very easy to make through Yelp. When we got there, notice the place was small and all the tables we full which is a good sign. By the time our late friends arrived, they were set to seat us. Staff was very friendly. Only major complaint I had through out the night was the smell of them using either an old mop or rags to clean with. The smell was very distracting and it's hard to enjoy the food with that sort of smell. Other than that, it was cool. By the time we sat around 8:45, they had already ran out of a few dishes which we were eyeing. Drinks were good (especially the spiked tea). All and all, it was a good night."
9/20/2019,1 star rating,"The service was horrible .. There was an argument with a off duty staff member and the manager the police had to be called .. We had to wait at least one hour and a half for our food .. The waitress kept asking us if we were ready to order at least three times we had to remind her that  we had ordered and was still waiting for our food .  Before leaving I had to use the ladies room OMG  I almost fell the floor was soaking wet a staff member was mopping up water from a leak coming from the sink unfortunately there was only one bathroom .. I will never go there again ., I do not recommend this place at all!!!!!!  I tend to believe that the good reviews came from the  staff family members !!"
1/9/2020,5 star rating,"Went here today for lunch with a friend, we both had the Catfish PO Boy and we shared a side of macaroni and cheese. The food was good and so was the ambiance. The hostess and waiter were very friendly and pleasant. I will return to the BLVD Bistro again..."
5/29/2014,4 star rating,"I went to brunch here with 3 friends this past Sun. It's a charming little place on the corner of 122nd & Lenox with indoor and al fresco seating and is definitely an asset to Harlem's booming dining industry. We waited a bit, but that's to be expected - we were actually seated sooner than I anticipated. We ordered a couple adult beverages and I swear if I remembered what they were called, I'd implore you to get them. Yum! Anyhoo, we all ordered something different to swap forks. In total, we had the chicken & biscuit, mac n cheese, shrimp & grits and the reg breakfast plate with eggs/meat/potato. We all enjoyed our meals, but my friend's shrimp & grits were the best. Creamy grits, that clearly somebody's Granny named Pearl stirred all morning w/a a wooden spoon w/a hint of jalapeño...can't beat it with a stick.The server, Anthony, was attentive and on point. We never really had to ask for anything. Then one of my friends ordered the banana/bread pudding topped with ice cream. It was really awesome, although, it was really more like banana nut bread. Buuuut don't tell that to Executive Chef/Owner, Carlos Swepson. He wasn't feeling my interpretation of the dessert...although it's still bread. Haha! He was mad cool about it and an all around nice guy. Go for good eats in a cute place and stay for the banana bread!"
2/19/2020,4 star rating,"Great atmosphere. Great music. Great drinks. Long wait even with reservations. Brunch menu options was just OKAY! But overall, I'd go back. They're black owned and I'm all for supporting my own."
7/28/2017,4 star rating,"Ate here after a recommendation from my sister who saw the chef / owner on the Food Network.She suggested the double thick pork chop, knowing that pork chops are a favorite of mine, but I wanted to try the pan fried chicken, to see how it compared to my all time favorite served at ""Southern Fresh"" in Safety Harbor, Florida.It was very tasty, as were the greens and potato salad that it came with it, but did not dethrone my all time favorite.I started with a mixed green salad which was delicious and plentiful.My sister had jumbo shrimp and grits which she loved.The service, ambience and music were good as well.I'll be back for the chop."
11/21/2018,4 star rating,"Tasty, rich mac and cheese. Overpriced though. Love the ambiance. No full bar. Greens were good"
11/18/2018,4 star rating,"Avoid the over hyped, overly salty soul food in Harlem and do your taste buds a favor.   BVLD is better than everything else, the service is better and the people are nicer.  The only complaint is that the place is so small.  For your first time, go during the week because weekend brunch has a crazy wait."
10/7/2014,5 star rating,Blvd Bistro what a nice restaurant. Went on a Sunday for brunch. The place is small and intimate. Met some of the staff who came over to day hello and welcome us to the establishment.  Ordered the Shrimp and Grits. Never have I had such creamy grits. The shrimp was cooked just right. Their famous biscuits were good but loved the butter to put on them. Definitely will be back to try dinner!
2/3/2017,4 star rating,"Great place for a solid meal. This is Southern comfort food, po'boys, grits, biscuits, and wings. The food is not quite 5 star but it's very good and very filling. The staff is warm and attentive, making us feel right at home. I also liked the look of the place, very cosy but not too crowded. I wonder if it might be a bit too crowded come dinner time (we were there for lunch) but that's not my problem!The only down side? This place won't do your diet any good! Luckily I don't live around the corner but I've already decided I need to bike up here more often (and I need to bike to burn off some of the calories I'm going to splurge on here)."
7/28/2016,5 star rating,"Ohhh! Such good food and service! I'm from the South, so my taste buds are jumping for joy when I encounter real, Southern food. Can't go wrong with anything on the menu.  The owner and Chef interacts with customers very well and often."
4/11/2015,5 star rating,"Blvd Bistro is a hidden Gem.My daughter took me there last night for dinner. I must say the Food is great, service great and ambiance is cozy and comfortable. Owner and staff very engaging with the guests. They care about the customer experience. That's good business. I will definitely be back soon."
12/10/2018,4 star rating,"Made reservations on a sunday for 4pm, was seated pretty quickly. Very small place but the waiters made us feel at home. Food and drinks was delicious, will definitely return!"
3/25/2017,5 star rating,Delicious food. Awesome atmosphere. Friendly service. Go to this place if you enjoy everything listed. You won't be disappointed!
1/20/2019,5 star rating,My FAVORITE spot in harlem!!! Ughhh just typing this right now makes me want to go there and eat. The biscuits alone are worth the trip #HoneyButtah lol
3/25/2015,4 star rating,Came here with a friend before we explored Harlem.- they serve biscuits with Steen cane butter. That butter is one of the best tasting things I have ever tasted and you must ask for it!- the service was exceptional. Our waiter was very pleasant and also gave good recommendation- I ordered the crab cake. It was a bit pricey and also a bit saltier than I would like
9/1/2019,5 star rating,Best pancakes and biscuits in NYC. Pretty incredible. I recommend a reservation on Sundays.
9/18/2016,5 star rating,"Several weeks ago I went to BLVD Bistro and loved my experience.The staff and owner were so welcoming. I was greeted immediately upon entering, the wait was not long and the waitress was great. The food! I was delighted with my Fried Chicken Sliders (perfectly seasoned) and ordered the  Georgia Peach and Macadami Nut Buttermilk Pancakes as my brunch entree, it was delicious. I'll be going back again soon. Check this place out, everything was just right."
9/22/2018,5 star rating,I've been to this restaurant for many years and the food has always been solid. If you're ever in Harlem stop and give this place a try. You can thank me later.
3/10/2019,1 star rating,"My friend and I visited BLVD for brunch today. Vestibule was overcrowded with waiting customers. We got on the waiting list & were told it take an hour. Texted approx 35 minutes later for update; told ""still looking for tables"". Returned 1hr later, and told that they don't take same day reservations and that the list we got on was some kind of secondary list. We left and found a fantastic meal elsewhere. Listen, BLVD. Train your hosts to tell folks upfront what the deal is with the wait. There is too much competition for brunch in Harlem to let folks waste an hour of their time to go hungry. Didn't even taste your food and I'm already rankled with this place. TIGHTEN UP."
1/13/2019,5 star rating,Food is excellent and staff is friendly.  I moved from Mississippi and they're better than anything I had in the south.
7/10/2018,1 star rating,"Worst dining and customer service I have EVER experienced...My boyfriend and I were very excited to try this brunch place last Sunday but ended up very disappointed. We called in and asked how long the wait was (we called from across the street, a minute before getting to the restaurant), we were told 15 minutes. After getting to the restaurant, the hostess told us we would either have to sit at the table right next to the door (basically in the entrance, there shouldn't even be a table there) or we would have to wait a hour. We told her we would leave instead and then suddenly there was a table available for us....Even though it was INCREDIBLY loud in the resturant (lots of very intoxiacted people yelling across the room) we decided to stay. We ordered the Crab Benedict and the Catfish and Grits (eggs over easy) and iced coffees. The food came out literally 5 minutes later and the eggs were completely over cooked, and the catfish was cold. After talking to the waitress, she decided she would put in a new order just for the eggs instead of sending the food back. Ten minutes passed, no eggs and our food was completely cold. After that, we decided to give up on BLVD all together and try to find a new brunch place. The hostess apologized, gave me her personal phone number and invited us back for lunch. Hoping to give this place one last chance, I reached out to her. She never responded to my message. Overall, this place was really disappointing. The customer service was TERRIBLE, the atmosphere felt like a college tailgate party and the food was a HUGE let down. Save your money, and go check out other brunch places in Harlem. Trust me, this place is not worth your money or time.*read the response from the owner below if you have any doubts concerning the professionalism of this restaurant"
5/21/2017,3 star rating,"Nothing too special to write home about BUT, nonetheless the food and service was fare. CONS:A bit pricey with smaller portions then I would like. I ordered the Catfish and Grits, wish I had ordered something else to fill me up.PROS:Seasoned just right, waiters were nice. Wait time wasn't too bad. Get there before 11:30AM for brunch to beat the rush."
3/8/2020,1 star rating,"I highly recommend you do not go here. I'm so mad at the experience I had here. I'm trying to use my back dollars to support black businesses but the amount of disrespect I just experienced at this facility is unacceptable. I walked in at 315 pm, the current time is now 520 and I still was not seated. The waitress at the front told us a 30-45 min wait. I asked for a manager and they weren't even trying to seat us. Still waited another 30 mins as I watched other parties be seated. And supposedly I talked to the owner too. There was no sense of urgency to get my party seated. Their excuse, the other parties had reservations. I know for a fact all the parties I watched be seated did not have reservations and the fact they didn't even try and seat us and use that excuse is unacceptable. So this facility only takes reservation? 2 hours is unacceptable. And what you don't know is that I'm a student veteran at Columbia University. And I came here to observe the facility to possibly add it as a vendor to receive free money from the university for events. I will DEFINITELY not be recommending this ""establishment"" to receive vouchers from us. And I'm telling every soul that I know to not spend a penny here. I'm telling my veteran community that live in Harlem not to come here. I'm telling every black person I know to spend black dollars else where. Fuck y'all, you don't serve to be in Harlem. And I can't wait to see gentrification drive you out the neighborhood."
12/9/2016,5 star rating,"If you havent made your way here for brunch or dinner you are doing a disservice to your tastebuds. This is the first time that I have tasted shrimp and grits and loved them. The biscuits, pancakes , chicken you name it .....it's delicious. A hidden gem in Harlem, this is my officially my favorite brunch spot."
1/15/2017,4 star rating,"Like others have said the space is small. We went on a Saturday for brunch so it was quite packed, but despite this we were still pretty comfortable Service is amazing. Jasmine was our waitress and she was extremely friendly, alert, and informative.We ordered the crab cake benedict, mac & cheese, shrimp & grits and a Bellini karafe. Extremely flavorful! My plate was wiped clean and everyone was happy with their order!  I will definitely be returning to Blvd Bistro again."
2/3/2018,4 star rating,"We went to eat here today and was a bit nervous of their B grade inspection but we were to past that. I ordered the French toast, amazing. Not overkill sweetness like ihop but way better and they have these cute little jars of jam and syrup. My friend got the chicken sandwich in a biscuit. Delicious."
3/9/2018,5 star rating,"I took two colleagues (one Australian, one Scottish) with me. They wanted to experience American food, and I thought the most authentic fare possible was definitely soul food. To Harlem we went. BLVD did not disappoint. Service was impeccable. Friendly, prompt, full of suggestions and tips. This was the perfect compliment to BLVD's atmosphere, which reminded me of Auntie's dining room. Laid back and comfortable, where all are welcome.I introduced my companions to fried okra (I even had to explain what okra was!), shrimp and grits, and fried catfish. We were absolutely giddy by how good everything was. Flavorful, good-sized portions, fresh. And then I sent them home with BLVD's delicious desserts-- one of each of course. I can't wait to make my way back up next time I'm in the city."
6/29/2018,2 star rating,"Was very excited to come here after my friend recommended it. Have to say I was very disappointed with the service here and will not be coming back again. First of all, we waited almost 2 hours before we were finally served food. We were initially told that there were no seats available inside the restaurant and could only dine outside, yet guests who came after us with no reservations were seated inside without waiting. The hostess seemed very overwhelmed (not sure if she is new but she needs to learn how to adapt to a fast paced environment. It is not good for business). Our waiter just didn't seem to care about us. We constantly had to remind him that we needed something...utensils, our drinks, ketchup, or napkins. He never came out once to ask how our food was. Not to mention one of my friends found an uncooked noodle in her gravy and when she asked for new gravy, he caught an attitude with her. The only reason why I am giving this restaurant 2 stars and not 1 is because the food was pretty decent (despite the fact the presentation was so sloppy and it was way overpriced ). I ordered the catfish and grits. In addition, the worker Solomon was a saving grace for us. He came around to refill our water, asked us how we were doing, and pretty much made up for the areas our waiter lacked. We did end up complaining to management about our experience and they offered us a card to eat there again for free. Sorry, you can keep that offer. Will not be coming back here again."
5/12/2018,2 star rating,"50th Birthday dinner. 6 o'clock reservation. Party of 10. First ones seated. A number of things went wrong here and I'll list them below:1. We were told that the soup of the day was Lobster Bisque. They brought out what looked to be Tomato Vegetable soup. ME, knowing that Lobster Bisque looks nothing like Tomato Vegetable soup, questioned it. Their response: ""Oh yea, that's crab soup. I don't know why the kitchen changed the soup."" My thought in my head was...so, you're just going to serve me soup I didn't order? Conclusion...we all sent our soup back.2. We arrived at 6 o'clock. Our food didn't come out until about 7:30pm. The folks at the table behind us had about the same wait and they were livid and left. If we didn't have such a big party, we would have left also.3. The chicken was left under the broiler too long and was burnt.4. The macaroni on the top of the macaroni and cheese was hard and inedible because they made the macaroni and cheese with a roux and put it in the oven without topping it with cheese, causing the top layer of macaroni to dry out and become completely inedible.5. We sent an email request for the reservation, as per their requirements. We were told because it was a birthday, the chef would prepare a special dessert. There was no special dessert. There was no dessert of any kind.I'm disappointed and surprised because this place received such good ratings. I could forgive the delayed service, but what I can't forgive is the way the food was prepared. A chef should know that food should never come out of the kitchen the way I described it. This is Culinary 101.My hope is that they make some changes in the kitchen because what I experienced this evening was completely unacceptable for an establishment of that caliber."
2/23/2019,5 star rating,Breakfast is my jam therefore I've had breakfast around plenty of places in manhattan and Brooklyn but BLVD has the best breakfast I've had yet!! The staff were great and the waiter was friendly and helpful!
11/17/2019,5 star rating,Great brunch spot!  Delicious biscuits and yummy cheesy grits! Would definitely come back again.  The service was great too. Would recommend they add more vegetarian options to brunch.
6/28/2016,5 star rating,"My bestie and I always meet up at some good soul food and/or BBQ place when I am working in NYC.   We planned to go to an old standby to satisfy our fried chicken craving and it was packed.Thankfully Yelpers had much to rave about this place,  so we called and found out there would not be a wait.  First,  the atmosphere alone is like stepping into someone's home and every person working here treats you like family.The menu found my head spinning and simultaneously drooling at the selections.My dining partner went with the fried chicken, complete with greens and garlic mashed potatoes and loved it.I could not resist the shrimp and grits,  with a side of greens.   Grits were cheesy and just the right consistency and shrimp cooked to perfection!Greens were off-the-hook -- just the right vinegary tang and spicy kick!2 other surprises:- You must try the peach iced tea !   They purée fresh peaches,  coupled with unsweetened tea and topped off with some seltzer.   AMAZING and refreshing.- The complimentary biscuits ... Ahhhhhhhhhhh.   Just the right flaky on the outside and pillow soft on the inside.   Slather it with their honey butter."
