date,rating,review
8/26/2018,2 star rating,"I really want to give 2 1/2 Stars I was halfway impressed. Being a Harlem native & watching all the restaurants pop-up & disappear to see BLVD stick around was enlightening. I was hoping for so much more seeing as every time I've tried to visit for brunch there was at least an hour wait. But finally the opportunity presented itself and there was only a 20 minute wait even after BLVD made its debut in the hit series Luke Cage on Netflix. Very cute, quaint location with a homely decor. PROS: To start the wait staff is awesome and friendly even when the place is jumping & busy. The food came quickly and the portions were large. My blueberry pancakes were thick and tasty and full of blueberries. CONS: According to my guest the french toast wasn't as tasty as he'd hoped & was missing the signature sweet cinnamon pop you expect in French toast. He wasn't a fan of the bread used either. My side order of eggs were a bit too runny for my taste although I asked for scrambled hard. We order 3 side orders which were way overpriced at $9 especially for 2 eggs undercooked. I'm somewhat of a lush but the watered down sangria did nothing to make me happier. But I must admit I might have enjoyed my food more had it not been Africa HOT inside of the restaurant. This place is making way too much money to not invest in better air conditioning and ventilation. It was turned off because it was leaking on diners as they enjoyed brunch so we all suffered. We were originally seated by the kitchen where we melted and received quite a few apologies from the staff as they walked by until I finally asked for the manager. Another apology later and I requested to change tables. Moved to the front table by the door slightly overrun by gnats we decided to give up and leave. My guests didn't finish their food so we payed our bill tipped our waitress (again super nice staff) and left. You would think after seeing the patrons suffer through the heat some kind of retribution would have been offered... nothing. I want to give this place one more try and maybe go for dinner in the winter. Lol"
4/12/2017,4 star rating,"Fresh, fresh, FRESH food! The location space is small.. it is set up in a garden level brownstone, with a super small bar. That still doesn't take away from fact that the food was GREAT! I ordered the banana pecan pancakes.. my partner ordered the catfish, grits and biscuit.. Tasty! The Executive Chef was hanging out in the dining area, receiving the praise for his work! He was confident about his work... his words: ""I don't worry about how my food tastes, I worry about my credit score!"" Lol.. The wait was about 50 mins long, so make sure you are wearing some comfy shoes to add comfort to your ""while you are waiting"" walk."
1/30/2020,5 star rating,"Incredible deal for Brunch! Bottomless has no time limit. Tip your servers well, they deserve it."
5/5/2020,5 star rating,I took my wife to Blvd Bistro in Harlem a few years ago for Mother's Day and it was the best food I ever had in Harlem. The place was clean the decor and art work was beautiful and the smell of the food when I walk in the door was mouth watering. We ate we drank we talk can't wait to go get my takeout this coming Sunday damn u covid19 it won't stop us from getting our shrimp and grits. The staff is superb very attentive and professional love that place I highly recommend it
10/21/2018,4 star rating,"My good friend invited me and she share that the food is fabulous. So we waited, outside in the cold. A nice touch would be to offer hot tea in blvd bistro cups for your dedicated patrons waiting in the cold. It is an inexpensive touch that creates an experience we won't forget. Heated lamps in the outside patio would invite patrons when it's chilly, like in Paris!There is an odor near the bathroom in the dining area that must be dealt with. Clorox - and the rug covering the uneven flooring in the back - rug looked unclean and smelly. These are small fixes - you have the clientele- just pay attention to details so you can keep them coming"
3/9/2020,5 star rating,"Great drinks, delicious food and an awesome vibe made it an all around wonderful dining experience"
9/15/2019,1 star rating,Hostess had a horrible attitude! My friends had made a reservation for my birthday at 2pm and we weren't seated till 2:56pm. When I approached the hostess booth to ask a simple question she responded in a matter-of-fact-tone with a hint of condescension ....  I'm the birthday girl just asking a simple question on our ETA and if there was music playing. Staff can greatly effect one's dining  experience I hope they rectify the situation. The owner did come to us with a pitcher of mimosa however I still left with a horrible impression. The hostess didn't come over to communicate the delays within the dinning area. We had to go up to her a ask on various occasions. I will not review the food because no matter how amazing the food was the service left a horrible taste in our mouths.
7/16/2018,4 star rating,"The only reason why this does not get 5 stars, is due to space/ service. Came for brunch and still had to wait an hr even though we made a reservation. Food is divine and overall delicious. Definitely a fan. Just be prepared to wait since its really a small dining area."
1/18/2020,5 star rating,The first time I came to BLVD they were located in a smaller location. I was invited to a birthday dinner there and my experience was okay. My best experience was going during the day for lunch and having their shrimp and grits. AMAZINGGGG. I will go again. Their customer service was great; the server was very attentive.
12/9/2019,5 star rating,Had some issues reserving for a large group on a Sunday but Markisha resolved the issue and our waiter Freddy truly made the experience. The food was AMAZING.
2/23/2020,3 star rating,"Delicious and authentic food and flavors - enough to make me a return customer but it's worth noting the service is really poor. It's not a lack of ""will"" but an obvious lack of training and standards being set. I want this new location to be successful and service will be critical to remain a mainstay in Harlem."
1/5/2020,1 star rating,"I normally come here and love it. This last time was a terrible experience. I ordered a burger medium. 1st time it came out rare, 2nd time it was cooked ""well"" which is not medium. It also came back with no toppings. 3rd time I asked for a new order, which the Head Chef actually came over and apologized for. He said a new order will be right out. Finally I got my order and this burger was the most overcooked burger I ever bit into. It was charred like 1/4 inch thick. By this time my girlfriend had eaten her meal and we were both ready to go. We really liked our server and the Chef seemed to be helpful BUT the food I had was terrible. Huge miss"
5/28/2018,2 star rating,"Two stars are a courtesy for being Black owned, having a flexible hostess, and their bread basket. Short answer for the low review: Extreme heatLow food quality Poor serviceCelebration ruinedLong version:My families Saturday brunch was ruined. The heat in this place was so extreme, no one could enjoy their food. The carafe of Bellini's at ($36) did not have mango purée as listed, it tasted like over sweet canned Goya juice at best, orange look aid at worst. I am so frustrated with the level of service and food received. I cannot believe I offered BLVD as an option for out of town guests, I was embarrassed! The food quality and pricing do not match. What exactly is in the seven cheese Mac & cheese that makes it $20? It isn't listed, but my guests wanted to know. Even the chicken basket was met with a 'meh'. Southern folks being dissatisfied with southern cooking is mortifying.I've been to BLVD before and it was much better, what is happening?! This brunch was for my cousin to celebrate her birthday and the birth of her twins. I discussed dessert at length with a hostess (called at an off peak time), days prior. We discussed plate fees as I planned to bring my own cake, but was discouraged from doing so because BLVDs homemade cakes would be available. I went forward and secured our reservation. Shortly after the meal began, the check was brought to the table. No option of dessert.No acknowledgement of a celebration.No thank you for joining us. Nothing.When I brought it up with staff: ""oh we don't do dessert on Saturdays, they probably just didn't know what day you were coming"". You're telling me to my face, the person making my reservation talked to me for 20 minutes and didn't know what day I was coming? We were offered a candle in a pancake, after our meal. Staff needs to be trained better. Menu and drinks need to be reworked, and maybe some acknowledgement for ruining my cousins birthday, before I would ever come back. Best of luck with the move."
1/4/2020,5 star rating,I love the vibe in the restaurant and the biscuits are EVERYTHING. The new location is very cute and spacious. They have an excellent brunch menu.
1/4/2020,5 star rating,I went to BLVD Bistro on a Saturday for brunch with a group of friends. The staff were friendly and the crab cake Benedict was pretty amazing! The biscuits were homemade and the crab cake was served with a generous amount of crab with the poached eggs cooked just right. I'll definitely be back and highly recommend it.
10/13/2017,5 star rating,"Ok--So, after a bumpy, disappointing start, I still love this place! I've been wanting to try it for a couple of years! I had friends visiting NYC and I suggested we meet here. Based on reviews I made a reservation -- for 2:15. They were kind of discombobulated today and we didn't get seated until 3:20!! BUT, they were warm and apologetic throughout the process and provided complimentary ""beverages""!!Then the food is frigging AMAZING !!! I can't wait to go again!!Update 10/13: Went back for dinner tonight! Yum!'"
10/8/2017,4 star rating,"Ok--So, after a bumpy, disappointing start, I still love this place! I've been wanting to try it for a couple of years! I had friends visiting NYC and I suggested we meet here. Based on reviews I made a reservation -- for 2:15. They were kind of discombobulated today and we didn't get seated until 3:20!! BUT, they were warm and apologetic throughout the process and provided complimentary ""beverages""!!Then the food is frigging AMAZING !!! I can't wait to go again!!"
10/6/2018,5 star rating,"We made reservations through Yelp for a Saturday morning. We were promptly seated. Service was great - attentive and friendly. My coffee was good. The food was even better. I got the eggs with the home fries, turkey bacon and a biscuit. I love that the food comes out in small cast iron dishes - it makes the food more flavorful as the dishes probably get more seasoned over time. The biscuit was amazing! And I loved the side of cane sugar butter, hot sauce and jam that they provide. My husband liked his biscuits and gravy and declared his grits the best he has ever had throughout our many travels around the US. We have been coming to NYC for years, each time staying in and exploring different neighborhoods and this is probably one of the best breakfasts we have ever had."
7/18/2017,4 star rating,"I love this place!!! I was there last weekend and the food was absolutely delicious. Biscuits in sausage gravy were yummy. Crab cakes over eggs bennie? Genius. My mom ordered the French toast and she couldn't get over how soft and tasty they were. My brother ordered the pancakes and he didn't like them nor finish them (they did look a bit pale and odd - my only complaint food wise). What I really enjoyed was the fact that the chef was out there making sure his business was running the way he wanted to. He even came to our table to make sure everything was okay. The staff is also nice and inviting, not super attentive but they get around. However it's such a tight space. My chair was bumped several times by passing waiters and busboys. If you don't mind that then this is the place for you because the food is BOMB."
12/29/2018,5 star rating,"Damn, damn, DAMN! This. Spot. Is. GOOD! Wow! The shrimp and grits are what i got and MAN! It was BOMB!"
12/27/2019,2 star rating,"Shrimp Po Boy ($18) came with three shrimp on a huge roll that was very soggy on the bottom because no one drained the cole slaw that was served on the sandwich. The chicken on the chicken sandwich was covered in cheese, such that you could not taste the chicken."
10/11/2020,5 star rating,Amazing food and drinks!! I had the shrimp and grits and everything was so well prepared and fresh.  I had a side of potato salad which was delicious and the buscuits were to die for!! The drinks were strong just like I like them and the service was on point. I thoroughly enjoyed my experience at BLVD BIstro!
4/25/2018,4 star rating,"First off I am from Houston. Ya'll know well our food reputation.I had the BLVD Catfish with the collard greens and potato salad. There were 3 catfish strips fried lightly to perfection. Beautiful golden brown exterior. The collard greens and the potato salad were both just delicious. She had the shrimp + cheddar grits and she loved it! It came with 4 jumbo shrimp and a small pan of delicious cheddarrrrrrrrreddd grits.But nothing was touching the light flaky golden home-made biscuits. They were so good we had to order another pair. Lawd! The butter that comes with it is just perfect. Not too sweet. Spreads easily. Perfection. 4 *'s because the food is expensive and you don't feel the value for the cost. 1. We both left hungry. For me, 3 small strips of fish and two sides smaller than the size of a side on a Popeyes meal (although much more delicious) for a full grown man.? For her, 4 pieces of shrimp, cheese, and grits for $30? At this price point the trade off should be you wont leave hungry. I think learning the portion size that relates to that satisfied place for the average customer could be a big gain for them in the near future. 2. If you know you charge a premium price and offer smaller portions you must have a good trade off. Free biscuits, cheap drinks, etc.  3. The place didn't set me in a mood. It didn't give me an outer body or outer city experience. No extraordinary decor. No fun surprises. Extremely mediocre customer service.         Just great tasting, small portioned food."
8/3/2019,4 star rating,"The owner greeted each guest personally upon arrival (nice touch). Prompt service, although we had reservations the wait time was short (apx 10 minutes). Absolutely no vegan options (I had the collards and picked the turkey meat out)...still finger licking delicious!"
1/28/2020,5 star rating,Love this place....the food is excellent. The buttermilk blueberry pancakes are the best in town and the fried chicken and biscuits are a must. Can't wait to go back! Yummy!!!!
8/16/2018,4 star rating,"This is by far my favorite brunch spot in Harlem. I have ate here a handful of times and you can never go wrong with anything that has a buttermilk biscuit.  The breakfast sandwich includes scrambled eggs and cheese with your choice of meat, on top of the buttermilk biscuit. Another great option is the chicken sliders with homemade ranch dressing, on top of the buttermilk biscuit.  I have yet to try the dinner menu but it is definitely on my list of places to try.Bonus:  The music here will have you dancing in your seat!"
11/8/2019,4 star rating,"Food Timelines of Table Meal Service Post Meal Service My Family and I were in town for the NYC Marathon and went to Brunch the day before my Race.  We had a party of 8 and we were sat approximately about 30-45 Minutes after our reservation time.  Our server did his best but felt like he had a lot of tables to cover.  Our orders were taken accurately and praise to the chef and his staff for being so quick.  We finished our meals and chatted before we were advised people that were people waiting for our table. Highlight: Busboy Staff was amazing.  Music was awesome.  Reason I Can't Give it 5 :We asked our bill to be split into 2 cards and assumed it was done correctly. A few days later, I checked my account and the entire bill of $212 was charged to my account by 2 separate charges. Make sure they charge correctly before you leave."
5/21/2016,5 star rating,"After a long bike ride from lower Manhattan, my husband and I decided to try BLVD Bistro as it was on our must-try foodie list. And it just might be our new favorite brunch place in Manhattan! We were blown away by the food - homemade, generous portions and high quality. Also great customer service. I ordered the catfish and grits because it came with BLVD's much hyped (and deserving of this) biscuit. The grits were creamy perfection, and the eggs were cooked just right. My husband ordered the pan fried chicken dinner (which is on the brunch menu), which was well-seasoned with a perfect texture both in and out.We will definitely be back soon!"
11/7/2018,5 star rating,"The food here was absolutely delicious. I went there for my graduation lunch and was not disappointed! I got the fried chicken and biscuits, an appetizer with chicken wings and was greatly satisfied. The chicken stayed hot from the first to the last bite. The biscuits were soft, buttery and delicious. The chef even gave extras which was kind of him. I'm definitely coming back next time I get the chance!"
7/12/2018,3 star rating,"This place states that it is ranked for best soul food in America; however, I was not that impressed. The green beans were not seasoned at all. The rice and beans little too salty. And the mac & cheese was dry on the top and lacked depth of flavor."
3/13/2020,5 star rating,Decided to come here instead of red rooster to give it a shot. And man it was the best decision. The food and the service was top notch!! The cuisine I had was the BLVD Southern Dinner with the fried catfish and for the  soup the lobster bisque. It was so so good. And our waiter was so friendly and attentive!! Definitely coming back!
10/30/2019,5 star rating,I love this place the owners and staff treat you as if you are a friend who stop by for dinner. And the food is amazing
3/7/2020,5 star rating,"The food and the atmosphere was absolutely amazing!  Hats off to the Chef! I don't normally eat grits, but I did this time and ordered some to go.   The pancakes, the fish, the chicken, the breakfast potatoes...all Fabulous!"
3/7/2019,3 star rating,"I spontaneously went because my friend wanted brunch and it popped was on my map app. I have also seen it on social media once or twice.The food is without a doubt great. I had a breakfast sandwich on a biscuit. The biscuit was a pretty good biscuit. I personally think you can get more food for your money at many other places. The place is pretty small and gets very crowded for brunch, so you may want to get there early or make a reservation. It was pretty tight in there with a few waiters going back and forth. At one point a waiter has spilled something on my jacket. It was very nice of him to alert me and clean it off for me. The small place really took away from the experience. The service was amazing although it was busy, the servers were very attentive to their customers making it bearable."
11/10/2014,4 star rating,"This right here, this right here. . is. . . good!  But heed my warming: you've NEVER had cheese grits this serious, EVER!  It's more like creamy cheese with a side of grits.  But I am not complaining.  Just don't feel bad about it afterwards.  The breakfast egg sandwich is the best in Manhattan that I have experience thus far, hands down.  Fluffy, tasty eggs mixed with bacon and surrounded by homemade biscuits.  Heaven on earth.  Then there's the fried chicken, loudly crispy, moist, seasoned to perfection.  The service is attentive enough but has room for some improvement.  You want brunch here?  Get your ass their early then.  Hah.  Lovely to have this in the neighborhood"
1/7/2020,4 star rating,What a spectacular place to visit.....it is truly a place to visit when in Harlem. Be forewarned that the place is much larger than the old space but it still gets packed very quickly. It is on a corner of goodness and people just like to see what is going on ... there's been some celebs trotting around there as well ....
7/27/2019,5 star rating,"This was a great experience. my friend order a peach and macadamia nut pancakes and I ordered the cat fish and grits breakfast. We made reservations on yelp and we were immediately seated when we arrive.  once seated I noticed all the wait staff and the cooks were all man. ( I guess that's a good thing) Our food arrived in a manner and the food was very delicious, not disappointed at all. Would definitely return."
3/1/2020,1 star rating,"For whatever reason this establishment can't seem to properly triage its clientele. We made a reservation, arrived on time and we had to wait an additional hour to be seated. What's the point of even making the reservation? What makes matters worse is they aren't apologetic nor are they accommodating. This is the third time I've tried to give the establishment a chance and each time I leave more disappointed than the last. I've run out of empathy and I won't go back to this restaurant."
11/24/2018,4 star rating,"This review started out with a 1  rating, but ended up at 4 s cause the food was so damn good; I had to be fair.   My waiter was way off with the service provided.  This was interesting to me, because I can tell he's actually really good at what he does... my vibe may have been off [not an excuse for him], but too many missed opportunities during our interaction.  Hence a lower than 5 star rating.    So, to the real deal ....no hot cocoa and very limited selection of juices.  I ordered well done beacon with eggs over easy... these are served with home fries, a homemade biscuit and a great selection of condiments.   My beacon was served burnt to a crisp and the eggs were actually well done.  The waiter offered fresh ground pepper and that all a well done plate really needs.  With the exception of the burnt beacon, everything was super delicious!  Even the well done eggs that should've been easy... do good, that I had to get some eatable beacon.  I asked the waiter if another piece of beacon was ready to go, meaning I wanted to have it right away to continue enjoying my meal, and was told I had to order a side of beacon for $9.  Not to delay my meal with a debate, I said go ahead with the order, as I intended to follow up on the back end.  After some delay, perfectly prepared beacon arrived and I finished my meal.  I disputed the $9 at checkout and it was credited... the waiter offered a handshake after checkout and I took this a some form of him acknowledging his misstep; I respected that.  I'm under the impression that the food is generally great here and will return soon... please don't mess with my meal for retribution"
12/30/2018,4 star rating,We waited an hour to be seated for 3 which was fine..all the staff were friendly  and you do feel at home . Food was good. Just disappointed in catfish n grits...it was more like a snack and for $24 we expected more...shrimp and grits  were good...im from the south so we make our grits thicker  but they were season good and shrimp  was cooked perfectly ..pancakes were good
8/12/2018,5 star rating,"Stopped in at BLVD Bistro for brunch after looking at a few menus in the area. We were lucky to get a table, only had to wait 5 minutes or so. The restaurant is quaint and cluttered with soul decor and incredible music from all decades. Our server Jasmine was exceptional, and it's obvious that the place runs like a well organized machine. We waited about 20-25 minutes for our food, which was the best part of our visit. I ordered the omelette with a side of cheese grits, which were unique and tasteful. A must have when you visit. I'm not in the neighborhood often, but I for sure have a reason to come back! Highly recommend!"
10/4/2019,5 star rating,"Tried this place for the first time the other day.  The catfish is was GREAT!!!!  The biscuits and cane butter means business though, I'm hooked on just those three things.  Can't wait to go back."
10/2/2019,5 star rating,"An amazing brunch spot. This is our go-to whenever friends visit us in Harlem and everyone is always incredibly happy. The biscuit sandwiches, pancakes, cheesy grits, chicken are all amazing. I've tried a number of other things on their bfast menu and it never disappoints. Even the scrambled eggs are amazing - once I nearly asked how the heck they make them so yummy."
11/3/2019,5 star rating,"Great food especially the collar greens! Nice vibe, brunch is fabulous...love the shrimp and grits served in cast iron!"
9/3/2019,4 star rating,"If you plan on coming for Sunday brunch - MAKE A RESERVATION. I ended up waiting over an hour for a table but once seated, everything else was great. Music is good, servers are friendly and the food is well worth the wait! I ordered the shrimp and grits which came with a biscuit. The grits were perfectly cheesy and the shrimp was perfectly seasoned and cooked. So looking forward to coming back!"
2/4/2020,5 star rating,"Definitely a new fav in Harlem. Nice ambience, fast service, didn't feel rushed once we finished our meal. The server was super nice and very  informative. I'm mad I don't remember his name. Hope to see him again. Food was on point. Can't wait to go back."
9/18/2019,5 star rating,"This new location? MUCH BETTER! The service? IMPECCABLE! I can't remember the woman at the bar who does the unlimited mimosas, but when I tell you sis gets you TOGETHER!!! I left that spot JUST RIGHT and the food is STILL good as hell! I LOVE supporting a black business that's about their business!"
