date,rating,review
6/13/2022,5 star rating,"My boyfriend put me on to this restaurant & ever since I've been hooked . We always go on a Sunday. The brunch is always great . I always order the crab Benedict ( however , I do eat some if my bf's food ) . Music is always great . The owner and his wife are so pleasant & entail great professionalism . I went one Saturday evening with a friend . Restaraunt machine wasn't working to make froze's , however the owner went above and beyond to accommodate us . This was really appreciated . This is definitely my most favorite brunch spot ."
6/12/2022,5 star rating,put simply... delicious... with great portion sizes... i've been coming here since inception when they were at a smaller location a few block north and it's only gotten better.  one of the best brunches in harlem
6/6/2022,5 star rating,"Went two weekends in a row best grits , bomb service GREAT DJ and the wait time was very accurate and timely."
6/4/2022,2 star rating,Wait Staff AFood BSafety B-Air quality COverall not worth the visit after so much hype.  There is better food away from the hood and addicts and homeless lurking as you wait for a table.
6/4/2022,5 star rating,"Jumbo Shrimp and Cheddar Cheese Grits 10/10Service 10/10My server Brandon 10/10Host 10/10DJ 10/10Bathroom  was clean 10/10I'm not a easy person to please but wow! The biscuit was fresh, grits were so amazing and the shrimps were great. I'd recommend less salt on the shrimp. Other then that wow I will be back. I'd definitely recommend making a reservation on"
5/30/2022,5 star rating,"Hidden gem! This is a must try place!!We came on a Saturday for brunch and didn't make a reservation. The staffs were super friendly and accommodated us. We got lucky but I would highly recommend using Yelp waitlist. We ordered:- blueberry pancake with fried chicken- shrimp & grits with biscuits I've had chicken & waffles, but never thought to pair savory chicken with sweet fruit pancakes. I'm obsessed now, it was life changing! The rich crumbs from the chicken adds texture to the fluffy sweet pancake. You also can't skip the blueberry... it adds a wonderful ""freshness"" to the fried chicken. The ingredients complimented each other so well. Their chicken is tender and fried to perfection. (Doesn't feel too greasy either) The jumbo shrimp and grits was also very delicious. This is very rich and flavorful... and it comes with a biscuit. They also give you hot sauce and honey butter to eat with the biscuit. The waiter gave us an extra biscuit since we were sharing the dish, very thoughtful gesture.I love this place, definitely need to come back again and spread the word. If you're ever craving soul food - look no further, this is the place!"
5/30/2022,3 star rating,"Located in Harlem, this place has a casual-cool vibe, and serves modernized soul food classics. I was thinking of getting the Fried Catfish Dinner with turkey collards and southern potato salad, but then I saw the Fried Catfish Poboy which was a fraction of the price, so I ordered that. The Catfish Poboy also came with french fries. The piece of catfish was a decent size, and there was coleslaw on top, nestled in between a brioche bun. The catfish was fried to perfection and was delightfully crispy, as well as tender. The catfish was also well seasoned and full of great flavor. The coleslaw was a fresh crunchy addition, while the bread was buttery and soft. The fries were thick cut and satisfyingly crunchy with nice potato taste. My friend had the Fried Chicken brunch, which was served with biscuits. All the food and sauces came at the same time, except the biscuits, so when we mentioned it to the waiter, he very graciously brought over 4 biscuits instead of only 2. This was definitely a nice gesture. The fried chicken was okay, but didn't blow me away. The biscuits were too try and a bit on the bland side for me (even with maple butter and jelly).Service started off pretty good, but part way through our meal, the waiter gave us our check and let us know he was on his way out, but to let us know if we needed anything. This confused us, and it was difficult to get the attention of any of the servers after that. I was not impressed by the meal and have no plans to return."
5/30/2022,5 star rating,Everything is so delicious! Vibe was just what the doctor ordered. If you are ever in Harlem...pay them a visit!!
5/27/2022,5 star rating,This is my go to in the neighborhood for a fun brunch with a live dj and amazing food. The staff is friendly and food is amazing
5/22/2022,5 star rating,It was absolutely delicious. I can't wait to return. Allen was our waiter and he provided us with great customer service. The food was delicious.
5/22/2022,4 star rating,"Food was amazing, although it took over a hour for it to come. I'm pretty sure they were busy since it's Sunday"
5/22/2022,5 star rating,It was our first time at this restaurant. The atmosphere was outstanding m. There was a live DJ playing the great tunes. The drinks were good and strong. The food was phenomenal. You can taste the flavor. Will definitely revisit on my next New York Trip.
5/17/2022,1 star rating,"My fiancé and I ate here several times back at the old location and was in the neighborhood for the new location. The dinner was good and we enjoyed the food. Now a month later, I get a text alert that my credit card got charged $12 during an hour where the restaurant was not open. Now I have to call my cc and have them send me a replacement card. I told my fiancé we are not eating here again"
5/14/2022,5 star rating,I've consistently had great food and great service!!!! This restaurant will not disappoint you. I recommend the French toast and potatoes!!!
5/14/2022,4 star rating,"Came with friends for Saturday Brunch. Nice atmosphere, friendly staff,  great music. I ordered the Catfish and Grits, with eggs, absolutely delicious.Definitely recommend this spot."
5/9/2022,5 star rating,CONRAD WAS EXCEPTIONAL!!! he made our birthday brunch beautiful!! thank you for  great service and food was great and fulfilling!!
5/7/2022,5 star rating,I came here back in February for brunch when we had a snowstorm. BLVD Bistro was one of the few places open. I ordered the Fried chicken with pancakes and added blueberries to the pancakes. The chicken was delicious! Crispy on the outside and juicy in the inside. The flavor was perfect. The pancakes were unbelievably fluffy. Adding the blueberries is a must! I will definitely be back!
5/7/2022,5 star rating,Incredible food and service. One of our favorite restaurants in the city. Sunday brunch is the best
5/6/2022,4 star rating,The food is delicious but the music gets really loud. It's a fun place to eat but not the best for conversations.
5/2/2022,5 star rating,One of my all time favorite spots. Always on spot with food and drinks. Location is a bit small but that's how it goes with a NYC hot spot. I wish they had later hours on the weekend. Maybe it's just me but I think they close early on the weekend for a NYC restaurant.
4/29/2022,4 star rating,"Sunday brunch done RIGHT! I had an amazing experience at BLVD Bistro and I seriously can't wait to go back! We got there as soon as they opened on a Sunday and there was only one other party ahead of us. As soon as we walked in, the hostess showed us to the table and it went all the way up from there! The waiter we had was wondrous! We ordered a few things from the menu and they were all a hit! The chicken was seasoned well, fried perfectly & finger licking good! The buttermilk pancakes were definitely 4 stars in my book! Although they didn't have those good old southern crispy edges, I still thoroughly enjoyed them. I tasted my friends collard greens and seriously contemplated ordering some for myself! The vibe here is definitely on 10! I mean what's better than listening to soulful gospel music while eating a delicious soul food brunch?! I was singing and eating and eating and singing!! I noticed a few of the workers dancing and singing as they worked which was fun to see! The restaurant is small, and the food is scrumptious! So you know what that means? You're probably going to wait a long time for a table. We got lucky that Sunday morning but I'm already prepared to have to wait when we go back again. Stick it out cause it's definitely worth it!!*we had no problem finding street parking!*"
4/28/2022,4 star rating,"Turkey Meatloaf: Banging. Drinks are good, I just recommend you make reservations, it gets packed."
4/25/2022,1 star rating,"I went in at 2:46pm for a table, they told me a hour wait. So I waited, then returned at 3:46 and asked about my table. They told me someone was getting up to pay their bill and they would seat me and my friend. At 4:40pm, we were still waiting and just left. We ended up having our brunch across the street because we were STARVING. Poor experience, poor customer service."
4/24/2022,4 star rating,"The food was really good especially the grits and the catfish. The drinks took a while and I felt that should have made a little sooner. The music was great, had us doing a little dance in our seats.The server sold us a pitcher of moonshine and said it would get us six drinks. After waiting a while for the pitcher, it came out and only made 3Drinks and it was 3 of us. He apologized forMisinforming us and that was cool of him to do! My cousin had the ribs and she loves it. The vibes are great if you are looking for a Harlem brunch spot. Side note which I didn't like can't sub sides on the weekend.. crazy right!"
4/23/2022,5 star rating,"We had such a fantastic night at BLVD. not only was the food A1, but then service... oh my gosh. The service was wonderful. From the minute we got in we were met with very sweet hostess's and the floor manager KevEon.. chefs kiss! He is really wonderful. Our server, Emilio was one of the sweetest most efficient servers that I've had in awhile. We always felt tended to. Even a wonderful woman who was not our server, Lynn, kept checking in on us to make sure we were doing well. We honestly never wanted for anything here. There was always someone making sure we were good always. At the end Ernesto cleared our table to make sure we could finish our drinks comfortably. We will 1000% be back. Thank you so much for making a dining experience feel like a home cooked dinner with family"
4/17/2022,1 star rating,"Incompetent and unprofessional. I went to be seated, just myself, and was told I could sit at the bar. I have no problems with them accommodating larger parties first but I waited an hour and they didn't ask anyone at the bar to leave so other guests could sit. People were sitting at the bar not eating or drinking with to-go bags for an hour and I watched the host seat people and overlook me."
4/17/2022,4 star rating,"Solid soul food and drinks. Place was bumping on a Saturday night and set the tone for the rest of our night out. Food was delicious and although the place was busy, service was on point and attentive. Would recommend this place to kick off a night out in the city on Saturday night."
4/14/2022,4 star rating,Blvd Bistro was a great time! I was visiting New York from Los Angeles and came here for dinner with friends. It was a Friday night and busy so the food and drinks too a long time to come out but still a great vibe and good food. There was a live DJ playing R&B/Hip Hop. Everyone enjoyed their meal. I had the Fried Chicken Dinner and it was a good size. I feel like they gave me the whole chicken! Overall 8/10!
4/10/2022,4 star rating,"CONRAD SAVED THE DAY! I'm guessing you get a better experience with a reservation, at least I'm hoping because the service we received was  as well as the table next to us while seated in the patio. After being seated it took about 20 minutes before we realized no one was going to even bring us water. Once we caught the attention of a passing by server (Conrad) he was extremely apologetic even though we weren't his original table and worked to rectify things. We finally were able to place our order which at least was one small win. There seemed to be an extended wait for the food, we arrived at 11:00AM and did not receive our food until after 12PM which seems like a bit much. I will say the food was amazing (I probably would've flipped the table if it wasn't after the wait and less than great service initially) which is why they received the rating I gave. The environment seems fun and enjoyable with groups both large and small with a fun live DJ on Sunday. I'm hoping this was just a ""bad"" day for the establishment because I would like to come back again in the future for another try."
4/8/2022,5 star rating,"My first time here....with my best girls (Mom,Aunt,& Sister). The atmosphere is chill....the food is OFF THE CHAIN I had fried chicken potato salad and collard greens. OMG!!! Can you say good af....lol the servers/staff all have amazing energy and personality. Please forgive me I can't remember my server's name....begins with an N, she was AMAZING very attentive and of course friendly! Thanks Kevon you and your staff are AMAZING....I will be back!!"
5/22/2022,5 star rating,It was absolutely delicious. I can't wait to return. Allen was our waiter and he provided us with great customer service. The food was delicious.
6/25/2021,5 star rating,Brunch Date with the girls ! It was a wait. But the food and music was absolutely worth it . BLVD is right on the corner of 116th in the middle of all the hustle and bustle of Harlem. Parking was hard to fine so I suggest a Uber . The inside was would have looked better but with all the PPE protocol that we have to follow. I completely respect safety over style. The DJ had us jamming . The music was it ! We ordered two crates of mimosas. And the ended our meals with a moonshine punch. ( definitely worth the try) . And the service was super quick I don't think we waited more than 15 minutes for our food to drop. My friends had the breakfast sandwich and the shrimp and grits . Both looked good. I had the pancakes and fried chicken. Pancakes were delicious. But the chicken was topNotch . Perfectly seasoned and fried. Crunchy on the outside and super moist on the inside. I was definitely happy with my food. Considering that most brunch spot are hit or miss when it comes to the food. Would I go back ? Most definitely Should you ? Yes! Get the punch n the chicken
3/29/2022,3 star rating,"Very busy place. Was lucky enough to grab a couple of seats at the bar before before crowds descended upon the restaurant. Took a while to get things started with service but bartender waitress was pleasant enough. My catfish breakfast was deeelicious. Catfish fried n seasoned perfectly, flawless cheese grits. Ordered a side of gravy for the biscuit that was supposed to come with the meal (i had to ask for the biscuit cuz it didnt come with my food). Hard pass on the gravy and the biscuit was nothin to write home about.. too crumbly. My bf's country fried steak was literally a whole steak that was deep fried.. the laziest, worst rendition of a CFS ive ever seen, but bf didnt complain. I would have sent it back. Not a bad spot.. curious as to the other offerings to see why ppl crowd it out tho."
3/25/2022,4 star rating,"Good flavors but still needed salt, hot sauce, and honey. Great spot for a more upscale brunch. No drip coffee and greasy home fries. This spot is for brunchers. It is tight and if you sit at a booth you better be skinny"
10/20/2021,4 star rating,"The food gets 5 stars. You can go wrong with anything on the menu. The biscuits, grits, pancakes, wings were all very delicious."
5/27/2022,5 star rating,This is my go to in the neighborhood for a fun brunch with a live dj and amazing food. The staff is friendly and food is amazing
4/9/2021,4 star rating,"The thing that BLVD gets is that anyone can get soul food in Harlem at a million places. And what sets BLVD apart is that it manages to hire friendly staff and seems to always have the owner on site to ensure all is well. That's something that many other places lack. The food is solid and made upon request, so do know that the food takes some time to make it out. However, their drinks are solid, the music is always good and the decor makes you forget all of the previous businesses that tried to hold this corner of 116th street.  Speaking of which, the location couldn't be better nor easier to find.During the pandemic, BLVD has set up outdoor seating, a weekend brunch with a live DJ and it's classic Brunch all day menu.  There's always something going on in this neck of the woods. This is what makes BLVD hold it's own against it's very popular neighbors. Definitely check this place out and explore this pocket of Harlem and beyond. They follow COVID-19 restrictions with dividers and the like for indoor dining. If you're planning on a weekend brunch experience, make a reservation!!!"
5/2/2022,5 star rating,One of my all time favorite spots. Always on spot with food and drinks. Location is a bit small but that's how it goes with a NYC hot spot. I wish they had later hours on the weekend. Maybe it's just me but I think they close early on the weekend for a NYC restaurant.
5/25/2021,5 star rating,This place has amazing vibes I must say.  I was walking down Fredrerick Douglas St and I noticed this restaurant being very busy.  So of course I fomo and decided to give it a shot.  We had to fill up a form before being seated to ensure that we don't have covidWe weren't too hungry so we only ordered 2pcs of chicken one dark and one white.  I must say their chicken was flavorful.  Crispy from the outside and moist from the inside.  I also ordered their Nina Simone and it was great also.  Our waiter was very nice and he added some biscuit to our order free of charge
4/3/2021,4 star rating,"Hmm should I give away the best little gem in Harlem or naw. Starving on a Sunday and found this hidden black owned gem on Yelp. O M G. O M G.Called ahead in attempt to get a wait time (to see how much longer I had to starve lol) but the hostess wouldn't even give an estimate over the phone. Weird but anyway....Parking is a doozy but it's the city to be expected.Pulling up to the restaurant I already knew this place was lit. Walked in to see a DJ blasting all the good hits. Such a good vibe! Luckily, for a party of 6 a table was available right away, yesss! Staff: Didnt really care for the waiter as he did not check on the table often. Never came back to ask if I wanted a refill on my drink but yet a 20% gratuity is charger for parties greater than 3. No wonder he never came back, he doesn't have to work for his tip :( The good ...:.Food: 100/10 deliciousAppetizer: Had the biscuits basket. Had to ask the waiter to bring butter and jam smh. The biscuits were so good! Tasted like a less dense Popeyes biscuit. Definitely crumbly though so hover over ya plate if you want to eat it and leave no crumbs aka so you don't waste ya coins and lose this biscuit to the floor. Got a side of bacon too. Only 3 pieces for $8 ehhh not with that price, however, the bacon was delish! Not too hard. Thick. Smokey-ish flavor. Entree: ok so I really wanted pancakes and chicken but it would have been silly for the whole table to get the same thing. So we all ordered different things. EVERYTHING was amazing. Everything was Chicken and pancakes $22:First let me say thank you for the combo of chicken and PANCAKES! Haha everywhere else I have to beg to have this combo instead of waffles. The chicken was piping hot. THREE nice  sized pieces. Perfect light coating. Not too thick. Not greasy. Juicy. Seasoned well but not overpowering like some black owned places that take seasoning to the extreme. The pancakes. Yessss! I love some good buttermilk pancakes! Perfection! Reminds me of the pancakes from Sweet Chick. Huge. Moist. No lemony flavor (thank god). Melt in your mouth and the blueberries or blueberry compote on top was a great addition.Shrimp and grits:Speechless. O so yummy! Definitely not your nasty Quaker microwave grits lol. Almost so ""smooth"" and buttery it was like eating mashed potatoes. Huge shrimp on top with that delish thick cut bacon and cheddar cheese. I was stuffed at the end trying to finish the 1/4 I had left. Too embarrassed to get a to go box for that little. Well done entree.Catfish meal:Perfect coating. Not thick. Good seasoning and again not overwhelming but I felt the seasoning didnt get into the fish if that makes sense. You took a bite and it started off yummy and then bland because it didn't penetrate all the way through. Would like to see other fish options too like flounder.The potato salad and greens were good too. My madre said after awhile the greens tasted too sweet.Drinks:Sneaky sneaky. Ordered the spiked lemonade. The blueberries definitely shined through and made for an awesome drink. Not overly strong but it definitely sneaks up on you. Thought about ordering a second one but the waiter was a no show until the end but I suppose in that respect to was a good thing because I'm not sure if I would have came out of that place standing. Can't wait to come back and really experience a good outdoor summer vibe."
5/30/2021,4 star rating,"This time for brunch I stopped at BLVD Bistro (black -owned). I had the Catfish breakfast, Bistro wings and Baldwin cocktails. Everything except for the eggs were great! The catfish and grits were well seasoned. Catfish was fried perfectly. The Bistro wings were dressed with garlic, soy and ginger sauce. The Baldwin cocktails were on point because I had 3 of them . They are made with blood orange juice, lime juice, simple syrup and Ketel One Botanical Peach & Orange Blossom.The vibe was really nice. There is a live DJ all day. It was just really laid back! I will definitely come back.."
11/21/2021,4 star rating,This was my first time coming to BLVD for brunch.  It was super crowded but good vibes only.  There was a DJ setting up around 1:30PM which was a highlight for me nothing like good music and good food! I made reservations via YELP which was the best thing I could have done because there would have been a wait.  The bar was full and definitely an overflow but drinks were coming and the bartenders were handling the crowd.  The food came hot off the press and I enjoyed everything.  I have to say I had delivery but it definitely made a difference sitting in and enjoying the meal there.  Big bathroom very clean a little wait because there was only one stall but that's life.  If your in Harlem check it out!
5/7/2022,5 star rating,I came here back in February for brunch when we had a snowstorm. BLVD Bistro was one of the few places open. I ordered the Fried chicken with pancakes and added blueberries to the pancakes. The chicken was delicious! Crispy on the outside and juicy in the inside. The flavor was perfect. The pancakes were unbelievably fluffy. Adding the blueberries is a must! I will definitely be back!
5/17/2022,1 star rating,"My fiancé and I ate here several times back at the old location and was in the neighborhood for the new location. The dinner was good and we enjoyed the food. Now a month later, I get a text alert that my credit card got charged $12 during an hour where the restaurant was not open. Now I have to call my cc and have them send me a replacement card. I told my fiancé we are not eating here again"
9/20/2021,2 star rating,"Disappointed. Never EVER again. We were seated promptly upon arrival. The woman who sat us at our table had a friendly demeanor and was courteous. However, our cloth napkins were stained and the cups were dirty. Two of our cups smelled like rotten egg.  So gross. That should've been a red flag for us to leave. It also took a bit for our waitress to come around to our table to serve us water. She was nice but seemed overwhelmed. She forgot to bring us straws, napkins, condiments, etc... we got up to grab things ourselves. I felt bad because the place was super busyIn addition to the ridiculous wait, the music was nightclub loud we had to yell to communicate to the waitress and or the person sitting next to us. Not pleasant at all especially for families with children. The lyrics to the song selection were raunchy. Songs like Pop that p$**y with kids waiting for food. Because the food took sooooo long we felt we should go elsewhere. My daughter was developing a headache and was really hungry. The waitress brought us complimentary biscuits after 45 minutes while we waited another 30 minutes for the food to arrive. When the food finally arrived, the worker legit threw the plate at my daughter with an attitude. As if we were at fault for their delays. She was so friggin nasty. My French toast was NOT delicious however the rest of the food my party ordered was. Management seriously needs to do a better job at communicating delays in the kitchen prior to seating instead of having the waiters make a million excuses while trying to serve. Get your back end and front staff more support during peak times. Teach your staff to update your customers. And check your attitudes at the door when you come to work. It's not the customers fault who come in hungry to wait hours to be served drinks and food. This experience makes me sad because I was so excited to support a black owned business. ."
