date,rating,review
9/22/2018,4 star rating,"So I had this place book marked for quite some time and since I was in the area, I decided to check it out. Although I heard this was a great spot for brunch, I came here during there lunch (almost close to dinner) time. As I walked up, the hostess was standing outside and immediately showed me to where I could be seated. The place is small but quaint. The staff was very friendly and attentive. There were nice pictures on the wall of the restaurant and beautiful photos in the bathroom projecting Black Renaissance which I LOVED!While you wait for your food, the server provided you with biscuits that were really good! I only ordered a drink here and the ""Lobster Bisque"" which was quite filling. I planned on going to another restaurant and happened to come across this one which is the reason why I did not order an entree. This is also the reason why I gave it 4 stars because I did not get a chance to try there brunch or dinner, however I would come back. Ps- this restaurant is literally walking distance from the 125th downtown area which makes it very convenient for eating."
9/14/2019,4 star rating,"First time at the new location. BLVD is consistent -- food is always good, service always friendly and professional. We didn't have a reservation and were told by the very friendly host that a table would be ready in 15-20 minutes; we were also offered seats at the bar if we didn't want to wait. We decided to wait for a table, and one became available in only 10 minutes or less. My daughter and I both got the southern dinner with fried chicken, plus a side of biscuits. Our meals came out so quickly that we hadn't even got our drinks yet! They give you a 3-piece mixed serving of chicken, which is quite ample. It comes with collard greens and potato salad, both very tasty. I can't remember the names of our specialty cocktails and I don't see them on the online menu, but they were yummy and not stingy on the alcohol! One of them was mango puree and tequila and the other was raspberry puree, vodka, prosecco. I can't remember our server's name now, but he was a sweetheart, as were the hostess who took our names, the man who seated us, and the host who was floating the dining room. Thanks for being here for Harlem, BLVD Bistro."
1/19/2019,3 star rating,"Pricey and cramped inside. Menu is short but food is tasty. Easy choice for meeting up with friends, local or visiting from out of town. A good Harlem staple."
8/31/2019,5 star rating,"I came here for brunch and we made a reservation for 10:30am because my daughter informed me that the place gets really crowded. Our waiter was Solomon - can't write a review without mentioning him. He was an excellent waiter.For brunch I ordered the homemade buttermilk sandwich (bacon, eggs & cheese). It came out nicely plated with a little jar of fruit preserves. It was 2 sandwiches on the plate. The biscuits were nice and soft with flavor. The bacon had a nice sweetness to it that went well with the eggs and cheddar cheese.I also ordered a side of cheddar cheesy grits - can't come to Harlem without ordering the grits. The grits was really good, nice and thick with a lot of flavor. I didn't add a thing to the grits and it was delicious. For my drink I ordered the bottomless Bellini. I think they just started the bottomless drinks because it wasn't programed in the cash register. I had one carafe of the Bellini since it was early. The Bellini taste really good, it was a great mixture. It was worth the price.My suggestion is to make a reservation and to come early to avoid a long wait."
2/13/2021,5 star rating,"BLVD Bistro, in my opinion, now holds the crown for best soul food in the city. The environment was modern and vibrant with great music. Our waiter Conrad was a great help in navigating the menu as well. The drinks were unique and tasty. But the thing that sealed the deal was the food!!!! The suasage gravy, chicken, eggs, everything was outstanding! I will be back on my next weekend venture to NY for sure."
6/13/2021,3 star rating,"I visited BLVD Bistro today for the first time, a friend recommend it. I had a 4pm reservation. It's apparently an 'It Spot' as it was packed with patrons. The music was on point but was so loud that you had to shout to be heard. We were seated in one of the pods outside but before being seated our temperatures were not taken and contact information was not taken. (Maybe they're not doing that anymore). The waiter was not the most pleasant and initially had a bit of an attitude. My friend and I ordered a drink each that came in a small plastic cup instead of a glass and we were still charged $16 dollars. We orderef the fried chicken dinner with potato salad and collard greens. The potato salad was really good but the greens were salty and the yams were hard as if they were not boiled/cooked long enough. Overall the experience was okay but I was not too satisfied with my food."
6/11/2021,5 star rating,"Stopped into BLVD Bistro and all I can say is I'm a huge fan. The service was incredible, the food delicious, and the atmosphere was really energetic. I'll definitely be adding to my favorites in Harlem. If in the neighborhood, stop in for a delicious meal."
4/1/2021,5 star rating,The catfish breakfast is my forever fav! The grits are creamy and catfish is delicious! The brunch is my favorite time to check them out
10/27/2019,3 star rating,"Unsalted fried catfish. Was there for brunch. But the grits and cheddar cheese with poached egg was good- but how can you go wrong with that. My husband said the French toast was one of the best he ever had- really sweet, if you're into that.The biscuit was amazing. I'd like to go back and try the fried chicken but if they don't salt the catfish I'm scared about the chicken."
3/7/2021,5 star rating,Great Fried  Chicken and the collard Greens are a must. The apple goat salad was a great size ans can be shared.  Then let's talk about those warm biscuits with the honey butter Baby. I will need a 45 min session on my peloton tonight.  Great space music and service brunch menu has a great selection as well.  .
11/23/2021,5 star rating,"I haven't been back here for almost two years due to California living, and I miss the food and vibe. Sunday brunch includes gospel tunes and great food. Blueberry pancakes that almost float off your plate, good coffee and great service from a hard working team. You're my NYC tradition, hope to see you soon."
5/22/2021,5 star rating,"Blvd was amazing!!! The biscuit, eggs, and pancakes were incredible! If my daughter enjoyed the pancakes than they must be delish. Service is great!!!"
10/25/2021,5 star rating,"the food is creative and delicious, the staff is so friendly and welcoming. Have gone a couple times and always am happy !"
11/20/2021,5 star rating,I travelled here from Maryland to celebrate my 30th birthday. This place is an absolute party!! The food and drinks were amazing and the atmosphere was LIT!! I will definitely be coming back.
11/18/2021,5 star rating,"I had the best experience at this restaurant today. From the host who remembered to politely ask for proof of vaccination to the most delightful server, Brendon. But, the sign says it all, ""BISCUITS ALL DAY""!  Delicious. I was equally impressed with the individual cups that our condiments were served in.  No need to worry whose hands had touched it-unlike most ketchup/hot sauce bottles!  I will most certainly be returning! Oh and the ""Catfish Po'Boy was really good, too!"
12/7/2020,5 star rating,"Delicious food but everything is served in plastic to go containers . I was able to taste  Mac and cheese , crab cakes , collards (cooked with turkey meat )  , fries were great , super pricey drinks but i would definitely eat here again ....Oh yea banana pudding"
5/4/2021,4 star rating,We had a table in the back only one other table was occupied the front had a lot of individuals occupied I asked the host to please seat myself and family in an area where there was a six feet distance due to the fact that I work for DOH and wanted to keep safe
4/5/2021,5 star rating,"Oh my goodness. I had brunch on Easter Sunday. I ordered the shrimp with cheese grits. Absolutely delicious. Kudos to their hostesses, servers, floor walkers ( don't know their real title)  to make certain that all is going well, chefs and overall staff. My only drawback was the music was rather loud so it was hard to converse with others at your table. You were forced to speak loudly. Drinks were outstanding, nice and strong. My overall experience was excellent. I will definitely be dining there again. This time I'll try the fried catfish. Thanks Blvd Bistro. Keep doing what you're doing."
11/4/2019,3 star rating,"The food is delicious well seasoned. Its good soul food! The shrimp and grits were delicious! However the biscuits were served cold and a tad hard. I reiterated to the waitress I wanted warm batch and again, I was served cold biscuits Try and make a reservation it's sometimes full.Over all it's a good restaurant to if you're really hungry."
9/11/2021,5 star rating,Food was awesome but I recommend just making an early reservation because the Later in the day the longer it takes to be seated and your reservation might be sabotaged as sometimes people sit for longer than the 1.5hr time limit.
9/9/2021,5 star rating,"I really liked this place. Great music, live atmosphere, great people. The food is pretty good too. The only thing I wasn't pleased with was the cinnamon biscuits--they were dry. The wait was somewhat long, but that's okay because there's enough to do in the area to pass the time. Also the Ronald Draper art installation outside of the restaurant makes for a great photo op!"
9/28/2021,4 star rating,Very nice and clean establishment! The food and drinks were excellent and the staff very friendly.
1/24/2021,5 star rating,"C'mon Shrimp & grits...with a buttermilk biscuit!! Omg sooooooo good! The best shrimp & grits in NYC in my opinion. The DJ is always on point during brunch. I love it here. The owner & his wife are sweethearts. The manager Trent is a joy, love him! We have a favorite server, I feel bad because I don't remember his name...but he's Hispanic, petite yet powerful:) His service is the BEST. This is one of my go to restaurants in Harlem...where are we going? To BLVD bistro period! No regrets ever. Bellinis are delicious and STRONG."
2/28/2021,5 star rating,Went to brunch here and had so much fun! They had a live dj playing bomb music. Their food is so good and you can get a carafe of alcohol too with your meal. I got the omelet and my bf got the shrimp and grits. Both were amazing! We tried one of their moonshine mixed drinks and it was delicious. Highly recommend this spot. Both the atmosphere and the food/beverages are very good! :))
10/17/2021,1 star rating,I usually go to this restaurant all of the time. I love the food and USUALLY I receive amazing service. I actually was so hyped to be there. However this time my friend found a rubber band in their food and at first we were assuming the best because we speak with the owner often and always have a great time. However our food was not compensated and the new manager SHANNON was so unbelievably rude. Her Whole approach gave the energy like she felt like we were trying to get free food I am like ma'am every time I'm in Harlem I support BLVD bistro. It was the saddest experience because we deeply respect the owner and his business. They need to get rid of SHANNON ASAP she's not a good look for their business. A RUBBERBAND? There should be no discussion the food should be free. The waitress was great everyone was great but how that manager dealt with it. WOW disappointed
10/16/2021,1 star rating,"Disappointed.  The fried chicken was tasteless.  Service was very slow but waiter was very nice and had too many tables to wait.  I came to this place because I saw it featured on Dr. Oz and they raved about the biscuits, which were very good, but you had to pay for them.  Usually you get a basket of bread before your meal. Here you had to pay for it.  For the chicken,, you pay  for white meat like a fast food joint..  My meal cost $45 with no alcoholic drink, fried chicken, which came with potato salad and greens, which were okay, lemonade and biscuits.  Finally, there are two prices on your bill, one for cash and one for credit which is higher.  I don't know if all restaurants are doing this since COVID, but I was shocked and luckily we had cash.  Bottom line, for me, Boulevard Bistro gets a thumbs down."
3/13/2021,2 star rating,"The service was great! My waiter was funny and fairly attentive. The vibe is cool and music choices are pretty dope.But the food was lacking. I had the shrimp with grits, which was cold--first bad sign.Then the biscuit it came with was not only cold but hard and pretty flavorless.The Bellini was decent just needed to be stirred as the flavor was at the bottom. But unfortunately this was room temperature at best and not cold."
10/31/2021,5 star rating,"Such a welcoming, cool place. The food was delicious. I had the fried chicken dinner - so good and the collard greens were AMAZING! Yes, Red Rooster and Sylvia's are in the area, and I love them too, but this is a must brunch spot in Harlem!"
9/3/2020,5 star rating,"I went there for breakfast, service was good the people were friendly. The food was amazing, the price was equal to the service and quality of the food. AlexE"
3/31/2021,3 star rating,"The drinks and food were okay. Very crowded place and loud so not the best place for a first date. But, great for friends and just chillin."
3/28/2021,5 star rating,"Everything was delicious! I highly recommend the cinnamon biscuits, pancakes with blueberry topping, catfish breakfast, and fried chicken"
3/12/2018,3 star rating,"So, this place is cute. It's very small and they got as many seats as they could in there.  It was Sunday, so they were playing Gospel music - cool, but turn it down a bit - the volume made conversing a challenge. I had catfish and grits that came with a biscuit and eggs. It was DELISH!  The fish was perfectly fried with a light coating of corn meal and the grits were CREAMY with the right amount of cheese. The scrambled egg was perfectly cooked as well. The spiked sweet tea with prosecco was amazingly yummy.  The only negative re:the food was my biscuit. It was CLEARLY overdone (see pics). About 3/4 of the way through, a waiter asked us ifnhencouldnhave the extra chair at our table. It was holding our coats which he took to hang up. It meant that I hen had to get up, put my chair in the aisle so he could have it and then slide the other chair. Just an inconvenience in a crowded space."
11/19/2020,5 star rating,Delicious food in a safe environment.  Brought out water for my dog without asking.  Group of 6 felt comfortable and food is awesome.  Varied menu for brunch made everyone happy. Thanks for you efforts
10/23/2017,5 star rating,"The. Best. Grits. I've. Ever. Had. I'm still dreaming about the grilled prawns nestled in a bed of bacon and buttery grits. The texture was creamy but not mushy and everything came together in a wonderful symphony in my mouth.The greens here were also amazing. Yes, they came in a very small cast iron pan that looked cute but made me nervous because of how small it was. Did this dish belong in a miniatures cooking video? However, once I took a bite of it, the flavor was much bigger than than a hundred miniature cooking shows put together.The fish on corn plus honey was also a terrific blend of crispy, tender, juicy, dry, sweet and salty. The chef here does a beautiful job of highlighting contrasting notes without letting them fight with each other. Instead the flavors compliment each other wonderfully.Definitely more like $$$ for dinner, but well worth the experience. Will come back for the Mac and Cheese dish, because if it's anything like the grits, I'm sure it will be unbelievable."
11/5/2017,5 star rating,"Just had brunch here. Dang!!  That was good!!! It's a tiny little joint with a line out the door and for good reason. We went at 11am on a Sunday which was just about the right timing. When we left there was a huge crowd waiting. We ordered the pan fried chicken, banana pecan pancakes and macaroni and cheese. Holy crack a moly it's tasty!  The chicken was PHENOMENAL!  It's hard to make chicken that is thick and yet it's super moist and very flavorful. This chicken is all that and a bag o chips people. Sides were potato salad and greens. Both solid. My husband, a pancake connoisseur says that these pancakes might just be the BEST HE'S EVER HAD!  I tried them and concur. Super moist and packed with flavor. The Mac and cheese with bacon on top was also excellent. Service was awesome and the vibe was super cool. Overall you should hurry up and go get some brunch here!"
9/18/2021,1 star rating,"On Saturday evening 9/18/21, I waited over 10 minutes to be recognized after being seated. I'm assuming one of the owners or managers (male late 50s) waited on a table next to me even though I was seated first(it appeared he knew them). He had his back to me (he was sagging) to the point I read the brand of his underwear. He completely ignored me. I wanted to see how long I'd wait. I was given water by a young man who stated he wasn't my server after asking him. He said he'd get them. I waited approximately 7 minutes. Meanwhile the older manager came to check on the table next to me, further ignoring me. A couple sat on my other side and that manager tended to them, again ignoring me. I started to think I was either invisible or he had some unknown personal grip towards me. Finally, a waiter asked if I had been served and I said no. This waiter was pleasant in taking my order made a suggestion on beverages. I waited another 15 minutes for my food. I didn't receive any condiments for the food that was supposed to come with that particular meal. I waited another 7 minutes before getting my waiter's attention. When I finally received those required condiments, they were in a metal cup about the size of a silver dollar, (butter, syrup and jelly). I had to ask for more. The manager/possible co-owner checked on both table on my right and front ( me in the middle) never once acknowledging me. When It was time to get my check, I waited about 10 minutes ( napkin in my plate, manager/co-owner still tending to both tables. I finally got up went to hostess and said, I would like to pay. She located another manager as I was sitting down and that manager asked me if I needed my check and I said yes. I observed her talk to the other male manager/co-owner and I observed him saying and pointing to my waiter who was immersed in other things. Finally, the waiter came with the check and I pointed out that he did not delete the unsweetened lemonade. That little transaction took another 10 minutes. The waiter obviously forgot, walked past me and was serving customers outside. By this time, I made up my mind, no tip will be given, I will not spend another dollar at this restaurant and I will write a yelp review. It took another 5 minutes before I got the adjusted check. To say the least the service and lack of common/basic customer service was unacceptable and unprofessional by the waiter and the older manager/possible co-owner (sagger). The food on a scale of 1-10.... I rate it a 6. (Fried chicken and pancakes). The syrup and butter weren't at all tasty. Stick with regular butter and syrup. Hopefully, those two individuals will be better. Some how, I think It was kinda personal‍"
9/23/2020,4 star rating,"Those biscuits are AMAZING. Mac and cheese was on point! Vibe is nice, and I can't say enough about the great service. The one suggestion I would make to the chef/owner is the wings that are used HUGE. And while this sounds great, larger wings are generally from those that are low quality over fed mass produced chickens - which produce a ""rubbery"" texture to the meat. It may be ok for most (which is why I assume they still use them), but for those from a culinary background, will get sent back. I would happily pay $2 more if they used organic chicken."
9/14/2020,5 star rating,"BLVD was truly wonderful! Their wait was pretty crazy, but then again it was a Sunday, and everyone was out. Well worth the wait! Sangria was delicious, food was fresh and tasty, and the music was BOMB! I'll definitely be returning!"
9/14/2020,5 star rating,"Come support Blvd Bistro , guarantee amazing food , good ambiance, and safety is a top priority. The owner is wonderful and hands on with all her guests. My Sunday was a beautiful outdoor experience. Thank you to everyone involved ."
2/2/2020,4 star rating,"Very upbeat place for brunch. Service was fast , food was great. I would definitely come back and bring my child . I had the chicken and biscuit basket, yummy !!"
9/6/2020,5 star rating,Had a wonderful experience at this establishment. The food was AMAZING the service was the best and the music was good. I definitely will be returning
9/6/2020,4 star rating,"So it dealt with social distancing. My waiter was very pleasant , however who saved the day was Malik (forgive me if I'm spelling his name wrong). Although my waiter was very pleasant he was very busy. Malik acted as a filler brought over our drinks (very well made , quality of brand is in question. I got an Amsterdam vibe) . The food: grits were the best I ever had in a restaurant setting. The pancakes while the effort was there it was an obvious fat content (butter or oil in batter) that took away from the potential fluff. It was also very pleasant to see the head waiter interact with patrons / bussing tables"
9/5/2020,5 star rating,"Staff was so sweet and everything was delicious! They have a great outdoor set-up. I had the watermelon goat cheese salad to start and shrimp and grits. If you're craving soul food, this is an excellent option. It was packed when I went on a Saturday afternoon so would recommend going early!"
9/3/2020,5 star rating,"I went there for breakfast, service was good the people were friendly. The food was amazing, the price was equal to the service and quality of the food. AlexE"
8/30/2020,5 star rating,"Enjoyed a wonderful brunch today with my husband as we celebrated our 1yr anniversary ... food was amazing..we enjoyed catfish, grits(lawd have mercy) ,cheese eggs and a savory biscuit ( butter on the side had a nice sweetness to eat) delicious .. the Dj was great & funny.. gave us hip hop and R&b jams both new and old school.. kept us entertained and was interactive with guests .. our waiter was very attentive, he made us very comfy from his initial greeting ( knew we wanted to drop a nice tip from his service 4 sure).. until next time.. i def reccomend.. the quality of service was pretty great i might add"
8/30/2020,4 star rating,"I came here with my fiancé for a nice night out, he picked here to eat. The interior of the restaurant looks nice with ranch style and a rustic look to it. Since we are in a pandemic, we were situated outside behind a bus stop. I'm not rating this however. To drink I ordered shrimp and grits and Chardonnay to drink. The meal was ok. I liked the jalapeño with the cheese and bacon bits. I just wish there was more shrimp. The biscuit that came with the meal was tasty with the maple butter they served with it. The staff were great as well, I can't wait until this pandemic is over, I would have loved to sit down inside. The decor really had me. The food and drink were served in take away pans. I understand why, but it doesn't make for a good photo lol."
8/29/2020,3 star rating,This was a really cool getaway for the night. There was ample seating along the sidewalk of the restaurant even though seating was off-limits inside you still got a really good experience being there. I got the fried chicken with biscuits and a side of mac & cheese. The fried chicken was very moist and hot so you can tell it was freshly made the biscuits were delicious along with their maple butter and the mac & cheese is very girly and cheesy just the way I like it I had a really good experience our waiter was super friendly and super cool. I definitely enjoyed being there and I will definitely go back when things clear out and we are back to normal once again
7/21/2019,5 star rating,"Okay so this restaurant is also worthy of its five stars. Great Service and well designed soul food!The portions are not gigantic designs to Stuff you face. The prices are on point with the quality of their food. The items that take time to make such as collard greens black-eyed peas, baked beans are presented with properly prepared Fried Chicken, shrimp and grits, and Sliders. What that means is that the chef knows exactly what he's doing in his kitchen and nothing's over cooked or sitting. This is a very important point when you're trying to get soul food especially from anywhere in Harlem.The importance of soul food is making sure to get things right with good timing. If a restaurant is struggling they may serve you food that's been sitting for awhile. Thank God that the Boulevard Bistro does not do that. Which means you get great food every time. Be sure to come here avoid all the other ones that have been around for 20 years serving you bad food.  Just because a restaurant has been here for 20 or 30 years doesn't mean it's good.Be sure to try the Blvd Bistro! Btw: Great service from David:)"
