date,rating,review
6/1/2022,5 star rating,"HEYOOOOO the best soul food i've found so far, and i knew harlem would be the place. let me tell y'all --the food is amazing and the service was lovely. it's affordable and it will feed you for daaays. we got the fried catfish dinner--can i tell you this was seasoned!!!! wow i could eat that for days. esp paired with their hot sauuucee ooo it's amazing. the meals come w 2 sides and we got the mac&cheese and collared greens. it's everything you'd dream of. mac and cheese was cheeeesy and melty and baked. collared greens were salted and seasoned, not bitter at all! bbq zing wings--it's like a reeeeallly tangy bbq sauce, and it's addicting af. we almost got another batch! they're crispy and super saucy, they definitely don't shy away on portions. i cant recommend this place enough! it's worth the hike if you don't live in harlem!!"
2/6/2022,5 star rating,"The service & food was outstanding. We ordered the Crab Cake Plate with Cabbage & Mac. Lobster Fries, Shrimp w/ Wings, & One of their Juices. All of the food was fresh & delish. Large portions of food, worth the price. Cash Only so bring your Dinero."
6/1/2021,5 star rating,"Passed this spot while walking back to the brownstone I'm staying at and saw this guy holding a bowl full of big beautiful crab legs. I instantly went to Yelp lol. Saved it to view once out of the rain. Decided to eat dinner here tomorrow. First night in New York and I think I'm in love. Did the create of own fresh seafood boil. You take a bowl and pick your items YOURSELF. Jumbo Prawns, Scallops, Snow Crab Legs, Corn, Cabbage, and Brussel Sprouts in Old Bay and Garlic Butter. Also added a side of Mac N Cheese because the reviews highly suggested it. The peach cobbler was sold out. The wait was lengthy but it was crowded and you have to allow cooking time so no complaints there. The garlic butter is COOKED TO ORDER!!!! That alone speaks volumes. They have a sauce rack/area where you can fix your condiments to take with you so I took lemon juice, cajun seasoning, and hot sauce. The food was beautiful as she ladled the garlic butter on top. Once back inside I found the seasoning lacking a great bit for my liking so I added a good bit of Cajun seasoning and the hot sauce for spice. The prawns were over cooked and that made me very sad bcus of their price lol. But it's a risk when cooking it all together like that I know. The scallops were fine and the crab legs and corn were perfectly and fresh. The brussel sprouts were done and so was the cabbage. The Mac and cheese is definitely scratch made and you can tell. It's full of cheese and made just the way you love it from a good ole southern kitchen like my own lol. (Visiting from Alabama) I love the fact that you can pick your own seafood yourself and that it's steamed fresh. I just need more flavor and spice personally. Would definitely recommend and would definitely return to try more of the dishes I watch them prepare while waiting."
10/3/2021,5 star rating,"I ordered the loaded lobster fries online. The line to order in person can be very long. The loaded lobster fries are so good. The amount of lobster and shrimp you get is insane for the price. The only thing I wish they gave more of were actual fries. It wasn't an issue for me, I just made more fries at home to add to the batch. This is also a meal you can share. I normally eat a lot but it's definitely something I suggest sharing because it's a lot!"
11/12/2021,5 star rating,Everything is delishes ! Highly recommend Greens are especially good Also I went to the 2nd location near 116th.. cool hookah bar connected to it if you wanna sit down and eat maybe smoke some hookah and have some drinks
7/26/2021,5 star rating,"Video Review Here: vm.tiktok.com/ZMd7BN629I've been highlighting black owned NYC restaurants on my food vlog, and came across theinfatuation.com's list, where I found Lighthouse Fish Market. I'm officially a New Yorker, but a Maryland native at heart, which mostly means that I know and love good seafood. Maryland does seafood well! Here in NYC, I've had amazing seafood, ok seafood, and terrible seafood. It's always a toss up, and a risk, even. Today, when approaching Lighthouse, I just had a feeling. I had the feeling that they'd get it right....I walked in to find a line of people. Some of which, I could tell were regulars. They just had that ""I've been here before"" energy. It kinda excited me to see their excitement. I saw some of them walking out with their orders, which looked really good. I noticed that they only accept cash, so had to step out to go get some. Once I came back, I knew that I wanted a fish and shrimp and chips platter, but was unsure of which fish. I asked the cashier if she prefers the whiting or the catfish. She says she doesn't eat fish lol, but said that they're both quite popular. I went with the catfish, shrimp and chips. I placed my order, and waited maybe 20 minutes, which is fine. I saw them hand-battering the fish on sight, which honestly makes it worth the wait. When they're making your order fresh at these restaurants, it takes time. To me, it's totally worth it to have my food made to order. While I waited, I got a couple dipping containers, and loaded some with lemon juice, ketchup, hot sauce, and tarter sauce. Oh, yes....I was ready to go IN! Lol. So, I get my order, and I couldn't believe how much food it came with. It was huge! It was a big enough portion to feed at least 2 people. It cost me $20, which was amazing. I take my order to a bench nearby in Harlem, and I get down to business! People walked by and told me how good it looked lol. I was makin' the people hungry lol. I started eating the fish, and it was beyond fresh, crispy, and seasoned to PERFECTION! I wasn't expecting it, honestly. I mean, the flavors they developed were perfect. The same with the shrimp. Beyond crispy, fresh, and flavored nicely. Even the fries were nicely flavored. There's no extra salt necessary. They take care of that for you. I dipped the fish in the tarter sauce, and it was just perfection. I'm sorry that I haven't heard of this place sooner. It is extremely well done, black-owned, and produces some of New York's best seafood. My only minor critique would be cleanliness for the kitchen area. Otherwise, I had an amazing experience!"
5/29/2022,4 star rating,"First, I am going to state each time I visited both establishments the food has been excellent.  I truly applaud the owner for growing his business during these uncertain times we are living in.  However, I have a concern with why the establishment do not accept credit cards.  People come in to support this establishment but is required to utilize an ATM machine that charges $3 fee plus the bank fees.  We are living in times where people are using debit/credit cards.  Cash is rarely preferred due to safety concerns, etc.  Consideration to accept credit cards should be considered to improve the quality of service and it will show some care and concern from the owner."
7/23/2021,5 star rating,Harlem. Soulfood.Black Owned.Always Packed.Long Lines. Very Tasty & Flavorful.Order In Advance. I Will Always Support.
8/14/2018,4 star rating,Always Wanted To Come Here For Some Seafood.It Was Worth The Wait. The Food Very Flavorful. Tons Tasty Options. The Customer Line Was Out The Door. This Was Just A Monday Lol.  I Can Image What Fridays Look Like. Definitely Stopped On The Side Of The Road & Body My Whole Plate Of Food. Would Definitely Patronize This Restaurant.Good Job.
4/5/2021,2 star rating,"Food was good but the wait time is insane.  I ordered fish and chips,   I waited for more than one hour. You can not dine in, this is take out only.  I got in line, only to realize after standing in line for 15 minutes that there was a note on the cash register that says, accepting cash only....no debit or credit cards.  This sign should be placed on the door. By the time I saw this there was one person in front of me placing their order.  I got out the line, stepped outside to call my husband who ran a quick errand.  He had cash on him and brought it to me.  I got back in line and waited another ten minutes before I was next to place my order.  This place is super busy and the customers follow the mask rule, but they do not honor space requests at all because it's a bit difficult to do so due to spacing. I waited long enough to see employees openly arguing loudly in front of customers.  I was there long enough to see customers who had already waited over an hour argue with the staff because they were told there was a certain amount of an item available only to find that the product was prepared and given to someone else, requiring that they wait longer.  Overall the food was really good, fresh, chips nice and crunchy, and everything was seasoned appropriately BUT there are other restaurants where take out would be much quicker, with far less drama going on.   If we knew the wait would be this ridiculous we would have opted for an indoor dining experience at a sit down restaurant."
12/6/2021,1 star rating,Went to lighthouse Dec 6 2021 one of my favorite spots in Harlem for seafood WTF the dam food was way off. Told the cashier I wanted whiting and shrimp combo she got it mixed up with just the whiting and shrimp regular order. I ask her where are my frys she said you ask for the combo I said yes the combo come with fries. I was not charged from fries so no big deal I just give them $5 bucks for some fries. FYI their fries are seasoned fries  I hate seasoned fries the food have so much seasoned can I have a option to just get some dam regular fries smh that way us brown peeps have high blood pressure.  So back to the food the whiting and shrimp was horrible the fish was smelly I guess old fish the fish was so small tiny I have never seen such small whiting fish and it was greasy All the whiting was a nice size and shrimp was fried up nice. Well nit thus time my whole family could not eat this smelly small fish and shrimp! They owner of this spot is a smart and sharp dude you better step up your game you have a popping spot but if you keep your quality going down like this you will lose your customer base. You are better closing down then put out wack food ! Bye the way I did see some local Chinese lady delivered you a bag o whiting that day that shows you was not using your normal supply chain. Also I gohot some show crab legs $29 a pound that's crazy show crab legs was way to dam salty how do you make steam crab legs too salty and i had to tell the girl to chill on the butter. At the end of the day I was out $75 for food Me and my family could not eat. I'm usually get great food from lighthouse and they are black own so I try to support but the food I paid good money for was very very disappointing!!
9/28/2021,1 star rating,All i got to say is my friend bought me some food from here and i wish they could get they money back.. i aint lying .. flounder with mac and cheese .. nasty fish has no taste .. tastes like grease mac is 2/5 could use more seasoning
4/10/2022,2 star rating,I was in love this place but theres a new set of people working there and the service has been horrible ever since. I spent a while waiting on a Basa dinner and noticed that everyone else who came after was getting their order even though i had asked about mines. When i got my order it seemed as though my fish was refried from how soggy it was. I absolutely love lighthouses foods but today was disgusting. The fish was also a little on the salty side. Also the last time i went there the business was completely empty one night and staff were just conversing amongst themselves. It wasnt until i interrupted after some time to ask about prices that a skinny red hair girl came to assist me. Service is getting worst and worst but food is usually anazing but todays fish was the worst i ever had from there. Side note i only started eatting fish when i tasted light houses fish so today was very dissapointing.
9/16/2021,5 star rating,"This place goes absolutely NUTS. I'm new to the Harlem area and this is one of the three seafood places I've found nearby and ever since I've come here I haven't stopped coming. Definitely dangerous to live close by because I stay wanting to come here. I've only tried the catfish dinner and haven't been inclined to try anything else since it's so good but every time I come I see other orders ready and I'm tempted to try something new.  It can get (really) busy sometimes but I'd just say that's a good sign? I don't really mind a wait, especially considering they're open pretty late more than half the week (which is also dangerous for late night cravings......)."
10/6/2021,1 star rating,Terrible service and try to rip you off not explaining combos ... disappointed .
11/11/2020,5 star rating,"First time coming to this gem after wife was unable to cook. Upon looking at my food & taking in the aromas of the food I knew right away that I should have came to this Seafood spot a longtime ago. It's open late, they cook fresh food up until closing as there is high demand for the food here. Mike conveyed appreciation to his staff & customers while being swarmed with orders. Thank you for your attention & food quality.Much success to you on all your ventures. You have recipes, dedication, team & personality to win & expand successfully throughout NYC. The lovely young lady tonight was right when she said ""You have more than just real butter to brag about, tell him (me) about all the dishes you make."" No need to tell me anymore you've won me over as a customer with great food, good service & nice hospitality. I look forward to trying out more items on your menu as O proudly support an African American business."
8/6/2020,3 star rating,"Great food. Well prepared and a really good menu. However customer service is a problem. On my first visit here , I checked in on Yelp and I was given a 10% discount as a first time visitor. When I tried to use my coupon I was told that they don't honor Yelp coupons and that "" they just add us on that app! We don't do that stuff!"" Like WTH.. as a first time customer honoring that coupon that would have been the right thing to do. Instead the put their pockets over customer service and long term customer loyalty. It's sad because I support black owned businesses regularly. Unfortunately greed and petty business practices tend to ruin the integrity of many of them."
7/7/2020,4 star rating,"This little hotspot is something that you cannot miss! I was told by one of my roommates to go by this place because it was one of the best places in New York City! She continue to press me, until I had to make the run. This is a takeout joint you cannot call and you must go there and order your food. I had the opportunity of looking at the menu and the prices were great,  they were not too high and the full proportions were astounding! Now let me tell you anytime you can get someone to look at the quality of food or something that they don't normally eat, you know it is a homerun! Let's start with their homemade macaroni and cheese. Now a good cook can look at the macaroni and tell that it's seasonings,  you can see the crackling pepper and you could tell it is two types of cheese. They don't give you just a little bit cheese, oh no child that macaroni makes you want to slap yo mama! I cannot tell you enough on how good the food was and I am just getting started. Next,  I tried their homemade candy yams. Now you know that everybody cannot make good candy yams, these were caramelized candied yams with cinnamon and nutmeg you could taste the sugar.Next let's go to this golden fried crispy flaky hot and tender fish (ooh child), if this food was not good.We cannot stop until we talk about the butterfly fried shrimp. I am talking about the kind when you don't need tartar sauce nor cocktail sauce. The food was seasoned to perfection! Anytime my friends say we have got to go back there again, I'm ready. I wanted to just try the steamed broiled food because the other food just couldn't be that good. Now all of you know I love food, but I must say this has got to be one of the best soul food take out joints in New York City. Come to think of it, I don't believe I have ever tasted food as great as this for takeout ever! I am telling you If you ever come to New York, you cannot miss this spot. Updated message, I had a chance to go back a second time the same day and there was at least an hour wait for your food and the customer service was not as friendly as the daytime which brings them down a star.Also, if you have a coupon from Yelp, and the manager is not there, they will not honor it! I called to notify management but did not receive a response."
6/24/2020,5 star rating,"This little hotspot is something that you cannot miss! I was told by one of my roommates to go buy this place because it was one of the best places in New York City! She continue to press me until I had to make the run. This is a takeout joint you cannot call and you must go there and order your food. I had the opportunity of looking at the menu and the prices were great they were not too high and the full proportions were astounding! Now let me tell you about! Anytime you can get my boyfriend to look at the quality of food or something that he doesn't normally eat and says oh no I have to taste that you know it is a homerun! Let's start with their homemade macaroni and cheese. Now a good cook and look at them macaroni and tell that his season from here to tell you can see the crackle and pepperoni and you could tell it is two types of cheese and they don't give you just a little bit cheese oh no child that macaroni makes you want to slap yo mama! I cannot tell you how good the food was and I am just getting started. Next I tried their own homemade candy yams. Now you know that everybody cannot make candy yams these are very good candy yams and they are caramelized with cinnamon and nutmeg you could taste the sugar. Next let's go to this golden fried crispy flaky hot and tender fish (ooh child), if this food and good you let me know and I will give you your money back. This thought was blazin!!!! I'm still not finished we cannot stop until we talk about the butterfly fried shrimp, I am talking about the car will you don't need tartar sauce nor cocktail sauce. The food was seasoned to perfection! Anytime you can get my friend to say we have got to go back there again, i'm not gonna tell you that I had to go back a second round because the food was so amazing I wanted to just try the steamed broiled food because the other food just couldn't be that good. Now all of you know I love food but I must say this has got to be one of the best so full take out joints in New York City. Come to think of it, I don't believe I have ever tasted fold as great as this for takeout ever! I am telling you if you ever come to New York, you cannot miss this spot. If it's a long line where your mask do your social distancing but you have got to come and try this food!Wait a minute I forgot one more thing. They had a punch that made you remember old fashion Kool-Aid. Now I don't know if many of you know anything about a good Kool-Aid but when I tried the tropical punch with pineapples in it was so good!"
11/1/2020,1 star rating,"I've lived in Harlem for years and always heard the hype about Lighthouse. So on a Halloween night after a long day of celebration me and my boyfriend decided to check it out. When we got there the inside was super packed with about 20+ people, it was so packed that we had to wait outside but I didn't mind it at all. We finally get in and was hit with a heavenly aroma so we were excited to place our order. We ordered the lobster tail stuffed with crab meat with macaroni and cheese & garlic mashed potatoes and the Herb salmon dinner with macaroni and cheese  and collard greens. After waiting about 45 minutes for our food to cook we excitedly left and went home to try it. My boyfriend loved the herb salmon and the sides although the salmon was dry. But when I got to my lobster tail I noticed a slight ammonia smell but the crab meat and sides I had go with it over powered the smell so I dug in. The stuffing was delicious but when I bit into the lobster tail it had a strong vinegar taste and reeked of ammonia, thinking I was crazy I took another bit and it was absolutely horrible. I was very disappointed, I was finally looking forward to trying this place out only to be served with a spoiled lobster tail. I paid $45 for this meal and it annoyed me that I wasted my money on this. I would've went back if it wasn't so late and far away from where I was at. Another annoying aspect about this place is that they do not accept cards, apple pay or Samsung pay you must have cash.I'm giving this review 1 star because the sides were good."
6/25/2021,3 star rating,This was not the original location and when I come from Atlanta I always want Lighthouse Fish. I was so disappointed... the fish had absolutely no taste lack of seasoning on the fish as well as Mac and cheese. The greens were ok.  The staff working in there was so dry and lacked any form of customer service Lordy. The location by Target is a no bueno please go to the other location in Harlem. It is DEFINITELY worth it (they get 5 stars)
4/6/2020,2 star rating,"As I write this. I'm trying to be lenient as we are in unprecedented times but I was not satisfied with my visit to lighthouse today, especially for the prices that they charge. There was supposed to be a limit of 7 people in their small space at a time. They finally abided by it after we reached about 10 people inside for the second or third time. My steamed food was underseasoned, I received the wrong side - an odd tricolored macaroni salad at that - and they would've forgotten my banana pudding had I not reminded them again when I was finally able to grab my order, 30 minutes after ordering. I've been here a number of time so the disorder while ordering and waiting isn't new but the food used to make up for it. Now, that's not the case. Oh, and to add to the disappointment, they were cash only today."
3/31/2019,3 star rating,"Here are some things you should know before you go... it's virtually a box inside. Don't come in here thinking you could move around and what not because when that line gets long (which it often does), you're pretty much stuck. You will also wait an eternity for your food, so please have some time on your hands. Lastly, I'm pretty sure they just either cook the fried seafood and chicken in the same grease or they don't change the seasoning for it because they all taste the same. Nonetheless, the food at Lighthouse is really good for the most part but for the wait and the prices... there are about five other places I can think of off hand in the area that you can go to and get close to the same things that they offer. Having said that, I love their Mac and cheese and collard greens a lot. Do I love it enough to waste at least 40 minutes of my life when I go there? Nah"
6/13/2021,1 star rating,Food is to salty... please ease up on the salt  when I first came here the food was so good now it's like they are dropping the whole jar of salt in it
8/29/2020,3 star rating,"I had the fried fish and shrimp with a side order of macaroni and cheese.the food was so so the wait time was out of this world there's no reason to take over an hour to fry fish I gave them a 3 because the people who worked there were extremely nice, though no one kept their mask on there was no social distancing in this store what so ever there are these giant containers of what I'm going to call Kool aid and everyone helped themselves once you paid for the bottle would I go back no but it was an experience"
2/4/2020,3 star rating,"The food is decent, yet overly priced. The place was filled  with people. Ignoring just how dirty the place was. Dirty pans, food that looked like It's been left out for days. The oil that they fried maybe 95 percent of the food was black as tar. Oh how we want our small businesses  To do well. Yet, the service sucked! The cleanliness was horrible. This is truly sad! The wait was horrible and the cashier was coughing over the food! Never again even with the yelp discount !"
3/20/2021,1 star rating,"What if during Covid there was a magical place where nobody seemed to care. Where people could cram into a tiny space, shoulder to shoulder, and wait inside for your food. Or maybe you can sit in your double parked car waiting for 40 minutes or more. Don't worry aboit traffic. Nobody does here. It's all good. Just go on in and join the crowd. Yell your number. Maybe someone will notice you. Well friends, there is such a place. Lighthouse. The street is constantly filled with their patrons, flocking to place an order the only way you can - in person. That's right. They believe so much in safety and convenience, that they just want to give you that extra personal touch of being shoulder to shoulder, and bumper to bumper , with as many people as humanly possible. Could they choose to take orders by phone? Sure. Delivery or internet orders? Of course. But in these extra vigilant times of Covid, they choose to put human contact first by giving you no other choice. People are so happy and excited about this method that cars are double and triple parked literally for blocks, causing massive traffic and parking backups, lively arguments, and jovial honking at all hours of the night. They bring so much energy to the neighborhood.Thank you light house, for putting your boutique ordering experience of walk ins only, ahead of needless safety measures and care of your neighborhood. We have all come to be very familiar with it, until 2 AM. Just follow the incessant honking horns and yelling."
