date,rating,review
8/10/2015,4 star rating,The location is interesting and definitely a bit sketchy but I'm a Brooklyn girl so I was down for the adventure. The seafood is well seasoned and the Mac and cheese is pretty good. I wasn't impressed with the macaroni salad and sweet potatoes.
5/22/2017,4 star rating,Lighthouse is a get it and get situation. They really need to expand! The food was amazing. I had Lobster fries & Wings with Crazy sauce. For a Seafood place they know wings! Also had a piece  of Lemon Cake for dessert that was like a slice of Heaven. Can't wait to return.
5/6/2018,5 star rating,Amazing food. Mac and cheese was great. Fried fish was great. Candies yams was great. And the lobster fries were banging!!! The wait was a bit long but I'd say it was worth it. Will be back next week!!!
1/30/2018,2 star rating,"Let's just say I had high expectations of lighthouse because I've ate here before more than what I've posted on Yelp and I'm very disappointed.. for starters it was very greasy I literally titled my container to the side and the amount of grease actually made me feel nasty, second off the Alfredo clearly has the taste of jar Alfredo wasn't from scratch, third it was wayyyy too much Alfredo sauce other than the cons the pros were the salmon and shrimp were both cooked to perfection! Lastly for 25$ the least they do can is give you a slice of garlic bread! Lighthouse this wasn't your best dish! Hopefully this was just a off day for y'all!"
1/20/2018,4 star rating,"Food is great and fresh!!! Hot, lightly battered but as with most restaurants service can be friendly but extremely slow... Great meal!"
3/4/2019,4 star rating,"I had the loaded lobster fries which came to $20  it was a meal in itself it was the best fries Ive ever had. I also had a steam salmon fillet with vegetables u can pick which fish you want and vegetables they cook it any way you like fried broiled steam sauteed  in diffrent sauces they have crab legs, shrimp and many more options  shrimp alfredo, curry shrimp over rice I called to place an order nobody ever picks up that phone I waited 1hour to get my food all you need to spend is 2 of the most important things you have and that's time and money it's a lil pricey depending ok n who you talk to it also good food the parking sucks and it's a to go place they have an instagram lighthousefishmarket where you can keepnupmto.date with what's goin on"
5/15/2020,5 star rating,best black owned seafood spot i've ever been to. the food is worth every penny! i always go there from jersey & its worth the ride too.
7/24/2019,5 star rating,"I wish I would've taken a picture of my food, but even the picture wouldn't have done the food justice! I've been to Lighthouse a couple of times and each time their food is AMAZING!! Even thinking about the food makes my mouth water!!! You should go here expecting to spend a pretty penny compared to other take out restaurants but it is DEFINITELY worth it. The restaurant is also VERY tight in space and the wait times can be long but i promise, it is alllll worth it. I've had the bbq wings, jerk chicken wings, macaroni and cheese, seasoned fries, shrimp & a seafood platter and they were alllll good. Only thing i wouldn't recommend would be the collard greens."
1/29/2018,3 star rating,"The food when I first went here was good that's the only reason why they got a 3 star, however last night I got food from here and the Mac and cheese was burnt and crispy. I was very disappointed, I know they could do better. It was like they gave me the corner burnt piece of the pan."
9/5/2016,3 star rating,It is now under new management and the service is really hit or miss. They no longer accept credit/debit and sometimes there are odd smells coming out of the place. I'm not in a rush to return but I also can't say I have had a horrendous experience.
10/14/2014,4 star rating,"Extremely quick and absolutely fresh offerings. They also sell fresh, raw fish although I have not tried this aspect of the business first hand.Placed my order of the ""Patrick Ewing"" special (fish and shrimp with hand cut fries) and watched them prepare my food within minutes. I received my meal and had it packaged to go right out of the fryer. Based on this experience I would definitely return.Took my order to go. Was offered condimens but declined to experience true flavors.  Friendly staff and pretty clean facilities. Definite plus was the lack of ""fishy"" odors."
4/11/2020,3 star rating,Ghetto but the food is good. Don't look for superb customer service however the food is worth the wait.
4/22/2017,3 star rating,The food is amazing! however they have to work on rolling the food out faster. The wait time is ridiculous.
1/11/2017,3 star rating,"Poor service. Called ahead of time. Went to pick up a package. Arrived 40 minutes after the standard ""15 minute wait"" and my food still wasn't ready. Very disorganized. Pro: Food is good"
2/2/2019,5 star rating,"So damn good. Worth the wait, true Harlem experience and characters in here. Best part was taking that tray home and enjoying it at my kitchen table. This def going to be a spot I'll coming back too. Those crab legs were..... so damn goooooood. I just got the steamed food though, I'll be back to try the cooked dishes on the menu."
4/18/2017,4 star rating,"Okay, the wait is a nightmare if you want steamed food but....It is amazing! We actually ended up going on Thursday night and Saturday night. I was trying my best to be kind... and I was. I had to remind them about my food in the steamer. Then they were like, oh, sorry. OMG! I wanted to break things. Both times we got steamed muscles / crab legs / brussel sprouts /broccoli. They were seasoned with Old Bay, butter and garlic. SO SO SO SO SO good and meaty. We were going to another place to get muscles and they were so tiny. I am not sure why it took us so long to come here. Again, the wait is a nightmare and so is the ordering line at night but it is definitely worth the wait. Good people watching.Prices are reasonable. Service is slow. Business is clean and well maintained."
8/12/2016,1 star rating,"The worst customer service ever! Unprofessional, disorganized, and ghetto... I hate to use that as an adjective but that's just what it is. I desperately wanted to support this small business but after so many disappointments I can no longer spend money here. They forget orders, they make wrong orders, they run out of food, they are slow, slow, slow, some days they decide they are cash only, different cooks, different outcomes... Don't bother calling an order in, it won't be ready when you get there or they'll just sell it to someone else if they run out of food. Who runs out of linguine??? And they never apologize for sh*tty service. Like they are doing you a favor by taking your money! Avoid at all cost, or at the least until they're under new management.August 2016"
5/21/2019,4 star rating,"I got fried fish & shrimp wit a side of collard greens & baked mac&cheese. The food here is sooo good & fresh. I just hate that you have to wait 45mins plus for the food, depending on what you order. So don't go if your hungry cause you will have to wait atleast 30mins. I would deff go bck, Its actually worth the wait in my eyes!"
5/9/2020,1 star rating,I hate this place. All the staff has a terrible attitude and they are very disorganized.  Wtf is going on! Small ass dirty kitchen... safety! The food is ok... but it's not consistent so what's the point!
2/13/2017,5 star rating,"Fried shrimp in Honey BBQ sauce over yellow rice. Options are jerk, butter garlic, honey zing, & crazy. Also the wings sauced up, your style, over garlic mashed potatoes are bomb af. You're welcome. :)"
5/22/2017,4 star rating,Oh my god I have never had more amazing wings than the wings I've had here. I've honestly been craving them for weeks since I got them and I cannot wait to go back. I'm truly giving them 4 stars because of these wings. I also had the mac and cheese which has a bit of spiciness to it that gives it a nice kick. And I tried their salmon with potatoes and corn (the special which is only $8) but I was not impressed with this because I have acid reflux and they added Cajun spices to my salmon without asking me so it completely upset my tummy. I guess next time I go I'll ask them to hold off the Cajun and/or simply order my wings and go.
3/15/2018,3 star rating,"Im sorry to say my 2nd experience there sent me to the ER the next day regardless of the fresh food preparation I GOT FOOD POISONING!!!I'm a nurse an very careful what eat! I'm super picky, some people may not take the time to post especially after being sick! No food preparation is perfect and I narrowed down all I ate before coming to assumption of what made me sick. Thank God I'm better now an being super careful and picky about the food I'm ingesting. Everyone please be aware an take note of what you eat food poisoning can some times be fatal especially in children!"
7/8/2017,4 star rating,"Good food, Instagram ad a little misleading, thought they had a sit down area.  Had the seafood platter seasoned well.  Wish I could have tried the lobster fries but wasn't ready as we were early that day.  Overall good prices, good food"
3/16/2019,3 star rating,Went to the Lighthouse on a recommendation. The place is small. As you walk in the door you walk into the line for the cashier. Wait to place order wasn't too bad. I ordered the loaded lobster fries $20. The wait was real though so be prepared. The dish itself was very tasty and worth the wait.
3/11/2019,5 star rating,Great taste and fair prices. I ordered some Butter Garlic chicken and it was so well seasoned. I ordered it with macaroni and yams and it was amazing accompanied with the macaroni. The wait was long but thats because there was a lot of people. And it's nice to see your people working because it makes you at home  especially with the music they had playing.
12/9/2019,5 star rating,"Hands down an absolute must when in the city. One of my top 5 favorite seafood restaurants ever and for good reason. From the fresh catch section on one side with an assortment of caught options to watching the magic all go down right in front of you. This place is simply amazing. Now for some the size of the restaurant may be off putting with limited space and seating or for others, the wait for the FRESH, MADE TO ORDER, cooked food isn't ideal but you have to give credit where credit is due. The food is outstanding and there is no argument about it. The menu is generous with so many options and combinations you'll spend most of your time just reciting how everything sounds so good. The chef's are seaseoned veteran's in the game and can pretty much walk you through anything on the menu. The lobster fries are out of this freaking world and to watch it all go down is even greater! The catfish is one of a kind. Well seasoned but not too salty or overdone. You honestly can't go wrong with any sides. They're all good. There are no bad options on this menu and you can't say that you visited NY without making a pit stop in this absolute gem from Harlem.I highly reccomend."
7/12/2018,1 star rating,I have tried to like this place plenty of times. Their food is tasty but the customer service is so poor I can not support this business. The employees fail to properly serve customers. They will give you an attitude for ordering food. I received no utensils with my order when I went back and asked the lady rolled her eyes. Very very very poor service.
1/31/2016,2 star rating,I just moved to Harlem and I'm on a mission to try out the good fish market spots. I follow Lighthouse on instagram for a few weeks now and I finally decided to take a trip there. Everything was going great until I got to the register. Since this was my first time I did not know this establishment does not accept credit/debit. They only accept EBT food stamps and cash. I'm not really the cash handy type I'm more of a c.c. swiper. I was disappointed to hear that and immediately got turned off and didn't follow through with my purchase.However the food did look delicious and the staff was very helpful in assisting me with selecting what i wanted so I plan on trying them out again with cash on hand!
8/28/2019,4 star rating,"I was iffy about eating at this place but OMGAWD most of  what I bought was so good. The Mac and cheese is to die for, as well as the BBQ chicken wings. The only reason I'm not giving them a 5 star is because their is not that much of space and the garlic mashed potatoes was not a good as I thought it would be."
4/5/2017,5 star rating,"Simply Put...it is Good.I have seen long lines and avoided the crush, knowing one day.  Today was that day...steamed salmon steak w steamed veggies and rice.Just how I needed it.The menu is full and the music is a welvome compliment to warm service.Merci."
11/4/2018,4 star rating,"Visited a few weeks ago and I feel obligated to take one star off because of the wait and customer service. I chose to walk in and place my order. The restaurant was very crowded as space is limited so I was already thinking oh boy this may take a while. The lady taking orders was preoccupied by whatever was going on with her coworkers and myself and the gentleman in front of me stood there waiting to place our orders for at least 5 minutes before she even acknowledged us. It took 10 minutes for me to place my order although there was no line, and I waited another 15 minutes to get my food. I was annoyed by the near half hr wait until I got my food. Love at first bite. I had the fried fish and shrimp with seasoned fries and macaroni & cheese. Every bite was amazing. I can't explain it. I guess it really is worth the wait."
8/25/2018,2 star rating,"Surprisely, I was very disappointed with the food and the service. The staff was not friendly at all and it took them forever to acknowledge me. I ordered fish and wingettes. The fish was horrible it tasted like garlic and the wingettes were not any better.  Definitely will not be back!!"
2/11/2020,5 star rating,Best seafood spot in Harlem. HandS down. It's usually pacKed but the food is always fresh. The fish is always fresh. 10/10.
2/9/2020,3 star rating,The food is good but it's not worth the nasty attitudes they have. The lady at the cash register has a very nasty attitude and the wait time is ridiculous. I love to support black owned business but there's always a reason why I don't. They need to go to class for customer service because they are lacking in that area.
8/8/2018,4 star rating,"Food is DELISH!!!!! You can either have your order steam or fried. It's made to order (can take up half your lunch hour!) but once it's prepared it's SUPER fresh and HOT! I have yet to be disappointed! HOWEVER....Do not even bother try calling your order in for pick up, the woman designated to take orders answers the phone when she feels like it. Once you're in the spot, the girl taking the orders is EXTREMELY SLOW! Once you're at the counter, she'll walk away, to do other things outside of her duties, without taking your order meanwhile there can be a line out the door (another reason why your entire lunch hour might be spent waiting on your food) At the point that she DECIDES to take your order, she's rude! And don't you dare get up there and still be indecisive about what you want (as you might be; because almost everything on the menu looks GREAT), she'll give you the ""I'm waiting"" look. SMH!Otherwise the food is Good! And the male cooks are nice!"
12/24/2015,5 star rating,"This is probably one of my all time favorite fish markets. They'll make it anyway you like either steamed, fried, sautéed, etc. They have a large variety of sauces and butters to satisfy any, and all tastebuds. They're often very busy so I would just suggest you stay on top of your order and to verify before leaving with your food. I've never had a problem, and everything is always so fresh. Whenever in the area, I always pass by. Enjoy!!"
2/11/2017,5 star rating,This is probably my 5th or 6th visit now! I absolutely love the steamed food! I love coming here because everyone is beyond friendly and my food always tastes amazing! I usually get steamed food but today I'm trying their sautéed salmon!
1/2/2017,5 star rating,"Pretty decent for a Harlem fish market! My only complaint was the insane wait time for takeout! Granted I was getting steamed crab legs on New Years Eve so I should've known better BUT, I waited well over an hour between waiting to place my order and waiting to get the food. The crab legs were amazing!"
5/1/2017,4 star rating,Had a combo flounder and Schrimp was delicious flavorful staff was excellent Vegas could use one of these jawns
4/17/2016,5 star rating,So I've lived in the area for 4 years & passed this place tons of time... Well I finally stepped into the establishment & was beyond pleased with food & the customer service... Not to expensive & well seasoned seafood will get 5 stars from me anyway... the sides I had chosen were mac & cheese n their potato salad (weird combo I know ) the staff was very pleasant they were on top of their orders and just really kind....after many months of skepticism I'm not disappointed & I will be making many more trips back to this establishment
2/27/2016,4 star rating,"Yea so their food is ROCKIN! I had a shrimp scampi seasoned very well with a mac & cheese on the side. HUGE Jumbo shrimp. And they make the food right in front of you. The only thing though is the wait time. You have to be patient. Depending on wat you get, youll wait about 25 minutes for your food but Id say its worth it. Jay Z was playing in the background was a plus. Seafood market, mixed with soul food is PERFECT. 1000x times better than the 24 hour spot on 125th. I'll be back!"
1/1/2017,5 star rating,"Lighthouse food is great. If & when in hungry while I'm home lighthouse is usually my only option besides Jimbos for breakfast. Staff is cool & down to earth . Food is always fresh , smelling good & tasting even better ! Yes there is a wait being that the food is fresh . My fave are the honey zing wings , along with the lobster fries. All the steamed seafood is amazing also. They can literally create whatever you may ask for."
8/21/2017,3 star rating,"Now i want to start by saying to really do like this place but i am writing this review due to the inconsistencies i always encounter when i come. The food is great i usually come on Fridays and I pick my fish and veggies and i have it broiled. This past Friday i came in and picked up my somewhat usually order (2 fliets of salmon, just under a pound, 10 jumbo shrimp and my veggie medley). Since this is a custom order is tends to cost more than the usual fried stuff. My order after ordering my side & a drink was like 32, like i said my Friday usual lol. I usually wait for my food so i sat in the corner and wait. This day was a SUPER long wait but i waited patiently as always finally when my number was called there seemed to be an issue. It was unclear on what was mine (not strange this happens ALL the time) so after a lot of back and forth and waiting i was presented with something. Wasn't what i ordered :( ... Apparently the order before mine was a sautee order and mine got mixed up. I didn't even have the pieces of fish or shrimp i order... I ended up leaving with the sautee order because i did not have another 45 mins to stick around and wait ... Needless to say i am disappointed because when you do custom order your items are weighed and you pay based off the weight and i pay extra to have it broiled. So if i pay 26 for salmon and shrimp and then i get something that wasn't what i paid for i am not a happy camper, and too often this happens when i go. I really wish they would get a better system so peoples food are not mixed up. I go once a week and at least one a month my order is correct and its usually because its when the owner is there and if he sees me waiting he remember and will double check but there have been times when my order is lost and then they go pick out what i ordered again and redo it. So while the food is great i really think they need to work on their process or at least have some kind of check process because too often i am wasting time correcting something that should of be clear when i placed my order and worse that i paid for it and didn't get what i paid for. I need you guys to do better as i want to continue to be a customer but its not the best thing when your customers are used to mistakes ... eventually that will lead to us going somewhere else if we continue to be dissatisfied."
8/21/2015,2 star rating,"They only get 2 stars because the candied yams and mac n cheese was pretty decent.  I stood and waited for an hour for my food and it wasn't worth it , fish was not fried hard enough !the Tatar sauce had more seasoning than the fish and shrimp ! I read reviews and also had word of mouth about this place being great , I'm very disappointed ! I will not be returning ! Like where is the rest of the food"
12/4/2018,5 star rating,"I came here last night,for the first time. The only issue I had was with the wait time and the place is so small,but when I tell you that I had the best blackened catfish (paired with Mac& cheese and collard greens)that I've had in years!! I will most definitely be coming back,especially when it gets a little warmer out."
1/5/2018,5 star rating,Dear lighthouse I love you for always coming through in the clutch with the bomb late night eats thank u amen lol
7/1/2016,5 star rating,Heated up the leftovers they tasted better than last night. I just wish they weren't a cab ride away I would love to eat from here more.
9/18/2015,4 star rating,Went here ah few Saturday's ago just on a hunger whim had the fried shrimps and fries. The fries were my fave never had a fry that yummy; the shrimp were season to perfection. Next time I'll get some steamed seafood the wait is pretty long I called and ordered and still ended up waiting almost an hour.
6/28/2016,4 star rating,"I have always wanted to go to this fish market ever since they opened at that location, unfortunately I didn't get to go myself to purchase food from there the times I've eaten food from them so I can't really comment on the store itself, but the food omg it was delicious. Worth every penny, I got a lot of different seafood to steam so my food came up to just about $40 I believe. I was able to use my Yelp check-in discount code which made it a little better. But I honestly feel it was worth it. The steamed clams was soooooooo good, the only thing they are missing is the minced garlic and they will be good. I will definitely keep getting my food from them. Worth a try. I love the fact they put it in aluminum and not styrofoam plates, it keeps the food hot."
3/25/2018,5 star rating,"Even though I traveled from my neighborhood of the East Village to HarlemWorld West 131st and Frederick Douglass Blvd taste Lighthouse Fish Market & Restaurant fish dinners. It was worth every minute and every dollar! The customer service is awesome. The fish is fried fresh and seasoned perfectly just like my family down-south would prepare. Man, those collard greens are the best in NYC. Finally, Lighthouse's red velvet cake is so moist and delicious. Lighthouse needs to open a restaurant downtown Manhattan.."
11/1/2015,3 star rating,"Overall the food was good.  I ordered fish, shrimp, yams and Collard greens.  I also ordered the banana pudding. My bf ordered the shrimp with mac n cheese and yams and a blueberry lemonade.  All of the food was good except for the collards.  They were extremely salty.  I didn't realize it until I was home and I wasn't going back. The banana pudding as mediocre but not terrible. The blue raspberry lemonade tastes like a blue jolly rancher.  I for one do not like lemonade so this made the drink a lot better :)The place is very small so don't plan to dine in. There are about 4 stools and a counter where you can sit. I do like that you can pick out your own fresh seafood and have them make it.  The first star I took off was for the customer service.  While the cashier was very friendly and helpful, the rest of the staff was terrible.  The cook and one of the girls were arguing the whole time I waited for my food.  Yelling at the top of their lungs.  It was very unprofessional.  The girl, however, was really trying not to say anything.  It was the older man (cook) who kept on and on. It was a bit ridiculous. The other cook was just being rude to customers in general.  I don't know how long this place has been in business but it seemed to be too busy for them and they were all overwhelmed with the amount of tickets.  The 2nd star was taken off for the portions and price.  For the high prices, they don't give you big enough portions.  I may come back to this spot. It was my 1st time here and I always like to give places a 2nd chance"
10/14/2017,1 star rating,Our second time and thoroughly disappointed. The food was overpriced and OVERRATED.  The fried Whiting tasted like either the oil or fish was old and the Mac and Cheese WASN'T cheesy at all. DONT WASTE YOUR $$$.
6/27/2015,1 star rating,"Please update your hours of operation and answer your phone when possible patrons are calling. I drove all the way here just to find out your business was closed and it's no where near 4AM, it's actually 1:19AM."
11/24/2017,5 star rating,"Real heads will understand. Most incredible place in NYC. DELICIOUS food, best people who will help you order anything, worth the wait. Enjoy Harlem"
11/9/2017,5 star rating,"Real heads will understand. Most incredible place in NYC. DELICIOUS food, best people who will help you order anything, worth the wait. Enjoy Harlem"
