date,rating,review
7/5/2018,5 star rating,The best seafood in the Tri-state area!!! I don't say this a lot but everything on the menu is good you cannot go wrong with this place.
5/20/2018,4 star rating,"The fried fish is tasty and the side dishes are real good as well.....you can pick fresh seafood and get it cooked up right the staff are very nice and attentive to your simple request remember there are cooks as well and it's a tight dance from customers needs and them cooking over the fire.....waiting should be outside or in the car but it's worth the wait....I still have more dishes to try like linguini and alfredo sauce but it's worth a second,third go round"
8/6/2018,5 star rating,"What I love the most about this location is that majority of the workers are African American. The food is great the customer service seemed okay. My only complains are the flies, I understand the raw seafood area but something needs to been done about the flies for sanitary and health purposes"
9/12/2018,5 star rating,"Food is always on point!!! Went today and was satisfied per usual! The owner wasn't there yet, would've loved to see him...he's the best!! Truly cares about his customers!"
5/14/2018,4 star rating,Excellent food. Seafood platter to die for. I come all the way from Brooklyn just to enjoy myself.
6/21/2018,5 star rating,"This is the best seafood restaurant in Harlem !! Everything is cooked on the spot and seasoned to perfection. Tried the shrimp linguine, seasoned fries. Mac & cheese and the crab cakes. It's also big portions so I recommend splitting with someone. It's black owned as well.  5/5"
4/22/2015,4 star rating,"My goodness!!! I love it when I find a late night jackpot.. 1 am and I'm getting fish, shrimp and Mac...Perfect!!! The seafood was flavored well. They just need to puncture the Styrofoam so the fried food doesn't lose its crispy goodness.  Also, this spot is super clean because it is take out. Staff are nice. They have a fish market which is open during early hours. And they take credit cards!!! I wish them nothing but success because they are a great addition to the neighborhood."
9/18/2015,5 star rating,"Got the vip platter, 2 actually and it feed 5 of us with some leftovers! Onion rings, Mac and cheese, collard greens are all great! Service was fantastic too! Can't wait to go back!"
8/20/2015,5 star rating,Best fish ever and great desserts too.  You must come and get some. Big variety of seafood to choose from.
8/5/2019,4 star rating,Prepared with care and pride in their dishes.  Seasoned expertly and given attention to the details of putting out a finished dish.  Not just thrown into a fryer or steamer and put up for sale.
3/24/2018,4 star rating,The food is unbelievable. You won't be disappointed. Pick your own fish or let them just make something off the menu. It gets very crowded so go early
9/16/2017,3 star rating,I believe that this restaurant is too small. The pasta of the shrimp was too bland but the shrimp was very flavorful. I did taste my friend's Alfredo and it was excellent. Very creamy. I'll come back though to try the rest of their menu.
7/30/2018,5 star rating,"This place is off the chain, well the seafood is. Omg, the lobster fries is to die for. The portion is larger than I can manage. Love everything. I only wish I could dine in but maybe it's for the best cause food like this should be eaten at home where you can get down and messy.."
3/13/2018,5 star rating,"The LOBSTER FRIES ARE A GOOD, GOOD SIN!  They are absolutely delicious!  And leftovers when heated up in the oven (uncovered)are still very delicious!!"
12/25/2015,4 star rating,The stars are all for the food. They messed up my order 3 different times. I DONT LIVE IN THIS BOROUGH. I was pissed to say the least. Anyway ..they tried to accommodate the mistake. It's very small & takes a while for your food to be ready. But once all that is over & you get your food home (CHECK IT) ...it is very good.
7/15/2018,5 star rating,First off the food is delicious it's like so worth the extra your have to pay for it being a little more on the expensive side of fish market fare. However the cashier here is so freaking rude if your seem confused will just stare at your before rolling those big ugly eyes takes your money without saying thank you. I ordered two fresh juice drinks for which I was told the cops would be brought our I'm waiting on line and just happened to notice the cops had been sitting on the counter this lady is a real bitch thank God she isn't cooking.
3/25/2018,4 star rating,Went here one night to take out for dinner and had the most AMAZING food! I ordered the Shrimp with Garlic Butter over Rice and it was delicious! The portions are also pretty good! It is a little pricey but you're definitely getting good food and good quality! Can't wait to try more off the menu soon!
7/19/2017,3 star rating,So ... the first time I came here the food was phenomenal I ordered the fish and shrimp combo with coleslaw and seasoned French fries .. the food was so good that i decided to get the same exact order again and this time the food was horrible the fried fish was old and dried out and taste like oil the coleslaw was bitter and the fries were not seasoned I guess this place is hit or miss depending on the cook for the day I went on a Monday so whoever cook on that day SUCK! Request for fresh fish!!
9/4/2017,5 star rating,"Great food, great service, great music, great price.  First time there and I didn't realize there were secret menu items like LOBSTER FRIES!  Definitely going back."
4/17/2017,3 star rating,"Tried this restaurant on a recommendation from a friend. I ordered two Whiting  sandwiches on whole wheat bread. I also ordered a side of coleslaw and a side of macaroni and cheese. The coleslaw was just ok, the mac  and cheese did not have any seasoning but it was loaded with cheese. The wait staff was very courteous. Wouldn't go back any time soon."
7/5/2019,4 star rating,"The food is very tasty. It's worth the drive from Westchester county. The only thing that's somewhat frustrating is the time consumption; but when you really think of it, it's freshly made which I appreciate. Worth the wait."
10/30/2014,2 star rating,"This is my second time here,  I don't know what happened seems like everythings changed.  Bad food (too salty) bad service (hard time placing order).     First it took 10 minutes to place my order, and  the place wasnt even busy. Then fried fish whiting had almost no meat on it,  and over seasoned.  and the ""fresh cut fries"" lol I saw them come straight out the freezer then out the bag.  Waste of time waste of money"
6/30/2018,5 star rating,Thanks for the love they put in the food all items are good can't wait to try 24k wing's Harlem rules soul food all day everyday ONLY the southern part of US can touch the northern part USA all the way up
6/27/2018,2 star rating,"This is a takeout joint. There is a counter and four stools and if you sit, people will have to reach over you to get their orders. I can only tell you that the food looked good as we left when told that we would be be better off getting our food to go. I went there because of their misleading radio adds that call this a restaurant."
11/19/2016,1 star rating,"I give the food 5 stars because it is delicious but as far as the organization and speed it gets a one. I first called to place an order (that I would pick up) and was told ""we not doing that right now"". That's annoyed me but o said ok I'll just go in and order in person. Had to wait on line for at least 15 mins while the man at the register spoke to other customers around me and chefs. Finally placed my order and was estimated a 15 min wait, which I was fine with. I came back 20 mins later and my food was NOT EVEN BEING COOKED! All in all I waited 45 mins. Love the food but I won't be getting this again anytime soon."
8/16/2015,4 star rating,"The food is sooooooooo amazing, so tasty, so delicious. Like everything...I had the shrimp linguini and the garlic flavor was so tasty, so good. Now the actual spot is a cute little clean spot....but thats the issue...its little. They should have more seating room at least another counter or something but doesn't look like thats happening...The service...the service is why it gets 4 and not 5 stars. Everyone working there was nice and polite...however...it was so busy that they seemed almost flustered with the business. Orders were slowed down and forgotten and had to tell 3 or 4 people what I ordered before it finally came...and getting the food takes between 15-30 mins thats the only frustration... but great food , nice people....worth the wait and trip to Harlem"
5/29/2016,5 star rating,Love coming here on a Sunday afternoon!!! Food is awesome and service is great!!! Lines are out the door but so worth the wait!!!
1/20/2018,5 star rating,This is fuckin good ass food... Tight lil spot but the quality big if you got a wavy buja you sliding round with & tryin take it back to the koop grab a bite here you definitely hittin that after trust me and the price right can't be that with a bat
10/1/2014,5 star rating,"It's all good neighborhood place good fresh fish prepared the way you want it, just open a couple of months ago"
1/14/2018,5 star rating,Delicious seafood. Good prices. Excellent service. Line can be long but it is well worth the wait. So happy this place is here!
11/19/2016,1 star rating,I loved this place when it first opened ! NOW the staff is rude and disgusting!! I will never come here again ! You're a business ! MONEY is what keeps you open so why be rude to your customers!? Idiots I hope they close down.
6/27/2015,5 star rating,Nice small place in Harlem. A friend had there food and posted a picture. So I had to try them. I had the shrimp and fries. It was very good. Thinking about going back tomorrow. It is definitely a must have.
7/11/2016,1 star rating,"I really wish I had read prior reviews before placing an order over the phone. They are SO RUDE! Beyond rude, just annoyingly unprofessional, disorganized, and barely listen to what your order is. They quickly brush you off telling you ""we're really busy I don't have time to go to the register to tell you your total and bring cash, cash only!""So turned off, there are so many places in Harlem to eat. If I want nasty attitudes and bad service I would've gone to any hole in the wall"
10/17/2016,3 star rating,"Went here over the weekend after hearing a lot about the restaurant only to realize it isn't exactly a restaurant. It's a fish market that sells cooked food and seafood dinners but they do have maybe 6 seats so I guess it's a restaurant. I had the fish and shrimp meal with collard greens and the greens were way too salty for consumption. Overall I would say I'd go back but their payment options are very misleading. They have a register with a card swipe and a credit card machine right next to it. Their menu board even says they take cards but they have a paper sign up on the window to the fresh fish area that says cash only. Unfortunately this place is so small there is usually someone standing there blocking it so you get to the register only to realize it's cash only. They ""conveniently"" have an ATM though... go figure."
2/15/2018,4 star rating,Seasoned to perfection..The food is good and the employees are kind of getting better with their service.
6/28/2017,5 star rating,Everything was great food was amazing but almost an 2 hour wait. Wow. It was about 6 people there total. Didn't think it packed at all. But the taste of the food was amazing.
8/1/2016,1 star rating,"You literally stand in there for 15-20 minutes and no one takes your order. They tell you they'll be back in a minute and disappear. Everyone else is like busy so they're also avoiding any type of eye contact with you. I've gotten food from here twice, yes it is good but totally not worth the wait of sometimes an hour after you order. Screw that, I am pretty sure I won't be giving them my business again. If you're willing to wait then don't come hungry because who knows when someone will be tending to you!"
1/14/2018,3 star rating,This place has great fish but i have to say the cashier is acting as if she is doing you a favor. No smile and she speaks as if she is sick and came to work. Unfriendly. We called in to pick up the food and it actually took us a lil longer but it wasn't ready and they started preparing it when we arrived. When I got in and started to say what the purpose is to call in for the order they for faster. I monitored the owner another time when I was there and I know he cares a lot about his business. I'm sorry but I didn't feel welcome this time.
2/9/2017,5 star rating,"The food at Lighthouse is absolutely delicious! Between the great food and friendly staff, they will continue to get my money! You can just taste the love in the food. I recommend anything sautéed. As a matter of fact, I recommend the entire menu! And those lobster fries....OMG!  I can't wait for my mother to visit NYC so that I can introduce her taste buds to all of the deliciousness! This place is awesome!"
8/21/2017,5 star rating,The service and the food were fabulous!!! We all got there at the closing time and they still provided great service :) the trip from Brooklyn was well worth it !!!
2/24/2016,1 star rating,"I would give them 0 stars if I could....So my boyfriend and I decided to go here yesterday, he had the food before and raved about it. So we place our order and after waiting for 20 minutes, half of the order comes out. We wait another 10-15 minutes for the other half of the order to come out.... And nothing. Then one of the people behind the counter, asks what we're waiting for... We tell them, another 5-10 minutes passes and nothing . Mind you were number 21, and they're calling orders 32 by then. So we proceed to inquire on what is taking so long and if we're coming up next. They disregard our questions . So we wait... A few more minutes.. The staff was confused and disorganized and basically gave away our order to someone else. We tried to explain to them that they gave away our order... And instead of them making our order next, they continue to serve those that came way after us.. My boyfriend just asked for his money back because because we had waited over an hour for our food... And it didn't appear like they were going to make the 2nd half of the order. No apologies from them or anything, the WORST customer service EVER! Didn't get to try the food and I won't be because I'll never give an establishment like this my hard earned dollar!"
8/15/2016,1 star rating,"I recently bought the $9.00 Combo special and a Whiting fish sandwich to go. When I got home I was set to enjoy my meal. Well I couldn't eat it simply for the fact that it was beyond greasy. Let me state for the record that I have been a loyal customer, but I encountered a problem once before. Sorry but they will not see me or my business anymore. I believe that this is a business in decline. Seeing it go from an A to a Bit. Rating is not a good sign. The oil that was used to cook the fish was burned. Again not good for business."
6/19/2017,5 star rating,The fish sandwich was big and tasty. Had slaw for the side and it was equally good. I'm used to southern style coleslaw but this slaw had the a vinegar flavor Charleston style. Had the salmon with lobster cream sauce; it was exquisite. For the price you can't go wrong. You select your fresh fish form the adjacent freezer section and it is weighed and cooked while you wait. The seating area is limited to 5-7 bar stools.
1/13/2016,1 star rating,"I've come to the Lighthouse a few times and each time they've gotten progressively slower. Yes, I wrote progressively SLOWER! I entered this seafood spot at 7:52p ... It's 8:52p and I'm still here....................... with no apology or explanation  for the hold up. There's absolutely no reason that a takeout spot should have you waiting over an hour for food. The owner/employees here definitely need a better solution for getting customers in and out. It's sad to say but the horrible service trumps how good this food is."
7/24/2017,4 star rating,"Went to buy some fish from there yesterday and Lenny was very helpful in demonstrating the differnt types of fish that were available. The area where the fresh seafood is being sold is extremely clean!! I am new to the neighborhood  and looks like is this is my go to place to pick up fresh fish, look for Lenny if you need any help, hes usually cleaning fish. Feeling lazzy to cook?  You can just ask them to steam your seafood for free or saute it for $2.00. I have not yet tried the food but I am pretty sure i will soon!!"
1/10/2016,1 star rating,Waited over 40 minutes for a simple fish order. Went here because of all the good reviews but this will be the first and last time I ever go there. Kitchen is unorganized and has no idea how to prioritize incoming orders. To top it off the food wasn't worth the wait or the price.
6/29/2017,3 star rating,Their wings were good but the mac and cheese was dry and nasty potato salad was good also. I'll definitely get the honey zing wings again tho.
3/20/2017,2 star rating,Not a restaurant ... carry out spit. Don't know if food is good or not. Uber here from midtown only to walk in and see 4 bar stools and a line of folks crowded around the counter...  disappointed really wanted to try
9/15/2017,3 star rating,"The food and portions use to be so big . I went recently and the macaroni and cheese is no longer as good, not creamy at all just cheese and macaroni noodles. The yams are still good and the catfish is delicious though they did use to give you 4 meaty piece they now slice the filet in half"
8/29/2016,2 star rating,"I really wanted to be able to say good things about this place. So many of my friends rave about it as if it is amazing, but my experience was not even close to what I was hoping. I had the fish sandwich and my wife had the shrimp dinner which was $18 bucks with two sides and to me just seemed to be way overpriced. Both dishes were underwhelming. My wife had mac and cheese and yams. The mac and cheese had no flavor at all. It was borderline terrible and needs a lot of work. The yams were actually pretty good. Oh yea, and let us not forget the strand of hair that we found in our food! Yum Yum! The fish sandwich was okay. It was edible, but nothing I would desire to come back for. I didn't try the shrimp, but my wife let me know that she was not impressed. Not sure that we will give this place another shot."
9/2/2016,4 star rating,"This is take out only and always a wait. The food makes this place, it never disappoints. I honestly  believe the cooks can battle the best seafood restaurants in the city and win. The meals can be steamed fried or sauteed. My go to is the sauteed salmon or lobster fries with the blue mystery juice....amazing!"
6/8/2016,5 star rating,"Late review. I've been to Lighthouse 3x since the first visit. My aunt who live in Texas told me about this place from someone on Instagram. I live in Brooklyn, every time I'm in Harlem, I stop by. The seafood is so fresh and the braised cabbage is an experience all by itself. I've had the jerk shrimp pasta, Alfredo shrimp pasta, fried shrimp and crab legs. Everything is good. I didn't really care for the coconut cake but everything else makes this a 5 star review!"
3/9/2016,1 star rating,The fish was extra greasy...wont be returning.....maybe they need to change the fish oil because it made the fish greasy and have a linger taste afterwards....
8/6/2016,5 star rating,The food here never disappointed me. I dont always check in but I come for lunch everyday. Great food. I just wish they took credit. I understand they had a problem with people using stolen cards here. Shame. Doesn't hurt that the woman that takes your order is beautiful . Great service
12/13/2015,3 star rating,"The food was good...I like how they sauté as the other option it looked and smelled delicious, however the service can be better....if a 'friend' comes through I notice their order gets bumped up and the guy who bags the food is all over the place he can't seem to focus. When I asked for more than two tartar sauce for my $80 plus order he got out of line and asked if I know how to make my own. If I hadn't already paid I would have walked out. I hope they get more organized, treat everyone equally and be a little more respectful, maybe then they can get a better review from me....I'll be back one day.....maybe"
5/14/2015,3 star rating,"The place is small, but the product is fresh and very tasteful. The wait time for orders to be filled is over 20 minutes.The staff is friendly but seem to be distracted by conversation with the customers in the restaurant.The dishes are good and tasty."
9/14/2018,5 star rating,"First time here and everything is freshly prepared! The only downfall is that it takes forever but they're legit cooking it on the spot. I have to come back here, might come back every time I'm in New York! They have pasta, rice, sautéed veggies, sides like collard greens, cabbage, man n cheese, fries like it's a must try if you're ever here."
9/14/2016,4 star rating,"One of my fav spots in Harlem --- crab legs are a must when I go, have also had there sautéed salmon w/ peppers & Brussels sprouts"
10/12/2015,1 star rating,"THIS PLACE IS A JOKE IF YOU WANT IT DELIVERED! DO NOT, I REPEAT DO NOT PLACE AN ORDER FOR DELIVERY UNLESS YOU HAVE 2HRS TO WAIT. I called in my order at 8:47pm and was told that it would take 30min. I called back at 9:41pm and was told it was out for delivery. At 10:07pm I was told that my food was about to leave the restaurant... WTF? I thought it was already out. At 10:16pm my food is still at the restaurant and the manager told me he could not comp my meal but would give it to me half off. It is now 10:31pm and nothing has been delivered. POOR POOR POOR SERVICE! ONLY IN NEW YORK."
8/16/2015,1 star rating,Not good at all twenty five minute to find out no flounder and they burn the catfish.  No tartar sauce or ketchup in the bag. They are very unorganized.  Over thirty minutes for a fish and shrimp order.
8/13/2015,1 star rating,Worst food I have ever had. Poor service and bad customer service. I have a picture of the catfish burnt to show
1/15/2016,3 star rating,Delicious. The chef is great. Sides are a bit weak but all and all great spot open late on weekends. Only 3 stars because seafood is farmed raised. No beuno - unfortunately I'll have to fall back. Plus took me 45 to get my food. Ugh too bad
5/2/2016,4 star rating,"Came in here at 930pm on a Friday night and it was packed. I ordered 2 fried fish dinners with fries and 1 fried scallop dinner with fries to go. It took awhile, waited well over 15 minutes, but it was well worth it! It wasn't like people were not hustlin to turn out food; just packed and busy. Everyone else around me was getting their fresh fish dinners, so I need to come back here for those! Looked so good. Will for sure be back. Scallops were so good! A bit of spice to the batter."
12/21/2015,5 star rating,"I love this place! Best takeout in Harlem! I was referred by a friend, that I had to try it and I was not disappointed! I have ordered three times in a two week period, and that's more than I eat out ever! The seafood is always fresh and tasty!"
6/23/2015,3 star rating,"Brought food from this place for dinner  on  father's day for me and my boyfriend, the reason I gave them only three stars because there's no place to sit and eat, it was packed,I was waiting for an hour and a half for my food, the cashier didn't have change so she said, I owe you $.73, I'm going to get some coins, she went to the back, I stood by the cash register and she didn't even  mention my change again, she just kept taking other people's orders, yes it's $.73 but if it was the other way around, I couldn't get my order if I didn't pay the full amount, I jut thought it was unprofessional, I didn't make a big  deal about it because I didn't want to ruin father's day for my boyfriend, I ordered the sautéed shrimp linguine for both of us,it was really good, I wanted to order a banana pudding and peach Cobbler, but I didn't want to wait on that long line again, I would eat here again, and next time I want all my change back...."
9/24/2016,5 star rating,"Very Very Tasty food! I love the seafood with Pasta Dinners, Shrimps are good whichever way  you prefer fried, steam,sauteed all are very good. Customer service is great!"
7/1/2018,4 star rating,"I love Lighthouse! I travel all the way from the Bronx to Harlem to get the delicious fried catfish and shrimp that I'm craving.  The sides are pretty good, but I don't really care for all of the salt and there are sometimes splintered bones in the collard greens.  The line is always crazy when I go (late night), but the old school soul music blaring from the speakers makes the wait go by faster.  I also like that people can pick out their own fish and produce, though I haven't taken advantage of that option yet.  Parking is crazy, lots of double parked cars, but it's worth it."
