date,rating,review
2/17/2018,4 star rating,"Went here with co-workers NNN and DMJ. We are part of a secret ""food crew"" at the office that rotates through fine NYC eating establishments every month. First up was my choice: duh, KEENS. Second was NNN, MELBA's.MELBA's is a more upscale (yet still casual) spinoff from Silvia's, the famous Harlem restaurant staple that is always busy and something of a cliche political campaign stop for anybody stumping in the neighborhood. You know, like how they stop at a cheesesteak place whenever they are in Philly, or visit some cow farm in Iowa. Zzz...MELBA's was pretty great. I had the chicken and waffles and shared an oxtail, plus something else I don't remember. DMJ had a fish and reported it was good. NNN had fried chicken but the gravy was overly salted. MELBA's was good enough to take it back and give her something without gravy, but then it just wasn't the same dish. Too many places are just going mad with the salt and not simply using it as a baseline ingredient to seal flavor. SMH.Nice touch to see owner herself here!"
3/14/2021,3 star rating,"Food was good. Had the fried chx and waffle fries and mashed pots. Wife had the fried shrimp with greens and onion rings. The fried food were cooked very well to taste. Waffle fries and mashed pots were good. Greens were good. Onion rings were ok. Too much batter...way too much. The service was good. Our server, I forget his name, was very much on top of it. Busy for a Covid Saturday night. Only thing is, they need more menus. Either have everyone scan their phone on a barcode for the menu or have enough menus for ever customer. The female server who I asked for another menu basically made me seem like a crazy person for asking for another menu so my wife and I didn't have to break our necks looking at one practically sideways. Then making it known she went alllllllll the way outside in the cold to get me said menu. She needs better customer service skills. Overall good spot to try. A box checker...Just need more menus and not the attitude when asking for another one. Again, just have us all scan a barcode for the menu. Be better surrounding that. Oh one last thing...drinks are WAAAAAYYYY over priced. $21 for a Manhattan drink. Ummmmm no!"
12/31/2015,4 star rating,"So glad I got the chance to enjoy Melba's! The place is quite smaller than I expected but there was a steady flow. The service was great and very attentive. Samantha seated us and Raquain waited on us. Both were attentive and pleasant. Everything was delicious. Each of us ordered a different dish: The fish strips, the chicken and Eggnog waffle and the Fried chicken with rice and beans with spinach.For dessert,  we shared the Coconut Cake and the Red Velvet Cake. Both were equally yummy and satisfying.I look forward  to going back!"
9/10/2019,4 star rating,"Nice server , the host is pleasant and the atmosphere is comfortable the food was like home made cooking . I enjoyed the Short Ribs , MAC & Cheese and Collard Greens . I recommend this place for brunch which ends at a certain time check their website for accurate times for brunch . I believe there is a two hour wait after brunch ends then dinner begins Check first !"
3/17/2016,4 star rating,"After hearing about Melba's a bunch of times from my friend. Finally, he took us here for brunch. There seemed to be a wait, but 5 of us got seated right away. This is my first time trying chicken and waffle. I kinda have mixed feeling about it. You mean, you pour syrup on Chicken and eat it along with waffle? Oh hell, I'll give it a try anyway. After we ordered, we were served with scones to go with our coffee. Three of us got the fried chicken with waffle. I ordered mine with dark meat. It was pretty good with or without the waffle. One of my friends got collard green omelette. It was actually good and healthy. Make sure you get Bloody Mary!"
4/11/2021,4 star rating,"My friends and I went to Melba's, after a year of being quarantined and not having in restaurant dining. After receiving the vaccine, we decided to go out to celebrate our friends birthday and I am so glad we chose Melba's. The restaurant was set up with all the social distancing requirements, which we were all happy to see. However, it was our server Brian, who made our experience memorable. He was accommodating, professional, and most importantly patient and friendly while managing multiple tables. Brian, made our experience truly memorable and we are forever grateful. Thank you Brian for being a class-act:;-)"
9/19/2020,5 star rating,Food was amazing! Ordered the catfish strips with collard greens and mashed potatoes. Also ordered a second meal which was the eggnog waffle with southern fried chicken. Both meals were great and the service from our waiter Brandon was great as well especially considering what we are currently dealing with (covid/outdoor dining) this was my second time at this establishment and I will DEFINITELY be returning!
8/13/2019,5 star rating,"By far the best oxtails I have ever had in my life!!!  I recommend that you make a reservation.  Was seated quickly, service was good.  Really nice soul food menu.  I thought their collard greens were ok (surprised that they were a bit on the sweet side) and the same for the yams, they were ok, but not sweet enough.  I think next time, I will try different sides.  Friends, had their spinach and cheese empanada app and that was really good. Desert, red velvet cake and sweet potato pie, just can't express in words, how good they both were. If in NYC, Melba's should be on your list."
1/27/2020,5 star rating,I was in NYC for a weekend and was recommended this spot by a friend. I ordered the catfish and waffle and it was AMAZING! I had stellar service and can't wait to go back. I went at 11 AM on a Sunday for brunch and was immediately sat but when I was leaving the front was filled with people waiting for tables. Melbas is a little small on the inside but it is delicious! It's a must try.
10/24/2018,5 star rating,"I used to not understand how people can eat friend chicken or fish with waffles... until I went to Melbas. I ordered the Fried Catfish with Waffles and it was amazing. The waffle was slightly savory to compliment the fish and it was even better with the chipotle dip. Overall, delicious Brunch spot with a decent wait time and good atmosphere!"
12/28/2020,5 star rating,"Ms. Melba's restaurant, as usual, for me, came through, especially now during the pandemic.  I wish there was a way that I could leave updated reviews on Google, FB, etc., but since it has never dawned on me to leave a review on YELP until now, here I am leaving one here.  Ms. Melba's restaurant has been my go-to for the past, I think, since 2014.  I've either visited with my girls, have had a small anniversary shindig at her restaurant, and requested catering.  EACH time, I've experienced nothing but professionalism, friendliness, kindness, and GREAT food and beverages!  I've had the pleasure of meeting at Ms. Melba in 2014 or 2015 at her restaurant for my anniversary, and what a pleasant Hostess she was.  My second encounter was in 2016 at the Essence Circle of Sisters.  That is also when I've had another pleasure of not only meeting with Ms. Melba, but taking a picture with her and buying her cookbook, lol.  I've been a frequent customer of hers when she's not been present at her restaurant too.  Now, let's get to THIS year, 2020:  needed 35-36 take-away dinners with desserts and got above and beyond.  Ms. Melba, Mr. Reginald Warren, and her crew came through!!  I hear how difficult it has been for Black Owned Businesses and/or MWBs (Minority & Women Owned Business) during the pandemic.  I hope you stay open, Ms. Melba.  My friends, family and I simply love your food and I am thanking you to time indefinite!  God willing, next year, if the virus is eliminated or more under control to the point when restaurants will be able to have indoor customers, I'll be among the first to request a table for 30! ;)"
4/21/2015,5 star rating,"Where do I begin? From the very beginning...So I wanted to have my 3rd wedding anniversary party which was a surprise for my hubby.  Mr. Jonathan, the catering manager, I will say, has been most gracious from the time I sent the first email to him about setting time and dates aside. Ms. Melba was one of the most gracious, lovely,  and accommodating and professional ladies I've ever encountered.  I would go to her establishment over and over. Great service, great team, great food, great everything!  I'd give you 10 stars if I could :D"
9/30/2020,5 star rating,"10/10 Even there sides hit! I'm a pescatarian and sides are important, the catfish was amazing and my boyfriend loved the smothered chicken. Definitely coming back w family & skipping breakfast when I do"
1/12/2020,5 star rating,"Usually make a stop in Harlem when visiting New York for chicken and waffles. Tried Melba's for the first time today. Soooo good! Super moist chicken. And, the waffles are made with eggnog mix and comes with some kind of delicious flavored butter. Staff was friendly and helpful. Great atmosphere, too. A+!"
11/4/2019,5 star rating,Congratulations Melba's for earning the Manhattan chamber of commerce's Large Impact Award.
8/31/2018,3 star rating,"It was an honor to have had eaten at this black own business and I would have given 5 stars, except:* No technology used for walk-ins to notify when their table is available. Only suggested due to the popularity of the restaurant and no waiting area. * Although waffles seems to be apart of their signature dish it was very dry. * One sever for a whole section, seating more than 20 guests combined with parties averaging 4 or more.  The food I had was fantastic, catfish and chicken was flavorful and went well with the spinach omelet. Our server Reyna was like Superwoman, despite how busy it was she very attentive and pleasant. If I return I will try the French toast instead."
6/26/2020,5 star rating,"Fried chicken and waffles -- I order this whenever I see it on a menu. Melba's can not be beat. The fried chicken is not a big portion but the waffle is amazing, this is an outstanding version of a tried and true classic."
8/23/2020,5 star rating,"Thank you Chef Cesar, the coconut pineapple cake (whole) that I ordered was delicious and well worth the wait and price.  I also appreciate your help with confirming my purchase by checking on the service at least a day prior.  This is not the only time that we will be calling!"
4/22/2019,4 star rating,"Melba's, is one of the best soul food restaurants in New York, let alone Harlem. Each time I visit Melba's, I have a great experience. I recently took my mom and aunt there and they throughly enjoyed their meal, drinks, and dessert. Melba's offer a great vibe, good music, and amazing food. The Crab Cakes, Catfish, and bbq meatloaf are my top 3 favorites on the menu. Their cabbage, greens, and candy yams are very good as well. Also, please try the peach cobbler! It's sooo good!!"
8/23/2019,4 star rating,First time at Melba's and the food didn't disappoint. We ordered several appetizers and sides. My favorite was the slider. The meat was so tender and succulent. I also enjoyed the catfish. We ordered so much I couldn't finish my food. This will make a great snack for later.  I couldn't give five stars as the restroom was hot and unkept at the time of my utilizing it.
12/28/2019,5 star rating,I had an awesome time at Melba's this evening.  Brian R was our host and he did an exceptional job.  Definitely will come back Thanks Brian R.
3/21/2021,5 star rating,First dinner out in order a year. Was a bit hectic. Had to wait despite reservation but because I chose to sit inside. Was WELL worth the wait. 4 of us and everything we ordered was delicious. Our waiter Rich M was a magician. As busy and hectic as it was he did not miss a beat. Very attentive and got everything right. Will be back and will ask for Rich as our waiter. Real southern comfort food
10/19/2019,5 star rating,"Brunch today (with Olleigh as our wonderful waitress) was out of this world!  Chicken and waffles (with an extra piece of chicken, naturally) and shrimp and grits were the best of all time. And we went through half a bottle of their delicious hot sauce. Will make another special trip back sooner than later."
8/24/2019,3 star rating,We traveled uptown to 114th street from Mid-town for this restaurant and I wish I could say it was worth it. The food was ok but not seasoned well and the restaurant was very loud. They might have been under staffed this night but our server was really busy. There are a dozen better choices in Harlem for soul food and next time we'll choose wisely.
9/19/2019,3 star rating,"Wanted to love my meal but it was okay...  Customer service was excellent! I love this area of Harlem. I will return for another meal option. I was expecting more flavor. I know folks who live and die by this place.i ordered th e smothered chicken because they had no smothered pork chops . Mac and cheese, greens and potato salad"
2/14/2021,4 star rating,"We did Restaurant Week To Go here, and so glad we did!  Friendly staff, tasty food - everything was good, but the sautéed spinach was kind of magic.  Have I ever had better spinach?  Maybe, but can't think when.  The famous carrot cake is more of a spice cake, imho, but very delicious.  There was only one piece of catfish, so a little stingy there, but the mac and cheese was very generous!  I want to come back and dine in - it's a lovely space.  We love eating in Harlem!"
1/19/2020,5 star rating,"This place is a home run. Food is delicioys, I love their shirt ribs and their fried chicken with waffles with the strawberry butter....extra butter please!!! Won't be upset at all. I only wish they opened earlier so I can have lunch here. Lol."
7/11/2018,4 star rating,So far so good..came here because Amy's is closed for renovations...quick seating quick service.Short ribs deliciously tender. Candied yams just right. No one can match my mom's Mac & Cheese but this is a close second.The all butter pound cake took a while to come out but I think they just made it. All n all..I'll be back.
8/11/2020,5 star rating,"I love this place and the owner since the days she started out at Sylvia's restaurant. Melba's comfort food is just that. Warms the soul, feeds the hunger and inspires the spirit. Reservations are must!"
10/12/2015,5 star rating,"A few friends and I were hanging out in this neighborhood on Saturday. We were trying to decide where we were going to eat dinner. I pulled out my phone and went to my favorite source......Yelp of course to search for restaurants. Several restaurants popped up in the vicinity but I noticed that Melba's had at least 474 reviews and after reading a few reviews, I suggested that we give it a try. Upon arriving at Melba's, I noticed that it wasn't that large in size but it was just right.....leaning more towards an intimate setting. There is a bar section with about seven to eight bar stools.When we arrived it was fully occupied with few seats available at the bar. The host Michael came to greet me and was very nice. What I love is we came at the right time and didn't have a long wait to be seated because we only had a party of four. Upon being seated, our server Trent came over and introduced himself and welcomed us to Melba's. He was also very friendly and nice. He also was very attentive to each of his customers needs. Now about the food.....oh my goodness! We all enjoyed each of our selections from the menu. I really enjoyed my chicken and waffle. The chicken was seasoned just right and fried to perfection. The eggnog waffle was the best waffle that I've ever tasted. The strawberry butter was amazing that I almost wanted to ask to take some home with me lol. I truly enjoyed dining at Melba's and will definitely be back in the near future."
9/8/2019,5 star rating,"I FREAK'N LOVE THIS PLACE! It's so good I first came to Melba's for a late birthday dinner with my mom and aunt and I've been hooked ever since. The catfish is FIRE (amazing, excellent, superb). My go-to dish that I have become an addicted too, it's sinful.Today I brought my friend, it was his first soul food experience. Our waitress Olay is what I believer her name was. She was SO nice and helpful. She was bright and bubbly and over-all nice girl. Now my friend and I left in a food coma but it's worth it, perfect cheat meal."
10/4/2019,5 star rating,"This restaurant has been recommended to me for YEARS by my Primo Antonio & tonight was the magical night to finally visit! My girlfriend and I were able to quickly get a table during the dinner rush and have the best server Olleigh, who made us first timers feel at home! She was super welcoming and had wonderful menu suggestions that made me think she read my mind moments after the introduction!Thanks to her, we were able to start off with the appetizers: Crab Cakes, Spring Rolls with the Strawberry Henny / Fruit Punch drinks! Then we received our main entrees, which were: signature southern fried chicken (dark meat) with eggnog waffles and marinated chicken cutlet with 2 sides of Mac & Cheese and Collard Greens. All food orders arrived at our table quickly and efficiently looking gorgeous as ever! We finished off the night with dessert being the savory goodness that was the Peach Cobbler with Homemade Vanilla Ice Cream and the Sweet Potato Pie that felt like a warm cozy hug from Grandma herself!Melba's has a warm living room atmosphere that invites all cultures and ethnicities into its doors with kindness and genuine smiles all around. We came in hungry and left completely satisfied! Thank you so much for the authenticity (especially when someone had a birthday and had everyone help sing the Stevie Wonder rendition) I cannot wait to visit this wonderful establishment in the future with more friends and family!Written by Joy"
5/4/2019,3 star rating,"Came here for brunch with my sister. I was underwhelmed. Our waitress was nice, and was helpful; cheery disposition. I purchased the southern fried chicken with the eggnog waffle. It states on their menu that it was showcased on the Food Network. The waffle was good, but I got no hints of eggnog, like at all. The chicken was greasy and it tasted of Old Bay (the seafood seasoning). It was hard for me to enjoy because I kept thinking that I should be eating shrimp with this seasoning.The Arnold Palmer was decent. Tasted more like tea than the combination of both. The decor was nice. Although seating is limited. We were also seated in the back of the restaurant in a really tight corner although it wasn't busy. My sister noticed that every seat had pillows, but ours. I think they thought we were young so didn't treat us as thoughtful as they would normal (adult) customers. My sister had southern fried chicken & pancakes. The pancakes were crispy & saturated in butter. It tasted like she was eating butter. I tasted it as well. She felt the chicken tasted like seafood as well. She LOVED their music (90's R&B)!"
7/23/2020,5 star rating,"Melba's is our favorite neighborhood restaurant. The best Mac & Cheese, the best waffles. I could go on and on."
3/10/2018,3 star rating,"I came here for happy hour and I really wanted to give this establishment 5 stars but I couldn't find it in myself to do it. They put a brand new bartender (Jessica) behind the bar by herself on a Friday of all days and, although she was sweet as pie, she couldn't manage whatsoever. She could barely remember orders and it took her about 20 minutes just to pour me a glass of wine. The mixed drinks were absolutely horrible. It was really busy so she was just rushing and mixing. They get 3 stars because the catfish strips and spring rolls saved them. They were absolutely DELISH!"
2/12/2020,1 star rating,Overpriced. Small portions. I placed a delivery order for the chicken dinner. I got ONE piece of chicken and 2 sides for $18!!! How sway??? I could've went to Popeyes for a fraction of the cost AND the same level taste. The food is ok. I called the restaurant 3 times no answer. Grubhub called them to no answer. Horrible service all around.
9/5/2020,3 star rating,Drinks were good. Service was good. Only thing I disliked was the fried chicken. It tasted bland and unseasoned as if they just threw unseasoned chicken in the fryer. However the waffle & strawberry butter was good. The fried catfish was good and the Mac & cheese and collard greens were good. Overall it wasn't a bad experience.
11/17/2019,5 star rating,The food and service is amazing. I had the chicken and eggnog waffles. My husband had the veggie burger. My husband and I have found our new spot!!!!
8/31/2020,2 star rating,"My family and I came around 5:50pm-6pm (was told no reservation was needed prior to coming) and not only did we have to wait between 45 min-1 hr. one of my family members had to write his name on a waiting list (On a Sunday) to be seated.  First, The crab cake meal I received was bland and include some shell bits, the mini hamburgers my nephew ordered was not edible and over cooked, the waiter/ress took too long to serve our meals while we saw other parties who came after us being severed theirs...The side spinach was okay, no flavor really....I think most of us agreed that the only thing good were the drinks and I mean good not great....Really disappointing experience for us and not to mention too pricey for what's being served but maybe for others, their experience won't be as disappointing..."
8/15/2019,5 star rating,Visited Melba's for the first time 2 Saturdays ago. I ate at the bar. I has two Mellini's along with an order of shrimp and grits and chicken wings. Food was delicious! Was happy to taste good soul food outside of my family's home cooking. Alicia was very nice and attentive even though it was quite busy. Awesome experience and I'd definitely come back! Thank you
7/27/2019,5 star rating,Came here after an event nearby. Originally planned to go to BLVD bistro up the block but I've always heard good things about Melbas. We were seated pretty quickly for a Saturday evening. It took a little while for our waiter to get to us which was a bit annoying but I think the quality of the food mad me forget about that. The catfish melted in your mouth the collards and Mac and cheese was the perfect pair. Overall great home cooked southern meal. Planning to come back very soon
3/30/2019,5 star rating,"My experience at Melba's was truly amazing,from the ambiance,the art work,food,drinks,and music.My family and I came to Melba's for my birthday brunch. We did not have a reservation,and had 7 people in our party.We arrived and waited to be seated in less than 5 minutes.We were greeted by our waitress who answered many of our questions ,and proceeded to take our order.From the craft Mimosas,Salmon Croquettes & grits,Chicken &Waffles,Salmon Salad, etc. We were very pleased with our experience at Melba's and will definitely be back in the near future!"
8/11/2019,4 star rating,"Still dreaming about the catfish!I went to Melba's for the first time despite living in East Harlem for years! Food was excellent!!!We had spring rolls, crab cakes, Mac n Cheese, eggnog waffle, and catfish strips!! All were good. I didn't love the Mac n Cheese, crab cakes were full of fresh crab but a bit heavy on the mayo. It needed a lemon wedge. My friends loved the spring roll. It had a prefect thin crispy crust. But it wasn't my fave.Catfish Strips were OMG!! So fresh so perfectly seasoned and perfectly cooked. They. Were. The. Best. And I loved the waffle!!! The texture was great soft moist. I just wished it had a crispier crust.Catfish is a must there!! Drinks were inventive and well made but I didn't love mine ... I should have asked for non-well alcohol!Bonus is it's also on a strip of other cute restaurants. Several w outdoor seating and even a Paint and Pour paint your own painting and wine place!"
2/27/2021,5 star rating,Melba's gets a five for the service but a 4 for the food.  I've had better soul food other places but they treat you like royalty.
1/21/2018,3 star rating,"Melba's has a nice ambiance and perfect for an intimate date night.  The host and server were very gracious and friendly.  The food however, was on the salty side.  My oxtail was room temperature but my bf's chicken was right out of the fryer.  Other similar southern soul food places in Harlem in comparison are cheaper and have better food but if you're looking for a more upscale experience, Melba fits the bill."
8/16/2015,5 star rating,There are more pros than cons. It is a small really small restaurant but if you want to eat there go early. The host and waiting staff was so off the hook respectful. The Harlem Iced Tea was on point and not short of flavor but let's get to the real deal the meal. Ordered the country catfish with sautéed spinach and Mac and cheese. Sautéed spinach needed a little flavor but I had some of my fiancé collard greens and off the hook. The Macaroni and cheese was very moist and delicious. The catfish was well seasoned and very delicious. Inexpensive and very nice environment to have dinner there just needs to be bigger. Best to go there as restaurant is opening not later or make a reservation the day before. I definitely would return here again
