date,rating,review
12/29/2015,5 star rating,"Came here to brunch with a friend and I truly enjoyed myself. Melba's closes after brunch and reopens again for dinner. I got there a little late for brunch but I was accommodated. Loved the atmosphere which was sophisticated. The decor, paintings and low music made me feel right at home. Our waiter was nice and he even gave us suggestions on what to have. I had the fried catfish and cheddar grits and it was delicious. You have to try the cheddar grits!  To drink I had a mimosa and it was delicious. All in all- I will be returning again, to try dinner."
12/1/2015,3 star rating,"I came here with my girlfriend and we had a great time. It is a family-run establishment, and more than anything the service and the vibe are what I liked best about this place. I had the chicken and waffle--the waffle in particular was fantastic, considering I don't love waffles. That being said, Harlem is a hot spot for great comfort food, and there are better places in Harlem.We had dinner, and then 2 hours later went to dinosaur bbq which is the king of soul food in Harlem."
9/29/2019,4 star rating,"Service was good! Shown to our table right away. Took a large group order right away. No appetizers since we had an event to get to, but the food came out with gaps for different people!  The food was very good though, fresh and tasty but not hot.  The waiter forgot my drink order and I had to catch their eye a couple of times to remind them! I ordered a second drink but waiter forgot again and did not bring before we had to leave!  Melba's has expanded since the last time I was there and the extra room made the dining experience more comfortable than in the past. Breakfast and brunch is the best here!"
9/29/2019,4 star rating,"Food & Service @ Brunch was amazing. Shrimp &Grits, chicken&waffles, catfish&waffles - all.was very flavorful and everyone at the table left pleased & satisfied overall. Great spot"
9/28/2019,4 star rating,I loved Melba's. Great entrees and side dishes served in hearty portions. Try parking on the street and stop in for a drink and dinner.
10/27/2019,5 star rating,Favorite spot in Harlem . Illegible and shinnel awesome service. Thanks for everything.
8/5/2015,4 star rating,"The chicken and waffles here were perfection!  (And they are apparently recipients of some Bobby Flay stamp of approval, if that means something to you.)  I was with one other person, and we split this main dish with four sides: - The spinach, which was light and garlicky goodness.- The collard greens & the peas-n-rice, which were both tasty.- The mac n cheese, traditional and terrific but for the burned bits that felt like shards of uncooked macaroni.Knowing we were splitting everything, the waiter asked the kitchen to bring everything already split, so we got eight little bowls for our sides, and the waffles and chicken in two servings.  Very thoughtful!For dessert, we asked the waiter if Melba's is especially known for anything, and he called out the Peach Melba Cobbler without hesitation.  It's not what you'd expect--it's not a wedge or square of pie, it's more like a  suspension of cookie dough and baked peaches served in a glass cone.  You can get it with a scoop of house-made vanilla on top, which we did, but it was a bit tricky because digging into the ice cream caused the whole cup to overflow, spilling the peachy goodness.  I'd say skip the scoop, the dish was swell without it.A live band plays here sometimes (I think every Tuesday night?) -- when I was here, it was the Swagger Band, fronted by Jeanetta, whose name I hope I'm spelling correctly.  They kicked in around 8:30pm, playing a mix of funk and songs like Everything is Everything, some Sade, some Mary J Blige.  It was too loud for the space, but hard to dislike.The space is small but not cramped, dim but not dark, and full of families, couples, and larger groups of friends.  And the bill was surprising inexpensive.  Only $7 for desserts, $14 for the renowned chicken waffles, and $4-5 for sides."
11/23/2015,4 star rating,"My boyfriend and I went here last Saturday, and we had a great time. While we did make a late-night trip to Dinosaur BBQ a few hours later, the portions were yummy and well-sized. The fish and chips (my order) was filling but not as fried as your standard iteration on this dish and the eggnog waffles were some of the best I've had. There was also a wide variety of cocktails, and the bartender was willing to make cocktails that were not on the menu.Most important, the entire staff was extremely respectful and gracious. Dirt from someone's shoe transferred onto my boyfriend's coat and one of the waiters insisted on wiping it off. Not necessary, but very thoughtful."
5/17/2019,1 star rating,"I did not get to actually eat in the restaurant. My mother and I was almost knocked down by someone that rushed to the door as we tried to enter, informing us that they do not open until 5:00pm.  It was then 4:35.   I thought it was very rude and unprofessional to have an elderly woman with a cane stand outside of your establishment especially when it looked as if it was about to rain...As a corner table would have been sufficient until it opened.  You have now lost two customers!  Unfortunately I could not leave 0 stars because that would be my rating of the establishment!"
8/1/2013,4 star rating,"This place is tiny, so be sure to have a reservation and dont be late. Initially the service was slow, but then it changed. Maybe because Melba walked out and chatted with us. She even touched my shoulder..*swoons*The food was amazing and worth the wait, I got the beef rib, spinach, and yams. I tasted the catfish and mashed potatoes and both were very good also. I maybe an alcoholic because my friends said the drinks were strong, I didnt think they were. However, they were tasty! I ordered The Harlem Iced Tea. My lily livered friends ordered the Lust in Paradise and White Sangria which I finished for them.I'll be back!!!! The server was a thin woman with brown eyes, she was a hoot!!Sidenote, replace those big chandeliers with even larger ceiling fans, it was HOT!"
8/27/2015,2 star rating,"Let me start off by saying I am from the south.  I went to Melba's because of it's high ratings, of course, but I should've thought better about getting southern food up north.  It was an ok attempt at doing southern food, but it doesn't hold even a tea light next to true southern cooking.  It may be good to people who aren't from the south, but it did not make my taste buds jump.  The chicken was dry and my friend didn't enjoy her catfish.  For what you got it really wasn't that inexpensive like people kept saying. We were happy to quickly grab up seats at the bar because the restaurant is super tiny and she said it would be over an hour wait.  The service was okay.  It was just an experience that this southern girl could've done without on my trip to NYC."
7/19/2018,3 star rating,"It's OK. If you are too lazy to cook and want a meal that feels like home cooking this is your joint. It's close by, so I order from here fairly frequently, but would I tell an out-of-town visitor that then *need* to try this place? No.I will say its a little pricey for the flavor, but I'm not going to stop ordering from here."
4/8/2018,5 star rating,Great southern style place in Harlem !! Loved food. Good quality. Check this place out. Mac and cheese is amazing also.
9/2/2016,5 star rating,"A very cute, cozy place. The music playlist was amazing!!! The service was good too. Server checked in and was attentive. I ordered the chicken wings ans waffle with strawberry butter. My friends ordered fried shrimp with greens, Mac and cheese, candied yams and rice. The greens were amazing and I haven't always been a greens fan! The candied yams just warmed my soul with each bite. I could eat them everyday!! The waffle was light and fluffy perfection. I did not try the mac but both my friends said it was flavorful and delicious. I will definitley go back. If you are looking for good soul food with that homemade taste this is the place for you!"
5/24/2014,4 star rating,"What a lovely place to go for lunch with a good friend. The fried chicken was cooked to perfection. I enjoyed the waffle, biscuit and my friend  really enjoyed her sweet potato pancakes.  The fruit salad was delicious as was the coffee. The place is small which makes it feel very cozy. The staff was wonderful. No pressure and was well attended to throughout the meal.  The prices are par for the area.  My only complaint was the bathroom. I enjoyed the tiles but the toilet was very low to the ground and the seat was not stationary.  The metallic stainless steel sink was reminiscent of being on an Amtrak train or airplane. Happy there was ample hand soap and paper towels.Lastly,  the red velvet cake was a little undercooked but had very delicious frosting."
5/5/2019,5 star rating,"The fried chicken is AMAZING!!!!!!! I come here every Sunday after church and the food is amazing! The owner Melba is even there sometimes and greets customer. Great, happy place to go to get a great meal with great service!"
7/5/2019,3 star rating,The vegetarian breakfast was tasty (eggs and potatoes)! The drinks were overpriced and the place is dirty. I wouldn't eat here again just for that reason alone.
11/15/2019,5 star rating,The food here is sooo great! The service is fantastic and the ambiance was wonderful. This is such a lovely gem in the heart of Harlem!
9/10/2018,2 star rating,"Glancing into the entrance the main room looked inviting! However our large party with a reservation was placed in the back room. We were grateful they seated us early! That was kind. The table was actually a long plastic card table with a soiled black fabric table cloth over it. It was pretty disgusting that the table cloth couldn't be replaced with a fresh clean one. Food: Our party all ordered cocktails at the same time as placing our food order. Surprisingly the food came out FIRST! Unfortunately, the rapidness of receiving the food came at the cost of the temperature. The oxtails were ice cold. Obviously they had been refrigerated but not properly reheated. I found two hairs in the Mac & Cheese. Cocktails: I've never had a worse cocktail. It was a classic cocktail that doesn't require much expertise to execute. Loved the music! I wouldn't recommend this restaurant."
4/21/2019,4 star rating,"Melba's is G00D Money w/me, point blank period!!! After A Looonnnnggg 4/20 day in GYALhattan TRYING to find parking in order to attend the International Auto show @Jacob Javits, I was beyond Hungry and wanted something good to eat and from somewhere nice. Considered shooting to Bk, but after A few minutes, we decided to head uptown and check out Cove lounge, cause The Lady, wanted chicken & waffles and the red velvet interested her. As we got to Harlem, I inquired about Melba's, drove that way and directly across the street A vehicle was moving, which allowed INSTANT parking!!!!!! You can't beat that with A Bat!!!!! Once inside, we were seated immediately, it's A small Intimate, establishment, with many paintings adorning the walls. Music playing, but not too loud, where, it's impossible to have A conversation while dining and the lighting allows you to comfortably view the menu. The bathroom is well kept. As far as the main reason we attend Restaurants, The F00D....... I considered the salmon, but them rib(S) were calling me, so I asked the server about the portions and he assured me it was A Hearty amount, w/that said I ordered the ribs with candy yams, rice and peas and A  Guinness stout. My Lady ordered her waffle and chicken wings, she clearly enjoyed the waffles not so much the chicken as she gave me A piece and indeed it was kind of dry.  As for my meal.........piping HOT and Delicious!!! As well as A pretty nice amount, I was not the least bit upset. I WANTED the PEACH COBBLER for dessert, but we decided to leave. I Definitely plan to return and test out that cobbler. Melba's is A G0!!!!!!!! 3.3/4 STAR(S)"
11/10/2019,5 star rating,Such a beautiful restaurant / wonderful place for a lovely weekend brunch. The service was great i had the pleasure of dealing with Alysha who was very knowledgeable of the menu and answered all of our questions with grace. Will def be back for the chicken and waffles and will recommend this place to my friends and family.
4/16/2019,5 star rating,Alysha is one of most pleasant ppl I've met thus far at this spot. She was very knowledgeable on the menu options. Super friendly I will definitely be back soon !
5/12/2019,1 star rating,Their food is outstanding so this rating has nothing to do with their food. Their front desk host/manager Nicholas needs some training. He is so rude.
10/15/2017,5 star rating,So my wife and I decided to do a little Sunday night date night at Melba's. I was a little hesitant bc all the soul food I have been getting in Harlem has been leaving a lot to be desired but not this place first off the hostess I didn't get her name but she was very welcoming and sweet she even went around and checked on everybody as we ate which I enjoyed very much. Now on to the food the spring rolls were great I almost ordered some to go but I didn't want to be super greedy lol. The Macaroni and cheese is freaking amazing I loved it best I've had in a long time. I also really enjoyed my potato salad and chicken. My wife had the egg nog waffle and fish which she said was great as well. Overall I really enjoyed Melba's and we will definitely be back.
10/2/2019,5 star rating,Friendly service. Good food. Although my date felt her potato salad is better...and no her name isn't Karen. Lol
11/6/2018,5 star rating,My favorite restaurant in Harlem always treated nicely my food is always on point.I love the live R&B on Tuesdays.
8/4/2018,4 star rating,"Visited on Saturday evening, got busy as night went on...Started with Crab Cakes and my wife got grilled Shrimp...Both excellent...Had BBQ Turkey Meat Loaf with mashed Potatoes and Collard Greens excellent...My friend had chicken and waffles...All superb...Tge service was incredible and the staff very attentive , will return...."
8/31/2018,3 star rating,"Sooooooooooo I was there celebrating my sisters birthday August 29, 2018. Let's go one thing at a time. I love this place let's keep this in mind.. Ready? Okay it was 8 of us 4 adults and 4 kids and we we're hungry. We walk in and they seat us in one section that was slightly quiet and then we were asked if we would like to move where we could sit comfortably. We agree and don't know what we had in store... MIND YOU IT IS HOT AS HELL OUTSIDE; since we we're placed by the door we didn't get any air conditioner.. SO PISSED.... Now it's time to order - I ordered catfish, spinach, mac & cheese, potato salad and a half & half with smiles and everyone else orders their food. About 20 minutes or so the waiter comes and gives us all the wrong food so we had to exchange plates and he didn't care a bit he just walks off. As I go and try and enjoy my food as sweat dripped down my face the mac & cheese was dry and looked horrid, the catfish was salty as ever and my half & half was not what it was suppose to be. We are all annoyed by the service and the food at this point. I call the waitress that has been missing since she took the orders and ask why is it so hot she explains again it is because we are sitting by the door and everything is moving slow because it's a big party next door. POOR EXCUSE..... The best thing I ordered was the peach cobbler... OMG... Can we say YUMMY..... Best I've ever tasted..."
8/17/2016,4 star rating,"Food amazing, service great, live band Tuesday AWESOME!!! One complaint....they didn't have a few drink ingredients."
8/24/2019,2 star rating,"We went back to Melba's on a Friday night to celebrate my husband's birthday which we noted on our reservation.  We waited 30 minutes for our ice tea and then asked 3 more times for it before saying just cancel the tea. It's coming was the standard waiter's response. The catfish dinner and sliders were a solid 3 or 4 stars, but the birthday went unacknowledged so we left and had dessert elsewhere.  Oh yea....it was Harlem Restaurant Week, but I guess that means just order from the menu at regular pricing.  There were no specials or combos as with New York Restaurant week.  Overall, a disappointment and we won't be back."
10/27/2019,5 star rating,I'm from the south and I love soul food. MELBAS never disappoints. The food is seasoned and delicious! I bring all of my friends here because the staff makes you feel like you're at a good relative home for dinner! The sweet potatoe pie AMAZING! The OXTAILS yes lord! So good!
1/1/2018,5 star rating,"This place was amazing for the fried chicken and waffles! Plus, great coffee with a very attentive and funny waiter. Great experience for a Sunday brunch. The decor was classy and sitting at the bar was just fine."
7/21/2019,2 star rating,Please tell me how this place has 4 stars on yelp? First impression walking in was not good...it just did not have a clean vibe. The food was not the best either....it just did not taste fresh nor was it good...PERIOD! I had the fried chicken and that was ok but the pancakes were not. My husband had the salmon croquettes that tasted fishy and overly breaded at the same time...bottom line they just weren't good.  The home fries were far from crispy and fresh too.  I rarely leave bad reviews for a place but this was just not the best culinary experience as i was hoping per the great Yelp rating.
5/26/2015,5 star rating,Best meal I had all year! Excellent service also- will be going back. I had the catfish with Mac and yams. Catfish was fried to perfection and the Mac and cheese was to die for. Yams were sweet and savory! Go for a little piece of south in the city!
6/22/2013,5 star rating,"Went with the family to Melba's for the first time. I had the Southern catfish with collard greens and the trés mac and cheese. It was...phenominal. All were delicious with generous helpings. The staff was so friendly and the atmosphere was contemporary and chic. My only complaint was that the music was a bit loud for such a small space. And it is small, so I suggest a reservation.  Or you can wait at the bar. I didn't try any drinks but I can't wait to return and do so."
12/4/2015,5 star rating,"My first time here and I loved it! I had the catfish and eggnog waffles...pretty good! ! My boyfriend had the turkey meatloaf w/ collard greens and mac n cheese. The turkey meatloaf was good but the sides were amazing!! Coming from a family of comfort food cooks, I was blown away by the greens and mac and cheese.  I'm the greedy girlfriend so I sampled everything no complaints. The service was amazing everyone was welcoming as soon as we walked in the door. The servers were extremely courteous. The size of the restaurant is small but it wasn't a tight uncomfortable space, nice and cozy. The heating,lighting and music was good. I do wish the music was a little bit more up to date, but overall it was a great experience and another go to hot spot."
5/9/2015,5 star rating,Oh dear.... I want to give it 1 star because now I will never have any money and there goes my waistline. The food was delicious.  The service was impeccable.  Get the fried chicken and pancakes with a side of bacon.  Start your weekend right!
8/31/2019,5 star rating,"Great food, great ambiance, best waiters in the world. My new favorite nyc restaurant. I will definitely be back."
5/8/2015,3 star rating,"So the lesson learned is: don't come on Friday at the height of dinner time. But otherwise, our meal at Melba's was delicious!My husband and I drove in from CT to join my family for my father's birthday dinner at Melba's. We arrive just before them, and after some initial confusion over the reservation (under ""Big Papa's Birthday"" - because I totally would've known that, Dad *insert sarcasm*) are seated at one of the window tables - clearly the best seats in the house. The place is tiny and cramped, especially with full tables/bar of diners, which also makes it LOUD. You can't have a conversation with anyone at your table without shouting, which honestly was unpleasant and caused my father to pretty much not talk at all.Our waiter was very nice, took drink orders after getting us water and left us with the menu. Everyone was pleased with their beverages, especially the mojitos. We shared the catfish strips and pulled shortribs sliders to start; the strips are quite good, crispy batter-fried with a light batter akin to tempura, and a tasty aioli sauce. The sliders were...teeny tiny. I mean, they are legit bite-size, and two per order. The kitchen and waitstaff seemed to be having difficulty with the packed dining room, but our entrees finally arrived and the food is really good. My dad allowed me a taste of their eggnog waffles and fried chicken (delicious, some of the best waffles I've had, but sweeter than most) and his side of mac 'n cheese (good cheese combo, creamy). My pan seared chilean seabass was delectable, they cooked it perfectly (portion was so small, but maybe I'm being greedy) - although I regret getting the potato salad, my sister's description didn't quite match my expectation. My husband also had the fried chicken, although he wished there had been more meat on his plate. The pecan crusted tilapia was also fabulous, as were the collard greens - and boy are those yams SWEET! The one issue we had was how freaking long it took for us to leave. My dad was the only one who wanted coffee, so we waited...and waited...and I eyed the large crowd waiting for seats...and waited...and as my mom got up to find someone and ask for the check, his coffee arrived. 20 minutes. As he drank, my mom paid and we gathered ourselves to go home for the cake I made. My parents have been to dinner at an earlier time during the week and didn't experience any issues, so it must be the weekend where you have noise and longer waiting times for everything. Make sure you have a reservation if you're dining here!"
7/5/2018,5 star rating,"I Came from Dc and had a list of restaurants to go to.  Melba's was everything I hoped it would be. We had Ox tails, mashed potato's, greens, mac and cheese, chicken and and waffles. EVERYTHING was good. You know you get it right if the macaroni and cheese reminds you of Thanksgiving. A side note, the music and staff were also awesome."
1/29/2018,5 star rating,"Soul food at its finest. Location was in the heart of Harlem, close to shops and places to visit just in case you find there is a wait (they do take reservations!). Very friendly hostess and waiters, attentive with warm personalities. A variety of entrees to choose from: we got the vegetarian spring rolls with dipping sauce which was delicious!; fried chicken/garlic mashed/collard greens were fantastic as well! No triple layer chocolate cake available but no loss there.. we got the peach cobbler with a scoop of chocolate ice cream on top and were NOT disappointed! Great music, ambiance, and overall character at Melba's."
7/30/2018,4 star rating,"The food is in point! I went there with my son and we got for starters Buffalo wings & fried shrimp. The shrimp was good I didn't taste the wings but, my son said it was good. For our meal he got the fried chicken with Mac& cheese and he loved it. I got fried catfish with yams, potato salad and collard greens. It was soo good! For desert I got sweet potato pie. I gave them a 4 star instead of a 5 Star because they only give you 1 piece of chicken and fish. The place was nice and clean and I will be back!"
