date,rating,review
6/5/2022,5 star rating,"This was one delicious dinner we had at Melba's. I had no complaints maybe my bestie for not having rice and peas. Yo they even gave us oxtail gravy on the side and it was a lot. The fried chicken breast was juicy and flavorful. I loved the greens had a bit of sweetness. I loved their homemade hot sauce. The catfish was fried perfectly. Didn't care too much for the sauce that came with. The spring rolls were good it was made with cheese, collards, rice, and black eyed peas. I'll be back soon. There is also another room when you ener which I didn't get to film with a small bar. Their portions are big and filling."
6/3/2022,3 star rating,"Food:Mashed potatoes were cold. Both the sautéed spinach and the collard greens were extremely salty. The mac & cheese was also quite salty but would be tolerable if not accompanied by even saltier sides. A$AP yams were cloyingly sweet and not ""sticky"" at all, despite the description. Chicken and catfish were both great!Water is served in plastic cups, while cocktails were served in glasses. Why?Service:The manager was very friendly.  Everything else was a bit of a mess.  One server came to take our orders within a couple minutes of sitting down, before we had a chance to make decisions, and no one came back for about half an hour. After putting in our orders (different server), the drinks came out within a reasonable time but we waited another 40 minutes for the food to arrive. As a vegetarian, I won't be back, but Melba's is a Harlem institution and I'll continue to recommend it to non-veg friends."
5/17/2022,5 star rating,"Let me tell you something. I mean what I say and I say what I mean. Best soul food RESTAURANT in New York City. Hands down. No question. Find me a better one and we'll battle. Not a take out spot, not a mom & pop spot ( love them all btw) but if we're talking RESTAURANTS then Melba's takes the cake.You need a reservation here unless you don't mind waiting 30mins-1hr for a table. ESPECIALLY on a weekend. Black folks don't play bout our dining here so a reservation is HIGHLY recommended.Speaking of recommendations you can close your eyes and order blind and you'll enjoy everything. I've had the catfish, chicken, Mac & cheese, candied yams, collards, and a whole bunch of other sides I can't think of right now BUT LEMME ASSURE YOU ITS DAMN GOOD. Like, the servers almost don't have to check on you after the food is delivered. The table has syrup and hot sauce ready for you and the food is just made to perfection so once you have it, bliss mode activated.Just dine here, that's all I gotta say. Do it, enjoy it, love it."
6/4/2022,5 star rating,"I'm always watching The Food Network Channel. One time I was watching and Melba was one of the food judges. It showed her restaurant in Harlem N.Y. I knew instantly I wanted to visited her restaurant. So, glad I had the pleasure of visiting on last week. The staff was organized and very attentive. Small space with an outside patio. Nice music and energy flowing. Our server was nice. She had a nice Harlem Accent. I ordered the  2pc catfish fillet with greens and mac and cheese. Let me just say this is how soul food is cooked with perfection and good seasoning. We all ordered the Roc Berry LemonadeCocktail. There was no compliant at our table. This is another one of my favorite places to dine and eat in New York. If your ever in N.Y I highly recommend you stop by Melba's Restaurant. A small fun fact. I also have an aunt named Melba."
5/1/2022,4 star rating,"Can I have born, bred and buttered engraved on my resume please?Despite not having a reservation in the middle of lunch hour, we were seated pretty quickly. Ordered the signature chicken and waffles with sides of yams, collard greens, and mac and cheese. I won't lie, it did take a bit for our food to arrive but, I also think that's just a pandemic product (understaffing and whatnot). Our waitresses were trying their best!The food itself, was yummy. The waffles were soft and sweet, the chicken fried and well seasoned. The strawberry butter, wasn't too crazy about. Too much of it had like a strawberry candy sweetness to it. The yams were sugary, and the collard greens were nice bitter break from the richness.The mac and cheese though. Omg, probably one of the best mac and cheeses I have ever had. Cheesy with a considerable crust on top, and flavorful, most importantly. Honestly, I would just go back for a plate of that!"
5/26/2022,5 star rating,This is my second time dining at Melba's in four weeks. The food is still great y'all! I could not wait to order these sides again and I opted to order a different protein (fried wings). My first visit I ordered the same sides with short ribs (I salivate every time that I think about them)!  The Turkey meatloaf was gigantic and quite tasty too. I am a forever fan and will continue to patronize Melba's whenever I visit Harlem.
4/18/2022,4 star rating,"Came to NY for my bday weekend and my mother recommended Melba's. We went for lunch. It was not crowded which was nice, so we were seated right away. We had the spring rolls which were yummy. Not as flavorful without the sauce but definitely good. For lunch we had oxtails with rice and peas and macaroni and cheese, and the dry rub wings with collards, yams and spinach and cheese empanadas. I was a bit surprised to see empanadas on the menu. They tasted fine, no different from any other empanada. Everything was good! However, I was a little perplexed that my Mac was touching my oxtails, but they put the rice in its own bowl. I think it should have been the other way around. I am one of those people who hates their food to touch so it threw me off a bit. I still ate it though. I was not as excited about the Mac mainly because it had quite a bit of cheese. I love Mac and cheese (together and separately - LOL) but I was worried about how my stomach would react to so much cheese at once. Thankfully I was fine.  All the food was very flavorful and I would recommend trying any of it. I also had a glass of rum punch which gave me a nice buzz. Very tasty too!Lastly we had some pineapple coconut cake for dessert. Delicious! Definitely recommend, but don't come here if you are in a rush. Service was a bit slow. It seemed like they didn't have enough wait staff so lots of people in our section had to keep asking the busboys for someone to come to their tables. Our waitress was wonderful but you could tell she was overwhelmed. She had just about every table in our section except the two the bartender took on, and some tables outside. So bring patience and your appetite!"
6/12/2022,5 star rating,Really great fried chicken. Service was so pleasant and helpful. Sat outside on a Sunday afternoon and enjoyed people watching.
5/6/2022,5 star rating,"Now THIS is southern comfort in NYC! The best placeFor chicken and waffles. I'm a big sides girl so I had the Mac, the greens and a waffle on the side of myChicken. The food was delicious. We even got to meet Melba! She was so kind and took a photo with us. We felt so grateful that she took time out of her day to chat and take photos! You will definitely see celebrities here. The food is just AMAZING!"
3/3/2022,4 star rating,"Went to Melbas on a couples trip last weekend. I had a great time. The host was very sweet and upbeat. We sat down quickly and ordered. I got the dry wings which were old bay. I'm from MD, they were actually really good. But 5 wings is not enough for the price. I ordered fish and chips the fries seem as though they were fried in old oil, but the fish was delicious. My BF got the wings, mac and yams. He loved it mainly the yams, and said that it was big portions. Our server was sweet but kind of rushing not as attentive. But we saw she was working the bar as well so I know how that goes. Overall I will definitely be back. We were kind of sad the food was so short to get back to us. It's a nice vibe."
5/18/2022,5 star rating,I mean... I think the photos say it all. One of the best restaurants I've been to in NYC so far. The cheese in the Mac n cheese is so fresh and the candied yams or ASAP YAMS were also delicious! The ambiance also gives Sunday Brunch vibes and the place is very very clean. I also recommend their homemade lemonade
1/29/2022,4 star rating,"I finally ventured out to Harlem after several trips to NYC, and I was so happy that I did! Definitely got to see another side of Manhattan, and experience Soul food in the big Apple city as a Southern boy.We were glad to have been able to reserve a table at Melba's for brunch on the day of! The server and hostess were just very nice and welcoming, just like what you'd experience in the South.For food, we ordered the Crab cake as our server recommended it as one of the bestsellers. However, I had to disagree, maybe because I am very particular and had my best crab cake version that I like imprinted in my mind already. But my SO did not like the crab cake here either. We could see the crab, but we felt it was more of a Tuna cake feel instead. For entrees, I had the Fried chicken and Eggnog waffle - and it was DA BOMB! The chicken was crispy and piping hot, and the waffle had a crispy touch as well. Well done! My SO had the Fried chicken and collard greens as his sides. He was disappointed that his chicken was not crispy/crunchy at all (which was shocking since mine was!). The collard greens was on the sweeter seasoning, which he did not like but I LOVED - so just be aware.For drinks, I had the Sangria, which was definitely too sweet for me, and my SO had the lemonade. Tl;dr: Overall, I really enjoyed the hospitality and the Fried chicken & waffle dish. I do feel overwhelmed by the sugar level of the drink and food by the end though."
4/11/2022,2 star rating,"If only I had not gone to the bathroom! The bathroom was so filthy that I couldn't erase it from my mind during dinner. Trash can overflowing, paper on the floor, and just disgusting!  I felt like I was eating in someone's nasty house.Ok, so let's talk about the food:. My mother had the oxtails, mash potatoes and spinach.  The oxtails were seasoned well, but the numerous tiny bones made it undesirable.  The spinach had no seasoning. I had the beef short ribs and they were seasoned    well.  The short ribs and oxtails appeared to be seasoned in the same gravy.  I had collard greens and mac and cheese.  The greens were really sweet and the people at the table next to us made the same comment.  Personally, I don't want my veggies to be my dessert too.  The mac and cheese was very thick and dry.Since it was my mom's birthday they presented her with a cake and the presentation from the staff included Stevie Wonder's song!  Their presentation was Awesome and greatly appreciated!!!!!  Now, the cake was extremely dry and we had two different cakes with icing.Overall, I would say that Melba's has the potential to be so much more, but has a high-end carryout feel to me."
4/7/2022,5 star rating,"Lawd have mercy on my soul as I wrote this review. If you're looking for some hearty and warming soul food. This is the place. I also just want to say that I've had Sylvia's awhile ago and that place is also good. And after asking our server Shaquana which is better she said they're all a family and they're both good which just made me fall in love with them even more. I truly felt the Southern hospitality upon arrival here. The food made me speechless. I had got the catfish plate with the Mac n cheese, greens and a side of the yams. BOY I TELL YA! Everything, and I mean EVERYTHING was a hit. The catfish came with the chipotle dipping sauce but it didn't even need it for real. I don't even like my Mac and cheese creamy like that but man I have zero complaints about it because it was stillGooey and stringy just how I like it. I also love to drown my greens in hot sauce but honestly these greens didn't even need nor deserved to be be drowned in them (but I couldn't help myself lol). Lastly, the yams were not overwhelming sweet but you can tell they were slow cooked to absorb all the flavored needed to make them candied enough. Taking a bit of the yams, greens and Mac and cheese together is a must, trust me!!! Honestly I'm craving it right now so I need to stop writing because I'm getting sad."
6/5/2022,5 star rating,"Melba's is an all time favorite of mine! The best soul food in the area! I personally love the catfish, collard greens and candied yams! The vibes are always dope! Want to shout out Awa and Amani for their amazing service and hospitality"
3/30/2022,4 star rating,Atmosphere was cozy and sort of family style. Small place where everyone is kind of close together. They play good music. I had a margarita which I felt wasn't strong.... I also had the catfish with Mac n cheese and collard green. Everything tasted good and was seasoned well. The only complaint was my collard greens. They were slimy..... I told the waiter about it he reheated my collards and the slimy texture subsided.
5/20/2022,2 star rating,"Got here ready to eat, easy to make reservations online. Visited on a Friday night for two. The ambiance was loud, and joyful. Got seated right away in a small corner. We ordered the dark fried chicken, and country catfish along with chili onion rings, potato salad, collard greens, Mac and cheese. The collard greens were really good, enjoyed the potato salad with the catfish, and the onions rings were just okay, the Mac and cheese was cheesy but a little dry, enjoyed the crispy cheese on it. Partner was surprised there was only one thigh + wing. Everything was a little too over salted for my taste. Not sure I would crave this again. Service was fine."
11/14/2021,4 star rating,I have been wanted to try this restaurant for a while. I made reservations for me and the girls for 1pm. When we arrived I found parking close by. We walked in and the restaurant is pretty small. I gave the hostess my name and seen they didn't update the table from 4 to 5 people so they had to squeeze us at a table. Malice was our server and she was so nice and attentive. For my first drink I went with the rum punch which was too sweet for me. So I changed it to the red sangria which was better. For my meal I got the eggnog waffles and fried catfish. The girls ordered different things that I tasted. My meal was very good. The waffles were so soft and fluffy. I tasted the oxtail and chicken and that was so good as well. Let's just say the food here was nothing short of amazingly good minus the collard greens. I did not care for the greens because the juices it was in was thick and had a weird taste. One thing is the food is made fresh so it took a bit to bring everyone's out. When we got the check a 20% gratuity was added already and it came to a little over $54. All in all we all had a good time and I would return.
3/18/2022,5 star rating,Decided to come here after a few drinks for some southern comfort food and it did not disappoint!  Ordered the chicken and waffles which apparently went up against Bobby Flay and it was a pretty solid choice!  Chicken was fried/ cooked perfectly and the waffel with strawberry butter was a winner!  Definitely recommend if you're in the area!
6/13/2022,5 star rating,"melba's is great.  she has a few locations now!  professional workers, great svc., great food!  great for all!  great for girls dinner out!  guys, night  out! couples night out! go have fun dining out! with whom ever.  enjoy melba's & let her know!‼‼‼‼"
2/10/2022,2 star rating,I came here because of the Wendy show and Sherrie Shepard (home girl in my head) said it's on the list of things to do while visiting BUT HEEENNY let me tell you.  Melba's is not what it's made out to be like Sherrie said! The bathroom is diiiirrrty.  They extended their restaurant so they no long have corn bread.  What kind of soul food place doesn't keep corn bread on the menu?! Melba if your reading this. Clean ur bathroom and find a way to bring back the corn bread ok love.  Ur servers are nice and are 10/10 but u need to repair the oven ASAP because it's affecting the quality of the Mac and cheese.  It's gooey instead of crisp.  I flew all the way from Hawaii to eat here and I'm so disappointed.  All the fried fish items are not crispy. The chicken was okay. The greens to sweet idk what made it sweet. I personally liked the yams.  What I did like was the waffle that was great and the drinks were super strong! Mac and cheese was 3/5 for it not being crispy on top but that's just cuz I like cheesy but still wanted what I expected from the photos.
3/21/2022,3 star rating,"I liked it, but I didn't love it. Our group of 6 waited well over an hour for Sunday brunch and the food didn't really have that ""wow factor"" once we got it. The Mac and Cheese and eggnog waffle were excellent, but everything else was mediocre: catfish wasn't as well seasoned as I would've liked; the sweet potatoes were too sweet and the ox tails were just ok."
2/12/2022,5 star rating,"Melba's is a gem! We had a 7pm reservation on a Friday evening. As soon as we entered, we were greeted with the sounds of music and laughter. We submitted our information to the maitre d who immediately seated us.The area was well lit and diners nearby were clearly enjoying their meals. On the way to the restroom I ran into Melba!Melba is warm and endearing! She makes you feel as though you are at home celebrating with extended family! I was further touched by the warm, respectful, yet nurturing way she interacted with her staff. We ordered Melba's spring rolls, fried chicken, spinach, peas and rice and for dessert carrot cake and sweet potato pie.We were amazed at the light, crispy fresh delectable taste of the spring rolls that crunched to the bite and melted in your mouth! The catfish was well fried yet moist and flaky to the touch. The peas and rice was grainy, well seasoned and plentiful. Well, the fried chicken continued in pretty much the same fashion; well seasoned,golden brown and ample! By then, we were getting quite full but could not stop ourselves from eating and we did not even have dessert yet!Oh, by the way did I mention the drinks? How could I neglect to tell you of this! We ordered rum punch and Melba's iced tea. The drinks did not disappoint! They were awesome! My fiancé admitted to Rich; the bartender that this was the BEST rum punch he had ever had! That said, my fiancé is from St.Lucia and knows a good rum punch.We will DEFINITELY be regulars at Melba's! We had an amazing evening with excellent food and wonderful people!"
9/29/2021,5 star rating,"I forgot to check in when we came here for dinner on 9/19. The service is friendly and does a nice job of checking and giving updates as all the tables were occupied and there would be a wait. Everything on the menu sounded great but we decided on catfish with the side of yams and collard greens and I had the sauteed shrimp entree with the sides of collard greens and rice and beans. The food was fabulous! The collard greens definitely had smokey, rich flavor and were nice and tender. The rice and beans ... simple, straightforward and a nice balance with the garlickly shrimp and smokey greens. Of course we had to order a slice of sweet potato pie to end the meal. Great establishment, wonderful service and delicious home cooking. Don't miss out!"
12/11/2021,3 star rating,"I was recommended this place by a friend; so for this random trip I decided to try it out. We made reservations and the place was pretty full upon our arrival. We started with the Buffalo wings which came as all flats (hallelujah) and they were crispy! So those were delicious. Our entrees...we got the country catfish with macaroni and cheese, and spinach. The fish was HOT out the grease, the macaroni and cheese was not good and the spinach was VERY salty. Our server was very sweet, but I think they may have had her running around very busy, we only saw her twice during our dining. Overall, the place was nice and cozy, but I think I expected more than what was received."
10/25/2021,5 star rating,"I love good food and equally love good staff. Melba's give both. First time, walked in and was sat at an outdoor table. The menu has something for every foodie. We covered our table with catfish appetizer, sautéed spinach, chili onion rings, Mac'n cheese, chicken and waffles. Catfish strips were lightly battered and fried. I've never had them like this but I liked it. Spinach was good. Onion rings fried perfectly but I did not taste chili. Mac n Cheese tasty. Chicken ( white meat) perfectly fried and seasoned.  Waffles served with strawberry butter and syrup. We had a great time.!! Our server was attentive and patient. The manager checked on us a few times. Overall, excellent service. We laughed with other customers, staff and sing  Happy birthday 3 times. Note: Reservation required for indoor seating."
9/17/2021,5 star rating,"Melba's is a NYC gem. It was my first time dining here and won't be my last. I tried the chicken and waffle, which was absolutely delicious. Perfect fluffy waffle and crispy fried chicken was absolutely what I needed that night. And I'll be thinking of the strawberry butter for a long time to come. I also got a Mac n cheese, which was good but I only tried like a forkful before I was completely stuffed and decided to take it home for next day lunch. The only thing I didn't think was great was the ""sexy sangria,"" which was too sweet and lacked fruit. Our waiter Tequan had a great vibe and everyone else working here is really friendly too. I asked to sit in one of the covered booths outside and was accommodated with a smile.Wheelchair access: I didn't go inside but there are no steps"
4/30/2022,1 star rating,"This review is based on the establishment, not the food.Extremely disrespectful wait time for a take out order. The ""hostess"" stated that we had to wait for a server to be free to place an order. That was pretty confusing, what is her purpose if not to also help place to go orders? I waited 30 mins just to place an 2 entree dinner order. There is no understanding of how orders are handled. I actually ended up waiting 2 hours before I couldn't wait any longer. The ""manager"" couldn't give an estimate of when the take out orders would come up, on top of that she was snarky. A couple that came in after me, sat down for dinner and were actually FINISHED, walking out the door before my to-go was produced?!? I had to request a refund. And waited another 10 mins. The whole staff, with the exception of the male server, could take a refresher course on professionalism and customer service."
11/21/2021,5 star rating,"What can I say, run don't walk to Melba's / remember we're not counting calories here.  What's good -I'll tell you what we had - collard greens - tres cheese Mac & cheese- Yams - dry rub wings - short ribs (omg)  - catfish with Chipotle mayo and yes the Beat Bobby Flay egg nog waffles are everything - you hear me!!! Yes yes yes please to all of the above!"
4/14/2022,5 star rating,"Believe the hype y'all!!! My friends & I had a few hours to kill before we had to catch our flight back to Cali & decided to stop in at Melba's for a quick bite! We'd heard the food was great and couldn't wait to see what all the hype was about! We arrived & were seated right away. Our waiter, who was very personable, gave us menus, took our drink orders, joked with us, and left us to decide on our meal. Everything on the menu looked so good that the waiter had to come to the table twice before we finally decided! But I chose the oxtails,(been craving them) Mac n cheese, & mashed potatoes!(2 starches...I know! Lol) My friends chose fried shrimp, short ribs, sautéed spinach, & yams. Our drinks came & surprisingly our food arrived shortly after! That's when our eyes got big & the table fell silent! Everything looked amazing & they did NOT skimp on the portions!! We started eating & not a word was uttered for at least 5 minutes! After we came up for air...all we could talk about in between bites was how goooood our food was! The fried shrimp were large lightly battered & huge & the short ribs plentiful!  My oxtails were tender and seasoned just right! They were a little small but they gave you enough to make up for it! Mac n cheese was slap yo momma good & the mashed potatoes just right(but who could mess up mashed potatoes )for my oxtail gravy! Everything was so flavorful that no extra seasoning was needed!(I love that!)Can I tell y'all that I cleaned my plate!! I usually stop eating when I'm full but this food was so good that I ate it all! Talk about stuffed! I looked at my friends plates & we all laughed! Theirs were clean as well!! I swear if I lived here...Melba's would see my face often!! I will definitely be back every time I visit & will tell all my folks that this place is a must when visiting New York!Pros: Flavorful foodStrong (alcohol)drinksLarge portionsFriendly staffFast serviceCons:Lemonade needed more lemon ""flavor"""
1/23/2022,5 star rating,"I can't wait to come back, will be there in about two weeks. This is honestly one of the best brunch spots I have  been to. THE CHICKEN AND WAFFLES WITH STRAWBERRY BUTTER.... I could not get enough. The ASAP yams...ORDER THEM! Not only that but their greens, and the mac and cheese hit the spot. This is one place that I need to make sure not to order the menu and as a picky eater, thats rare. The staff was really friendly and surprisingly there was no wait on this Saturday afternoon. The music was great as well. I highly recommend"
