date,rating,review
6/22/2012,5 star rating,"Love, love, loveee Melba's!!! The food is delicious, the ambiance is very nice with a hybrid rustic and Tudor feel and the staff is amazing! I've had the salmon (delicious),  Yukon mash potatoes ( so savory), spinach (soo tasty), crab cakes (perfect blend of crab meat and crunchy coating) and the waffles with strawberry butter....to die for....like you have not lived unless you tastes Melba's waffles! But what makes this place really amazing is the staff: Damien, the manager, is quite honestly one of the nicest and warmest human beings I've ever met; and to think my first encounter I was trying to be a pushy  customer. Instead of throwing shade  back at me, Damien, instead,  stayed calm, cool and collective, reassuring me my table would be ready once all my dinner guests arrived (we were 30 mins late to our reservation). Since then, I've enjoyed every moment with Damien, he is truly so kind, fun and a great manager! Then there is Sherrie...Sherrie is one of the most attentive waiters I've ever had the pleasure of meeting. She was a sweetheart from jump, never rushing us and making sure that whatever we needed , was taken care of 100%. So you might be questioning how sweet and lovely Sherrie really is? Well when one of my inebriated dinner guest forgot their credit card, Sherrie was kind enough to run 2 blocks, in all black, in 90 degree weather, just to make sure my friend's credit card was returned...that amazingly kind and lovely!And this is what I love about Melba's: it's old Harlem 21st century style. When you would go to a restaurant in Harlem  back in the day, halfof the time you went to the restaurant for the food, but the other half you were going there for the people because you knew the people and the people knew you and cared about your well-being! That's the service Melba's provides: great food and better people! I  Heart Melba's and you should go!"
4/27/2008,4 star rating,"I'm a sucker for chicken and waffles.  And this place certainly hits the spot.   All this at a small yet classy restaurant with the nicest lady around makes dining here a welcoming and warm experience.Chicken was fried to perfection with the skin at the right saltiness and crispiness while the meat was of the appropriate juiciness - not at all oily compared to the fried chicken at lesser dining establishments.  If you're worried about dried out chicken, I recommend sticking with the dark meat.  The half chicken breast I got for my white meat portion was on the drier side so it was disappointing (the fried chicken at Gladys and Rons is slightly better).  While the fried chicken was on par with what I can get, the waffles were absolutely AMAZING.   Melba's Belgian waffle-styled eggnog waffles were amazing in their sweetness and fluffiness and not like anything I've ever had.  That accompanied with the strawberry butter is TO DIE FOR.I understand that the fame of beating Bobby Flay at a throwdown is going to flood the place, it wasn't too terribly busy while I was there and I thought they would be slightly more attentive than they were (hopefully they can work on that).  Despite their shortcomings the amazing waffles combined with their fried chicken in an amazing place."
1/24/2011,5 star rating,"There are some tasty, tasty,..... tasty things happening in here. I've only been here for brunch so far, but I've tried quite a sampling of the offerings. It's hard to keep trying new things when the cheese grits are as delicious as these are, when the bacon is as massive and amazingly crispy, the sweet potato pancakes are fluffy and perfectly sweet, and the eggnog waffles are light and crispy. I shouldn't write this review while I'm hungry. Nor should I even THINK about Melba's when I'm hungry.Moving on from the food, the service is kind, efficient, and well, honest. On one visit one of the servers took my sweet potato pancakes to another table by accident. Our server (who may have been Melba herself!) apologized profusely and brought me an ENORMOUS mimosa (that was basically straight champagne with a shot of orange juice) while the cook remade my order. Not only did I get what looked like an even larger helping of sweet potato pancakes, i also got a big old bowl of cheese grits since I had to wait. My entire meal ended up being taken off the bill. It's a nice gesture and I know it's not unheard of for places to do things like that when someone's order gets screwed up, but that one incident will definitely keep me trekking uptown to get my delicious carby brunch on!"
3/20/2017,4 star rating,"I wrote a review a few years ago about how bad the food has gotten because the Chef had changed. I have not been to Melba's in about 3 years, I decided to call and see it they had hired another Chef and to my surprise they did! The food was amazing! We were a party of 5, we ordered 4 different appetizers to share (shrimp, catfish, calamari and crab cakes) and loved each one. I ordered the chicken and waffles and I hummed each time I took a bite. I also got to taste the mac-n-cheese, all I can say is Whoo-Whee. My only complaint is that the restaurant was pretty crowded and the waitress could use a little help. It took us a while to get our drinks. The waitress and staff were very pleasant. Yes I would go back and I recommend Melba's to others."
7/23/2017,4 star rating,"Definitely one of the better soul food restaurants in Harlem. The staff here is so welcoming and extremely nice! We went here on Sunday for brunch. It gets very busy during brunch time here so arrive early. We ordered the southern fried catfish with sweet potato pancakes (delicious!) and my boyfriend ordered the Spinach omelet with grits and an extra side of turkey sausage (delicious also). For ONE sausage link $5.95! I think that was outrageous. Also, be prepared to wait a minimum of 30-35 minutes for your food to be delivered to your table. Other than that, everything else was good. We will definitely return."
12/12/2015,5 star rating,"I had the pleasure to dine in on Friday and had the stuff cat fish with Lobster sauce  Omg Amazing!  The taste the presentation  and the service was a great experience!  I'm a foodie I give this spot a top rating, best spot in Harlem hands down!"
7/19/2015,3 star rating,"The dinner was delicious in my opinion but the wait is what threw me off. So we came at around 8:30pm last night and told a lady that was wearing red (I assume the greeter) that I would like to have a table for 3. She said it would be a 40 minute wait which I did not mind. One would assume your name would be written down on a list with your party number but i guess not. 40 minutes passed, then a hour, then a hour and a half and still no one calls our name but yet I see employees walking in and out the door and going around the corner. What made it worse is that people were coming in and being immediately seated. When I finally asked about my party they asked who did I tell my party to I said the lady in red as she walks out the door because its the end of her shift. No apology about waiting nearly 2 hrs or the unorganized establishment that they was running. What really saved this place was the food. I don't know if I will be back."
12/18/2011,4 star rating,"This was my first chicken and waffles experience - although I actually had the fried catfish instead - and it was borderline transcendental.I was brought to Melba's a couple of weekends ago, after a movie, on a date. First of all, the space is impressive. The large chandelier-esque lights cast down a light glow which tends to bring out one's best features... and although the space is small-ish, the tables are situated so you aren't on top of the table next to you. It felt intimate despite the dining room being full by the time we left. We also got a table once we walked in - though we arrived close to opening time for dinner.The food was great. I got the fried catfish and waffles, as mentioned above, and my date got the fried chicken and waffles. I am a person who LOVES having sweet/savory in one bite - and this particular salty, well spiced fried fish paired with the sweet maple syrup covered eggnog waffles filled all of my foodie fantasies...and left us rolling towards the train back to Brooklyn.Right on, Melba's - we will be back."
2/21/2018,5 star rating,"Their food is amazing ! Ribs that fall off the bone, oxtails so tender they taste like they were slow cooked perfectly . Mac and cheese like my grandmother made it. Even when given minor issues they insured they were taken care of. Love the staff and the owner ! Best soul food in Harlem !!!"
7/8/2007,4 star rating,"Wow. I love my (soon-to-be) neighborhood. Everything about it has really impressed me thusfar and Melba's is no exception. What a BEAUTIFUL restaurant. As I was sitting there amongst fellow yelpers I took a moment to envision me and all my friends dining and laughing and enjoying good food and good company.I had already eaten across the street but I browsed the dessert menu and went for my first slice of Red Velvet Cake. It was indeed red. It was certainly velvety. And quite rich. A little sweeter than what I desired but all the same quite enjoyable.I was sitting next to Hugo O. And when his Po' Boy Sandwich came he offered me some fries. I wasn't going to take one and then he gently insisted. And ... Well ... THOSE ARE SOME GOOD FRIES. Golden brown, crispy, seasoned to perfection with a little kick at the end. Mmmm.The wait staff was slow with getting our order and slow with bringing the check. Guess they wanted us to stay a bit longer. Southern hospitality I suppose. Surprisingly reasonable for the atmosphere as far as prices are concerned. And the background music was really good. I can't wait to go back."
9/23/2011,4 star rating,"My grandma is going to turn over in her grave- but I think Melba's is the best soul food experience I've ever had- straight up. First off the place is super cute- tiny bistro tables and candle lit, but still low key. Perfect place to take a date for dinner or bring your mom for a ladies brunch. THE FOOD IS AMAZING. Split the fried catfish and fried chicken with my date. Came with 2 sides, we got mac and cheese, greens and a side of yams. Yams were ehhhh. A little too sweet for me. But the mac was SLAMMIN. We got an extra order at the end just to take home because it was that good. SO cheesy, gooy, amazing. Greens were also to die for, especially with their homemade hot sauce. Stuff is crack. Only thing they were lacking was maybe some amazing corn bred, but I honestly didn't even need it. Everything else was beyond beyond amazing.Service was a little slow and shaky at times and the cocktails weren't really work $11 a pop which is why I had to knock em a star. Our waitress was super sweet and did her best, but she was way over her head. She didn't have much experience and maybe just started, but she was so NICE and adorable I can't knock her hustle. At the end of the day, the food was so good I would have served myself to get it!! Melbas- yall do take out? I can't be showing my face in there 3x a week, cus that's definitely how many times i""ll be coppin your mac n greens combo. See ya soon!"
9/20/2011,5 star rating,"Love...Love...Love Melba's!!! The food is ""slap ur momma"" good!!! I had the pecan crusted tilapia with Mac n'  Cheese and candied yams! The Mac n' Cheese was to die for along with the fish! The yams, I could have done without. I think they used too much vanilla and they also seemed under cooked?? Idk. Other than the yams the food was superb! The staff was nice and friendly(which is hard to come by these days). I also went back to Melba's for brunch on Sunday and once again, I was overly impressed! I had sweet potato pancakes, cheese grits and slab bacon! Whew! I was super full and delighted :)The only thing that I would suggest they improve on is the lack of space. It's extremely small, but exceptionally CLEAN! Melba's is my go to secret!"
6/8/2015,4 star rating,"I have come to Melba's a few times each time was for brunch on a Saturday or Sunday morning.  I never had an issue getting a table. Service and food have always been great.  Catfish with cheese grits were GREAT!! Tried the egg nog waffles and fried chicken,  the chicken was not for me but I think that was just because the recipe is dumbed down for those with less adventurous palettes."
10/28/2014,4 star rating,"Great atmosphere, great food, great customer service. I was here for my sis-in-law's birthday with a party of 12. The servers were very attentive and pleasant. I had the chicken and waffles. They were both cooked to perfection. The calamari needed a touch of salt. The place is small but cozy. Music can be very loud so come prepared with cotton if it's too much for you. Overall a great time!"
11/9/2008,4 star rating,"My friends and I had tickets to see Tracy Morgan at the Apollo so we stopped here for a quick dinner before the show.  The dining room is small but is dimly lit.  I think it would be a nice place for an unpretentious date.  So my friends had seen Melbas on the Food Network show - Bobby Flay's Throwdown where they competed to see who had the better chicken and waffles.  So we went there with great expectations and wanting to try the famous dish.Well when I first received my plate, I thought - boy I'm going to be hungry.  And as I slowly ate my waffle, I thought this is pretty good but I didn't think the fried chicken was anything to write home about.  However, the whole is greater than the sum of its parts.  When you combine the two and eat them in one bite, now that is a good dish.  I don't know what it is about the crispy chicken skin (maybe all the grease? ;-)) but it makes the waffle that much better.  Oh and by the way, the dish was surprisingly filling."
5/16/2013,4 star rating,"Let me start by saying CATFISH, CATFISH! One of the best tasting Catfish dinners I have had! This fried Catfish is to die for! My niece had her Sweet 16 dinner here and had about 20 folks.  The downside is that this spot is SMALL!! I mean Tiny.  We were really cramped up in the corner and could barely move our elbows to lift our forks! The owner however, (Sylvia's Niece), was super nice, warm and friendly, meeting and greeting us at the door and stopping by our table to make sure we were full and happy! I cant think of anything else but that Catfish/Mac and Cheese, however, my brother ordered the short ribs and they actually made my eyes cross!! They were seasoned to the nines and tender as tender could get--excellent! My only disappointment was and I hate to say it...the Fried Chicken.  This was actually the dish that she beat Bobbi Flay at when he challenged her on her Waffles and Fried Chicken on Food TV Network.  I just didnt care for it, too much seasoning and salty.  Outside of that, I loved Melbas and would absolutely return for that Catfish and those short ribs and that Mac & Cheese! Also, its on a really nice corner street in Harlem USA, that has decent parking and is a decent area."
1/31/2016,4 star rating,"Great food at Melba's and very friendly vibe! Prices are reasonable; service is uneven...they forget to bring your drinks, etc, but not a big deal. The room is very pretty with great lighting.  Music is too loud and not conducive to staying and lingering. An easy fix, which would tempt me to go often."
12/9/2006,4 star rating,"Been living in the neighborhood for over 2 years and have neglected the nearby restaurants, firstly because there aren't very many and secondly, since I tend to meet friends in Hell's Kitchen all the time.  But, finally, I made my way around the corner for dinner with a friend/coworker (Amy) at this cozy little uptown eatery.  Got there early so the place was quite empty leaving table choice up to us.  We grabbed the corner and our super friendly waiter got our drink orders and shared the specials.  A DJ was setting up near the windows and soon started spinning plenty of Luther's Christmas Album, setting the perfect mood for a chilly winter's night meal.  The bar was full of the afterwork crowd, quietly enjoying the atmosphere and their cocktails.We shared a Mango Martini which was deliciously refreshing.  For dinner, Amy thoroughly enjoyed Pecan Encrusted Tilapia with Garlic Mashed Potatoes and the Country Yams (see below for description).  By the way she cleaned her plate, I'd say this was a fantastic choice!I had the BBQ Meatloaf.  Two huge slices of perfectly cooked Turkey Meatloaf with just the right amount of slightly spicy, slightly sweet BBQ sauce.  I couldn't eat it fast enough.  On the side, I had the sauteed spinach with garlic and like Amy, the Country Yams.  Oh those yams!!!  Every bite melted in my mouth, sweet as can be, YUM!Needless to say, we were far too full to even attempt dessert, but I know I have to make a return trip just to savor their Sweet Potatoe Pie.  You should too!"
10/4/2014,4 star rating,"My friend and I went to Melba's for dinner last Tuesday and everything was amazing! We both had fried catfish, collards, Mac & cheese with a side of potato salad. Piping hot, seasoned to perfection and nice portion size. I personally know Melba & she's down-to-earth, kind and really cool. We'll be going back soon with more friends!"
8/26/2012,3 star rating,"Wow. I didnt think it would be such a small space. Anywho, we went here for brunch after running the Harlem Week 5k. My friend had the salmon omelette & homefries. Cool thing about her fries was that they were made with both sweet & regular potatoes. Sure wish Id ordered those fries!  Instead I got the sweet potato pancakes with a side of cheese grits. The pancake flavor was nice but they were awfully mushy inside. We both had Mellinis to drink (mango nectar & (cheap)champagne). All & all Melba's was cool. I'd like to go again for dinner.  Saw a couple of children at other tables.  Maybe I'll bring mine next time.  Either way, its good to know that I can.By the way, Melba's has a ""B"" rating from the dept. of health."
2/19/2012,4 star rating,"Stopped here for dessert with a friend and was so happy we did.Upon entry, we were greeted by the owner, Melba, who was extremely kind and welcoming.  She told us about her upbringing, life as a chef, and how she started Melba's.  I really appreciate that she took the time to explain the history and interior design of the restaurant-just gorgeous!  I ordered the sweet potato pie and my friend ordered the red velvet cake. It's funny because while they were both good, we should have swapped desserts because I LOVED the red velvet cake (made fresh and served warmed) and she LOVED the sweet potato pie. I also ordered some mac & cheese to-go (don't judge!).  It was good, but not the best-Amy Ruth's got my heart for that one.  I want to go back to try their other dishes.Even though soul food can be a little heavy, I highly recommend that you save room for something sweet here-you won't be disappointed!"
8/20/2008,3 star rating,Melbas.....oy.I'm giving it Three Stars as an average--I have had both wonderful/savory/fabulousness and doughy/dry/choke-worthy crumblage. Great service while seated under the awesome painted of a  1970's Marvin Gaye and Vein-throbbingly bad service where my friends and I stood and waited for damn near TWO HOURS while people were seated who showed up after us. What can I say people? It's a crapshoot--the only constant is the Malibu Melba; this drink all by itSELF should get 5 stars!! :D
1/11/2012,5 star rating,"I love this place, and I actually think it's hands down the best ""soul food"" in Harlem.  That's not to say that some of the others aren't good, but they are the only ones who get the spirit right and I think they just have the best food.  There are a lot of complaints about the wait, and I'll be honest.  I'm not a planner and I've taken people here when I have the urge and have ended up having to wait longer than I would have liked--even with a reservation.  But if you have ever eaten in New York, you know the deal. Furthermore, the dining room is really small and I think this is one of the few times that the phrase ""intimate setting"" really does fit.  For two years I've supported the restaurant because each time I've gone I've had fun.  It's one of the few places where you can go an eat and meet new people while enjoying a fine meal.  Perhaps the intimate setting plays a role in that. If you're not a ""people person"" I wouldn't recommend going on Monday night...or anytime someone is having a birthday--the whole restaurant sings!  But this is what really makes this place standout.  At least, for me it's more than just is the food good, the service has got to work and here the service is peerless in Harlem.  Sure, the wait may be long but once you take a seat you'll experience the finest service in Harlem.Now the food.  I've had lots of things on the menu, but the chicken and waffles are great.  I don't like fruit...at all, but Melba has me craving for the strawberry butter with my waffles.  Now to be fair, it's not a full waffle they are three small waffles which is fine by me because the bird is really the star of the show.  The crispy outer and juicy inner is exactly what fried chicken should taste like and when the syrup from the waffles manages to stick to the skin...that's when the magic begins! I love the macaroni and cheese, but this is really a matter of taste.  I love how cheesy it is.  But those who don't like it I understand why.  I also love the catfish and the sauce they have on the side is delicious.  The potato salad and greens are also delicious.  I've had the tilapia and it was ok, and I'm not really a fan of the spinach.  But those are my only two complaints.  The cocktails are also delicious!  If you want a full experience in Harlem this is the place to go.  I'd say it offers the second best atmosphere, yea that place with the Red awning may have them beat on atmosphere by a hair.  But I definitely prefer the food here."
1/16/2016,4 star rating,Loved the brunch... I had fried catfish and cheese grits.... Wanted to try the waffle with chicken wings until they told me it would take 30 minutes for chicken wings.... And the Arnold Palmer could have used some sugar but overall enjoyed it...
2/5/2011,3 star rating,"My first time at Melba's brunch started off perfectly, with cute, classy decor, a coat rack, a corner seat, the best scone/biscuits that I have had in the city, and a great cup of coffee.Unfortunately, the ideal situation didn't continue through the whole brunch.  Nothing was horrible, but the service got a bit slower towards the end, they ran out of decaf coffee (which is why I am still buzzing a little at 5 pm), and I wasn't totally thrilled with my salmon croquette (I discovered an eye socket bone and realized that it was made with canned salmon, which just grosses me out when they keep all the skin and bones in it).My friend and I who were there both decided that if we could just eat biscuits and coffee the whole time, we would be perfectly content!  I would recommend giving it a try-- I would go back and try something else."
5/31/2008,5 star rating,"LOVES IT!!Ambience--great. Food--really good. Drinks--cool and great.And Peter, who sings there on Tuesday nights--AMAZING!I recommend just about everything on the menu, honestly. Been a few times, the catfish strips as a starter, and sea bass or fried chicken platter with spinach and collard greens (know it sounds a little weird) would be the perfect meal, a la New York Magazine.We liked it so much, in fact, that Peter will be singing at my fiance and I's wedding this fall. If that doesn't mean I loved it, I don't know what does!"
7/11/2015,5 star rating,"Perfection. I had the chicken and waffle with strawberry butter and loved it. The fish, macaroni and cheese, greens, and candied yams were also very well done. I also like the room itself. Usually soul food places are holes in the wall. This feels more like a night out. I hope they get successful enough to expand to Chicago or Texas. I highly recommend it."
