date,converted_date,rating,average,review
8/8/2020,20200808,5,4.8,"I feel safe ordering from here during the pandemic. They've got a walk-up window open so you don't have to go inside, and there are well-spaced tables outside if you want to sit & sip. (Bring sunglasses...the new white pavement makes it super bright even on a cloudy day!) You do have to give your credit card to the employee to take in to charge, so bring some hand sani, or download their app for touchless payment. I've enjoyed their iced Americanos and cold brew. My partner has been trying their different lattes--they have some unique options; very fun. The people are super nice. I like cream in my coffee and have learned to ask for ""just a little"" cream--they tend to be generous with half&half, so keep that in mind when you order (there's no self-serve add-ons at this time.)"
8/20/2020,20200820,5,4.81,"AMAZING COFFEE! And cute location, the service was quick and easy! The staff is very friendly and it is clean!"
10/3/2020,20201003,5,4.81,They are very nice people with great customer service. They take social distancing seriously even though you want to sit and chill. It's really bright and pretty here. Got a bag of coffee
10/26/2020,20201026,5,4.82,"I absolutely love this place. Since Covid-19, I miss going in and having a seat to enjoy my Bostock and coffee to the relaxing music. Wonderful atmosphere and the staff is terrific."
10/26/2020,20201026,5,4.82,"I absolutely love this place. Since Covid-19, I miss going in and having a seat to enjoy my Bostock and coffee to the relaxing music. Wonderful atmosphere and the staff is terrific."
11/16/2020,20201116,5,4.82,"Dropped in today and what a cool trendy little coffee spot! Parking outside was easy and free, which is always a plus for me. Walking in everyone was very welcoming! Only debt and credit right now with Covid! Atmosphere was very spaced out without tables and everything felt very clean inside! They have almost anything you can think of with a baked good section also! I enjoyed a hot Chia Latte and can only say good things! If I'm ever in the area I would stop by. Support small business and the small man's dreams!"
11/16/2020,20201116,5,4.83,"Dropped in today and what a cool trendy little coffee spot! Parking outside was easy and free, which is always a plus for me. Walking in everyone was very welcoming! Only debt and credit right now with Covid! Atmosphere was very spaced out without tables and everything felt very clean inside! They have almost anything you can think of with a baked good section also! I enjoyed a hot Chia Latte and can only say good things! If I'm ever in the area I would stop by. Support small business and the small man's dreams!"
11/16/2020,20201116,5,4.83,"Proof that a good attitude and a great idea, properly executed, can lead to success. I visited at noon on Monday, 11/16/2020. Three (3) bright enthusiastic people behind the counter greeted me with a smile ---how's that for a retro experience!?!?The first basic measure of a coffee house is **not** how well they make foo-foo sugary drinks, but how good their *coffee* is in a good ol' hot American brew! I was not disappointed. I got the medium roast, one teaspoon of sugar and medium on the creamer --- my barista hit the nail on the head. They said they've been open for three years and I wish them all the best in these trying times, but I know that I will be back. With me working on 8 Mile Rd on the Ferndale side, this is an easy lunchtime trip for me.Now, do they do gift cards? I forgot to ask. They would make the perfect holiday gift for my employees!Keep up the good work, folks; I'll be seeing you regularly as long as that coffee stays hot and tasty and and as long as I am greeted by smiles!"
11/16/2020,20201116,5,4.83,Stopped in here for a coffee and staff was very friendly. This place has a very cool vibe and is clean/following COVID practices. Street parking was super easy right in front of the store. Will definitely be coming back here to try another drink as they had an extensive menu!
11/17/2020,20201117,5,4.84,"This is such a cute place with the best service! There is a lot of parking along the street. I ordered the lavendar chai latte, and omg this was the best chai latte I've ever had! It was hot, spicy, and so delicious. They also have an assortment of Zingerman's pastries (YUM), and they toasted a chocolate croissant for me. Loved everything about this place!COVID-wise, they do a good job. There is a large hand sanitizer station right as you walk in, and everyone in the store was wearing masks properly. Only credit/debit cards right now d/t covid, and all tables were moved away."
11/17/2020,20201117,5,4.84,"This is such a cute place with the best service! There is a lot of parking along the street. I ordered the lavendar chai latte, and omg this was the best chai latte I've ever had! It was hot, spicy, and so delicious. They also have an assortment of Zingerman's pastries (YUM), and they toasted a chocolate croissant for me. Loved everything about this place!COVID-wise, they do a good job. There is a large hand sanitizer station right as you walk in, and everyone in the store was wearing masks properly. Only credit/debit cards right now d/t covid, and all tables were moved away."
11/18/2020,20201118,5,4.84,Seriously good macchiato!!! I wish that there were more around! Hard to find a place that can make one just right! THEY DID!!! Can't wait to go back and try everything else!!!
11/19/2020,20201119,5,4.84,"I did have an Americano while I was here. And it was great. But the real reason I'm here is to tell you about the croissant I ate that nearly reduced me to tears. This croissant is a prosciutto and parmesan croissant that they have in their baked goods case.If I had known the deep emotional reaction I was going to have over this croissant, I would have bought everyone they had. I probably would have given them to people on the street if it weren't for COVID. ""You deserve to know what joy tastes like."" I would say.The croissant was perfectly flaky and delicious and buttery. The prosciutto was tender and salty and good. The parmesan embraced all of these qualities and brought everything together in such a perfect way. When I say that it nearly brought me to tears... this is not an exaggeration. It was perfect. Just perfect. I'd warmed it up for just a little bit in my microwave. (The staff offered to do this at the cafe but I knew it was going to take me a minute to drive home and that sometimes croissants can be deliciously flaky shrapnel, so I didn't want to chance eating it in the car.)Go for the coffee. Stay for the croissants. I'm sorry I neglected to take a photo."
11/19/2020,20201119,5,4.85,"I always like coming here. The environment is cozy, service impeccable, cafe clean, and they adapted to COVID-19 safety guidelines very well. There are a variety of drinks from which to choose, as well as soy and almond milk. Narrow Way also has an app! Happy to support this wonderful black-owned business."
11/24/2020,20201124,5,4.85,"Even though I don't drink coffee, cute coffee shops make my heart sing & Narrow Way is SO CUTE! Even before I walked in, I knew it was going to be cute, because it has the cutest Issa Rae mural on the side of its building! But the inside is so aesthetic & gives it a very unique vibe that I haven't seen at any other coffee shop! The people who work there were so friendly & helpful as well! Everything is very pandemic friendly, plenty of space to space apart, hand sanitizer available right when you walk in, pastries covered from the open air, etc. I ordered a London Fog (because I always prefer tea!) and it was so delicious! Their menu has something from everyone - coffee, tea, smoothies, pastries, hot chocolate, and more!Their pastries are sourced locally from Zingerman's, which as a Michigan student, I STAN! I tried the vegetable bread, something I had never thought to try from Zingerman's, and it was the MOST DELICIOUS THING EVER! Don't be fooled by the name - it may have a ton of vegetables in it, but it tastes like a delicious moist piece of pound cake, spicy, flavorful, an autumnal party in your mouth with every bite! It's the perfect place to grab a quick pick me up if/when you're in the area! :)"
11/30/2020,20201130,5,4.85,"This is a great spot on the avenue of fashion. I loved going in here, the inside is so sleek. I had an iced lavender chai on the distanced sidewalk patio this summer and it was a delight. I look forward to getting a warm drink to take driving around looking for holiday lights."
1/22/2022,20220122,5,4.85,"My boyfriend refers to The Narrow Way Cafe as ""the really good coffee shop,"" and requests it any time we are in the area. I never say no as I love it just as much as he does! I almost always get the Iced Mocha because it is delicious and tastes like I'm drinking a chocolatey dessert. The walk up window is super cute and the workers are always friendly. Try Narrow Way if you haven't already!"
4/10/2022,20220410,5,4.86,"Great drinks. Tasty snacks. And I felt comfy the moment I walked in. At the time there was no indoor seating, but no problem--they made the right choice for their business, and I respect that choice.I'm looking forward to going again."
5/29/2022,20220529,5,4.86,"My older sis got me coffee beans from here so I was thinking about trying their in-house drinks.We came close to 9:15 on a weekday and it wasn't that busy. It's mostly parallel parking around here, but it's pretty easy in the morning.When we came in, there was one person in line in front of us. The staff is friendly! They seem to know their customers. They greet you upon entering and bid you goodbye.I got the iced vanilla latte while my sister got a cortado. That vanilla syrup was fantastic! I'm not sure if they make it in house, but it's something to come back for.My sister found the cortado to be a bit lackluster. But I think she wasn't a fan of the espresso. They only have almond and soy as the alt milk options, so I hope they add oat since some folks are allergic to soy and or nuts.They also sell a good variety of baked goods!"
