date,converted_date,rating,average,review
2/15/2017,20170215,5,3.8,"We really liked the cobbler from here! We stopped in one day as we were passing through the area and bought a cobbler to take home -- sadly my family ate most of it before I could get much more than one bite, Lol. We'd mistakenly thought this might be a dessert restaurant where you could sit down and order a bowl of warm cobbler with some ice cream on top... That is not the case, you've got to bring everything home and do the heating up & ice cream scooping yourself.The prices are decent, not cheap, but not too hard on the wallet either. Some of the other reviews mention the food not being fresh or being too dry, but I didn't notice that at all. Could just be personal preference, or maybe they bought another type? (So far we've only tried the peach cobbler with pecan crust.) I wish there'd been a little more variety -- when we stopped in I think they only had peach and apple cobblers available. I was hoping for something along the lines of blueberry/blackberry. And honestly the place itself could use a little sprucing up on the inside, but again it's not a sit-down restaurant, you just walk in, pick your cobbler, and go.I also wanted to include that a couple months later we placed an order online on their website to have a cobbler shipped to someone as a gift -- everything worked out great and the recipient was very happy. I like that they offer flat rate shipping to anywhere in the U.S."
2/19/2017,20170219,5,3.83,"Kobbler so delicious!!! Reminds me of my mother's home recipe, and don't forget the ice cream."
2/20/2017,20170220,5,3.85,Best pies in town! DONT SKIP ON THE PECAN CRUST!! Can't wait to try the bread pudding!! After this cherry cobbler though!!!
5/14/2017,20170514,5,3.88,Black berry cobbler had some a while after dinner and all I can say is Yum! It hot the spot I had it a a festival to and the desert was great
6/24/2017,20170624,5,3.9,"Thee BEST COBBLERS and SWEET POTATO PIES ever!!!! My family and I have been getting our cobblers here for the longest, especially for the holidays. My girl and co workers always ask me to stop by and grab a couple mini pies for them if im heading to the LA area. Best thing is, if i cant make it to the store before closing i can get them at Albertsons, food 4 less, and Louisiana Chicken spots as i get my fix before i head back home to the O.C. At certain events you can catch the truck and they hook u up with ice cream too. EXTREMELY GOOD PIES!! Thanks Kobbler King!"
6/25/2017,20170625,5,3.92,"My family and I have been getting not only delicious peach and berry cobblers from Kobber King for over ten years but also what has become my favorite the incredible banana pudding that will be sure to knock your socks off. We also don't let a holiday pass us by without getting their REAL DEAL monkey bread, not dinner rolls positioned in a bundt pan to resemble monkey bread. Do yourself a favor and wow your family and friends with the delectable treats Kobber King has to offer!"
6/25/2017,20170625,5,3.94,I love this place.. I drive from Pasadena just to get the peach cobbler and lemon cooler pie. Kobbler King has catered an event for me with seasoned chicken and fish. His special dipping sauce was a hit. I'm still trying to get his receipe!! :)
6/27/2017,20170627,5,3.96,"All I know is that The Kobbler King is the best place to get cobbler out there!!! Their Peach Cobbler is the best, my husband will not eat anyone else's. Thanks for always having such great tasting pies!!! Love it!!! Won't go anywhere else!!!"
6/27/2017,20170627,5,3.98,"I have been enjoying cobblers from the Kobbler King for years. I recently learned that they cater events big and small. Well, we had a graduation party for my nephew and had the Kobbler King cater the food. Honey, when I tell you the food was a hit, it was a hit! We had brown stew chicken, rice and peas, plantains, a garden salad, and of course that ultimate peach cobbler. I picked the food up from the restaurant at the time we agreed. It was hot and ready to go. Do yourself a favor, try them for your next gig you want catered. My family and guests were very pleased with the quality of the food and service we received."
6/30/2017,20170630,1,3.93,"So we called the Kobbler King in advanced to see if they take American Express. The gentleman said, ""Yes we take everything."" We drive from Irvine to Los Angeles over an hour, to barely make it there before closing time to be told, we only are taking cash!!! Come on black businesses!! Really? If you want to be taken seriously as a business you have to be consistent. If you take credit cards take them from opening to closing. They were loaded with pies and cobblers, but if you don't give them cash they weren't willing to sell it to you...shady. Won't return simply for the trouble they put us through. Even if you say no credit cards accepted 1 hour before closing at least customers know...FOUL FOUL FOUL!"
7/2/2017,20170702,5,3.95,I just picked up the Pecan-crusted Peach Kobbler and a Sweet Potato Pie...I've never been disappointed. The quality and freshness are evident. I love supporting a bakery that makes down home deserts just like me and my family make. Definitely my go to spot!
7/2/2017,20170702,5,3.96,My new favorite for holidays and special occasions. Fast friendly service and found they sell them at Vons and Albertsons near me in the valley. So happy I found The Kobbler King!
7/21/2017,20170721,5,3.98,"After having a disappointed dinner in Los Angeles. Went outside of the hotel. I notice The Kobbler king truck parking. Decided to try something sweet. I purchased Sweet Potato pie, Banana Pudding and Blackberry Kobbler. I'm not disappointed at all! All 3 that I've purchased was so yummy!! Couldn't stop eating it. It also comes with free ice cream!!! Pie and ice cream... what more can you ask for?! Thank you The Kobbler King for ending my night with a full stomach and a Smile."
8/6/2017,20170806,5,4.0,"My coworkers and I were planning a Juneteenth event for our office. We decided to have the food catered for up to 200 staff. We called The Kobbler King who helped us put together a menu of side dishes and dessert according to our budget. He worked with us on such short notice. We called him less than a week in advance and he had our food prepared, hot, and ready for pickup at the specified time the following week. He worked with us on our budget and delivered his promise on the quality and taste of the food.We settled on the garlic green beans and the cheddar cheese garlic mashed potatoes. They were delicious! Everyone is STILL talking about it a month later. We were repeatedly asked where we got the food. The peach cobbler really topped off the event. NOTHING was left over. I was hoping to take some home. LOLI just want to thank everyone at The Kobbler King for their professionalism. The food is excellent, the cobblers are THE BOMB, and it made our event that much more memorable. We will be using The Kobbler King again for catering our events in the future."
8/13/2017,20170813,1,3.95,HUH!!! I wish I could give this company a good score but the customer service blows. No matter how good your desert is TRUST me you live on referrals. The desert taste good but your customer service leaves a bad taste in our mouths here at #LongBeachJazzFestival.
8/26/2017,20170826,5,3.97,"The rumors are true - this is the best banana putting that I've ever had...reminds me of the one my grandma used to make! We also brought the savory fish cobbler to a friends house as a present, and it blew their minds!!! The peach cobbler with a pecan crust is a must every time we go out now as well! In addition to all of the fabulous treats we picked up, the woman that helped us pick a few new items out was very knowledgable about the products, and had such a pleasant energy about her - her smile is contagious!!! Thank you!!"
8/30/2017,20170830,4,3.97,"My husband knows I love the pecan crust cobbler so, tonight when I got home after a long day I had a great surprise! The cobbler and a seafood pop pie! That thang was soooo good! The chicken one was hella good too! Thnx Kobbler King . My inner greedy girl really appreciates u!"
9/27/2017,20170927,1,3.92,"The pie was ok but the places was gross. Dirty, smelly. I can only imagine what the restroom looked like."
10/29/2017,20171029,5,3.94,I tried this awesome place at the taste of souls and have been craving the peach cobbler ever since. So darn good !!!
11/5/2017,20171105,4,3.94,Let me start by saying yes the peach cobbler is good didn't really like the sweet potatoe pie It was my first time eating the cobbler @ taste of soul it was good definitely would recommend this place
11/28/2017,20171128,1,3.89,The owner talked to me so bad one day for no reason. Never will my money support abuse like that.
4/2/2018,20180402,1,3.85,The desserts were terrible they taste old they were not fresh the restaurant stinks so bad they need to shut it down
5/30/2018,20180530,1,3.81,"Call first...don't waste your time making a special trip to the location. A closed sign was displayed in the window, but the door was open and Yelp said ""Open"". The guy...assuming ""Kobbler King"" was not only rude, but of about 30 pies displayed in the bakery case, he pointed to the ones available for purchase. Yuck yuck yuck...my stomach hurts thinking about it. Best of luck if you decide to try."
6/29/2018,20180629,5,3.83,"I really enjoyed the ""Ultimate Peach Kobbler with Pecan Crust"" I grab it from my local grocery store and thought I'd give it a try; completely exceeded my expectations. Definitely bakery NOT gocery store quality, and most importantly It taste homemade. Yummm !"
8/14/2018,20180814,1,3.79,"Customer service is extremely important. As consumers we have choices. Although the cobbler was good, the service was not. In the future I will choose to spend my dollars elsewhere. No one wants to go into a business to be disrespected. Perhaps the owner should stay in the back and just bake and hire someone with a pleasant attitude to stay in the front to GREET THE CUSTOMERS. That's my constructive criticism."
8/18/2018,20180818,1,3.75,"Just tried the Kobb King at the LB BBQ festival. The guy at booth was very ""unconcerned"" and the cobbler was just okay. Perhaps you could hire someone friendly to be the face of the business. Just a thought ‍..."
11/14/2018,20181114,5,3.76,"My mom and I went to Leimert Park's Food Truck Friday event just to get this cobbler. My mom had tried it before (and wouldn't shut up about it). So, naturally I had to indulge as well (cheat day!!). At first sight...I immediately understood why my mom was SO anxious to get her fix. My mom got the blackberry cobbler, I wanted a taste, but she told me to get my own (the nerve!). There were too many delicious looking options, but I eventually settled on The Ultimate. Boy oh boy...the fresh crisp peaches and a perfectly rich buttery pecan crust made me want to slap my mama! It. Was. Devine. So much so, I drove over to his store on Jefferson to pickup another one yesterday (cheat day AGAIN!). You can taste the love that goes into baking these cobblers. Kobbler King, you've got a new fan!"
11/16/2018,20181116,5,3.78,"The Cobblers, Sweet Potato Pies and Banana Pudding are AMAZING, you must try!!!I normally don't write reviews, but this is a treasure that I MUST share. I love the fresh, rich, buttery flavor in each bite that they are able to accomplish in their desserts. Not only is the flavor on point, the consistency is not too soupy and not too thick, it's made just right. If I had to recommend my favorite it would be tough, but it would be the delicious mouthwatering peach cobbler with a scoop of ice cream.These are definitely the best desserts I have tasted and I will be back. Not to me mention the EXCELLENT friendly customer service."
11/25/2018,20181125,5,3.8,The peach cobbler is a must have. I bought two to take to thanksgiving dinner & everyone enjoyed them. And now they accept Venmo.
2/27/2019,20190227,5,3.81,The Kobbler King came to my office and the apple cobbler was insanely delicious. I can't wait to visit their store for another yummy treat!
2/27/2019,20190227,5,3.83,Bread pudding? Amazing. Peach Cobbler? Amazing. Kobbler King? Amazing.
2/27/2019,20190227,5,3.84,Absolutely delicious!! I tried the peach cobbler and was very happy with my experience :) would definitely recommend!
2/27/2019,20190227,5,3.86,"I've tried a few of their kobblers and have to say, while the peach is wonderful, their strawberry kobbler is out of this world! It is my new obsession. A few colleagues love the bread pudding as well. Highly recommend this place."
2/27/2019,20190227,5,3.87,I really enjoyed the apple cobbler. I was convinced I was only going to have a little bit but ended up indulging in the whole thing :)
2/27/2019,20190227,5,3.89,Absolutely delicious!! I tried the peach cobbler and was very happy with my experience :) would definitely recommend!
2/27/2019,20190227,5,3.9,Bread pudding? Amazing. Peach Cobbler? Amazing. Kobbler King? Amazing.
2/27/2019,20190227,5,3.91,The Kobbler King came to my office and the apple cobbler was insanely delicious. I can't wait to visit their store for another yummy treat!
2/27/2019,20190227,5,3.93,"I've tried a few of their kobblers and have to say, while the peach is wonderful, their strawberry kobbler is out of this world! It is my new obsession. A few colleagues love the bread pudding as well. Highly recommend this place."
2/27/2019,20190227,5,3.94,"To celebrate Black History Month, we had The Kobbler King so nicely prepare a plethora of tasty treats for over 500 employees. To say the least, everyone was very pleased! Delicious and so satisfying."
2/28/2019,20190228,5,3.95,The Kobbler King came to my office for a special occasion. OMG so delicious. This reminded me of my home made cobbler that grandma made. So amazing. I would recommend over and over. Thank you Kobbler King!
2/28/2019,20190228,5,3.97,The Kobbler King came to my office for a special occasion. OMG so delicious. This reminded me of my home made cobbler that grandma made. So amazing. I would recommend over and over. Thank you Kobbler King!
3/7/2019,20190307,4,3.97,"I found the kobbler king mini pies at Vons in Long Beach and had to get two of them, pecan and pumpkin. Both were delicious!! The crust was crunchy and sweet. The pecan was my favorite although i found a little hard piece in it. Will be buying more pies at Vons. I hope they will have more flavors to try out."
3/7/2019,20190307,4,3.97,"I found the kobbler king mini pies at Vons in Long Beach and had to get two of them, pecan and pumpkin. Both were delicious!! The crust was crunchy and sweet. The pecan was my favorite although i found a little hard piece in it. Will be buying more pies at Vons. I hope they will have more flavors to try out."
3/13/2019,20190313,2,3.94,They aren't same as the early 2000s. The crust was undercooked & tasted like firm flour baking soda mash. But I gave 2 stars cuz the peaches & juice was on point.
4/6/2019,20190406,2,3.92,Banana pudding was old. The man took forever coming from the back of the store not busy and the place could use some TLC
6/1/2019,20190601,3,3.91,My first experience with pecan crusted peach cobbler a few years ago when they were sold at Orleans and York was divine! The batch I got at the Obama Blvd event recently didn't have any flavor at all except for burnt. I bought the regular one as well but refused to eat it in fear of be disappointed again
6/1/2019,20190601,3,3.9,My first experience with pecan crusted peach cobbler a few years ago when they were sold at Orleans and York was divine! The batch I got at the Obama Blvd event recently didn't have any flavor at all except for burnt. I bought the regular one as well but refused to eat it in fear of be disappointed again
8/6/2019,20190806,1,3.87,"Never even got to try the cobbler.Bought one apple cobbler and one banana pudding from their food truck, after the Lionel Richie concert at the Hollywood Bowl on 8/5. Took it to go since we were walking to the car. Got home 20 min later, opened it up and the cobbler was covered in mold.Threw everything out since trust was totally broken. Not cool. Considering we paid like $12 for 2. Will never give them a second shot and will tell all our friends at the Bowl shows to pass on this business."
8/6/2019,20190806,1,3.84,"Never even got to try the cobbler.Bought one apple cobbler and one banana pudding from their food truck, after the Lionel Richie concert at the Hollywood Bowl on 8/5. Took it to go since we were walking to the car. Got home 20 min later, opened it up and the cobbler was covered in mold.Threw everything out since trust was totally broken. Not cool. Considering we paid like $12 for 2. Will never give them a second shot and will tell all our friends at the Bowl shows to pass on this business."
9/4/2019,20190904,5,3.85,"Ever Since 2013, Kobbler King Has Been My Go-To Guy For Good Ole' Down Home Desserts. Now, Whether Local or Mobile, He's Also Serving His World Famous Kobbler On a Dessert Truck. Great Customer Service. The Kobbler King's World Famous Desserts Can Be Found Locally Distributed at PAVILIONS, ALBERTSONS and FOOD4LESS; Along With Popular Festivals Such as TASTE OF SOUL L.A., LONG BEACH ORIGINAL LOBSTER FESTIVAL, WEST ADAMS JAZZ FESTIVAL, NEWPORT BEACH JAZZ FESTIVAL and Many Other Festivals Held Locally. I Catch The Kobbler King Dessert Truck Every Chance I Get When Checking Out a Concert, Especially at The Iconic HOLLYWOOD BOWL!! Kobbler & Ice Cream, Count Me IN!!"
9/10/2019,20190910,3,3.84,"Stopped by their booth at this past weekends Long Beach Lobster Fest. I love sweet potatoe pie and pecan pie so I had to made a stop here. Friendly customer service. But their prices were not so much. Double checking their website i saw that they upped their price per pie due to the festival. I guess I understand being a festival and all but damn. I ordered their sweet potatoe pie and their apple cobbler. Both were good. Nothing crazy as far as mind blowing flavors. I'd probably not try them again, especially at the price I paid for."
10/20/2019,20191020,1,3.81,"went to a taste of soul 2019 and bought 4 peach cobbler orders at $12 each from them, the nastiest cobbler ever.i don't think it should even be called cobbler. it was nasty peaches covered with a lot of, i think, cinnamon or something, not sure what it was, but i know forsure it was nasty. cobbler had no crust at top or bottom. i will never buy anything from them again. i wish i could give a no star. horrible product and their sign had the nerve to say sold at vons and albertsons. very nasty food from them."
11/15/2019,20191115,5,3.83,I was fortunate enough to have The Kobbler King take my last minute call requesting a peach cobbler for the Adult Medicine Department's Thanksgiving lunch. Everyone enjoy the freshness and flavors of the cobbler. I've shared The Kobbler Kings information with many staff members. The Kobbler King should be very busy this holiday season. Thank you!
12/1/2019,20191201,5,3.84,"Sweet potato pie and apple cobbler were ALMOST as good as my momma made em! Lol! Money well spent, I'll be back for Christmas."
12/30/2019,20191230,5,3.85,"In preparation for the holiday... I received a last minute request from my family to bring Monkey Bread. I told them it was going to be hard to find a place in LA AND most importantly one that I thought would be good enough to bring. My family is very picky about Monkey Bread because we grew up with my Grandmother from Texas making us a loaf every year.I called the Kobbler King and he indicated he was just taking some bread out of the oven. He was nice enough to endure all my questions. I showed up in AM and took a chance on buying 5 loaves. Couldn't wait to get home and try it and when I did OMG! It was soooo good! It reminded me of my grandmothers, I also had my sister try it and she said ""this is the Business"" lol! Same response from all my family as well. Thank you Kobbler King for saving Thanksgiving !"
2/18/2020,20200218,5,3.86,I brought some friends back to my favorite dessert place the kobbler king on monday feb 17th and again we purchased a lot of stuff and had some laughs with the head man in charge.... the stuff is all amazing!! Thanks again we will be back.
6/23/2020,20200623,3,3.85,"I purchased the peach cobbler with the pecan crust over the weekend. I prefer a juicy cobbler with a lot of crust in the juice. Though this sample had a decent amount of crust, it was dry and a pinch salty."
8/18/2020,20200818,4,3.85,I got a couple sweet potato pies and a blackberry pie...I give the blackberry 2 stars only because it smells sooooo good but it tasted bland. The sweet potato pies on the other hand .... WOW!!!! So good. I'll definitely be back for those lil babies.
10/20/2020,20201020,1,3.83,So not the Kobbler King! I was very disappointed in both the peach cobbler and the berry cobbler.
12/2/2020,20201202,1,3.8,"the best way to remedy this situation is to give me a full refund! i followed kobbler king on facebook for quite a while based on the pics of their products, i've contemplated on buying a dessert or two. i was impressed with how nice and delicious their pies and cobblers looked. finally decided to buy a dessert for this thanksgiving holiday. i placed my order over the phone monday before thanksgiving. i ordered three pies and one medium size cobbler. so busy with cooking dinner, my husband agreed to pick up the desserts. extremely disappointed when my husband came home with the desserts!!!! the pies were undercooked and the presentation was horrible!!! i was too embarrassed to bring the pies out for my family to enjoy, so i ended up buying store bought pies from ralphs on thanksgiving morning. the lemon icebox pie looked and tasted like garbage!!! compared to the pictures on facebook, the pies and cobblers were falsely advertised. will never order from this store again. kobbler king is an overstatement!!! the nice looking lemon pie is whats shown on the website. the homemade disaster is what i got. never again!"
1/26/2021,20210126,5,3.81,"I have a new favorite place called The Kobbler King.You know when you try someone's #bananapudding and it's the best you've ever had, and you think, hmmm... maybe their #peachcobbler won't be best in class?Or, maybe their #sweetpotatopie won't knock you off your feet?Not gonna happen. Close your eyes when you take your first bite of the King's #breadpudding and you'll swear you are on #bourbonstreet.Everything there is the best ever. I got a whole bag of goodies, waited till the kid was asleep, and broke it out for me and my husband. I had a teensy bite of the #pecanpie and then he commandeered it.I RAN OFF to my room with the lemon icebox cake. I made a nice decaf with steamed milk and locked the door behind me. I highly recommend you go there to celebrate your victories, commiserate about your fails, gossip with your friends and be thankful that you have your sense of taste and smell."
3/3/2021,20210303,5,3.82,"The Best , I tried the Blackberry Kobbler .... Soooo Goooood...! 5 worth the Drive . I am going back this weekend"
4/4/2021,20210404,1,3.8,"The peaches are bitter , and the pecan crust taste like vanilla extract is in it . Terrible !!!"
11/11/2021,20211111,5,3.81,"Pies and waffles available in multiple flavors are fresh, flavorful and delicious!Product quality is always consistent and it's Black Owned"
12/27/2021,20211227,5,3.82,"The apple&peach cobbler is off the hook, talking about spices and crust just like mama use to make it with love. No holding back on nothing and pricing total worth every damn dime"
2/10/2022,20220210,1,3.79,"I drove to Kobbler King because I had heard some advertisement of the Bakery. I drove from Western Ave and Florence Ave to the bakery in Los Angeles. I went inside and asked for a large size sweet potatoe pie. The man told me he didn't have any right then. I asked when will he have some, he replied he didn't know He kept referring to me as if I had been there before, by saying, you know you've been here before. He then said if said if you don't see what you want you can leave. I then told him I had driven far and I would get a peach cobbler. I asked him when the one's on display had been baked. He told me, ""I can't tell you that"". I told him I was getting it for a friends birthday tomorrow, he told me, ""I'm not going to say when they had been baked"". I asked him was he the owner, he told me, ""no"" I went to the website before writing this review and found out he is the owner (the man I had been speaking with). I am so puzzled why the owner of the bakery would be so rude to a customer. I hope the cobbler tastes good, if not I will be doing another negative review."
6/9/2022,20220609,1,3.77,had there desert before nothing like this weekend at Newport Jazz Festival full of crust
