date,converted_date,rating,average,review
12/26/2007,20071226,5,5.0,In my search for a Red Velvet cake I was told to go here. It was cheaper then the one place I went to. It tasted really good. The one bad thing is its street parking. Not in the best of areas. I would go back.
3/26/2009,20090326,5,5.0,This place has some of the best peach cobbler i have ever had and i love me some peach cobbler!It has been too long since I visited this place and I can't wait to go back.
7/4/2009,20090704,5,5.0,"EXCELLENT cobbler - very homemade and very tasty. You gotta get there early though, because everytime we go its late in the day and they're out of cherry! I hate that! But its a cute little place and worth the stop to pick up some wonderful cobbler to take home and pig out. I dont remember how much the cobbler was, but I think I remember it being NOT on the cheap side. Still - its good stuff and well worth it."
4/26/2010,20100426,5,5.0,The best sweet potato pie outside of Georgia.
12/16/2010,20101216,5,5.0,"I saw a bunch of cute little Sweet Potato Pies at Albertson's and couldn't resist. I'm happy I did, because they were delicious!! It was nice seeing on the ingredients label that everything was REAL (no artificial stuff or preservatives), and I'm big into supporting local businesses.I hope to see more flavors at Albertsons, and if not, I'll enjoy that sweet potato pie!"
7/15/2011,20110715,5,5.0,"I went to this place after reading some reviews and it was a great idea. Small store with one glass counter inside. The counter had a variety of sizes and types of desserts. The man behind the counter (I think he was the Kobbler King) was super nice and friendly. Bought myself a medium size peach cobbler, brought it home, warmed it in the oven, and added a scoop of vanilla ice cream. DELICIOUS~ Delicious peach cobbler! Wish I had bought more other varieties, but didn't bring enough cash. They have ATM/C.C. but it was down for the day. I want to go back to get some more soon."
9/3/2011,20110903,5,5.0,"I have to search for places that accommodate my hubby who is diabetic. This place has a wide range of cookies, cobblers, and cake that are sugar free. He is hooked on the sugar free Red Velvet cake. The girls who work there are nice and it's always clean when I visit."
9/10/2011,20110910,1,4.5,"I drove 30 min to get here hopeing to test taste some of the sugar free treats someone mentioned.I found no sugar free treats nor cookies,pie,monkey bread or sweet potato pie.All that was in the display case where 4 lonley cobblers. Is this place a front for something else ?I support southern cusine but was so let down and taken aback.What a shame."
10/13/2011,20111013,3,4.33,I wanted to love this place.I'm eager about any hole in the wall that I stumble across without being told.Sadly they let me down. The berry cobbler was great. The girl was adorable and the service was good but I wasn't diggin' the sweet potato pie and the apple cobbler tasted exactly like the pie.Could be this is the best sweet potato pie on the planet. Just not my thing.
1/27/2012,20120127,5,4.4,"The best pie & kobbler west of the Mississippi. In a small unassuming place, super friendly, and authentic. And try the savory pies that are delicious!"
3/17/2012,20120317,5,4.45,"Very great peach cobbler, this place was found because i was driving by n caught my attention to find out how good this place is to be called kobbler king. Well this place does mot look like a bakery at all. When you walk in all you see is a demonstration counter n a few different types of kobblers already to be taken home. The guy who attended me was the actual baker n owner of the place. He said that by the middle of the day their kobblers are almost all gone that is why they didnt have many to choose from. Thry did however have the peach kobbler n omg was it delicious. It comes in a 5x8 container that is safe to put in the oven for heating but you can eat it right away just like i did (fat ass lol). The koobler is not deceiving but the look of this place is. Get your kobblers here!!!"
8/30/2012,20120830,4,4.42,"The absolute best peach cobbler I have ever had. Period. I took away one star becasue the gentleman who attended us was quite unpleasant. No hello how can I help you and when asking the price he points to a sign instead of just answering. Normally I would not return to bad customer service, but I will put up with all kinds of rude for some more of that peach cobbler! Yum!"
10/24/2012,20121024,5,4.46,"Forget Roscoes, this place is church and not churches chicken or even close but CHURCH, as in holy, as in da bomb shit!!This is the best fried chicken in Los Angeles, just don't wear all red when going to eat, you may get blasted, murked, kilt, you know. This place is GANGSTER and the best!! Bring your napkin and your Glock!"
11/21/2012,20121121,3,4.36,"can rude service really be excused for a good piece of kobbler???? not in my book. the taste is good, but understand ""kobbler king"", good tastes, combined with pleasing service will keep people coming back...Customer service may be minor to a lot of people, but to me, it really does play a factor in if you'll get my money or not."
2/11/2013,20130211,5,4.4,"I thought I'd delve in to some of my culinary taste.I stumbled across this rustic storefront ,years ago,when it first opened.An outstanding review in the Los Angeles Time ,piqued my curiousity.Yeah,you're a KING.Wih this kind of hubris, I thought, we'll see about THAT.I was met by this laconic,wanna be Clint Eastwood chef.So show me the goods,and i'll be the judge , your lordship.I got home and had my palate assalutedwith this slap you sideways DELICACY.OK,so you won KING.Then,I started to hear about all these celebrites sending their  lackeys to pick up order's from this storefront joint.So,you win, KING.You got the jump on me because you're passing on secret recipe's you swiped from your grandmother,generations back! You can't keep up with demand,so take that.For those of you concerned about your arteries being clogged,you needn't worry.There are no partially hydrogenated oils in his product,since he doesn't have to preserve things for an extended shelf life.You just get the clean calories,with an otherwordly taste As far as the neighborhood, elderly colored & asian folk, don't really strike fear in the heart of this mortal man.It's a middle class area,with street parking.Ah,nothing like simple,organic ingrdedient's,sans the chemical cocktails of those commercial bakeries.Personally,i prefer his banana puddings,this should give you a clue to who I am,Brian.You share my middle name, but I spread the word.You can thank me later."
5/28/2013,20130528,4,4.38,"I had heard a rumbling on the vine about this King that made the best peach cobblers on Jefferson. I'll admit peach cobbler is my absolute weakness. So, one late afternoon my daughter and I gave it a try. The interior is simple. There's the dessert case in the center and a TV. There is street parking. You can sit briefly and wait for a large order perhaps, but don't expect table dining for your dessert.The peach cobblers were offered in two varieties (pecan) and (plain). We opted for the plain which was very good. I mean he did not sneak in bunch of margarine and skimp on the butter if you know what I mean. I only wish it had a bottom crust, because that's how my grandmother made it and other grandmothers made it....so that's why I pulled a star away.Overall, go get your cobbler fix and especially if you've never tried it! Have fun!"
9/20/2013,20130920,5,4.41,"This place has by far the best sweet potato pie. The best in the city. Sure the location is ghetto, but dang that sweet potato pie is good!"
9/30/2013,20130930,3,4.33,"I'd heard about these cobblers, and I really wanted to like them. But...The BAD: The crust/topping on the berry cobbler was cardboard-like. It was like stale bread mixed with stale granola over a perfectly delicious fruit pie. After 3 bites, I threw the rest away.The GOOD: The apple cobbler with pecan topping/crust is phenomenal... PHENOMENAL!! Moist,buttery, and sweet.THAT'S the crust they should be using for *all* the cobblers! Forget that cardboard mess and just use the ""pecan""! Bravo!!!"
10/1/2013,20131001,5,4.37,"I had the pleasure of trying the Kobbler King yesterday at the Abbott Kinney Festival yesterday, September 29, 2013, and OMG! My honey and I were floored at how yummy and reasonably priced it was. Awesome!!! My son said it's the best he's ever had."
12/3/2013,20131203,5,4.4,"I ordered several desserts here last minute for the holiday. Kobbler King was able to accommodate the order no problem! Pick up was fast and friendly! VERY reasonable prices, delicious desserts, and all with warm and friendly smiles! Thanks Kobbler King!"
12/17/2013,20131217,3,4.33,"The shop opens at 11, which was right when I was going by. The man behind the counter seemed almost confused that I was there and pointed to the display, stating that they only had a couple flavors at the moment. This was true: one small apple cobbler, a couple medium blackberry, and 2-3 large peach cobblers. Considering the selection was so limited, both in sizes and flavors (plus no pies or monkey bread), were they from the day before? I don't understand why a bakery wouldn't have anything to sell upon opening, why bother being open if there's nothing to buy? I've never been into a bakery in the morning that had empty shelves.I chose the apple cobbler and split it with a coworker; it was delicious, even though we had no way to warm it. Perfectly spiced, the apples weren't canned, good crust and not too much of it. I would happily eat it again, and hopefully would be able to put it in the oven for a bit first. Toss some vanilla ice cream on top and you've got something no one would turn down. The missing star in this review is solely for the confusing business practices. Hopefully next time I find myself in the area it'll be later in the day and Kobbler King will have a better selection."
1/5/2014,20140105,4,4.32,"A small location that packs a powerful punch!! I've initially had Kobbler King when they had a booth at the Lobster Fest in Long Beach and I was wowed. I bought an individual peach cobbler and individual berry cobbler. They were both sweet and the crust was amazing.Later on in the year I went to their actual brick and mortar location to pick up a large peach cobbler and a couple of their sweet potato pies. The cobbler seemed too sweet for me but my family devoured it. I've heard this sweet potato rivals what you can find down south. It's sweet, with a little spice, and soft yet firm at the same time. I was surprised at how delicious it was considering I thought It'd be a plain version of pumpkin pie. I recommend placing an order ahead of time to ensure that your order is waiting for you when you arrive (in the event they run out).I tried to place my order right before Christmas and it was too late. I was told that I needed to just stop by and see what they had in stock. I was nervous but they had what I wanted. This will be my regular sweet spot for holidays and special occasions :-)It was a little tough to find parking so I left my co-pilot waiting double parked in a driveway out front. Keep that in mind of you're going solo or in a rush."
1/26/2014,20140126,5,4.35,"4.5 stars rounded upI've had this place bookmarked for a while. Southern desserts are definitely my thing. I've seen Kobbler King in Albertsons and I often wondered if the cobblers at the actual bakery were better. And...yes they were! Not sure why, but it was.There's various desserts but I tried the following:Peach Cobbler ($6 small): Really good. Peaches were perfect...sweet and buttery. Lots of crust too. Choose between regular crust or pecan crust. I haven't tried the pecan yet.Sweet Potato Pie ($5 small): My favorite thus far...aside from my own. It was so good! I'll definitely be back for more.Tips:Parking could be a problem. There's no lot. Street parking only.Prices are okay but you get better savings on buying larger portions."
2/23/2014,20140223,5,4.38,"Pecan crust or bust!The girl at the counter was super nice. Always welcoming when I come by. I went today to buy 6 small varieties for a bbq I was headed to, a BBQ thrown by southerners. all of the cobblers were a hit. If Bama approves, you're gold. Seriously that peach though."
6/4/2014,20140604,5,4.4,"Awesome, awesome, awesome peach cobbler with pecan crumble crust!!! I found the shop's interior a little off-putting - there's one lonely, dilapidated display case with cobblers strewn haphazardly inside it - but the *tastiness* more than made up for it. The guy behind the counter was really nice and friendly, maybe the Kobbler King himself? Be sure to buy twice as much cobbler as you think you'll need - it's that good!"
6/22/2014,20140622,4,4.38,I've heard of this place but never made the trip to experience their food. Well I had a chance to taste their desserts at the Long Beach Bayou Festival...OMG Yessss!!!! This sweet potato pie is EVERYTHING!
6/25/2014,20140625,3,4.33,I tired the pecan crust cobble it was really good I would try it again. On the other hand the service I received was at a event they were working at and the guy at they're booth was rude and lacked professional customer service. It was my turn in line and they were really busy and as I'm telling him what I wanted he starts talking to someone that walked up on the side then got an attitude with me when I asked him for his companies location. He looked at me like I interrupted his side conversation and threw a card on the table. Just because of his service I won't be going back
8/7/2014,20140807,1,4.21,"We purchased two things from Kobbler King, against my better judgement. I usually just walk out when customer service is sub-par. Believe me when I say, it was the worst I've experienced in years, like sketch comedy bad! The guy was on personal call the entire time. We ordered a pecan crusted cobbler and a sweet potato pie. Once we got to the care we noticed the sweet potato pie was molded. I mean like big white fuzzy spots on the pie! When we went back in I said, "" one of the things you sold us is spoiled."" He promptly followed up with, "" yeah...the sweet potato pie."" I'm standing there like...if you knew why would you sell it. I wanted my money back for both because I couldn't be sure that the cobbler was not molded under the pecan crust. He absolutely refused, became super defensive and reveled the no refunds sign behind his head. Maybe I would have saw that before my purchase if I wasn't so distracted by his personal conversation and horrible customer service. #neveragain #beware"
8/12/2014,20140812,4,4.21,"I had the pecan crusted peach cobbler that I bought from Orleans and York. It was good, but I could of been happier with the regular crust...too much going on on top (but I'm not a big sweet eater). The filling was great, though."
11/1/2014,20141101,2,4.13,"Today I was finally able to go to the Kobbler King expecting a great experience and cobbler based on previous reviews. I placed my order then I looked on the wall, to use my credit or debit you are charging the customer 3% and minimum $11.00 purchase. This is ridiculous, you a business and you've too cheap to pay the extra charge on your ""Square Account"". This is the first turn off, and the second experience, the actual cobbler on the outside of the aluminum container was sticky. They didn't take the time to clean if off and furthermore the cobbler crust on the bottom was clearly over baked. This was my first and last time going to this business."
11/3/2014,20141103,1,4.03,"I first found out about this place several years ago during the ""Taste of Soul"" Festival.. I had the peach cobbler and it was absolutely delicious!! At the time they did not have a store front it was phone orders only. Fast forward to now, I've been craving for some lately.. I wasn't sure if they had a store front by now, so I looked them up to see if they had a website.. Found the website and judging from the website, It wasn't really absolutely clear if they did or not. Now keep in mind, my first experience with them was that they only took phone orders. If I'm on the web page and If the options are HOME, ABOUT KOBBLER KING, ONLINE ORDERING, BLOG, MEDIA, CATERING, EVENTS, FAQ, and CONTACT.. What would you think?!?!? I did find the contact part which shows the hours of operations, but that was still ambiguous to me.. Sooo I called and a man answered the phone, I asked him if they had a store front, he replied in a cocky tone of voice, ""Taaaa (huffing and puffing) only for such and such amount of years, yes we do""!!! I'm like okay, I laughed it off, but boy, I felt some sort of way, maybe a little ignorant that I didn't know this (smirk)! But honestly, I live ions away from LA and I don't get down there very much anymore, so I'm not in the know about the popular food places down there.. But any who, I take my cobbler craving self down there with jet fuel on my fired up feet, because I'm like this guy was cocky like ""Girl we have the best cobbler in the world and you betta recognize who we are"" type of attitude!! I get there and go to the counter which is the display case.. There was only peach cobblers with a nut type of topping and some other type of cobblers that were not peach.. So I ask the guy, ""Do you guys have peach cobblers with out nuts on top""? He answers with a cocky azz response (and instantly I knew, this was the guy I talked to on the phone), ""Taaaa huhhh yeah, we sell cobblers, we have more in the back...""!!! I kinda cut him off like ""Well, I wasn't sure, because this is all you have in your display case and this is my first time here""!! He cuts ME off and says while shaking his head and huffing and puffing with an attitude, ""Now come on now, you know we have regular cobblers""!! I saw where that was going, so rather than argue the point that he could have just said, ""Yes Ma'am we have some in the back, how many do you want?"", I just smiled and thought to myself WOWWW, really??!? Whatever, just shake it off and yelp later!! I tell him I'll take one peach, I get it and it looks dry, but I remember it being so dang ol' lawd have mercy good, so I didn't think much of it.. I get to my car, and crack this dry looking peach cobbler open and it was just as dry as it looked!! The taste was extremely below mediocre!! Hardly any peach juice, and a bunch of dry crust. Kind of reminded me of the those knock off turn over Hostess store brand pies they use to sell in the grocery stores.. They were 2 for a dollar!! All of this attitude and cockiness for this cobbler to be this bad was beyond me! Now I grew up knowing that some minority business' are known to have good food but with a side of attitude but, you still keep coming back because the taste out ways the attitude, but this was ridiculous!! All of that cockiness and it was one of the worst I've ever tried, get a grip!!"
4/5/2015,20150405,5,4.06,"Well cobbler is not my favorite dessert, but I may have to reassess that. The peach cobbler, apple cobbler, lemon icebox pie and lemon bars were just what the doctor ordered. I had everyone of those inside of 24 hours! I know, it seems excessive, but I had to try them all in order to determine the best. .from the rest! The best ---meaning the best in the business of cobblers and lemon icebox pies is the Kobbler King! Long live the King!"
3/14/2016,20160314,5,4.09,"""Wow"" is all I can write to begin with. I really wanted to avoid eating the cobbler because after many let downs I did not want to be hurt again...Pros: The Peach Cobbler is beyond good. It reminded me of when my Mother was still here raiding the neighbors tree for peaches that were too done to eat but just right to bake or can. I would suggest warming the cobbler up but it is still great cold for Summer days. Parking is fairly easy and the portion sizes are good.Cons: None.Will go back..."
6/4/2016,20160604,5,4.12,"Omg the pecan crusted peach cobbler is something out of a sweet dream. Not being big on sweets and having a major craving for smthg sweet I looked up the best dessert places in mid-city and the king appeared..... I was pleasantly surprised by the infectious aroma of nutmeg, cinnamon and all the other stuff that goes into cobbler, lol..... Anyhoo the guy who helped me was friendly and kind and joked about how the cobbler was so good that I wouldn't want to share with my Dad, and he was right that's why I got my Dad the Blackberry cobbler and I kept my peachwhich was awesome saucesome"
7/10/2016,20160710,2,4.06,"I went to Kobbler King one afternoon for a treat. Upon entering I wasn't greeted with kindness, but more of a suspicion and distrust. I ignored the vibe because the cobbler is quite good. The owner, a young black man, asked what I wanted and I told him one small cobbler. He then told me I could get two for a discounted price, to which I replied ""No thanks, I just want one."" He then frowned and said in disgust to where I could plainly hear ""niggas"". He disrespected me, my people, his people, and his business. Never went back and caution anyone thinking they have the right to get exactly what they want. You're being judged."
7/24/2016,20160724,5,4.08,"I stay in the high desert (Victorville) California and I just intended a lobster festival in San Pedro and purchased a sweet potato pie and a peach cobbler with ""free"" ice cream. I must say this is not one of the best damn pies I've ever had in my life! when I'm down there I will for surely go pick me up a sweet potato pie they were very amazing thank you. Hope to see u at the taste of soul."
7/25/2016,20160725,1,4.0,"Purchased a 14.00$ peach cobbler at the R&B festival it was extremely dry not a drop of juice in it and the sides were burnt. We try to support our people, but quality control needs to be better."
9/15/2016,20160915,5,4.03,"Growing up in he Midwest, I've had some amazing cobbler. But I've struggled to find really great cobbler in Los Angeles. Well, my searching has come to an end. Walking around the neighborhood, I saw a sign for ""The Kobbler King"" and became immediately filled with fear that it was a shoe repair shop. It was not.I got a small blackberry cobbler and it was fantastic. The fruit tasted fresh, the crust was perfect and the entire thing was very juicy. As a ""thank you"", I purchased a peach cobbler for my neighbor, who has lived in the area for thirty-years. When I gave it to him, his eyes lit up and he said, ""I LOVE this place!""They serve a variety of other deserts and I am sure that I will be back to try other things but for right now, I will continue to order their amazing cobbler."
10/7/2016,20161007,4,4.03,We saw this place when driving by and decided to stop. I am so happy that we did because their peach cobbler and banana pudding were perfectly on point!! I am in love with this place.
10/22/2016,20161022,1,3.95,"It was the worst cobbler we've tasted--just because they say 'made fresh', doesn't mean it's made 'GOOD'."
11/2/2016,20161102,4,3.95,"Most amazing Sweet Potato Pie ever made!!! I had the privilege of meeting the woman who's recipe makes so many people happy, at Lobster Festival. She's as sweet as her pie. Thank you for sharing your talent with the world."
1/1/2017,20170101,1,3.88,"We Purchased a Large Peach Cobbler for our New Year feast ( ""Mommie Helen's"" was not at the Baldwin hills mall, perhaps rain delay) It was the one of the driest cobblers I'd ever had! The Crust was thick & mishapen, as if it was the leftover bits of pie dough. But, we tried it anyway ( sometimes Ugly in the Outside is Good on the inside..NOPE!Hardly any juice & peaches! I love a good Crust, but this was crust was crumbly! I had Cobbler from here years ago & had good Cobbler. This Pie was hastily put together with bits & pieces to make a sale! Back to Mommie Helen's!"
1/24/2017,20170124,1,3.81,"I've bought a small peach cobbler from Albertsons market, when ask why cheaper at the market I was told because it was smaller in size which was not true. Also I bought a Monkey bread for $12. It was horrible. Was not fresh tasting and dough was hard and dense, not lite, moist and butter as Monkey bread should be. My family called it Gorilla bread. I did find good Monkey bread at Heavenly bakery on Vernon Ave."
1/25/2017,20170125,1,3.75,Went in to try this place out first off the guy won't get off the phone to take my order. I ask him for the $6 peach cobbler while still on phone points me out to the sign outside that says $9.99 I'm thinking ok so it's 9.99 instead of 6. So he gets behind counter and is signaling me what did I want I let him know when he's finished on phone. I decided to try a different black owned business because this is ridiculous. Service was horrible. Won't be back.
1/26/2017,20170126,5,3.78,I love this place. I've been coming here for a few years and the desserts never disappoint -sweet potato pie is excellent as are the blackberry and peach cobblers. I've taken the large trays to big family functions and got great feedback on how good and fresh the cobblers tasted.
