date,converted_date,rating,average,review
7/9/2017,20170709,5,5.0,"Great little breakfast nook right next to 2 other good places to hang. So I've got mornings and evenings covered!They are just opening up but the new owners have put a lot of work into the place and I love it! Their waffles are fresh crispy and TASTY served with REAL maple syrup! My friend had bagel & lox and that is the next item I will try. Being a native NY foodie, I know it's really hard to find supreme bagel & lox here in LA..Meanwhile, the other priority for my morning: the coffee is great and can easily be a daily pleasure! Will relegate my Keurig to days I am too lazy to go out..Really happy to see this new place in the neighborhood :)The menu selections they are talking about sound interesting and try all of them. Little businesses like this need our support to compete with the artificial flavored overpriced mega corps offerings and I will be a regular here ! Two Thumbs Up!"
7/14/2017,20170714,5,5.0,"Remember Muse on 8th? Remember thinking, it's great that there's a quaint little local coffee spot in chain-heavy Mid-Wilshire, but I wish this place had more charm and character? Look no further than Met Her At A Bar. This place is everything Muse should have been. The new owners, first of all, are a charming young couple who could not have been friendlier on my first visit. They came in and jazzed the old place up from top to bottom. Gone is the outdated, incoherent, dirty vibe from before and in its place is a clean new look that is trendy but with plenty of rustic charm. The owners relocated the front door to its rightful place on the building corner, and have opened up the storefront windows to really let in the sunshine. The color palette inside is natural and muted to balance things out, with pops of color from the condiment table to the pastel yellow espresso machine next to the register. Muse's open kitchen is retained, but looks more enclosed and separated now without making the space feel claustrophobic. Ivy runs along the wooden ceiling beams. Books of all sizes and topics are stacked on communal work tables and window-facing bar seating. The upright piano from before is still here!Part of the selling point is the house-made Belgian waffles they offer. I ordered a coffee to go, and the owners were kind enough to give me a small golden brown waffle to try out. Perfectly garnished with a dash of powdered sugar, the waffle was crispy on the outside, fluffy on the inside - absolutely delicious. The size of the kitchen space leads me to believe that they have many food items available, but I didn't have time to look at a menu and they haven't put one up behind the coffee bar just yet. Which leads me to say...The place is, of course, brand new, and the owners acknowledged that they're still getting it fixed up. Even so, Met Her At A Bar is already a bright spot in the neighborhood, in many ways that its predecessor should have been. So if you live in this area, or frequent it for work, and you're looking for an alternative to Starbucks/The Coffee Bean--go visit Met Her At A Bar. It checks all the boxes of a perfect, locally owned business that deserves patronage."
7/20/2017,20170720,5,5.0,"Love this new neighborhood coffee shop, the coffee is great, the service amazing and the decor so nice and clean!Super excited for a place like this. P. S. They also have a good and healthy food menu"
7/22/2017,20170722,2,4.25,"Well not off to a good start. Take the two star rating with a little grain of salt, but it says they are open until 3 so we walked over only to learn the chef was leaving at 1:45 and they could only make a few of the waffle menu items and nothing else. Will come back to update my review once I get to actually try the food. The ambiance seemed nice though."
7/22/2017,20170722,2,3.8,"Well not off to a good start. Take the two star rating with a little grain of salt, but it says they are open until 3 so we walked over only to learn the chef was leaving at 1:45 and they could only make a few of the waffle menu items and nothing else. Will come back to update my review once I get to actually try the food. The ambiance seemed nice though."
7/22/2017,20170722,5,4.0,Cute! Great iced coffee. I really like what the owners have done with this place. It's well decorated and put together. You can tell the owners really care. They got a really good air conditioning system which is such a relief.I'm so excited to have this place open in the neighborhood. They are a welcome addition. They had a soft opening and had plenty of people to service and I thought all was running really smooth.
7/22/2017,20170722,5,4.14,Very cool new place and the coffee is great. They have these glorious large Belgian waffles and the maple syrup is unbelievable. The place looks good and feels clean. They did a great job setting this place up. Can't wait to come back and chill with a cup of that delicious coffee. Calm and perfect for a little mid day reset.#realla#buylocal
7/23/2017,20170723,5,4.25,"Definitely a great place for Breakfast and Lunch. The staff here are the nicest and friendliest. Everything on the menu sounds delicious, it was a difficult decision, but ultimately decided on some Eggs Benedict which were amazing. Can't leave here till you have some of their waffles."
7/30/2017,20170730,5,4.33,Cute little brunch spot. Cold brew was on point. Ordered the Wake up Happy and my friend ordered the Waffle with Berries. Food was great! Nice portion sizes and the staff was so friendly. Only downside is parking but that's pretty standard for the area. Will definitely return!
7/30/2017,20170730,5,4.4,"Went on soft opening weekend, and I'm definitely impressed. Super cute menu.  Ordered the lox and cream cheese bagel which was absolutely perfect. My girlfriend ordered the waffles, eggs, sausage and bacon....everything was great, but those waffles!!!! So light and crispy, with the perfect amount of (real) maple syrup. She said it was the best waffle she's ever had. The coffee was LaColombe, and it was NOICE!"
8/2/2017,20170802,5,4.45,"People work there so nice, service was amazing, the food mmmmm can't say more It's a place you must try if visiting LA, try the cold coffee it's a heart breaking coffee & the waffles just amazing"
8/4/2017,20170804,5,4.5,"I love Met Her at a Bar! This is for sure my new go to local coffee shop in Mid-Wilshire. I've already been four times since their soft opening. The food is excellent, really light waffles and fresh ingredients. The owners and staff are super friendly and thoughtful too, which makes the experience so much better. They did a wonderful job decorating, the place has a great environment, which makes it ideal to get some work done (brownie points!). The place has been very busy since day one, which tells you a lot!"
8/5/2017,20170805,1,4.23,"In almost the best sense of irony, Met Her At A Bar is like that one girl you meet at a bar. Cute esthetic, but an absolute train wreck. Save the morning after walk of shame and pass on this and stay at home instead. My partner is vegetarian but the cashier wouldn't change the eggs Benedict to eggs Florentine when politely asked. In retrospect, they really weren't worth it. My other friend, who got the eggs Benedict, was presented with cold cut ham with basically a hard boiled egg on top- a cardinal sin in the LA brunch scene. I got the breakfast sandwich and again, kinda fitting with the horrible decisions we all make after meeting someone at the bar, I immediately regretted it. It resembled something I would make hungover if I only had one piece of bacon, two eggs and a forgotten frozen eggo waffle permafrosted to the side of the freezer. I will speak positively to the cold-brew. Nice tones and not watery. This place will be closed within two months, but don't worry it's not worth the drive even if you live across the street"
8/5/2017,20170805,2,4.07,"I really wanted this to be a picturesque Los Angeles brunch, but I was sorely disappointed at the customer service, quality of food, and overall lack of consideration for our dining experience.I brought my prima from out of town and wanted to try some place new, and as soon as we got up to the register I regretted it: the cashier was contrite and rude to us, our meals (three of us) were staggered so badly that there was no way to eat together, and the food was mediocre at its best.Sure, I understand missteps because of openings, but uncooked/raw bottoms on quiches (that I waited an additional 15 minutes for), overcooked eggs on a Benedict, and hardly a strip of bacon in a bacon/egg sandwich is not up to par.I'm sure there are nice people that work there, and that the place could improve--but that first interaction with the cashier set the tone for the entire meal: unpleasant and disappointing. I wish I could say different, but sometimes a bar isn't always the best place to meet."
8/5/2017,20170805,5,4.13,This is the best Eggs Benedict I've had in town. I don't know what Chris S is ranting about. You must also try their strawberry waffles and peanut butter granola
8/6/2017,20170806,5,4.19,"First, to the people that left the low star reviews: I'm not sure if we dined at the same restaurant. I absolutely loved this new neighborhood joint! The interior is very well decorated and the food was just as good. Even after reading the poor reviews, we still decided to give this place a shot since it's within walking distance from my apartment. I'm so glad we did bc it's now my new favorite place to go for rice bowls. I got the Met Her Rice Bowl and he got the eggs Benedict but on a waffle. It was super delicious, fresh ingredients, and great plating presentation. I will definitely come back and hope to bring more of my blogger friends here as well bc it's super charming."
8/6/2017,20170806,5,4.24,"This place rocks. The food is great and they made a crazy good waffle benedict! Who knew these would ever be so good! Service was great and the staff is super friendly.What was ordered: waffle benedict - woah. Super good. The hollandaise sauce is excellent. The waffle is perfect, the eggs were poached well and the greens in the side were just as good as the rest.Met Her Rice bowl - perfect portion size. He ingredients were all high quality, the mushrooms tasted great and the avocado adds a great creamy texture to the bowl.Iced americano - solidI'm going to be torn the next time I come here because I won't know if I want to explore the rest of the menu or stick to what I already know is awesome!"
8/6/2017,20170806,4,4.22,Soooo cute inside and The staff is so nice!! We got the waffle breakfast sandwiches. I loved it!!! Parking was easy to find on the street on a Sunday morning. We got here around 9:30 and it wasn't busy at all but started getting busier around 10/10:30.
8/9/2017,20170809,4,4.21,"I can only review the coffee, service and ambiance - we did not eat anything.We walked in and the setting is cute. You can tell they put effort into. The kitchen is open and right behind where you order so it can get noise-y and a little fragrant while you are sitting at your table.I'm a real stickler for good coffee. I ordered an iced almond milk latte and it was fantastic. I love the glasses they put them in (like wine glasses without the stem).I ended up getting another because it was so smooth. Service was nice. They are working out kinks still, but no reason for worry here.I live in Burbank, so I don't see myself making the drive to get here, but if I am in the area and need a place to meet someone, this is as good an option as any."
8/12/2017,20170812,5,4.25,"First time here and surely won't be the last one! Great food, great service, great presentation!! Loved everything, thank you!!!"
8/12/2017,20170812,5,4.29,"Here's a story for you ""A Guy Walks Into A Bar"" and meets a girl and opens a restaurant on La Brea and 8th. Future husband and wife open a new breakfast/brunch/lunch establishment - no pressure there, lol. Creative names on the menu ""wake me up happy"", lead to great food and service with unique dining experience. Enjoy!"
8/13/2017,20170813,4,4.27,"Cute Brunch Spot with Lots of PotentialThe Wilshire/Miracle Mile area doesn't have a whole lot of trendy brunch places IMO, so Met Her At a Bar is a welcome addition to the area. The interior is pretty cool and has a nature loft/outdoor terrace kind of vibe, even though everything is indoors. In terms of the food, waffles are their go to specialties and they have an excellent array of options here. I ordered the Turkey Waffle Sandwich and it was pretty stellar. A tasty combination of flavors with a nice siracha kick. Nom nom nom. I also ordered their chai latte which was also extremely well done. When I came here, the place had literally only been open for less than 2 weeks so I think they were still ironing out a lot of their kinks, specifically when it comes to order work flow. They didn't mess up my order or anything, I think it just took them some time, but this is an issue that most new restaurants face so I don't knock them for this whatsoever, especially since the employees were very friendly and apologetic about everything. My only slight gripe with this place is the hours. As of right now, they're only open 8am - 3pm every day. This can be a bit limiting since I feel like the brunch crowd doesn't usually show up until like 11am or 12pm. Maybe they will expand their hours once the place is on more firm footing? I could also see myself coming here and just plopping down and working on my laptop, but doing that might be hard to do with their current hours... Regardless, Met Her At A Bar has amazing food and beverages so it's definitely worth trying and supporting!"
8/13/2017,20170813,5,4.3,"I'm super picky with the spots I love and I LOVE this place! It's my second time here in 2 weeks, and the service, atmosphere & food is consistently on point! I ordered the overnight oats with berries & chia seeds, a flat white () and avocado toast the 2nd time.Each time we've been here the owner came by the table to ask if everything was good, & you can just feel how much they care about every customer & every plate of food that goes out. In a city were people are just wanting your business, Met Her At A Bar is so much more than that. We will be back!"
8/18/2017,20170818,5,4.33,"I ordered a power chai latte, a breakfast sandwich, and the strawberry ricotta toast. My bestie ordered a black bean wrap and the cold brew. Everything we ordered was AMAZING and I'll be coming back very soon. The owners are super personable and actually met at a bar! I love the concept of this place. Super casual and lowkey. Definitely somewhere to meet someone you've never met, someone you're acquainted with, or someone you know!"
8/19/2017,20170819,4,4.32,I passed by this place out of curiosity on my walk and the photographs attracted me.. the ambiance is comfy and inviting . It has an open and airy feeling.The coffee is fantastic! I did not have the waffles but after looking at their menu it is clear to see that is what they are known for ! When I am in the mood for a sinful treat I will go back and have them . I opted for a simple to the point chicken salad with arugula and it was good. Order at the counter and they bring your food for you . The owners and the staff are all pleasant. Will I go back? Absolutely
8/21/2017,20170821,5,4.35,"Came here this past Saturday with my girlfriend and we both loved it. Had the Avocado Toast and Berry Waffle along with an iced mocha and orange juice. I can't speak to the previous reviews of the poor service, but it seems like they got their act together. Even had employees check on us a few times after we got our food. It is a bit on the pricier side, but everything was great so it's hard to complain. Will definitely be back since it is in walking distance."
8/24/2017,20170824,5,4.37,"Came here on Tuesday before heading to a meeting down the street and fell in love. The owners have done such a great job at decorating the space. The register/coffee bar is so cute, the space is extremely cozy and the service was great. They just opened and are still trying to work out some quirks but the waffles were great (honestly every waffle item they had sounded great) and their coffee was better than other I've had recently. Will definitely be back to try the other waffle sandwiches! Really hope this place will make it. It's just what La Brea needed! PS- the owners are extremely sweet. Made everything that much better."
8/26/2017,20170826,5,4.39,"First visit, excellent service and food. The presentation was outstanding. It was very busy on the Saturday I came but as long as the wait seemed and worth it. La Colombe drip coffee was on point, I highly recommend this place. Hands down better than the place it replaced."
8/27/2017,20170827,5,4.41,"Been here twice now and both times the food has been great. The breakfast burrito really knocked my socks off! Only downside: it can be difficult to find an open spot to sit for weekend brunch. Looks like some early negative reviews must have been before they hit their stride, because I've had nothing but positive experiences so far. Really glad to have an upscale but still casual place like this in the neighborhood!"
8/28/2017,20170828,3,4.37,"A typical petite-sized, fancy brunch place in LA with cute decor with wooden theme and greeneries inside the store. Parking was such a hassle around this area, we had to park 2 blocks away from the place and since there was a lot of constructions these days on Wilshire, traffic was also bad. We got lucky because we immediately got a long table for the 7 of us. After we ordered, the place got super crowded and the line was long. We shared 4 dishes between us: waffle benedict, strawberry ricotta toast, bagel & lox, and waffle with berries. The food was presented very beautifully, excellent details on the aesthetic, but there were some problems with the taste and texture.The poached eggs on the waffle benedict were too overcooked, which were basic failures for eggs benedict. The strawberry ricotta toast was also a bummer for me, I didn't like the ricotta spread on the toast, the combo just didn't work. The only thing that satisfied me was the bagel&lox. My bro also got the espresso and he had some trouble with the beans not filtered properly. I might not recommend this place to my friends because there are other great brunch places around that area."
9/2/2017,20170902,2,4.29,"This place reminded me of Alien: Covenant. The crew of the colony ship Covenant, bound for a remote planet on the far side of the galaxy, discovers what they think is an uncharted paradise, but is actually a dark, dangerous world. When they uncover a threat beyond their imagination, they must attempt a harrowing escapeI had just picked up my friend from the airport and we were on our way to a tried and true brunch spot when we came across the waffle sign. Looked at pictures on yelp and it looked inviting. Here's what was ordered...1) Liege Waffle, $3... It was okay. Tasted like the packaged variety sold in Costco.2) Americano, $3... Despite using good quality La Colombe beans, the coffee tasted dirty. 3) Breakfast Sandwich, $10... I don't have enough time to describe how insulting this sandwich was. The bread was dry, no butter, no spread of any kind. On top of that, it wasn't toasted right. Soggy and chewy... Frozen? The scrambled egg was terrible on all counts. Over cooked and rubbery with some melted cheese that added no flavor. The arugula was partially wilted and mostly fell out because there was nothing holding it together. Lastly, the avocado that was mentioned as an ingredient was hiding out as a sliver on the edge of the bread. Closing comments... $20 later, what looked like a very promising new find was actually such a disappointment that I could never recommend anyone coming here. The food has the execution of a bus stop restaurant stuck in the 90s."
9/2/2017,20170902,5,4.31,"Great addition to the neighborhood. Met Her at a Bar is cool , hip and well.. darn good! So far we have enjoyed their eggs benedict and the waffles. Their espresso drinks are tasty and just right. The owners have really upgraded the spot from the previous Muse cafe - which is a huge improvement. Weekday mornings are pretty chill as you can see in my photo but weekends and mid-day it gets busy. We will most definitely be back soon."
9/6/2017,20170906,5,4.33,I ABSOLUTELY LOVE this place. Stopped by today for the first time after dropping off artwork at Liz's gallery. The capers/lox/cream cheese/waffle dish was sooo delicious. Just a wonderful blend of flavors that works super well.
9/13/2017,20170913,5,4.35,Needed to have breakfast before going to the Argentine Consultant nearby. Staff was friendly and the food was great. I had the breakfast sandwich and my son had the waffle sandwich. Savory. The best part is they serve La Columbe coffee. Definitely worth the visit. Interior and atmosphere is cool.
9/14/2017,20170914,4,4.34,"The last reviews I read for this place seem oddly off especially the Alien Covenant person...that was just weird, BUT good hook to your review, it kept me reading. I actually really didn't want to come here. By looking on the outside, it just appeared too simple, but I was pleasantly surprised! The inside is real cool. The wooden tables, leather booths, the light fixtures, it's all pretty cool. The tables are set up so you can come as small group, large groups, or sit communally and make some new friends. The staff is real friendly and welcoming. They're excited to be here and you can tell they enjoy what they do. The menu in terms of quantity is perfect for a breakfast/brunch place. You're not overwhelmed by what to choose and the items are described in a way that make you want to come back to try something new. The espresso is amazing. Didn't catch what kind of bean is used but it's smooth and very enjoyable. I came with a roommate and we have tried the following:Chorizo Burrito: (g/f) The flavor is this was really nice. It wasn't super spicy and surprisingly it tasted a little sweet to me. The potatoes could have been crispier but it didn't take away from the overall enjoyability of the meal. The avocado was fresh and the tortilla was heated just right. The side mixed green was also fresh.The Power Bowl: (v) please get this at least once. It's amazing! I was really surprised by this. I wanted to ""be healthy"" and thought this was going to bore me and leave me hungry but it did not. The flavor of this is amazing and I think it's pretty simple. The dressing for the salad is a nice tangy flavor. The quinoa was cooked perfectly. The poached eggs were a little runny for my taste BUT they were poached eggs. The cranberries and sliced almonds, YUM x1000. This tasted like it should have been bad to eat, but it wasn't. The Wake Up Waffle: two waffles, eggs, bacon, and sausage. This is good to share. The waffles, the whipped butter, and the syrup was all delicious. The eggs were scrambled fine. Unfortunately, I did not enjoy the bacon or sausage. The bacon was burnt, not crispy and the sausage I think was breaded and deep fried...too much. That's the only reason there are 4 stars."
9/18/2017,20170918,5,4.36,"So great to see this cute new casual breakfast/lunch place in the neighborhood. I had the waffle and lox, which is not a combination I would have thought of, but it was delicious. My partner got the Wake Up Happy with crispy waffles and a skillet of eggs, bacon and sausage. Delish! Unfortunately both dishes looked so good that we attacked the food before we thought to take any pics!"
9/21/2017,20170921,5,4.38,"My daughter and I were excited to see this restaurant emerge from the ashes of the vegan establishment that preceded it. Sure, they had their hipster poetry readings. But it never had that intangible quality of warmth, a place you want to stay for a while, that feels like home.That is what embraces you the moment you walk inside this new restaurant. Two young owners who are bravely taking on a new adventure and welcoming you to stay awhile. My daughter and her middle school friends see it as a rite of passage, too. They get to walk here on their own and order coffee drinks and fancy waffles and post it on their Snapchats. I went there with my babe when it first opened. Some neighbors had also walked in. We looked at each other knowingly and full of grace as it was the soft opening, and they were obviously figuring things out. The chef was reading from a recipe guide. I went back the other day with my baby girl and enjoyed a fluffy waffle artfully complimented with the right amount of Nutella, strawberries and bananas. My appetite is such that I can hardly finish anything I ever order, but I scarfed this down. It was perfectly crispy on the outside and tender and airy on the inside, made by one of the owners. They are looking for all kinds of new employees according to the sign on the door. These reviews need to all take a deep breath.Because, I don't understand reviews that put down these waffles. What planet are you from? Or are you from a competing restaurant? Leave these kids alone."
10/2/2017,20171002,5,4.39,Very cute spot to go have a brunch date with my girlfriend their presentation for their waffles is hands-down beautiful down to the little flower they add . Customer service is spot on . They are attentive . Thank you so much !
