date,converted_date,rating,average,review
2/26/2019,20190226,5,4.5,"First time there! I saw it the other day whilst at another restaurant in the area and totally thought it was a bar. When a friend suggested we meet here for coffee I looked it up and saw how amazing the food looked and couldn't wait. Got the avocado toast and some matcha tea today, which made for a delightful breakfast; but I will definitely be back to try some waffle goodness. Also that Crispy French Toast??? Sounds AMAZING. Everything on the menu looks delicious, so need to be back to try more! Staff is super friendly, too."
2/28/2019,20190228,3,4.5,"This place was pretty packed when we went (Saturday afternoon). The seating is quite limited and it definitely has more of a ""stuffy"", crammed vibe. I had the Eggs Florentine which were nothing outstanding. They didn't have that homemade taste to me for some reason -- perhaps the hollandaise sauce...Anyway, this was a place I had been meaning to try, so I am happy to cross it off my list. I don't think I would return as I found it barely satisfactory. It's worth a shot though... you never know, you could order something better than what I ordered ;)"
2/28/2019,20190228,5,4.5,"Visiting from out of town for my bachelorette, got here around 10:30 before the brunch crowd. You order at the counter and it's open seating. We ordered the waffle + lox, wafflebello sandwich, chipotle chicken wrap, flintstone waffle, and the crispy French toast. Everything came out so quick! The owner highly recommended the chicken and waffles, it looked delicious but we didn't have enough room in our stomachs to try it. Everything tasted so fresh and good. I'll definitely make my way back here!"
2/28/2019,20190228,5,4.5,"Me and my friends were visiting from New York and we had been trying different breakfast spots, so far this was the BEST one. The food is amazing and the service is really good I love how they surprised us with a complementary dessert! It was so sweet from them. Deff will be back next time we're in LA!"
2/28/2019,20190228,5,4.5,"Visiting from out of town for my bachelorette, got here around 10:30 before the brunch crowd. You order at the counter and it's open seating. We ordered the waffle + lox, wafflebello sandwich, chipotle chicken wrap, flintstone waffle, and the crispy French toast. Everything came out so quick! The owner highly recommended the chicken and waffles, it looked delicious but we didn't have enough room in our stomachs to try it. Everything tasted so fresh and good. I'll definitely make my way back here!"
2/28/2019,20190228,3,4.5,"This place was pretty packed when we went (Saturday afternoon). The seating is quite limited and it definitely has more of a ""stuffy"", crammed vibe. I had the Eggs Florentine which were nothing outstanding. They didn't have that homemade taste to me for some reason -- perhaps the hollandaise sauce...Anyway, this was a place I had been meaning to try, so I am happy to cross it off my list. I don't think I would return as I found it barely satisfactory. It's worth a shot though... you never know, you could order something better than what I ordered ;)"
3/2/2019,20190302,5,4.5,"The bacon was incredible and the eggs were creamy. The Halo tea is my favorite by far as well as a big fan of floral teas, I'm pretty particular."
3/3/2019,20190303,5,4.5,"Absolutely love this place- came here with my girlfriend and her mom and the staff was so hospitable. The food was delicious, presented well and quickly and they even gave us a dessert on the house. We enjoyed our meal outdoors and though not the most scenic location, was still an enjoyable nonetheless. It is a bit pricey but worth every penny."
3/10/2019,20190310,4,4.5,"It was my last day in LA and I noticed this place on Yelp beforehand and after passing it several times, I decided to stop in for lunch. I ordered the waffle Benedict even though I had eaten waffles the previous day. How often is it that you go to a restaurant where u can sub out the muffin for a waffle?! Never. I'm a big eggs benny fan, but something about this hollandaise rubbed me the wrong way. The spice-to-egg ratio was not well suited for this dish. It might be someone's cup of tea, but I did not care for it. I wanted so badly to enjoy my food because this place was very cute and the entire staff was extremely nice. I wouldn't be opposed to coming back and trying something new just because I enjoyed my experience so much. I'm sure they have some really enjoyable things that I never got to try. Kudos to this place :)"
3/10/2019,20190310,5,4.5,"Really cute place to eat! The service was fast even though it looked busy! The servers were super nice and very attentive. I ordered the Huevos Rancheros and a latte, everything tasted great! Definitely will come back!"
3/11/2019,20190311,5,4.5,This place is just amazing! This was my second time and it didn't disappointed! Food is just amazing and the atmosphere is just perfect. You can definitely feel that this place is run with passion and love for people and food! My new favorite spot in LA!
3/12/2019,20190312,4,4.5,"Met Her At A Bar's signage always caught my eye when driving by and it's nice that the couple has a cute back story to meeting and opening the restaurant! The restaurant has a quaint neighborhood feel, nested in the Miracle Mile neighborhood. We came at 10 am on a Sunday and got seated in under 10 mins and the food came out in record time. I got the crispy french toast, it had corn flakes, this is the first time I've had it with big pieces of corn flakes rather than it ground up. The french toast was good but way too sweet to finish, it had nutella, whipped cream, fresh berries, and edible flowers on top with maple syrup. I would've gotten it without the nutella next time. Street parking on the residential streets was very easy and a short walk to the restaurant."
3/13/2019,20190313,5,4.5,"Delicious, innovative breakfast items and yummy espresso drinks, fun ambiance, friendly and caring service staff that move quick, and cute love-story origins-- couldn't ask for much else in a brunch spot."
3/16/2019,20190316,5,4.5,"Fast, friendly, delicious, and super efficient! My kind of brunch place.My husband and I scootered here on a beautiful hot sunny day in March... speaking of which... when did it get so hot?!!!! Went from winter to summer and bypassed spring altogether. Oh SoCal. There was a small line outside around 11:45 am on a Saturday but it literally only took 5 minutes to get seated. Can't speak for parking as we scootered here. Definitely no lot. This place is cozyyyyyyyy. Ladies leave your big bags at home and fellas no backpacks whatsoever. The space is teeny tiny but they know how to jam pack the space so you're not waiting too long.We ordered the avocado toast and the crispy french toast as well as some fresh squeezed orange juice! The food came out within 5 minutes. They aren't messing around here. The avocado toast was deliciousssss and cheesy but my only qualm was that the crust was a bit hard so hard to cut through it with my arthritic hands and chew it with my teeth. The toppings though were perfect. The crispy french toast was amazing. Nutella, syrup, berries, whipped cream, crispy flakes of deliciousness. It didn't even need the syrup! So so good. Highly recommend. Juice was freshly squeezed and the small size was perfect. They servers were really friendly as well which always makes things 10x better.Go here now! :) Cant wait to come back."
3/16/2019,20190316,5,4.5,The food was absolutely amazing. The service was fast. Couldn't have asked for a better brunch! Highly recommend the White Truffle Toast!!
3/18/2019,20190318,5,4.51,"Came here for Sunday brunch with my girlfriends and we thought this place was SO CUTE. We were so afraid there would be a long wait, but luckily for us we only waited about 10 minutes. We ordered the avocado toast, strawberry ricotta toast, french toast, American breakfast and the eggs benedict. My favorite was the french toast. It was crispy and fluffy at the same time, so good. The strawberry ricotta toast was mild in flavor and the strawberry jam to top it off was not too sweet, just the way I like it. The avocado toast was heavily packed with avocado and cheese, thank you for that!! Everything came out super fast and the service was excellent. We had about 5 servers check on our table continuously throughout our meal. It was a great experience and I definitely would come back if I'm in the area."
3/18/2019,20190318,4,4.5,"Loved this little brunch spot and definitely want to come back to try other items on the menu!I came by at around 11 on a Sunday morning, and while there were a number of people waiting outside, my party of two was seated pretty quickly! They seem to be really efficient about getting people seated and getting food on the table.Service was SO friendly, and the food was great. Their brunch menu consists of classic brunch items, thai-inspired dishes, waffle creations, and coffees/teas. I ordered the Khai Jiao, a thai omelette with onions and maple sausage over rice + sriracha. The maple sausage was sweeter/more syrupy flavored than I expected, but I still enjoyed my meal overall. Last, but not least, this place is just really cute! Love the story of how this place came to be.I'll be back!!"
3/18/2019,20190318,4,4.5,"Cute place!It was very busy and I'm not a fan of the tables being so close together. It is very hard to have a conversation because it's so loud. We brunched on a Friday morning and it was pretty busy but got seating about 5 minutes later. I found metered street parking right out front. It's in kind of in a strange area. I ordered the French Toast and my friend got the chicken panini. The french toast was delicious and instagram worthy but the flowers and herbs were kind of annoying. Additionally, the waiting staff is incredibly kind and we even had a conversation with our server. Would come back but definitely during a less busy time!"
3/21/2019,20190321,5,4.5,"Amazing!!!!!! Must get avocado toast and coffee. Experience is great. The owner comes and talks to just about everyone, to see how they enjoy their food. Went with friends visiting LA - highly recommend. Will come again! And any friends visiting again - will take them here!"
3/23/2019,20190323,5,4.51,"This place was coming up a lot in my brunch searches so I decided to check it out. Came in for brunch on a Sunday and found 2 hour free parking about 2 blocks away. We went around 1pm and waited less than 30 mins for a table for 3 (not bad for LA brunch). We were seated at the bar, which was cool because we could see into the kitchen - lots of creative items! I would say this is definitely a place for smaller groups, anything more than 3 might be pushing it on the seating. We were on the corner so it was easy to converse but it might not have been good with 4. There are some tables and a little outside seating as well.I ordered the waffle Benedict because it was unique and recommended. It was cooked perfectly and delicious! Nice twist to have waffles instead of an English muffin. Came with a side of potatoes which were very well seasoned. I also had the cold brew coffee which was a great energizer and well-brewed. Service was also fast and very attentive. Overall, I had a great experience here - good food and adorable interior. I'd definitely recommend it."
3/23/2019,20190323,3,4.5,"Great coffee, cozy atmosphere, but a bit too overpriced for the crowded space and food. Close to becoming too instagram-pretty and hype."
3/24/2019,20190324,5,4.5,"Oh mah gawd!!!!!!! Soooo first of all, everything here DELISH! We lucked up and only had a 13 minute wait on a Sunday morning for 2. Josette (sp?) was our server. It was our first time and she welcomed us whole heartedly! She was patient with us as we decided what to order, and offered suggestions that we might try. We both went with the chicken and waffles, and I added the farmer's market berries (which were superb, btw). Okay, so it was freakish how fast our food came out that even our server was shocked! Apparently the chicken and waffles is the #1 selling item so it's always primed and ready to go. The place is small, busy, but worth every single thing!!! Whenever I'm in town then I'll be sure to pop in for deliciousness. Nom nom nom!!!!"
3/25/2019,20190325,5,4.5,"A cafe based on the concept behind of the owners' love story and how they met! Very hipster and trendy looking on the inside... what you'd expect to see in LA :) When we arrived around 11:00am on Saturday, we felt intimidated of the 6 parties ahead of us on the self service waitlist but we were pleasantly surprised with a quick wait and got in about 10 minutes.I got the breakfast sandwich and it was so good, the bun was a little oily but I can imagine how it could hit the spot for someone hung over. The customer service was excellent, everyone was super friendly! Bonus.. they have cold brew. Only thing to note is it is really small in there and we were so closely seated to the couple next to us... I could hear their entire conversation!Would definitely recommend this place for breakfast for anyone staying in Hollywood."
3/25/2019,20190325,5,4.51,"Really good food .. great service , and pretty inexpensive .. first time here , will be back .. great neighborhood local place .."
3/28/2019,20190328,4,4.5,It's a small little place but the food here is amazing. I do believe this place is crazy busy during weekends so try to go during weekdays. Extremely friendly staff. For parking it is only street parking so be ready to spend some money on parking and time
3/31/2019,20190331,5,4.51,"Super fast, cool atmosphere, pretty and very yum! Nice service Def coming back again"
3/31/2019,20190331,5,4.51,"Super fast, cool atmosphere, pretty and very yum! Nice service Def coming back again"
3/31/2019,20190331,5,4.51,"This restaurant was lovely to say the least. My friend and I came in for a late lunch, and the staff was so kind to us. The owner in addition to three other people asked if we had been helped while sitting on the patio with my dog. Suggestions were made and it was clear that the staff believed in the food by the way they detailed it. I had the fried chicken and waffles which was quite truly the most delicious piece of friend chicken I had ever had. My friend had a wonderful avocado toast. The table next to us had truffle fries whose smell wafted over. They also had a Nutella waffle that looked delicious. I do wish the hibiscus coolers came with refills, and the waffles were yummy but cold. That is my only issue and barely a detail. This is my first review as I am sometimes compelled to write bad reviews-- but never have. I have NEVER loved a restaurant so much that I wanted to write a positive review props to the owners. Maybe it's their beautiful story and kind gesture that makes the place so great!"
3/31/2019,20190331,4,4.51,"Overall good experience! I took one star off because of two reasons. First reason being they don't take reservations and don't seat you unless your whole party is here. Second reason was the price for their Waffletella. I love waffles with strawberries so I got that. However, $13 in my opinion is too expensive for one piece of waffle and some thin slices of bananas and berries l. The home made lemonade was great, love they make it free refill!"
4/1/2019,20190401,4,4.51,I got to know about met her at a bar through a coworker because he brought their toasts for our Friday breakfast and it was sooooo good. I wanted to bring my friend here since she was visiting from norcal. We came here on a Saturday around 10am and there were a lot of people waiting in line. I dropped off my friend so she can get seated first and went on a quest to find parking (it's so hard!!) my advice for parking is go into the residential neighborhood there was a good amount of parking a block or 2 away. (if you're coming from Wilshire take a left from the street met her at a bar is in) My friend got the waffle sandwich (vegetarian) and I got their met her burrito. The burrito was underwhelming. Wasn't super great but it wasn't bad either. My friend said her sandwich was very flavorful. It was a little confusing because there was waffles (as the breads) and syrup to compliment it but the insides of the sandwich were savory. Honestly I think I would only come here for the toasts tho! The toasts were way better than our meals. They have 4 choices and 2 of them are vegetarian. We got the avocado toast and strawberry ricotta toasts (amazing) they cost $13 & $9 but honestly I think every bite was worth it. I left some of my burrito but I couldn't get enough of the toast!! Would come back just to eat the other 2 toasts I couldn't eat this time
4/1/2019,20190401,4,4.5,I got to know about met her at a bar through a coworker because he brought their toasts for our Friday breakfast and it was sooooo good. I wanted to bring my friend here since she was visiting from norcal. We came here on a Saturday around 10am and there were a lot of people waiting in line. I dropped off my friend so she can get seated first and went on a quest to find parking (it's so hard!!) my advice for parking is go into the residential neighborhood there was a good amount of parking a block or 2 away. (if you're coming from Wilshire take a left from the street met her at a bar is in) My friend got the waffle sandwich (vegetarian) and I got their met her burrito. The burrito was underwhelming. Wasn't super great but it wasn't bad either. My friend said her sandwich was very flavorful. It was a little confusing because there was waffles (as the breads) and syrup to compliment it but the insides of the sandwich were savory. Honestly I think I would only come here for the toasts tho! The toasts were way better than our meals. They have 4 choices and 2 of them are vegetarian. We got the avocado toast and strawberry ricotta toasts (amazing) they cost $13 & $9 but honestly I think every bite was worth it. I left some of my burrito but I couldn't get enough of the toast!! Would come back just to eat the other 2 toasts I couldn't eat this time
4/3/2019,20190403,4,4.5,I got the truffle toast which was yummy! I want to try the ricotta toast next! We were seated right away on a Saturday afternoon and they had room on the outside patio despite it seeming busy. All the food options looked great. Wish they were opened late so you could come by and work on a laptop there. Service was super nice too! Street parking on 8th.
4/3/2019,20190403,4,4.5,I got the truffle toast which was yummy! I want to try the ricotta toast next! We were seated right away on a Saturday afternoon and they had room on the outside patio despite it seeming busy. All the food options looked great. Wish they were opened late so you could come by and work on a laptop there. Service was super nice too! Street parking on 8th.
4/4/2019,20190404,4,4.5,The only thing stopping me from five stars is the fact that they don't do modifications and they didn't have pure cane sugar for their matcha latte or hibiscus tea which were a bit bitter. Other than that this place is absolute magic and their food is amazing.
4/7/2019,20190407,5,4.5,GREAT FOOD!!! Got the typical Avocado toast and French toast. Delicious!! Highly recommended!
4/7/2019,20190407,5,4.5,"This place is amazing! The employees here are so nice, attentive, and they are always smiling. The food looks good and tastes good! I only have good things to say about this place. Everyone needs to come and try this place, trust me you will love it!"
4/7/2019,20190407,5,4.5,GREAT FOOD!!! Got the typical Avocado toast and French toast. Delicious!! Highly recommended!
4/8/2019,20190408,4,4.5,This gem is located on the corner of some random street! Definitely not the nicest view outside. The interior however is very cute and has that earthy vibe of most cafes. The workers are nice but in terms of cleanness it's okay. My friends and I came in a Tuesday afternoon and it was pretty packed with no seating so we waited for a table. After we were seated I watched a server/worker pass by several times with a towel but he did not wipe the table from the previous group (sorta messy as well). I didn't want to bother him so I wiped the table myself with some water from the self serving station. Not the best first impression but the food was so aesthetic and pretty I sorta forgot about that instance!! I got the Waffletella. It was really good but price wise a little overpriced but worth it for the display LOL. I paid $15.24 for one waffle (with $1 tip+tax).
4/8/2019,20190408,5,4.5,"Super friendly & knowledgeable staff, very clean, great ambiance!! Ordered by recommendation, Wake Up Happy (add berries + $3) w/ eggs bacon & sausage. Big fan of the bacon & everything in all is AMAZINGGG!! Also ordered: avocado toast, chicken & waffles & side of potatoes. & they all were soooo tasty!"
4/8/2019,20190408,5,4.51,"This place is amazing! Delicious food, great community vibe and friendly staff. Too many good things to pick my favorite menu item but I love the strawberry ricotta toast!"
4/8/2019,20190408,4,4.5,This gem is located on the corner of some random street! Definitely not the nicest view outside. The interior however is very cute and has that earthy vibe of most cafes. The workers are nice but in terms of cleanness it's okay. My friends and I came in a Tuesday afternoon and it was pretty packed with no seating so we waited for a table. After we were seated I watched a server/worker pass by several times with a towel but he did not wipe the table from the previous group (sorta messy as well). I didn't want to bother him so I wiped the table myself with some water from the self serving station. Not the best first impression but the food was so aesthetic and pretty I sorta forgot about that instance!! I got the Waffletella. It was really good but price wise a little overpriced but worth it for the display LOL. I paid $15.24 for one waffle (with $1 tip+tax).
4/9/2019,20190409,5,4.51,Excellent if not tight digs. Friendly staff and owners. Impressed they do so much and have such great food. Would come here over and over.
4/12/2019,20190412,5,4.51,There's one hour parking right outside. When you walk in you order at the front and they give you a number and you grab a table. When they food is done they search for your number where you're seating and bring it to you. The avocado toast was a good portion size and it comes with coconut shreds which makes is sweeter and fun to eat. The chicken and waffles were also a perfect combo for bunch. The waffle was soft and not super crispy and the chicken was so good especially after a late night out.
4/12/2019,20190412,4,4.51,"Waited about 20 minutes, which was what we were told. My only complaint was that I felt rushed when I was inside to order, eat, pay and leave for the next customers. Overall the food was rather good and the price was fair. I do have to say the avocado toast was very pretty if that counts for anything, but I wish that came with poached eggs with the price. Would come back."
4/12/2019,20190412,5,4.51,"I've always passed by this cute little nook and was intrigued by the name. After deciding to give it a try, I am so ecstatic I did. I had the waffle with berries which was superb! Gisette our waitress was very nice, attentive like the others, and even conversed a little. The minimalistic chic cafe is great if your looking for a great food spot that feels like your eating in a family home! Plus the story of how the owners met hence the name is a perfect touch!"
4/13/2019,20190413,5,4.51,"My cousin and I went to the LACMA and got hungry so we looked up places to eat and found this place, we were very happy with everything we ordered. The cold brew was good..the avocado toast .. amazing and the waffles were soooo good. The fried chicken was perfection."
4/14/2019,20190414,4,4.51,"I randomly came across this listing on yelp actually. I liked the story on how they met andI wanted to check it out because we were in the area visiting some museums. We arrived about 11 AM on a Sunday and there was a small group of people outside waiting. The wait was about 15 minutes for our party of four and we were offered seating at the bar which was fine with us. The inside of the restaurant is on the small side, and there is a small patio outside as well. We opted to order the strawberry ricotta toast, mamas omelette, the breakfast waffle sandwich and a fried chicken sandwich. As we sat at the bar, we watched the kitchen work feverishly to prepare the items as fresh and fast as possible which was really interesting. Although we didn't order it, the Fred Flintstone waffle looked rather interesting with the ice cream and fruity pebbles as did the chicken and waffles. The waffle that was served with each of our meals was delicious. It had just enough outer crisp and a chewy center with a hint of sweetness. The fried chicken sandwich was excellent. It was a generous portion of chicken on a soft bun with a delicious slaw. We also ordered the waffle fries, which were also delicious. Although I did not try the ricotta toast it looked amazing. We had a server, male, with reddish brown hair and a slight beard who was super nice. I like that they use an iPad style ordering system as well as a payment system. It really speeds up the process overall. We found street parking. The menu seems to have something for everyone, healthy, somewhat healthy and not so healthy."
