date,converted_date,rating,average,review
11/22/2019,20191122,4,4.53,"A super solid brunch place with AMAZING waffles. For the two of us, we ordered the chicken and waffles, the waffle benedict, and the french toast. The chicken and waffles was by far my favorite dish. The chicken itself was so deliciously crunchy. It was also juicy and packed with flavor. The waffle was so and fluffy, the perfect compliment. The waffle benedict delivered as well, and was very satisfying.The french toast on the other hand was plated beautifully, but was really underwhelming. I liked the cornflake crunch. The middle of the brioche was soggy, but the crust of the brioche was super tough. Other notes:At 10am, the wait was very minimal. Street parking was not difficult at all. Service was great. Small restaurant with some outdoor seating with water bowls for the pups! Cute and trendy interior."
11/23/2019,20191123,2,4.52,"Long ass wait but the food and atmosphere is fun. Giving 2 stars because they served me burnt bacon (the kind you can't actually eat). Waiter was nice and replaced it with ...yep , more burnt bacon. I just couldn't ask a second time so I asked for some bread instead since I felt it was easier for them but I think we all know bread can't beat bacon. For the price, I'll spend a few bucks extra and luxuriate at Pump instead. They are too busy and too crowded to deliver enough value for the price. Last time they forgot my latte too. I do feel bad giving this rating but I only review to affect change."
11/24/2019,20191124,5,4.52,"Honestly, when I got there, I thought I was going to starve because there were so many people waiting. The wait was a little much especially for a larger party. But it moved pretty quickly and was SOOO WORTH IT!!!! I absolutely loved the food, people, and service. I had brought my baby and huge stroller, which can be a bit of a mission ( I don't know what I was thinking) , and the staff didn't make me feel bad at all. They helped accommodate me and my child. The owner was most helpful and sweet. Oooohhhh but the food! I had the flinstone waffles and an omelette . Holy cow! I couldn't have asked for a better breakfast! I will be back very soon.I can't wait to try their new spot "" I met HIM at a bar"" across the street, when it opens! ! ! Things to look forward to !"
11/24/2019,20191124,5,4.52,"OMG- so I don't eat meat LIKE SOOOOO MANY PEOPLE,so I tried the portobello waffle sandwich. GET IT‼‼‼‼‼‼ it was so good that I felt guilty leaving and going to work because I just KNEWWWW nobody at work was as filled and satisfied as I was walking in there . Loved the service and would definitely go back."
11/25/2019,20191125,5,4.52,"Guh the friend chicken and waffles.... So delish! We were a group of five and waited about 45 mins for a table on a Sunday afternoon. The staff were super friendly and very attentive, our waters were always full. I have the chicken and waffles with Alfredo and it was yummy! The chicken was crispy outside and moist inside. The waffles light and fluffy, and the Alfredo sauce added an additional savory-ness to the dish. When an ordered dish was forgotten, server was quick to get the replacement delivered. Everyone thoroughly enjoyed their food and enjoyed the ambiance there. I will defo be back to try more things on the menu!"
11/25/2019,20191125,5,4.52,"Stopped here for brunch after deciding my husband and I decided to do something spontaneous and watch the sunrise in Santa Monica (for point of reference we live in Fullerton) We were on the way to look at homes in the Los Angeles area at the time with our real estate agent and we had some time to kill. At 8:30 AM on a Sunday morning there was no wait. We were promptly seated, waters came quickly and they were pleasantly attentive. We ordered the Fried Chicken and Waffles along with a Truffle Egg Scramble Toast. Wishing we had room to try other things but we had just picked up some donuts nearby which we had snacked on.The fried chicken and waffles was great! Warm on the inside while have a great crunchy texture on the exterior. The waffles were similarly well done as they put all the syrup on the side it doesn't leave any room for the course to be soaked through upon the time it's poured on to the time it reaches your table. (Which I've seen done at other restaurants). The truffle toast although seemingly simple in nature was our favorite! The egg scramble was delicious as they were fluffy although not so transparent in texture that substance was lost. The truffle taste wasn't overwhelming and was a nice additive to the dish. The overall ambiance of the restaurant is cozy and homey, not overly trendy and inviting.Would come back as the service was superior and the food was delectable."
11/25/2019,20191125,5,4.53,"We're here visiting from Phoenix for the weekend and all I wanted was a good chicken and waffle meal. And at this place, we hit the jackpot! I've eaten chicken and waffles from coast to coast and this is by far my favorite yet! The garlic parmesan gravy was just the icing on the cake. The chicken was so crispy and yet so juicy! My only disappointment is that I got full and couldn't finish all of it. I know that for the waffle to was very crisp and done to perfection. The vibe in here is very quaint and comfortable. I will definitely come back here again next time I visit."
11/25/2019,20191125,5,4.53,I've watched as this neighborhood restaurant has evolved into the spot attracting people looking for great food at a fair price. The offering on the menu include unique spins on some traditional dishes that are beyond satisfying. There is a very eclectic group of folks always present in a very warm hip setting. The only downside there is that as its popularity continues to soar so will the line waiting to get in.
11/26/2019,20191126,5,4.53,So I love this place. I come here a couple times a month just for the Thai omelet which is so good. Like SO GOOD. I love it with the sriracha and jasmine rice and just it is really good okay? Okay.Anyways service is always really prompt and fast and friendly. They're very busy on weekend (understandably) this is a great fast-service brunch spot. The place is small so you aren't meant to linger and that's okay! The environment can be loud so it's best to eat the yummy yummy food and then enjoy what LA has to offer outside. During the week during Normal breakfast/lunch hours it is easier to stay a little longer. It's a bit quieter. I wouldn't suggest people bring laptops or work meetings here - this is a place to enjoy yummy YUMMY waffles and toasts and omelets. Just enjoy the great food and kind service. Recently tried the strawberry ricotta toast and have to say it is also a must try. Perfect
11/26/2019,20191126,5,4.53,"This place is cute and filled with so many delicious looking dishes! My server was also super nice! While I was waiting I caught myself eyeballing everyone else's food thinking maybe I ll get that next time.As for my food... I ordered the crispy French toast with Nutella and berries (no whip), side of bacon, and a mimosa. It was ready much faster than I expected and it was SO good! All the while I enjoyed my book, just sat and relaxed. Eventually when I was done eating I wanted more, no not because I was hungry but because my first dish was amazing. Yes, I had just come from the gym. Ha! Anyways, ordered a side of potatoes, more bacon, and another mimosa. Yum! I will be back for more. Oh yes!"
11/26/2019,20191126,5,4.53,The best breakfast and brunch places I've ever been to. It's located on the corner of la Brea an eighth Street. I highly recommend this spot. It's hard to find a good spot around these days.
11/27/2019,20191127,4,4.53,"Heard so much about this place and was and still am excited for the brother shop opening up next year . Half way through my delicious meal I, i was appreciating the attention to detail on my latte coffee mug when I noticed lip stick left by the previous patron . Turned my stomach a little. They replaced it when I brought it to the attention of what looked him tHe owner or nearest host. The setting was beautiful and it was a fast paced environment but the wait wasn't long to get inside during lunch hour . I'll wait for the brother"
11/28/2019,20191128,5,4.53,Amazing food options. The staff are SO SWEET. Even on thanksgiving everyone is smiling and friendly. I can hear them thanking each other which is amazing. Really warm friendly environment. Gluten free waffles is definitely a plus. We sat at the bar and could watch all the food coming out. Everything looked delicious.Wait is worth it guys. Really I'm so happy with everything. Can't say enough how warm and friendly everyone was. We will be back!
11/29/2019,20191129,4,4.53,"Great brunch spot that specializes in waffles, but be prepared for hour-long waits on the weekends.Surprisingly for me, I was in the mood for a savory meal when I came here for brunch, and the Chorizo Breakfast Burrito was calling my name, so I opted for that. It was absolutely delicious, and I was surprised by how much chorizo and bacon they stuffed in there--it was mostly meat and eggs, which I appreciated. It came with a small fruit salad that was mostly melon, which was fine. The burrito was pretty substantial; if you have a large appetite you could probably finish the whole thing in one go, but I found it to last about 1.5 meals for me. The waffles looked tasty, and I'll have to try one next time.They close the Yelp waitlist remote check in during brunch so you have to go to the restaurant to put your name down. We ended up waiting about 45 minutes for a table and walked around a bit to pass the time, but there isn't anything particularly interesting in the area. Overall, it's a great place for brunch as it offers a unique menu that highlights a variety of waffle dishes. The interior is cute and quaint, and service was friendly throughout our meal. I'm looking to go back!"
11/29/2019,20191129,5,4.53,"I wish I could give Met Her At A Bar 6 stars! This place is more than just a restaurant, it's a community. I am so lucky to live so close that I can come to this gem often! The owners Vinny and Mindy have created a dining experience that can't be topped. From the impeccable service, amazing food, and loving environment, Met Her At A Bar is hands down my favorite place to eat and a must if I have out of town company! This is the first place I take everybody. The customer service here is unbelievable. Even on the busiest days the workers are so pleasant and personable, attentive and just so dang nice! It's so refreshing than most experiences in LA! My go to breakfast item is the Wake Up Happy and it never fails to be perfectly prepared each time. The way the owners are so involved shows how much love goes into this place. I don't think I have ever been here and not witness the owners there making sure everyone is happy! Their story and success is so inspiring and something we can all learn from! Thank you, Vinny and Mindy for putting your heart and hardwork into this place, it does not go unnoticed and I'll be a forever customer!"
11/29/2019,20191129,5,4.53,"The staff were friendly and accommodating. Service was fast, food was good and reasonably priced. The vibe was chill and would definitely return with my family when visiting LA."
11/30/2019,20191130,4,4.53,Cute spot but bad parking. We shall return though! Great location and location is key. Friendly bartenders. We appreciate you guys!
11/30/2019,20191130,5,4.53,Delicious!!! The waffles with Nutella is a must. We stopped here for breakfast and ordered the breakfast sandwich with avocado... wow.... incredible. The mimosa was the best we've ever had. Freshly squeezed orange juice with champagne- what else can you ask for. You need to come over here.
11/30/2019,20191130,5,4.53,"Wow wow wow. Came here for brunch on a saturday in LA and left so impressed. First of all, we only waited for about 20 minutes which was great for peak brunch time on a weekend.Once we were seated, we got to see that the atmosphere is very trendy while still feeling cozy. The service was amazing and so fast! I'm not kidding when I say our entire table of 4 received our food within 10 minutes of ordering it, we were so impressed. Now let's get to the food, YUM! I personally had the truffle toast, it was so good I could have it every day for breakfast. I also got to try the fruity waffle, fried chicken waffle, and portabello waffle sandwich. Everything I tried was fantastic and I wish I lived closer because I would be here every weekend. Also had an oat milk latte and the coffee was delicious. Lastly, the story of the restaurant is very sweet, love supporting a wholesome small business. Next time i'm in LA you know where I'll be brunching :)"
11/30/2019,20191130,1,4.52,A good restaurant would not do the following 1) stick their customers with a hidden health care fee that's added to the bill without consent 2) stick automatic 20% gratuity onto bill3) return for signature asking customers if they'd like to add a tip AFTER already including 20% tip into the bill. 4) rushing customers out by dropping the bill on the table while still eatingThis is bad service delivery even though we considered the server 'nice'For an idea of the full cost of your meal add 50% to the posted prices.
11/30/2019,20191130,2,4.52,Overrated brunch spot. The fried chicken is great. The waffles (the most significant dish in the restaurant) is not good. The waffles are soft and not warm--it must have been sitting there for a while before it got served. Do not recommend
11/30/2019,20191130,5,4.52,"Breakfast at any time, YES PLEASE! The wait was extremely decent, the staff super friendly, and the ambience garden escape beautiful. The food came fast and it was a burst of breakfast heaven and berries in your mouth. The waffles are so good seems like any combination ordered was perfect. I dont know who met who at what bar but this place is a must have!"
12/1/2019,20191201,4,4.52,"Hipster, instagram worthy restaurant. Met Her At A Bar is located on the corner of La Brea Ave and Eighth Street. There is no dedicated parking lot but there's plenty of parking meters which are $2 for 2 hours. There's usually long lines so plan on coming in early. The interior is unique and nice casual restaurant. My friends and I came for brunch. They serve amazing breakfast. The biggest complaint is their portion size. I ordered Waffles and Berries and it was $13. It was a single waffle with sliced strawberry and blueberry on top. Presentation is 10 out of 10 but really pricey for what we get. Food was pretty good and I would recommend coming here for having an elegant breakfast. Wouldn't come here if you're really hungry. For a party of 6 or more people, they add gratuity tip automatically."
12/2/2019,20191202,4,4.52,Everything here looks amazing. I had the fried pesto pannini. It was great! Coffee is also very good and strong. Parking is a little difficult. But great place! They still had brunch at 2pm on a Monday
12/3/2019,20191203,5,4.52,Reviews say it all. Amazing food and service; I ate soo much that's how delicious food was! And they have a cute simple setting.
12/3/2019,20191203,5,4.52,"One of the best breakfast spots ever! Wish the space was bigger, but we love it there. Keep up the best breakfast and service, so fun to go."
12/3/2019,20191203,4,4.52,Great hole in the wall brunch spot! Good variety of options and everything tasted fantastic! Gave it 4 stars only due to long wait times with very limited seating and waiting space. Will definitely be back to give it another try!
12/4/2019,20191204,4,4.52,"Ordered the waffle Benedict and crunchy French toast. I'd say that the French toast was not as crunchy as I was expecting it to be, but still tasted alright. The waffle Benedict should be eaten right away because it can get pretty soggy. I would like to try out some other items in their menu the next time I come in here. These two dishes were good but not something I will have a craving for. The orange juice is freshly squeezed which is always refreshing. Cute and modern decor. The servers were great, checking in on us pretty often making sure everything is okay.Street parking wasn't too difficult to find during the weekday, I'm sure the weekends are a different story."
12/4/2019,20191204,5,4.52,"Really great service! Nice and genuine employees.Food was ok, nothing to go crazy about, but I would still go back."
12/6/2019,20191206,5,4.52,Great service and amazing food! Came here when it opened on a Wednesday morning with some friends. Our waiter (wish I could remember his name!) was very welcoming and helped us decide what to eat. We ended up sharing the crispy French toast (yummm) and I got the Thai chicken & waffle. Highly recommend the Thai chicken & waffle - so many different flavors in one dish! Everyone else enjoyed their food as well. Extra bonus points for the artwork they displayed on the wall. Definitely will come again!
12/6/2019,20191206,5,4.52,"Literally, just left this amazing gem in the wall. I ordered a Matcha Latte with Oat Milk, & The Waffle Eggs Benedict. I was very satisfied the way everything was. The waffles weren't over cooked, and the service was fast. If I could give them 6 stars I would, and this was only my first time here. Definitely coming back soon."
12/7/2019,20191207,5,4.52,"Came here during a busy hour, the service was quick and the service was great! My food came out really fast. Loved the Flintstones waffle! It's perfect for people with a sweet tooth. The matcha latte was also good, just wished that there was a little stronger matcha taste to it."
12/8/2019,20191208,5,4.52,"The food was amazing! Everything we ordered was delicious! Normally there's a really long wait but the wait wasn't bad at all. My friend and I split the waffle fries, strawberry Ricotta toast, and chicken and waffle. Would def wait in line and go again for brunch."
12/8/2019,20191208,4,4.52,"This place is pretty good. Waffles are great with crispy edges, creamy scrambled eggs and perfectly cooked bacon. Space is small and there is a wait but the line moves fast. Conversation is minimal because it's very loud inside but no need to talk with your mouth full of deliciousness."
12/9/2019,20191209,5,4.52,"A few of TSG's own The Food Dudes came through before our KYCC volunteer event and man it did NOT disappoint!We got there around 9 and it was already packed! Thankfully, the colder weather kept everyone seated inside, so we were able to get a table outside for the 3 of us. We got our order taken and the food came out in literally 10-15 minutes. Talk about speedy service!I ordered the Chicken and waffle Thai style with a side of Truffle waffle fries, and the boys ordered the waffle benedict and crispy french toast. We also got a bottle of the rose cuz we're basic like that. Everything we ordered was amazing, but my chicken and waffle was the star. Juicy chicken with chopped peppers and the sambal sauce with syrup made for such great flavors. I'll definitely be back to try more things!!"
12/9/2019,20191209,5,4.52,"I've been meaning to try this place for ages and I'm glad I finally did. It's a cozy little spot on the corner of La Brea and 8th Street. I came here on a Saturday morning before noon and there was a small wait. We grabbed a menu as we waited so we were ready to order upon being seated. All the items on the menu have really cute ""lovey-dovey"" names which revolves around the story of how the restaurant came about. For food, I ordered the Eggs Benedict. You get an option of breakfast potatoes or a salad. I chose the breakfast potatoes The eggs benedict was made so perfectly I practically inhaled it. I definitely can't wait to come back here again. There were so many options on the menu and I wished I could've tried them all at once."
12/9/2019,20191209,1,4.52,"This place had great reviews, so I figured I'd give it a whirl. I looked at the menu and was all prepared to dig in to a delicious meal, until I saw the over abundance of four legged patrons mingling among the people. When I saw a dog sitting on the seats that are designated for people, AND leaning over the table, I had enough. Bringing your dog along doesn't mean that they should be on the table and/or chairs designated for human patrons. Obviously some people are ok with this, but for people who prefer to dine with other humans only, just say no. We ended up going directly across the street to the Commerson and had a fabulous meal."
12/9/2019,20191209,5,4.52,"Amazing food. Intimate atmosphere. Packed on thanksgiving morning. Blooming tea is an awesome experience. Great mimosa. Chicken sandwich I would recommend Pesto sandwhich is great, strong on the pesto Staff was very friendly even if it was super hectic"
12/9/2019,20191209,5,4.52,"Their vanilla latte with oat is one of the best I have had! Especially when getting it along with Wake Up Happy. The waffle was so soft and the berries were super fresh, it was perfect!"
12/9/2019,20191209,5,4.52,"Second time here for breakfast Amazing service. The food is always delicious and the waiters are always polite and ready to help. It's a great place to have breakfast and have conversations, cozy place. Make reservations especially on saturdays as it gets busy. Sunday's are better in my opinion."
12/9/2019,20191209,5,4.52,"Great place, awesome food! The story behind it all is cool too. I had the chorizo toast, finally something different."
12/10/2019,20191210,5,4.52,"Bougie little brunch spot with great service, and has wine/beer and mimosas. Parking is street-side only, but Sundays the meters are free.I really liked their Eggs Benedict Waffle, which replaces the normally stale bread for a delicious waffle that soaks up the amazing yolk. They also have a great Strawberry toast which was surprisingly filling for its size. Also tried their sweet potato fries which were solid.Overall a great spot to try in LA for a nice brunch. The waitress we had was super attentive, despite us being on the patio which I feel notoriously gets ignored at most places."
12/10/2019,20191210,5,4.52,"This is such a great brunch spot. I love breakfast and my Bf is more of a lunch type guy so this restaurant was perfect! The service was excellent, the restaurant was clean, the staff were all very friendly. We will deff return."
12/10/2019,20191210,2,4.52,"Meh.... really long lines usually mean amazing food. There was an hour wait for brunch. The wait did move along quickly. However, I didn't receive what I ordered and they didn't serve regular French toast without Nutella. When I finally convinced them to make it,the French toast Was extremely dry. The place is a cute little vibe though."
12/11/2019,20191211,5,4.52,Yummmmmmm!!Omg everything we ordered for my daughters birthday was delicious! Their chorizo burrito sooooo delicious! The breakfast tacos and fresh waffles!! Wow! Love the staff and super cute space to eat!
12/11/2019,20191211,5,4.52,"Great for brunch, although the wait can be a minute. GREAT food, though! Wish there was more room inside!"
12/11/2019,20191211,5,4.52,Amazing food!! Went a couple days ago with my boyfriend and it was amazing. I personally loved the chia berries overnight oats and so did my boyfriend. The service was fantastic and everyone was on top of their game. First time and won't be my last :)
12/12/2019,20191212,5,4.52,"All of them were good. This picture was only half of our order! The truffle fries were my favorite! Check out this place's story too, very cute."
12/12/2019,20191212,5,4.52,Get the thai chicken and waffles. Don't ask why. Just get it. It's the best chicken and waffles you will eat in your life. I had this on a date and it blew my mind as well as my girlfriend's.
12/14/2019,20191214,5,4.52,"This buzzing cafe is right around the corner from our new place and we're thrilled about it. I went two mornings in a row and was not disappointed. The staff is so welcoming and kind, such warm vibes in this place. The decor is great and makes it really inviting inside. There's both indoor and outdoor seating and we didn't wait long for a table either time we came here. The food is very vegan friendly, with wraps, avo toast, waffles, and salads being just a few of the incredibly tasty items you'll find on the menu. One thing to note is that they don't allow laptops between 11am-2pm but I enjoyed the tech free environment. I've had a black bean hummus wrap and avocado toast - both were good. The prices are fair and similar to other cafes in the area. I'm excited to try more things on the menu here! The story behind the cafe is so sweet and I love that it represents something bigger than a cafe. Safe to say this is my new coffee spot."
12/14/2019,20191214,3,4.52,"I've driven past this place a couple of times, and always saw a crowd waiting! Finally got a chance to try, but I don't think it was worth the hype. I ordered the portobello mushroom sandwich, it was okay, could definitely use more flavor. My latte and the service were great though! Friendly staff and okayish food."
12/14/2019,20191214,5,4.52,"Wow! Where do I start. First time here, and let me say, the food was DELICIOUS!!!!! I had the breakfast egg and chorizo burrito and it was yummy!!!!! My wife had the chicken club sandwich (substituted with crispy chicken), and it was very juicy and amazing! We will definitely stop by here again, the wait is worth it."
12/14/2019,20191214,5,4.52,Cool place with a cool story. Really good coffee and breakfast! I highly recommend! Oh...and the wait time was crazy ;) popular spot for sure!
