date,converted_date,rating,average,review
12/21/2013,20131221,4,4.11,"Famous Fish is a place that is tucked away so well that you would probably pass right by it if there wasn't a line coming out of its inconspicuous door.The experience is simple: Southern US style fried seafood and fries done right. No frills. No themes. No seats.You wait on line, you come in, you order, you pay, you wait. The food is up and staring you down on the counter, you add your condiments, you nod, they wrap it up, and you are out the door. Lost once you get in? Don't worry, someone is bound to tell you what you're supposed to do. It's actually a little reminiscent of the Soup Nazi.. but with nice people behind the counter. They won't yell ""No fish for you!"" if you get it wrong.The fish and shrimp combo is deal breaker here: Freshly battered catfish and large, cleaned shrimp. The fries as an add on is so cheap, it would be a waste not to do it. The entire order, flanked between whole bread slices is enough to feed you for hours to come."
12/21/2013,20131221,4,4.11,"Famous Fish is a place that is tucked away so well that you would probably pass right by it if there wasn't a line coming out of its inconspicuous door.The experience is simple: Southern US style fried seafood and fries done right. No frills. No themes. No seats.You wait on line, you come in, you order, you pay, you wait. The food is up and staring you down on the counter, you add your condiments, you nod, they wrap it up, and you are out the door. Lost once you get in? Don't worry, someone is bound to tell you what you're supposed to do. It's actually a little reminiscent of the Soup Nazi.. but with nice people behind the counter. They won't yell ""No fish for you!"" if you get it wrong.The fish and shrimp combo is deal breaker here: Freshly battered catfish and large, cleaned shrimp. The fries as an add on is so cheap, it would be a waste not to do it. The entire order, flanked between whole bread slices is enough to feed you for hours to come."
1/3/2014,20140103,5,4.13,"I love the fish, shrimp and fries. I never ate tarter sauce until I came here, I love the tarter sauce. There is not seating and the line is usually long but I love it...."
1/3/2014,20140103,5,4.15,"I love the fish, shrimp and fries. I never ate tarter sauce until I came here, I love the tarter sauce. There is not seating and the line is usually long but I love it...."
2/4/2014,20140204,2,4.1,"Fries were tasty as was the tartar sauce. Portions are pretty decent. But the most important part, the fish, was not. It was fishy. Yuck. If I can bring myself to, I'll need to try it once more then update my review but for now I'm not impressed. Hopefully just an off day."
2/4/2014,20140204,2,4.06,"Fries were tasty as was the tartar sauce. Portions are pretty decent. But the most important part, the fish, was not. It was fishy. Yuck. If I can bring myself to, I'll need to try it once more then update my review but for now I'm not impressed. Hopefully just an off day."
2/26/2014,20140226,3,4.04,"I love their food and everything. But come on guys, time for a new bigger spot. Sucks I have to stand outside to wait to get inside."
2/26/2014,20140226,3,4.02,"I love their food and everything. But come on guys, time for a new bigger spot. Sucks I have to stand outside to wait to get inside."
4/1/2014,20140401,5,4.04,I have not bern to NYC in years and wanted some good fish. I went to Famous fish snd was very happy I went. My fish and chips were hot and good after a 12 block walk. ...Excellent!
4/1/2014,20140401,5,4.06,I have not bern to NYC in years and wanted some good fish. I went to Famous fish snd was very happy I went. My fish and chips were hot and good after a 12 block walk. ...Excellent!
4/14/2014,20140414,4,4.05,"I must say the best fried fish I've had in New York. Its tasty, fried perfectly, and with fries. Its a little hole in the wall and you may have to wait in line, but its worth it. You get alot of food for a little $. Its a very limited selection but that makes choosing that much easier. If you're in Harlem, you much try this little hidden gem!"
4/14/2014,20140414,4,4.05,"I must say the best fried fish I've had in New York. Its tasty, fried perfectly, and with fries. Its a little hole in the wall and you may have to wait in line, but its worth it. You get alot of food for a little $. Its a very limited selection but that makes choosing that much easier. If you're in Harlem, you much try this little hidden gem!"
4/29/2014,20140429,3,4.04,"So I walk in and boy is the place small. But it's a hole in the wall that serves pretty good food. The cashiers were very nice. One young man packing the food while the young girl handled the cashier. I got the fish and chips $7. The fish was pretty good. It had a very strong taste of black pepper. And To be precise, the fish was 85% crispy. The fries were a little soggy and cold :(.. Which deducted a star. Oh And you get two slices of brown bread. Oh btw I don't think I would recommend the all shrimp, it's $9.75 and you only get a small hand full. ONE MORE THING!! If you get it to go, check your bag if there is tartar sauce. Because that's a fried fish's best friend!! I GOT NO TARTAR SAUCE :'( even though I specified I wanted all the sauces... Instead I got the non spicy! sour! Supposedly hot sauce and packs of ketchup....no bueno and that's why they are getting a star deducted!!"
4/29/2014,20140429,3,4.02,"So I walk in and boy is the place small. But it's a hole in the wall that serves pretty good food. The cashiers were very nice. One young man packing the food while the young girl handled the cashier. I got the fish and chips $7. The fish was pretty good. It had a very strong taste of black pepper. And To be precise, the fish was 85% crispy. The fries were a little soggy and cold :(.. Which deducted a star. Oh And you get two slices of brown bread. Oh btw I don't think I would recommend the all shrimp, it's $9.75 and you only get a small hand full. ONE MORE THING!! If you get it to go, check your bag if there is tartar sauce. Because that's a fried fish's best friend!! I GOT NO TARTAR SAUCE :'( even though I specified I wanted all the sauces... Instead I got the non spicy! sour! Supposedly hot sauce and packs of ketchup....no bueno and that's why they are getting a star deducted!!"
5/5/2014,20140505,1,3.97,"All I have to say is Devin""s Fish & Chip's is way way better. It is a few block's north on St. Nicholas Avenue, from famous fish. Don't take my word for it do a comparison of the two you wil be glad that you did."
5/27/2014,20140527,4,3.97,"Definitely a fan! ...and thank you yelp! Would never have known what this is if it weren't for the reviews. I've seen this so many days getting on/off the subway, but just had no clue.The line (that when I finally went started 2 people outside the door), went quickly and efficiently, even with some of the chatty locals taking their time. Usually, I'm more of a British Fish n Chips fan, but this style was quite tasty. Much less greasy (though just a touch more fishy than I usually prefer) and still warm and ready after the 5 blocks I ventured home."
6/3/2014,20140603,4,3.97,"It's tiny. There are no seats. Just be cool and stand outside and eat your food on the corner, like you're in a badass movie about NYC. Then, you'd hop on the ABCD train and have a ""night on the town"" montage, one that possibly includes popping out the roof of a stretch limo you somehow aquired for free and going, ""WOOOO!"" as you ride through Times Square. At least that's what I pretend I'm doing when I'm slamming down fried seafood on a street corner. Forreal though, it's pretty good."
6/6/2014,20140606,4,3.97,"Gotta say this whole in the wall is pretty good. There is always a long line when I walk place this place. There are no seats this is strictly a take out place. I always go late so most of the time they run out of things. So far I have have the shrimps, fish, and clams. My favorite is the clams. I look forward to trying the scallops next when I finally make it early enough where they still have it."
7/11/2014,20140711,4,3.97,"We had low expectations for a small hole-in-the-wall type of place....It blew our mind, the staff was friendly and talkative, the food was delicious and reasonably priced. Be prepared to order, pay, and leave- there is not enough space to sit inside. Be careful!!!! The stairs are steep; you'll be too busy admiring your fish sandwich and the next thing you know you'll fall into the arms of a stranger coming to order."
7/27/2014,20140727,5,3.98,"Great food and friendly service. It quickly gets crowded, but it is well worth having to wait in a line to experience it."
7/29/2014,20140729,4,3.98,"I'm definitely a fan of the food! Fish, Chips and the Shrimp are absolutely delicious! I remember when I lived right down the street from this place. Rain or shine, sleet or snow there was always a line packed with their loyal customers me included. The only downfall of this place is that it's literally a tiny hole in the wall and doesn't hold many people so good luck if you have a stroller or a wheelchair!"
8/6/2014,20140806,4,3.98,"Definitely a fan! I usually go for the fish and chips or all fish. They give you whole wheat bread with either order and there are plenty of condiments (either you can put them on their or they have small containers to bring with you). I usually put hot sauce and tartar sauce on my fish-yum!The place is tiny and can get pretty uncomfortable if there are a lot of people waiting. If there is a line that touches the door I opt out of going. It can take awhile if they don't have any more fish fried- so be prepared to wait a good amount of the times you go. Usually the servers are friendly and put pride into what they do. Only one time didI have someone doing a little too much flirting for my liking. Made me not want to go back for awhile. Overall, it's a good spot!"
8/18/2014,20140818,4,3.99,"Saturday night this place is jam packed. But it worth the line., fires are soft & soggy while the fish is crispy."
8/19/2014,20140819,5,4.0,I love this place. I have been going here since I was a kid I always get the samething; fish and shrimp no fries with hot sauce and tatar sauce. The food is always fresh and there is always a wait but it is worth it. It is expensive but the quality of the food is worth it.
8/19/2014,20140819,5,4.01,"Best fish spot in Harlem! It's a hole in the wall literally and when you go here expect to wait in line, but it's well worth the wait. Staff is super friendly and give great customer service. Food is always amazing!"
8/19/2014,20140819,5,4.03,I love this place. I have been going here since I was a kid I always get the samething; fish and shrimp no fries with hot sauce and tatar sauce. The food is always fresh and there is always a wait but it is worth it. It is expensive but the quality of the food is worth it.
10/30/2014,20141030,4,4.03,"A friend recommended this spot so I decided to try it. Had the Fish & Chips, with tartar sauce and hot sauce with two slice of bread on top. I wish the fish was a little more crispier but other than that, it was really good. On service, the staff was nice and attentive, quick, even being late in the evening (9-10pm) and there was a line too. Location, I almost missed it when I was looking for it. It under some scaffolding so it isn't very visible, small spot, no seating, just grab & go. But I like it because it makes it different and the focus is on the food and not the decoration or the place itself. Definitely coming back to try the other meals."
10/30/2014,20141030,4,4.03,"A friend recommended this spot so I decided to try it. Had the Fish & Chips, with tartar sauce and hot sauce with two slice of bread on top. I wish the fish was a little more crispier but other than that, it was really good. On service, the staff was nice and attentive, quick, even being late in the evening (9-10pm) and there was a line too. Location, I almost missed it when I was looking for it. It under some scaffolding so it isn't very visible, small spot, no seating, just grab & go. But I like it because it makes it different and the focus is on the food and not the decoration or the place itself. Definitely coming back to try the other meals."
11/10/2014,20141110,5,4.04,"Really excellent, simple, tasty fried seafood. The staff is very nice and the establishment is very clean. I just happen to stumble on this place coming out of the A train on 145th Street. Come here if you're around for unpretentious fried seafood. One of the nice young ladies tending the cashier was very sweet and considerate. I mentioned I needed some time to look over the menu since it was my first time. She was so nice and gave me free samples of the fried fish and shrimp. Now that, is true customer service that you can hardly find anymore. Brava to her and the whole crew!"
11/10/2014,20141110,5,4.05,"Really excellent, simple, tasty fried seafood. The staff is very nice and the establishment is very clean. I just happen to stumble on this place coming out of the A train on 145th Street. Come here if you're around for unpretentious fried seafood. One of the nice young ladies tending the cashier was very sweet and considerate. I mentioned I needed some time to look over the menu since it was my first time. She was so nice and gave me free samples of the fried fish and shrimp. Now that, is true customer service that you can hardly find anymore. Brava to her and the whole crew!"
11/15/2014,20141115,5,4.07,"Clean and tasty takeout. There are no tables and on nice weather days there will be a LONG line, but it's worth the wait."
11/15/2014,20141115,5,4.08,"Clean and tasty takeout. There are no tables and on nice weather days there will be a LONG line, but it's worth the wait."
1/22/2015,20150122,2,4.05,"I used to come here all the time for the fish. Recently I've realized new ppl working here and since then the place has gone down hill. I went Monday for a sandwich. I was never greeted, my order was never taken and there was a light skinned woman with tats cursing up a storm. There was a young child standing on line while the woman continued to curse. Where's the professionalism? I was enraged. I hate to say it but I don't think I'm ever going back."
1/22/2015,20150122,2,4.03,"I used to come here all the time for the fish. Recently I've realized new ppl working here and since then the place has gone down hill. I went Monday for a sandwich. I was never greeted, my order was never taken and there was a light skinned woman with tats cursing up a storm. There was a young child standing on line while the woman continued to curse. Where's the professionalism? I was enraged. I hate to say it but I don't think I'm ever going back."
2/1/2015,20150201,3,4.01,"Good spot as the food is ok and tasty. The location is rather small, so don't bring a huge group as you will be disappointed. The staff is friendly on most days, but today the two teens working had the worst attitude. Fix the employee customer service and it'll be all good."
2/1/2015,20150201,4,4.01,"Hidden Gem in the hood... Sweet shrimps and fried fish are my favs here. Also serving clams, scallops, and chips. Usually a long line to eat but worth the wait if u can stand it in such a busy neighborhood. Staff can range from nice to nicety (which is a professional nasty), but since this isn't a bar- just get ur fish and bounce."
2/1/2015,20150201,3,4.0,"Good spot as the food is ok and tasty. The location is rather small, so don't bring a huge group as you will be disappointed. The staff is friendly on most days, but today the two teens working had the worst attitude. Fix the employee customer service and it'll be all good."
2/7/2015,20150207,5,4.01,"It's a joke on the wall. But don't let that fool you. This the best fried seafood spot on Hatlem!! Fish, Shrimp and Fries. Just that damn simple!!!!"
2/15/2015,20150215,2,3.99,Place a little bit small cramped.The fish wasn't really good I didn't like the taste the fish had it didn't taste fresh. Maybe they should try using a better fish or different coating. The shrimps were ok need a little bit more season. The fries are pretty still decent they had a little bit of crisp till after I got home.
2/15/2015,20150215,2,3.96,Place a little bit small cramped.The fish wasn't really good I didn't like the taste the fish had it didn't taste fresh. Maybe they should try using a better fish or different coating. The shrimps were ok need a little bit more season. The fries are pretty still decent they had a little bit of crisp till after I got home.
3/15/2015,20150315,5,3.98,"Always fresh, always good, worth the wait. The line goes fairly quickly. I don't know what they use in their batter but it is soooo good. Great mom and pop hole in the wall fish store. They have another location called fishers of men in 125 which is awesome also.The fries aren't great do yourself a favor and try any fish and/or shrimp combo though :-)"
3/15/2015,20150315,5,3.99,"Always fresh, always good, worth the wait. The line goes fairly quickly. I don't know what they use in their batter but it is soooo good. Great mom and pop hole in the wall fish store. They have another location called fishers of men in 125 which is awesome also.The fries aren't great do yourself a favor and try any fish and/or shrimp combo though :-)"
3/22/2015,20150322,5,4.0,"DON'T SLEEP! This place iz da BOMB! Been eating here since I was a child in the 80's. It's food to go, open 7 days a week. ;)"
3/27/2015,20150327,1,3.97,"Back in the 80s & 90s, ""Subway Fish"" was IT!!!! I fell in love with whiting because of them, and went there 30-40 Saturday's a year. Every time it was an order of at least 10 fish sandwiches. Fast forward to my recent visit. Times have changed. I went to relive the mouth watering deliciousness of the past, because I knew I'd be in the area. I didn't really eat breakfast, and went in for an early lunch. I ordered the fish & chips, and couldn't wait to get on the train to dig in. Talk about bland/disgusting:-( Unfortunately I ate every piece, in hopes that one bite would be good. Fish, had no seasoning, fries were meh, the best part of it was the wheat bread. I will probably never patronize ""Subway Fish"" again. At least I have memories of what it used to be"
4/3/2015,20150403,4,3.97,"My goodness!!! I love it when I find a late night jackpot.. 1 am and I'm getting fish, shrimp and Mac...Perfect!!! The seafood was flavored well. They just need to puncture the Styrofoam so the fried food doesn't lose its crispy goodness. Also, this spot is super clean because it is take out. Staff are nice. They have a fish market which is open during early hours. And they take credit cards!!! I wish them nothing but success because they are a great addition to the neighborhood."
6/10/2015,20150610,4,3.97,The fish is good. Nice large portions and well seasoned with a crispy crust. The customer service leaves much to be desired however.
6/16/2015,20150616,4,3.97,"Perhaps the best fried fish I've ever had, which is probably why there are sometimes lines out the door and tons of double parked cars outside. Strictly speaking, they don't seem to know how to make proper french fries but who cares. The wonderful fried fish more than makes up for it. I haven't had the shrimp yet but they smelled and looked amazing so I will very soon."
6/25/2015,20150625,5,3.98,"Best fish and chips in harlem. Whenever I'm here In NYC I stop here. Hot sauce, ketchup, tarter sauce and I'm in heaven !"
7/28/2015,20150728,4,3.98,"Famous Fish Market will set you right. There is nothing better than some good/fresh fried fish, shrimp, chips (fries) with a side of white bread on a Summer Sunday afternoon. Located near on St Nicholas & 145th this location can be very easily missed, so here's the skinny:There will be a line of people waiting, which are usually patrons whom have already ordered waiting for their items to come up.Order at the counter and wait outside because this place is really small and it is basically a counter pick up.Listen carefully as you might miss your order, so this is why many are standing near the entrance way.Eat and repeat."
8/10/2015,20150810,3,3.97,"So today a friend and I decided to venture up to Harlem to try this place. No wait at all because it's Monday so that was great! I decided on the Fish & Shrimp combo. $13.75 excellent price nice and hot and quick. The food looked amazing however it lacked taste. I don't like to use a lot of hot sauce it takes away from the original flavor. In this case I had no choice very, very bland!"
8/13/2015,20150813,3,3.96,"This place was pleasantly good. Probably will come back if craving fried fish. Literally looking like a hole in the wall, this lil joint is a good bang for its buck. 7 dollar fish n chips. (This ain't no British style fish n chip)With a little tartar sauce and hot sauce, this brought me home. The food:Cons:-fries could have been crispier. (It's those fake fries with the potato flavor. But the good potato flavor...)-wish there was at least a bar to stand and eat (maybe outside? Three def isn't any space inside...)Pros:- Hot. Fresh fried. Fish. Batter wasn't too overwhelming. Fish wasn't too fishy. Good overall balance.Other:Cons:- looks like they need to upgrade to a bigger space. People were confused about ordering and waiting. But they seem to generally get things rolling without a problem.Pros:- simple menu- they stick to what they know and what they're good at"
8/16/2015,20150816,4,3.96,"Great little hole in the wall if you're craving fried seafood. Not many choices (fried fish, fried shrimp, fried clams and french fries) is what the menu consists of. I think it's good because they use fresh soybean cooking oil. I saw the oil was very clean that they used in the fryers. There are no tables or chairs...take out only. Worth stopping here if you're in the area."
8/22/2015,20150822,4,3.96,"I came here in the pouring rain. The fish and shrimp combo was great. I was scared because the space was so small and cramped, but everything was very organized for such a small space.If you're in Harlem and want fish, this is the place to be."
9/2/2015,20150902,4,3.96,"Ah, the Famous Fish Market of Harlem. I enjoyed this spot on many occasions while I was studying in CCNY a few blocks away. FFM is perhaps, in my opinion, the best fish and chips spot in Harlem. This place is LITERALLY a hole-in-the-wall. You'll never believe how often we used to walk by this place before actually discovering it for what it was worth. But this place is a no frills, no games place and I like that. They only offer three things. Fish. Shrimp. Or both. That's it. Straight and to the point. This is one of those places that doesn't act like they have 50 dishes that they get right. There is barely any standing room, so place your order and if you get claustrophobic easily, wait outside.If you're not ordering the combo, your meal will come with french fries and, if you agree to it, bread (not Arnold's or Pepperidge Farm but some low quality bread which is still fitting in a sense for where Harlem used to be just a few years back - it just works). The tartar sauce is quite remarkable and when you pair it with hot sauce, you need nothing else. They have a bunch of other stuff sitting on the counter like lemon juice, salt, pepper, the whole nine yards to sprinkle and shake stuff onto your meal prior to eating.-1 star because without all the food additions like tartar sauce, etc. the batter of the fish and shrimp isn't memorable. Au contrair, the meal is quite fishy without everything. Which leads me to believe that FFM can improve in one spot and that is adding some flavor to the batter itself to help reduce the fishy smell/taste of the meat in case someone wants to taste it for what it's worth before drizzling it with tartar and other sauces.Overall, this spot is a must try. This place has been here for years and there is no secret as to why. If a hole-in-the-wall can survive years of Manhattan-priced rent, you know business is good. And if it's a restaurant, you know the food MUST be good."
9/13/2015,20150913,1,3.93,I love a good fish and chip spot. This is not one of them. Everything is way too oily and most of the mixed fish tastes horrible. I have no idea why there is a line at any given time other than it proves many Americans have zero taste. Anytime you have to drench your food with that much sauce it can't be good and definitely isn't healthy.
10/13/2015,20151013,5,3.94,I usually don't like places with only two or three things on the menu but omg their shrimp!!
10/18/2015,20151018,5,3.95,Best Fried fish in NYC. Hands down this place is amazing. Its a hole in the wall with long lines but I promise its worth it and more. I always order the whole fish
11/29/2015,20151129,5,3.96,I really like there food it's amazing! The prices are good also. Parking not so good but hey with the great taste of food and good customer service you can't go wrong!
12/6/2015,20151206,5,3.97,Deserves the wait! Awesome the fish! Prices are extremely reasonable! Stuff is friendly!
