date,converted_date,rating,average,review
10/2/2017,20171002,1,3.94,"The smallest portion of food I have ever been served in my entire life. $50 bucks later and I literally left the restaurant hungry and dissatisfied.My friend and I both ordered oxtails which had a nice flavor to them but they took forever to come out, when they finally did they were just warm. The rice and beans was bland with literally 3 beans in it and the cabbage also was not seasoned with not a drop of gravy on it after I requested it. The rum punch tasted like it had no liquor in it and the overall service was just Ehhh!Definitely not a place I would recommend to anyone or a place I would ever return back to. With service like that I give them a year and the doors being shut down!"
10/6/2017,20171006,2,3.91,"Faux Jamaican We ordered oxtails and curry goat for delivery. The first hint should have been the limited selection. The food was terrible, just awful. It lacked flavor and the meat was dry and tough... when I say tough I mean pull at and hurt your teeth tough. Goat, when prepared properly, is supposed to fall off the bone. One piece of mine was actually crispy. What Jamaican food lacks flavor?!? It's some of the most flavorful cuisine in the planet but apparently not in this ""Kingston.""This was the first time I was actually happy for small portions, there was less for me to suffer through. One of the best things about going to a Jamaican spot is that they load you up. You can offer a medium meal and have lunch AND dinner. Nah... not here. There was a ton of empty space in my container but that good it was less for me to pick out of my teeth. Overall, it was all just weird. I wouldn't surprised to learn that the cook was working from Martha Stewart recipes. The only reason I gave 2 stars is because my BF begged me not to be mean and give an honest review. When I asked if he liked his food... *crickets. So that 2nd star was me being nice but NEVER AGAIN. You're better off at Golden Krust."
10/19/2017,20171019,3,3.89,"Saw this newer addition to the Harlem community, and being a Jamaican transplant, I wanted to check it out. Cute ambience, friendly & attentive bartender, tasty rum punch. Rasta pasta was delightful, the burger could use more seasoning since it's enveloped by patty crust AND coco bread. The curry pot was TERRIBLE: very oily & just...ugh. There were three of us: each of our meals came out about 5 - 6 minutes apart. Cute place but, it may be a while before I return here."
10/22/2017,20171022,5,3.91,The food here is delicious and our waitress was so friendly and hospitable. I definitely recommend this place.
10/31/2017,20171031,1,3.86,"Oh my gosh, you people should know better!!! Negril Village and Miss Lilys put you people to shaaaaame! .....I feel sorry for those who think this is good west Indian food. Your portions are also comical....get it together owner!...You're better off going to golden krust for a better bite!"
11/14/2017,20171114,1,3.81,This place is fairly new with little footwork but I wanted to try it out. The space is very small so you can't celebrate a birthday here. I was w 3 adults & 1 child and was seated at a small wooden table in the front. It was cute at first until the hard surface became uncomfortable. Until the food came out and the plates took up most of the room. 2 persons ordered oxtails and I ordered the fish w festival. The oxtails were meatless and small. Plantains nor rice seemed to have much flavor. The worst of it all was the 30 minute wait for food (it may have been longer) DON'T go there hungry!
12/2/2017,20171202,1,3.76,"I noticed this place about a year ago and always wanted to stop in because I work right down the street as a server myself so today I went in there before work having about 45 minutes to spare I thought I could sit down have a nice lunch and then head to work but I was wrong, I was greeted right away and given a menu and told that I would be given a few minutes to look it over as she disappeared to the back somewhere..a few minutes was way too long for my liking especially since it isn't a very big menu and I was the only guest beside two other women that looked like they were family...anyways...as I got up to leave I finally saw her coming back, no apology no nothing, actually seemed like she had a lil attitude like I kept HER waiting, like she had better things to do...anyways... After taking my order (A jerk salmon salad minus the tomatoes,onions and peppers) she questioned my order and actually had the nerve to chuckle saying ""So you just want Romaine, parmesan and crutons?"" Umm YES!! Anyways I asked for the bill right away bc at this point I'm wondering will I be late for work, she gives me my bill and disappears in the back of again saying that she was going to let the kitchen know that I was in a rush, which I don't understand what that has to do with anything because it's not like I want raw food and besides how long does a salad take?? Besides her giving me my check there would be no other way to speed up this process... anyways... I realize when she was gone that she only charged me for a jerk salad and not a jerk salmon salad and so I'm waiting for her to finally make it back to tell her I said salmon at this point too many mistakes have the made and the damage is already done especially since now she would have to go back into the kitchen and add to the order of which I was already waiting so I decided to just leave and ended up eating at the chicken joint down the street and got better service, I am jamaican-born myself and really wanted some Jamaican food and to represent my country but this place is a disappointment there's no wonder why every time I pass it's barely anyone in there. you guys need to do better."
12/22/2017,20171222,3,3.75,"I dined here as a party of one this past Thursday. I arrived at around 6 pm and there was no one there except the server. I sat at the bar and I ordered a rum punch and oxtail dinner. Overall it was just ok. I do not eat oxtails often, but I have ordered from take out spots and it was better tasting, a larger amount of oxtails and at a cheaper price. For restaurant quality and the $18.00 price, I think they were very skimpy on the oxtails. Also these seemed to be really thin and not very meaty. The cabbage was really the star of the plate. It was really good. It wasn't too hard or too soft and with the oxtail gravy, it was really good. The rum punch was ok, it didn't make me want to get another. The server was nice and attentive and the music was good! I also liked the decor. It made me feel like I was in a local spot in the Caribbean."
1/17/2018,20180117,5,3.77,"So great!! Happy I found this spot. Great music, amazing jerk chicken and lovable staff. Can't wait to come back. THANKS FOR THE JERK!!"
1/27/2018,20180127,5,3.79,"A great new edition to this area. This hostess/co-owner ensures that customers are satisfied no matter their dietary preferences. Additionally, the Veggie Curry is well seasoned dish and would be something I would try again as it caters to the Vegan/Pescatarian lifestyles."
1/28/2018,20180128,5,3.81,"Went to Kingston yesterday for a meeting and it was some of the best Caribbean Cuisine I've ever had the jerk chicken was extremely juicy and tender, the steamed veggies were very good and well seasoned. The drinks were also very good I had a drink I called ""The Tribe"" that was extremely good and I can't remember the woman's name who served us but she was Awesome. If you're in New York and looking for something to great to eat check them out!"
2/1/2018,20180201,5,3.83,"Amazing cocktails !Amazing food !Amazing service!Amazing music!We tried the spicy margarita, pork bite and jerk chicken with rice and cabbage ! Perfect! Congratulations !"
2/7/2018,20180207,5,3.84,"Lovely food and service. As soon as we walked in, the bartender was so welcoming and warm. The rice and beans were rich in flavor. Go for the food and stay for the generous service, and welcoming atmosphere."
2/21/2018,20180221,2,3.82,Came here to have drinks and great food...Instead i got a small fish without any of the stuff in the menu...will came back for happy hrs drinks and chicken on the grill...
2/25/2018,20180225,5,3.83,what a great dining experience! we started with a couple of cocktails (delicious) and jerk chicken (very tender). the pasta was perfectly cooked and the sauce was the bauss. the waitress was very down-to-earth and easy to talk to. we will be definitely back!
3/22/2018,20180322,5,3.85,The jerk pork bites were amazing omg! And so many for just 10 bucks! The Rasta pasta is to die for as well. The pasta is so well marinated and I highly recommend with the jerk chicken. Really good great place I've dined there 5 times in the last month!
4/2/2018,20180402,5,3.87,Really good food. I had the Pasta along with Bun and Cheese. Even the delivery man was courteous; I will definitely order/visit them again!
5/11/2018,20180511,1,3.83,"Ordered from here off on Grubhub. Spent $22 bucks on some Rasta Pasta that I have never tried and was really looking forward to it on this Friday night. But unfortunately they just took my money and never showed up ! They even sent messages saying "" on the way "" then I see it says "" order delivered "" smh it was never delivered. Never a call nothing . Sooo idk about this place that was horrible customer service and I haven't even went to the place yet . Yikes !"
5/31/2018,20180531,4,3.83,"I downloaded yelp just to write this review. Kingston is a cozy spot and it's very relaxed. Camille is the best. I came just before happy hour ended at 8:00 with me husband and 3 kids (youngest 1 months) we ordered appetizers of the jerk pork for the kids with with a sis and we shared the curry pot for 2. Kingston has an open front so if you grab the bench in front that's a good spot. Happy hour drinks were excellent, music was excellent and I will be back."
5/31/2018,20180531,5,3.85,"My first time visiting Kingston was definitely a pleasant experience. I ordered the jerk pork as a starter and it was dynamite! I next ordered ackee and salt fish and my date ordered Rasta Pasta w Jerk chicken. We both finished our plates wanting more, I even ordered Jerk Pork to go because it was so authentic and rare to find on a Jamaican restaurant menus in NYC. It was a like a little taste of home and I will be back for more. Also, not to mention the cute Irie server was so sweet! She invited me to come back on Friday nights for a Caribbean Nights Party and I will be back for the vibes and drinks next time."
6/2/2018,20180602,4,3.85,"Very, cute and trendy place ! The DJ plays the best music, and our girl at the bar kept the drinks flowing , and the food was quite delightful . Will be coming back next Friday for sure !"
6/2/2018,20180602,5,3.86,Food is fresh. Chicken is juicy. Service is pleasant. Drinks are solid. Authentic as it gets! Definitely coming back often.
6/4/2018,20180604,5,3.88,Great music and drinks!!! I will definitely go again. Place is kind of small but it is worth going. Dj played a lot of reggae and up to date music. Rum punch was strong
6/11/2018,20180611,4,3.88,Nice place. Small nice decor and lighting. Food was good. Jerk chicken and curry very tasty. As we looked inside a few passers-by recommended it was well. Great drinks very good tasting with a lot of kick! Good Caribbean food in Harlem.
6/17/2018,20180617,5,3.89,"Walked into Kingston with my cousins by chance as we were strolling the streets of Harlem. We were having one of those ""go with the flow"" Sundays. This establishment is a diamond in the ruff. Camille greeted and made our drinks. She was a kind and genuine host. The drinks were refreshing and delicious! We will definitely be back to try to food and more from the menu. Thanks for a great and relaxing time. We could truly unwind!"
6/22/2018,20180622,1,3.86,"I'm sorry, but this food is sub par!!!!! I ordered a jerk chicken dinner! For $12 I could have bought the ingredients and cooked it myself!!!I received a flimsy breast and leg! A cup of DRY ass rice and peas, and about about a fist full of cabbage!!! OH, and I had to order my plantains on the side!???What happened to the jerk sauce?? Who are you cooking this for b/c it's NOT EVEN HOT/SPICY!!!!?? It tastes terrible!!! I gave the DRY ASS, FAKE jerk chicken to my garbage can!! And why the fuck does the food smell like this???? I'm confused!!!? I thought I'd give ya'll a chance b/x you're pretty new, but this food is fucking garbage and not worth the money! How dare you call it KINGSTON!!! As a West Indian woman, I'm offended and pissed that I wasted my $12 bloodclat dollars!! My husband had to add the damn JERK SAUCE it comes with to make it taste better!!!!! I still didn't like it!!!! FUCK!!!"
6/28/2018,20180628,2,3.83,Sorry guys but I do not recommend this spot. I had hopes but there were too many issues 1. Food took an hours to be done 2. Had little flavor 3. Meat was not tender (goat and oxtail) Would not return.
6/29/2018,20180629,5,3.85,So I had the pleasure eating in Kingston. The food is delicious. I ordered the rasta pasta. It was so so good I nearly clean my plate. Almost wanted to like the plate to get every bit of the sauce and meat left. I highly recommend ordering it. My first time ever eating rasta pasta and I was not disappointed. The drinks are good as well. This is a very cozy nice place with good food. You want some good Caribbean food come here you will thank me later.
7/4/2018,20180704,2,3.83,If you know and love rasta pasta save yourself the pain! I came for Mother's Day because Amy Ruth's was overly crowded... I thought we would take next best thing but this was far from it. The food is so dry it was upsetting me and didn't taste anything like rasta pasta. I was grateful the waitress was nice but like many other reviews the place is just slow paced. I dont know how....there weren't many customers. The drinks were also super weak and over priced. I don't see myself coming back.
7/21/2018,20180721,3,3.81,I really wanted to like this place but it was pretty bad. Ordered the jerk chicken entree at lunch and chicken was super dry and tasteless. They used old chicken from day before. I wouldn't go back as miss Lily's does it right. So juicy. I couldn't get any juice out of the dud.
8/5/2018,20180805,1,3.78,"THE FOOD IS DISGUSTING THE COOK NEEDS TO BE LET GO...BUT DRINKS ARE GOOD ( I'M JAMAICAN SO I KNOW THE FOOD AND COOK IT VERY WELL AND THEIRS WAS A DISASTER) ! ...Worst Jamaican restaurant ever, as we say in Jamaica ""Dem cyaan't cook, food nuh taste nice"" basically the food is horrible, they cannot cook. Absolutely disgusting ! I tried the Curry Goat and it was so salty that I had to send it back to kitchen, it was not edible at all. I then ordered the Oxtail and they put so much browning (gravy master) on it that it looked black and is slightly bitter, whatever flavour there was was not a present because the excessive amount of browning chased it and left the meat tasting bitter. I will certainly give them feedback before I leave. Food was a disaster! I am Jamaican so cannot be fooled with the food, perhaps Yankee or other folks who aren't West Indian or Jamaican people know the difference, but I certainly do. I spoke with the waitress who even agreed that the curry goat was too salty and said that the Oxtail has too much browning and that she was tell the cook and the owner. I tried their Jerk Chicken once at the African Food Festival in Harlem and it was very tasteless and bland but this was almost 2 years ago and I said to myself the other day when a friend invited me to drinks there, let me give them another try to see if they improved but still to my disappointment the food was honestly the worst I have eaten from a Jamaican restaurant. I cook and eat the food at home as a Jamaican and from a family of restaurant owners and cooks so I know what I am saying. I certainly hope that they take corrective measures insofar as the cook because the food needs major improvements.ALSO THE FOOD TAKES FOREVER TO LEAVE THE KITCHEN...ITS COOKED ALREADY SO IT PUZZLES ME WHY THEY TAKE SO LONG TO SERVE CUSTOMERS !"
9/2/2018,20180902,5,3.8,"Love his place. Right in the heart of Harlem the food was excellent, I had the Rasta pasta!!! AMAZING!!!!"
9/9/2018,20180909,1,3.76,"this place is gross...do not go! curried goat was salty as hell, steamed veggies were bland as hell, and the whole snapper that i got was covered with boring meaningless crackers vegetables and other nonsense. wait staff was awesome though. food...terrible!"
9/15/2018,20180915,3,3.75,The food is mediocre. The space is on 116th which is not the cleanest block and it smells bad. I went on a Saturday and there was one server/bartender. She was good but service was slow. I would rather go to a hole in the wall with great JA food than this cute location with mediocre fare. Drink selection reminds me of being on a rum punch catamaran in the Caribbean- sweet drinks that arent so great. I felt like their were many flavors that did not belong together in the drinks and food selections -super sweet rasta pasta and way too much cheese on the salsa salad.
9/15/2018,20180915,4,3.76,"The Jerk Shrimp Rasta Pasta was excellent, but they have to work on their curry goat and white rice. The rice was extra buttery and the curry goat was chopped too small, with a lot of bones. There was also no gravy on the rice or goat and the cabbage was terrible, it needed seasoning or some flavor.The food was prepared in the exact timing my order indicated and delivery was right on time!"
9/17/2018,20180917,5,3.77,"This is my new favorite place for Caribbean food and Rum Punch. I was in search of Melba's and stumbled upon this hidden gem. The food is absolutely amazing. As a former employee of Citysearch my job was to review art, leasure and entertainment including restaurants. I give them 5 stars. I advised my hostess to me being a fan of Henricas rum Punch and it would be the deal breaker she exceeded my expectations. The food was flavorful. The jerk salmon was absolutely succulent. My friend enjoyed the steamed snapper. It was amazing. The broth was the type that makes you dip your bread to get every morsel. My other sister from another mister devoured the Rasta Pasta. The atmosphere is casual and relaxed. I promised to come back and I certainly am going to keep my word. Scrumptious!!!!! Bon appetit"
9/20/2018,20180920,2,3.75,"My friend and I stopped by here on a whim. My boyfriend is West Indian and I love the food, so I'm always down for a West Indian spot. First, I had a pineapple ghost pepper and something else margarita. It wasn't too spicy, but the flavors did not go together. Switched to a different drink that was better, but still blah.For my entree, I had the Rasta Pasta with jerk shrimp. No. No. And, a final no. Rasta Pasta is a little sweet, but this tasted like sugar, sugar and sugar. I thought the jerk shrimp would cut the expected sweetness, but it wasn't jerk. It tasted like a honey BBQ sauce, which upped the sweetness factor. If you've had real West Indian food, you will be incredibly disappointed. None of that flavor and love you expect in the food. Go to LoLo's around the corner."
9/21/2018,20180921,5,3.76,"What a hidden GEM in Harlem! I traveled all the way from BROOKLYN and the ambiance was cute, food was superb and Camille in particular, was the bomb @ss bartender. She mek mi and mi sister ah rum punch whey PACK ONE RAAS PUNCH, yuh see? We knee dem lock up pon we, outta road! We had grilled jerk pork and chicken, roti skin, festival and cabbage. Pepper sauce was saying ""ONE"" also. Authentic yaard cooking....STRAIGHT! NUFF LOVE, UNNUH BIG UP UNNUH SELF.....LIVE MUSIC TOO! CHAT BOUT CLASS, STYLE AND IRIE SERVICE! Thanks, Camille! Love, Peaches and Tasha!"
9/22/2018,20180922,5,3.78,"Stumbled upon Kingston, while searching for a bottomless brunch spot, and what an amazing surprise! They DO have bottomless, which is a plus! They're super affordable! The food is authentic, DELICIOUS and made to order. And Camille was beyond amazing with the hospitality. It was like having that traditional island attention and accommodation that I experienced while in Jamaica. I would HIGHLY recommend Kingston if you're in the mood for authentically mouth watering food matched with phenomenal service!"
10/3/2018,20181003,5,3.79,"Loved the food and drinks, the staff was awesome... I love the amazing decor it takes you to the island"
10/3/2018,20181003,4,3.79,"I met up with a few friends here for drinks and a light meal. It's a great cozy spot for a nice evening meal and I think on Saturday nights they have a DJ spinning as well. Service was great. The bartender (possibly also the owner?) was a one woman show and took care of everyone who came in after us in a timely manner. I reccomend the rum punch. The Rasta Pasta was tasty but didn't offer much other than noodles and a delicious sauce. As my friend put it, ""there's a lot of pasta but not a lot orf Rasta!"" I'm glad I added the shrimp! I will return here again."
10/3/2018,20181003,3,3.78,"Kingston is a really nice restaurant in the midst of Harlem. In the middle of all the soul food and African restaurants, it is nice to have a Caribbean offering as well. What I like most about this establishment is the service and the music. They play classic reggae tracks that if you are a fan, you love the atmosphere. The server was also extremely nice and police and that was a big plus for me. We ordered the oxtail and the curry goat. The curry goat was very salty sadly and uneatable., and my brother had the same experience with it when he went before me so that is their main drawback. However, the oxtail was pretty good and I heard their salmon is great as well. However, a bunch of stuff on their menu was not present when we went to dine there, which was a big disappointment because we had to keep switching our order. For the music and ambiance alone, though, I would recommend this place, along with if you order the right item."
10/6/2018,20181006,4,3.79,"We had an excellent time here... The drinks are the real deal.... Great atmosphere, laid back, chill and Nice. This is a hidden gem. I didn't have the food but I will try it next time."
10/12/2018,20181012,5,3.8,"Love love this place! The customer service is amazing and their food and drinks are to die for. I had the Rasta pasta with Jerk salmon and my husband had the Jerk Chicken and we cleaned our plates! My husband also had both the Prestige and Red Stripe beers and he really enjoyed both of them. Always ask for Camille the hostess/bartender, she is the sweetest!"
11/16/2018,20181116,5,3.81,I loved my food and the bartender ( I can't remember her name now; (2months later) But she was really pretty and upon engaging with me she learned I was visiting from out of town and she even offered so places to go out to hang out around the city . Very nice and helpful!!!!
11/24/2018,20181124,4,3.81,"Love the Rasta pasta! Don't get it with shrimp they only give 3-4 shrimp, but a great portion of chicken. The drinks were a little weak and small portions for the price. Really cute ambiance and the staff is friendly, I'd def recommend if you're in the area."
12/3/2018,20181203,1,3.79,"I ordered oxtails ($18) from here yesterday, paid prior to receiving my food and left a nice tip. For spending $25, you'd think I'd receive more than THREE dry oxtails. I couldn't believe it when I got home. This was my first time here and will definitely be my last after this experience. I understand it was late, but if someone would've just said ""we're running out of the oxtails"" I would've ordered something else. It was one thing to only receive three, but for the oxtail to also be dry and disgusting on top of that?!"
12/19/2018,20181219,5,3.8,This was my first time at this restaurant. Food was delicious.....Drinks were well created. Waitress/Bartender was super friendly an ensured that my double dates were well taken care of. The environment was quite chill and felt like having dinner at Auntie Karen's house in Trinidad. Will definitely add this to my list of retiring spots.
12/26/2018,20181226,5,3.81,Great food. Great customer service. Amazing time!! Environment made me feel like it was my 100th time visiting instead of my first.
12/29/2018,20181229,1,3.78,"Went to this restaurant today because my little brother wanted Jamaican food so bad and Kingston had great reviews.....however ....the service was horrible!! The place was so dark i thought they forgot to pay the light bill and on top of that the waitress/bartender didn't have a clue. I asked for a margarita she told me that this was her 3rd day and she didn't know how to make one, which means she probably doesn't even have a bartending license. I asked her to just give me henny and ginger, again she couldn't even make that( which i make at home)and what got me really pissed is that she kept quoting how this is her 3rd day like i should care ?? This is a business and that is extremely unprofessional to tell your customers. On top of that she went out of her way to try to make a Long Island for another customer yet i asked for something simple and she couldn't even do that. The Rasta pasta had no peppers at all and I've had my share to know their was no Rasta in that pasta! Also the ""peas and rice"" disgusting! Rice wasn't cooked all the way through and thier was no flavor and no peas only kidney beans...place gets 0 s . Never again and i will be spreading the word! Again horrible it's was not worth one damn dime !"
