date,converted_date,rating,average,review
1/12/2017,20170112,5,5.0,"Just had dinner here with my girlfriend after passing by while walking my dog! Menu looked great & the music had smooth reggae blasting. I ordered the jerk chicken while my girlfriend ordered the oxtail. Loved the food & also loved all night happy hour! To be honest that's what initially attracted me to try the place out. Strong tasty drinks with well prepared food! Prices were fair. Happy Hour was $6 well house drinks and beer along with $8 for their ""house punch"" (which you should definitely try). Hostess was super nice & from what I read she's the owner too so it shows she cares about her business. I will definitely be returning!"
1/12/2017,20170112,5,5.0,Kingstons is the new GEM of 116th st! Authentic Jamaican food - like my grandmothers! Interior is sleek and modern. And the own works as the bartender so the service is warm and timely! Will be coming back!
1/14/2017,20170114,5,5.0,"Came to this little piece of island with heaven with my momma. She's the one who wanted to come for the ackee and salt fish. She's originally from St. Croix, and her favorite dish is ackee and salt fish with jonny cake. (Something you can't really find to eat.) This place has my moms favorite dish and a lot of authentic options for island fooders who are looking for something other than your standard jerk or curry. This establishment serves a complementary cocktail with its brunch entrees. The ackee and salt fish was amazing and the jerk chicken with caramel waffles was great! The rum punch is recommended but they have a great selection of drinks and during dinner there is an all night happy hour. They play reggae music! And the interior is very sleek with island vibes. The woman bar tending is amazing and very hospitable! The only con I have is that it is sometimes cold inside but an order of jerk will solve that."
1/26/2017,20170126,4,4.75,Finally a Jamaican spot close to home . Had the Rasta pasta and it was pretty good. Not as spicy as I was hoping. Oxtail was delicious. The drinks are the best part of this place. All of them are delicious and they aren't cheap with the alcohol. I definitely recommend and I look forward to the menu expanding. Can't wait!
1/27/2017,20170127,2,4.2,"This is my second time visiting Kingston. I must say that the food is delicious (portions are too small though) but the wait time is too long. The place is understaffed. Seems like the one lady is doing the bartending, waitress, greeting, etc. Most of the time, you are just sitting there waiting."
1/31/2017,20170131,5,4.33,"I came across this new place randomly. It was was super cute, trendy in decor and looked clean unlike most places on the block. The vibe was very chill with great Caribbean music - almost like a tropical oasis lol. The bartender immediately greeted me with a smile and began offering suggestions. I went with the oxtails and rice w/ a side of Festival. The food was good... I have no complaints. I'll most likely go back and sit at the bar Friends and partake in the Kingston wings. Oh btw, the place is kinda small so I would avoid going with a large group."
2/1/2017,20170201,3,4.14,I would give 3.5. Oxtails-good. Well marinated and chewy oxtails. Tender boiled cabbage. Average quality of rice with beans. Jerk chicken-good. Well cooked and seasoned chicken. Sweet fried dumplings that taste like churros. Strong sauce. Small portion. Good presentation. Nice and friendly waitress.
2/17/2017,20170217,4,4.12,"Food was well seasoned, great Jamaican flavor, nice portion, but need more gravy/sauce. Must try house special drinks! Awesome! I definitely recommend this place and will be back :)"
2/18/2017,20170218,4,4.11,"I stopped in early Saturday and sat at the bar. It was not busy in this small restaurant. Thy have a Dj playing reggae, soca, afrobeats. I was greeted warmly. I got oxtails and was pleased. Oxtail is not my favorite dish and I rarely order it out because you never know how much meat will be on the bone. However I felt it was worth it. Rum punch was good. $35 bottomless. $8 cocktails. The person next to me did not enjoy his jerk chicken and waffle (waffles looked like eggo waffles). Cons: had to ask for gravy for my rice, rice and peas didn't have enough peas or coconut milk for me, no curry on he menu (I went during brunch maybe it's on the results dinner menu). Overall, I will give them another chance. This is a new restaurant hopefully they read reviews and improve. Not sure this can fill the void of Negril closing. But they can try."
3/4/2017,20170304,1,3.8,"I never give bad reviews. Check me. But this needs to be said - diners BEWARE! Saddest restaurant I've ever been to. Was really rooting for a good Jamaican spot near me in Harlem. Smallest portions, slow service, unprofessional. Bar tender is doing every job. She was nice but felt bad for her... and she also ran to a bodega mid meal. And one guy waited so long for take out that he got a parking ticket. Here is how it went down. we ordered the jerk Caesar, curry goat, plantains, and a fish entree. They ran out of fish so we got the salmon flatbread. Drink was ok...could have made at home ($12). Salad came out after 40 minutes. And to add insult to injury they forgot avocado on the salad, forgot the plantains outright, gave 4 croutons sizes of chicken on the saddest most boring ice berg lettuce salad. I mean I would expect a better salad on an airplane. Mains took 1hr 20 mins to come out. The flatbread was actually insulting - Bland taste, canned pineapple, and minuscule pieces of salmon. It was actually a shock, a PTSD event where I just couldn't wait to GTFO of there after being trapped for almost 90 minutes ... I will never get my Saturday night back. Then once she handed me a crumpled up hand written receipt, I was thrilled to pay and sprint towards my freedom.I've lived in Harlem for 9 years and LOVE supporting small businesses but this place is a scam unless this was just a bad night or something. Will close in 6 months unless they make MAJOR changes. An embarrassment to Jamaican cuisine. New Yorkers know better."
3/10/2017,20170310,5,3.91,I enjoyed this place great food great service. The rum punch is really good Very good vibes
3/11/2017,20170311,2,3.75,"The food was not fresh, but the restaurant's layout and happy hour menu shows promise. Single-staffed and we were convinced our server was also the chef. $18 rendition of chickn&waffles was just tepid chicken and toaster waffles with caramel glaze on the side. The server was very kind but average meal was not worth the money."
3/16/2017,20170316,2,3.62,Honestly this place has the potential of being a great experience the staff is very nice and the decor very cute drinks was 12 dollars not worth it me and my partner had 5 and was not even buzzed the wings was delicious the skewers not so much we ordered the Rasta pasta with shrimp and chicken it took over an hour to make only for them to give us over cooked noodles whole pieces of chicken wings and shrimp from the bag that u would find in your fried rice from the Chinese restaurant once we notified the server she was very apologetic and took it off the bill overall we won't be returning unless they get a new cook
3/18/2017,20170318,2,3.5,It really sucks that I have to give them two stars but I'll start with the positives. They have great customer service. Our servicer was extremely busy and still had a personal touch. My girlfriend had a drink and she swears by it. It's a nice small place and the Ambiance is great.For the negatives.The service was slow and I really slow. There were only two tables including us totally seven people. We ordered three different items from the sides and it took about an hour. Not only was the food over priced but the portions were tiny. Now if the food was tasty I would be giving a different review. Legitimately non of the food was good. The rice was soggy. The plantains were weird. Differently not JAMAICAN STYLE. Then the worst of them all the cabbage. Not only was it sour but with no exaggeration no seasoning at all. My girlfriend is doing a vegan diet right now and she was told that they could do the akee with out salt fish. It differently had salt fish in the meal. She also had festival which was dumpling. My friend had curry goat it was literally one spoon. When he was finished eating it look like he had the same amount of food on his plate because it was all bones.This is a great place to grab drink but no food
3/24/2017,20170324,3,3.47,"Seen this place as it was being constructed and couldn't wait to try it out. The spot itself isn't very big, which doesn't work if the place is meant to be a lounge or a restaurant.There are tables and then there are benches; you also have the bar for seating. The menu is VERY limited. I ordered the jerk pork bites.....I was expecting so much more. My food came out room temperature and there was no jerk flavor to it at all, my friend ordered the curry goat with white rice that was pretty good. The drinks pretty mediocre with potential to be better since, like the food menu, is limited as well. The ladies running the show that night were nice and were monitoring how the guest were taking to this new venue which is good. All in all I can't say that I would go anytime soon to this place. Hopefully over time this place will become better seasoned than it's jerk pork bites."
3/29/2017,20170329,1,3.31,"Warning: Very detailed, lengthy review with photos. I really hope this is read by the owners of this business.I was excited to see a Jamaican spot pop up in the area. After passing it a few times, I was happy to suggest to my friend that we each lunch there - my treat. When we got there, the bar was mostly full and most of the tables were full, which is me, is a good sign when going to any restaurant. There was no staff there to greet us and no one behind the bar. One of the patrons let us know that the barmaid would be out shortly. After about 10 seconds, someone came to seat us.We scanned through the menu and decided to order 2 Ginger Beers, the Veggie Burger ($15) for my friend and an Oxtail meal ($18) for myself. The waitress told us that the veggie burger would take some time to get prepared. Somewhere between 20-30 minutes. We didnt mind the wait, since we needed to run an errand in the area anyway. We asked if we can order and then come back in 30 minutes to sit and eat. The waitress said that I would have to leave my card behind to start the food and hold the table. No problem for me. I left my card and we left. This was at 4:55pm.We came back in about 30 minutes. After sitting down for about 10 minutes, we flagged down another waitress to let her know that we were here and were ready for our food. She looked confused and then came back and told us the food will be out in about 5 minutes. After another almost 20 minutes (no exaggeration), we started to become upset and increasingly hungry. We asked about our food again, and it finally came out about 5 mins after that.WELL, first of all the portions were INCREDIBLY tiny (see photo - i.imgur.com/EiNWivt.jpg). I just ordered an $18 oxtail meal! I expected to have food to take home, if anything. The meal was literally a child-sized portion. My friend's veggie burger was literally just a veggie patty split in half, placed ontop of a pita, with lettuce, tomato and cheese (see photo - i.imgur.com/wmzj4MY.jpg). The waitress told her that it would have plaintains on it - it did not. The food was also not warm.I asked the waitress why the food took so long. She said that she didn't put the order in until we came back. I asked her why she asked me to leave my card behind then! She explained to me that if she put the order in then the food would not be warm when we got back. The whole reason why we left for the 30 mins and left the card behind was so that the food would be ready when we got back, after she told us it would take about 30 mins!! However you keep the food warm is up to you, but I felt kind of violated that I left my card behind to stranger, for basically no reason!The meal portions were very very very small, especially for $18. I have never in my life felt so ripped off. Also, I asked for pepper sauce and it was more like a tomato/hot sauce blend. I know what Jamaican pepper sauce is suppose to look and taste like and that was NOT IT! Jamaican pepper sauce is very unique and I was extremely underwhelmed.After complaining, they discounted our order a little bit. But let me tell you, this business will not last under these circumstances. Additionally, it is not fair to the employees to have to endure the attitudes of the patrons because the food is so overpriced for the portion size. Its just not fair.I hope the owners/investors of this business are reading this. THIS BUSINESS WILL NOT LAST under these conditions. The taste of the food was good, but the service, the price, the portions are NOT OKAY. Who are you trying to cater to? Residents of the area? or the Gentrifiers? Even the gentrifiers know will feel ripped off. My family lives right around the corner on 115th and we will NOT be visiting here. My family members are also prominent members of Canaan Baptist church a few doors down, and I have already notified them and their members of my experience."
3/29/2017,20170329,5,3.41,Finally an Upscale Authentic Caribbean restaurant and great friendly customer service!My wife stopped in just for an app and couple drinks this time and still consistent service.It is awesome in comparison to a few other places we tried as we are new to Harlem we were pleasantly surprised but even our second time here still great.Try the Rum punch and a delicious selection from the Jamaican fare.
3/31/2017,20170331,4,3.44,"Great restaurant. The oxtail and the goat are my most favorite dishes!!!! The service is good and attentive, and the price is definitely a bargain. So happy that Kingston is here. Welcome to the neighborhood!!"
4/4/2017,20170404,5,3.53,Hands down by far the best West Indian spot uptown!!! The drinks are major key!! Will visit again
4/8/2017,20170408,5,3.6,"Best Jamaican food I've ever had outside of Jamaica! The service was great and the staff was top notch. They served these sweet dumplings with the Jerk chicken, which I've only had in Jamaica. Will definitely be coming back now that I know this is available in the USA. Thank you God."
4/23/2017,20170423,5,3.67,"Stopped by for a business meeting,The ladies who work there were very, very nice! I did not eat because prior to getting there I had dinner, but food looked delicious and the people I was with said the oxtails were great. I will definitely be back to try their food!!"
5/12/2017,20170512,2,3.59,"I'm giving two stars bc the girl was nice but....i'll just go ahead. I came here for a paint and sip class my friend was hosting. The place is very tiny with about 10 tables and 8 or so seats at the bar.-the rest of the lower starred reviews are 100% true- the bartender is the also the hostess and the chef, yes i said THE CHEF (which means while she is tending the bar shes taking food orders, going to the back, putting it in the microwave for an hour, and coming back to the bar to tend more-of course next thing is how long it took the food to come out- when it did come out you can tell it was microwaved - it was so far from authentic west indian food that it was insulting-a guy next to me got an order of wings and when they came out there were 3 on the plate and TINY. You could tell they were microwaved-not to take away from the fact that i actually like my food (had rasta pasta) but i added jerk shrimp to it and the shrimp had no jerk at all...in fact they had no seasoning and were extremely overcooked from being in the microwave too long-not to mention i had to ask 3 times for a rum punch each time i ordered one-the sink in the bathroom was also leaking like crazyI know the girl that was tending the bar is jamaican so i guess im wondering how in the hell can you confidently serve food that is not even cooked properly? She definitely knows better and so does everyone else. She was really sweet but unfortunately i dont see this place lasting with easy bake oven meals. In fact, it won't last. This place needs to be shut down."
5/27/2017,20170527,4,3.61,It was a pleasure to check out this brand new little dive during my visit to Harlem. We are late diners and appreciated that Kingston was open well after 10 pm. The curried goat and oxtails were excellent as was the sorrel though the portions were somewhat small and service was slow for them not being too busy. The vibe of the interior (down to the corrugated iron bathroom walls) was an authentic Jamaican cook shop and rum bar combo.
6/7/2017,20170607,5,3.67,I experienced such a great time here the culture the vibes and the food. Every time I eat here the food is exceptional and I get great customer service and conversation. It a real gem to have in the middle of Harlem with drinks and food I love be able to get authentic Caribbean food here I would love to see this place grow and blossom as the time goes buy
6/14/2017,20170614,4,3.68,"Happened upon this culinary oasis on a late night stroll and instantly felt at home. The food was great, drinks were well made, and the customer service was outstanding! Left knowing that we would definitely become regulars."
6/22/2017,20170622,1,3.58,"Slow service and that just the beginning. I hardly write any reviews but I feel this is a must. As much as I'm big on restaurant hopping in my neighborhood this is one place that won't make the list. Drinks where cool but as for dinner I'd call it a total disappointment. We shared the curry pot which is more like an overload of rice. You get a small portion of Curry shrimp, goat, and chicken. No whole chicken pieces, shrimp over cooked and the best tasting goat with mostly bones. Curry very oily and not authentic Jamaican curry. Venue and location great for drinks but as for dinner I doubt I'll be returning. Complained but manager didn't to make it to our table, totally the last time I'll be visiting this location."
6/23/2017,20170623,3,3.56,"There is so much to be said about this place however I'll make it short and sweet. Pros: The place is very small and cozy. I enjoyed the atmosphere as well as the scenery outside of the establishment. The food was absolutely delicious. Full of flavor and cooked quite well. We ordered the run punch and the Don won and a red stripe. They were Good as well. The Ackee and salt fish as well as the ox tails were delicious. Cons: the building was ridiculously HOT. We are from Texas so we are pretty used to heat however the establishment lacked any cooling system besides a fan. I was literally dripping in sweat. The next and probably biggest con was the portion sizes. I can not believe they charged $18 for 4 very small oxtails. We left still very hungry after spending $70. The service was fair, nothing worth mention. If you're in Harlem I would recommend a different venue with larger portion sizes."
6/25/2017,20170625,5,3.61,"Just left Kingston. I wanted something quick and light to eat before I head to a party later. I had the Kingston wings and a ginger beer. The wings were really great and they came out pretty quick. Very flavorful and a tad spicy. I cant handle a lot of spice, so this was just enough. Music was chill and the vibe was good. Chopped it up with the bartender for a little bit and I was off. Definitely will return to try an entree next time."
6/26/2017,20170626,5,3.66,"Great spot. I had the pork bites as a starter, they were so tender and juicy. Then for the entree I had the jerk chicken, my plate was completely clean after! So tasty. The drinks were also nicely done by Neca. Definitely a place you want to come to when you want a great meal with flavor."
6/27/2017,20170627,5,3.7,Loved it!!! Food was definitely delicious and spicy. Reminded me of home. Service was polite and prompt and extremely accommodating. Would definitely recommend to anyone looking for a good chill time
7/10/2017,20170710,5,3.74,"Its great to have a sitdown Jamaican restaurant in Harlem because there arent many of them. The food here is delicious and the decor with the Zinc really reminds me of Jamaica. I had the curry goat and the jerk pork. Delicious and well seasoned. The Sorrel drink and the Rum punch were on point too. One of the best sit down Caribbean spots uptown for sure, I'll be a regular"
7/11/2017,20170711,5,3.78,"I love this restaurant. The food was amazing - i would suggest the ""Rasta Pasta"". Amazing!!!!! The service was great as well, our waitress was attentive. I also love the ambiance. This is our ""new place""...."
7/19/2017,20170719,5,3.82,"Great restaurant, great customer service, support small businesses like this, highly recommended"
7/21/2017,20170721,5,3.85,Amazing food and drinks! I had the Rasta Pasta with jerk chicken and I literally cleaned my plate! The rum punch was strong and yummy. It's good to finally have a food Jamaican restaurant in the area.
7/23/2017,20170723,5,3.89,"Excellent Jamaican restaurant. Great food, good prices, great service!! Highly recommend it. Nice vine, chill relaxed style. Get some!!"
7/30/2017,20170730,1,3.81,Very slow service. Don't quite understand what goes on in their kitchen. But apparently takes a whole hour to get an $18 dollar salmon. I think they go to Jamaica to kill the fish and bring it back and cook it. Geez. Not worth the wait. Need better staffing. Won't be coming back.
8/1/2017,20170801,3,3.78,"Great customer service, super friendly bartender who makes great drinks. Pretty chill spot, I only remove two stars because the food is bland."
8/6/2017,20170806,5,3.82,Great food and fast service; very authenic flavors. Had the ackee and saltfish and the jerk wings. Drinks were on point. Will definitely come back soon.
8/9/2017,20170809,4,3.82,Spicy Pineapple Margarita isn't kidding. Nice drink.Spicy and sweet with a kick that lasts throughout .
8/9/2017,20170809,5,3.85,Very good.. I'm surprised that this place gets bad or not great reviews.. and it's mostly from people who I'm sure have never been to Jamaica someone complained that there was too much bones in the curried goat..lol.. this is a very great spot.. the bartender is very authentic..and very good.. the drinks and The food are great. This is my new favorite spot in Harlem ..
8/10/2017,20170810,3,3.83,"Spicy Pineapple Margarita ($12) isn't kidding. Nice drink.Spicy and sweet with a kick that lasts throughout . Okay, so I stayed a bit later and tried the food... not a great idea. The snapper ($18) was bland, as was the beans and rice it was served with. The redeeming part of the dish were a few bites of tender okra. The plantains ($5) were sweet of their own accord; a char would have gone a long way.If you swing by, have a drink but preferably skip the food."
8/13/2017,20170813,5,3.86,"First time coming here and the vibe was so good. I'm Jamaican myself and love the Jamaican vibes along with the music and great food. Since I've been in Harlem, I've been craving my Jamaican food and I was super excited to see such an authentic Jamaican spot. Highly recommended!"
8/20/2017,20170820,2,3.81,"I really wanted to like this place. A jamaican restaurant in the area? Yes yes yes...but my experience made it a NO for me. Came here with my fiance and i ordered the oxtails rice and peas. The oxtails did not taste like oxtails nor look like them. What was on my plate...i have no idea. The rice and peas werent bad. My fiance had the jerk chicken and waffle. He stated that it was just okay, but that he wouldnt get it again. The drinks werent bad, i had the unlimited which included either mimosas or rum punch. I tried both but didnt feel that any were as strong as they could of been. I will not be back!"
9/16/2017,20170916,5,3.84,Great food & atmosphere. Drinks are smooth and tasty! Affordable price for good Jamaican food!
9/17/2017,20170917,5,3.87,Great Food!!! The Jerk sauce on the Salmon was excellent!! Loved it! The service pleasant and informative. I will recommend and return!
9/20/2017,20170920,5,3.89,The Rasta Pasta and the Steam Snapper Fish is a delight..... make sure you get the salsa salad to begin and open the taste buds up.
9/22/2017,20170922,5,3.91,Seriously authentic and fabulous jerk chicken. The real deal. Jamaican-Caribbean vibe. Definitely a gem.
9/23/2017,20170923,5,3.94,"Authentic, Tasty food, great ambiance- chicken skewers were really good and the mixed curry was excellent. the rum cakes was the best we ever had! A great find on 116th"
9/23/2017,20170923,5,3.96,Love this spot. great food and great drinks!! Visiting from the Bay Area and glad we found this spot and easy to get to.
9/29/2017,20170929,5,3.98,"The music and ambiance in here is great, as NYC doesn't have many spots able to maintain that true Caribbean vibe. The server was super nice even though she was the only one working and every seat in the place was filled. We had a few red stripes and the oxtail but the jerk chicken was our favorite - definitely the best we've had since moving to Harlem a few years ago. We even got to have a slice of homemade carrot cake from the family celebrating a birthday beside us and were kind enough to share. That speaks more to the vibe in this place than anything else I say can."
9/30/2017,20170930,5,4.0,"Delicious food. I had the Rasta pasta with jerk chicken and it was so flavorful. I recommend the Don One if you're a Hennessy drinker and like a natural drink. It had fresh orange juice, tea, mint, and other fruit juices. Delicious!"
